skill_id,description,src_path
app-store-preflight-skills,"Scan an iOS/macOS Xcode project for common App Store rejection patterns before submission. Use when preparing an app for App Store review, after receiving a rejection from Apple, or when auditing metadata, subscriptions, privacy manifests, entitlements, or design compliance. Integrates with the asc CLI for metadata inspection.",lib/truongduy2611-app-store-preflight-skills/SKILL.md
asc-app-create-ui,Create a new App Store Connect app record via browser automation. Use when there is no public API for app creation and you need an agent to drive the New App form.,lib/rudrankriyam-app-store-connect-cli-skills/skills/asc-app-create-ui/SKILL.md
asc-aso-audit,Run an offline ASO audit on canonical App Store metadata under `./metadata` and surface keyword gaps using Astro MCP. Use after pulling metadata with `asc metadata pull`.,lib/rudrankriyam-app-store-connect-cli-skills/skills/asc-aso-audit/SKILL.md
asc-build-lifecycle,"Track build processing, find latest builds, and clean up old builds with asc. Use when managing build retention or waiting on processing.",lib/rudrankriyam-app-store-connect-cli-skills/skills/asc-build-lifecycle/SKILL.md
asc-cli-usage,"Guidance for using asc cli in this repo (flags, output formats, pagination, auth, and discovery). Use when asked to run or design asc commands or interact with App Store Connect via the CLI.",lib/rudrankriyam-app-store-connect-cli-skills/skills/asc-cli-usage/SKILL.md
asc-crash-triage,"Triage TestFlight crashes, beta feedback, and performance diagnostics using asc. Use when the user asks about TF crashes, TestFlight crash reports, beta tester feedback, app hangs, disk writes, launch diagnostics, or wants a crash summary for a build or app.",lib/rudrankriyam-app-store-connect-cli-skills/skills/asc-crash-triage/SKILL.md
asc-id-resolver,"Resolve App Store Connect IDs (apps, builds, versions, groups, testers) from human-friendly names using asc. Use when commands require IDs.",lib/rudrankriyam-app-store-connect-cli-skills/skills/asc-id-resolver/SKILL.md
asc-localize-metadata,"Automatically translate and sync App Store metadata (description, keywords, what's new, subtitle) to multiple languages using LLM translation and asc CLI. Use when asked to localize an app's App Store listing, translate app descriptions, or add new languages to App Store Connect.",lib/rudrankriyam-app-store-connect-cli-skills/skills/asc-localize-metadata/SKILL.md
asc-metadata-sync,"Sync and validate App Store metadata and localizations with asc, including legacy metadata format migration. Use when updating metadata or translations.",lib/rudrankriyam-app-store-connect-cli-skills/skills/asc-metadata-sync/SKILL.md
asc-notarization,"Archive, export, and notarize macOS apps using xcodebuild and asc. Use when you need to prepare a macOS app for distribution outside the App Store with Developer ID signing and Apple notarization.",lib/rudrankriyam-app-store-connect-cli-skills/skills/asc-notarization/SKILL.md
asc-ppp-pricing,"Set territory-specific pricing for subscriptions and in-app purchases using current asc setup, pricing summary, price import, and price schedule commands. Use when adjusting prices by country or implementing localized PPP strategies.",lib/rudrankriyam-app-store-connect-cli-skills/skills/asc-ppp-pricing/SKILL.md
asc-revenuecat-catalog-sync,"Reconcile App Store Connect subscriptions and in-app purchases with RevenueCat products, entitlements, offerings, and packages using asc and RevenueCat MCP. Use when setting up or syncing subscription catalogs across ASC and RevenueCat.",lib/rudrankriyam-app-store-connect-cli-skills/skills/asc-revenuecat-catalog-sync/SKILL.md
asc-screenshot-resize,Resize and validate App Store screenshots for all device classes using macOS sips. Use when preparing or fixing screenshots for App Store Connect submission.,lib/rudrankriyam-app-store-connect-cli-skills/skills/asc-screenshot-resize/SKILL.md
asc-shots-pipeline,"Orchestrate iOS screenshot automation with xcodebuild/simctl for build-run, AXe for UI actions, JSON settings and plan files, Koubou-based framing (`asc screenshots frame`), and screenshot upload (`asc screenshots upload`). Use when users ask for automated screenshot capture, AXe-driven simulator flows, frame composition, or screenshot-to-upload pipelines.",lib/rudrankriyam-app-store-connect-cli-skills/skills/asc-shots-pipeline/SKILL.md
asc-signing-setup,"Set up bundle IDs, capabilities, signing certificates, provisioning profiles, and encrypted signing sync with the asc cli. Use when onboarding a new app, rotating signing assets, or sharing them across a team.",lib/rudrankriyam-app-store-connect-cli-skills/skills/asc-signing-setup/SKILL.md
asc-subscription-localization,Bulk-localize subscription and in-app purchase display names across all App Store locales using asc. Use when you want to fill in subscription/IAP names for every language without clicking through App Store Connect manually.,lib/rudrankriyam-app-store-connect-cli-skills/skills/asc-subscription-localization/SKILL.md
asc-testflight-orchestration,"Orchestrate TestFlight distribution, groups, testers, and What to Test notes using asc. Use when rolling out betas.",lib/rudrankriyam-app-store-connect-cli-skills/skills/asc-testflight-orchestration/SKILL.md
asc-wall-submit,"Submit or update a Wall of Apps entry in the App-Store-Connect-CLI repository using `asc apps wall submit`. Use when the user says ""submit to wall of apps"", ""add my app to the wall"", or ""wall-of-apps"".",lib/rudrankriyam-app-store-connect-cli-skills/skills/asc-wall-submit/SKILL.md
asc-whats-new-writer,"Generate engaging, localized App Store release notes (What's New) from git log, bullet points, or free text using canonical metadata under `./metadata`. Optionally pairs with promotional text updates.",lib/rudrankriyam-app-store-connect-cli-skills/skills/asc-whats-new-writer/SKILL.md
asc-workflow,"Define, validate, and run repo-local multi-step automations with `asc workflow` and `.asc/workflow.json`. Use when migrating from lane tools, wiring CI pipelines, or orchestrating repeatable `asc` + shell release flows with hooks, conditionals, and sub-workflows.",lib/rudrankriyam-app-store-connect-cli-skills/skills/asc-workflow/SKILL.md
asc-xcode-build,"Build, archive, export, and manage Xcode version/build numbers with asc and xcodebuild before uploading to App Store Connect. Use when you need to create an IPA or PKG for upload.",lib/rudrankriyam-app-store-connect-cli-skills/skills/asc-xcode-build/SKILL.md
hig-components-content,"Apple Human Interface Guidelines for content display components. Use this skill when the user asks about ""charts component"", ""collection view"", ""image view"", ""web view"", ""color well"", ""image well"", ""activity view"", ""lockup"", ""data visualization"", ""content display"", displaying images, rendering web content, color pickers, or presenting collections of items in Apple apps. Also use when the user says ""how should I display charts"", ""what's the best way to show images"", ""should I use a web view"", ""how do I build a grid of items"", ""what component shows media"", or ""how do I present a share sheet"". Cross-references: hig-foundations for color/typography/accessibility, hig-patterns for data visualization patterns, hig-components-layout for structural containers, hig-platforms for platform-specific component behavior.",lib/raintree-technology-apple-hig-skills/skills/hig-components-content/SKILL.md
hig-components-controls,"Apple HIG guidance for selection and input controls including pickers, toggles, sliders, steppers, segmented controls, combo boxes, text fields, text views, labels, token fields, virtual keyboards, rating indicators, and gauges. Use this skill when the user says ""picker or segmented control,"" ""how should my form look,"" ""what keyboard type should I use,"" ""toggle vs checkbox,"" or asks about picker design, toggle, switch, slider, stepper, text field, text input, segmented control, combo box, label, token field, virtual keyboard, rating indicator, gauge, form design, input validation, or control state management. Cross-references: hig-components-menus, hig-components-dialogs, hig-components-search.",lib/raintree-technology-apple-hig-skills/skills/hig-components-controls/SKILL.md
hig-components-dialogs,"Apple HIG guidance for presentation components including alerts, action sheets, popovers, sheets, and digit entry views. Use this skill when the user says ""should I use an alert or a sheet,"" ""how do I show a confirmation dialog,"" ""when should I use a popover,"" ""my modals are annoying users,"" or asks about alert design, action sheet, popover, sheet, modal, dialog, digit entry, confirmation dialog, warning dialog, modal presentation, non-modal content, destructive action confirmation, or overlay UI patterns. Cross-references: hig-components-menus, hig-components-controls, hig-components-search, hig-patterns.",lib/raintree-technology-apple-hig-skills/skills/hig-components-dialogs/SKILL.md
hig-components-layout,"Apple Human Interface Guidelines for layout and navigation components. Use this skill when the user asks about ""sidebar"", ""split view"", ""tab bar"", ""tab view"", ""scroll view"", ""window design"", ""panel"", ""list view"", ""table view"", ""column view"", ""outline view"", ""navigation structure"", ""app layout"", ""boxes"", ""ornaments"", or organizing content hierarchically in Apple apps. Also use when the user says ""how should I organize my app"", ""what navigation pattern should I use"", ""my layout breaks on iPad"", ""how do I build a sidebar"", ""should I use tabs or a sidebar"", or ""my app doesn't adapt to different screen sizes"". Cross-references: hig-foundations for layout/spacing principles, hig-platforms for platform-specific navigation, hig-patterns for multitasking and full-screen, hig-components-content for content display.",lib/raintree-technology-apple-hig-skills/skills/hig-components-layout/SKILL.md
hig-components-menus,"Apple HIG guidance for menu and button components including menus, context menus, dock menus, edit menus, the menu bar, toolbars, action buttons, pop-up buttons, pull-down buttons, disclosure controls, and standard buttons. Use this skill when the user says ""how should my buttons look,"" ""what goes in the menu bar,"" ""should I use a context menu or action sheet,"" ""how do I design a toolbar,"" or asks about button design, menu design, context menu, toolbar, menu bar, action button, pop-up button, pull-down button, disclosure control, dock menu, edit menu, or any menu/button component layout and behavior. Cross-references: hig-components-search, hig-components-controls, hig-components-dialogs.",lib/raintree-technology-apple-hig-skills/skills/hig-components-menus/SKILL.md
hig-components-search,"Apple HIG guidance for navigation-related components including search fields, page controls, and path controls. Use this skill when the user says ""how should search work in my app,"" ""I need a breadcrumb,"" ""how do I paginate content,"" or asks about search field, search bar, page control, path control, breadcrumb, navigation component, search UX, search suggestions, search scopes, paginated content navigation, or file path hierarchy display. Cross-references: hig-components-menus, hig-components-controls, hig-components-dialogs, hig-patterns.",lib/raintree-technology-apple-hig-skills/skills/hig-components-search/SKILL.md
hig-components-system,"Apple HIG guidance for system experience components: widgets, live activities, notifications, complications, home screen quick actions, top shelf, watch faces, app clips, and app shortcuts. Use when asked about: ""widget design"", ""live activity"", ""notification design"", ""complication"", ""home screen quick action"", ""top shelf"", ""watch face"", ""app clip"", ""app shortcut"", ""system experience"". Also use when the user says ""how do I design a widget,"" ""what should my notification look like,"" ""how do Live Activities work,"" ""should I make an App Clip,"" or asks about surfaces outside the main app. Cross-references: hig-components-status for progress in widgets, hig-inputs for interaction patterns, hig-technologies for Siri and system integration.",lib/raintree-technology-apple-hig-skills/skills/hig-components-system/SKILL.md
hig-foundations,"Apple Human Interface Guidelines design foundations. Use this skill when the user asks about ""HIG color"", ""Apple typography"", ""SF Symbols"", ""dark mode guidelines"", ""accessible design"", ""Apple design foundations"", ""app icon"", ""layout guidelines"", ""materials"", ""motion"", ""privacy"", ""right to left"", ""RTL"", ""inclusive design"", branding, images, spatial layout, or writing style. Also use when the user says ""my colors look wrong in dark mode"", ""what font should I use"", ""is my app accessible enough"", ""how do I support Dynamic Type"", ""what contrast ratio do I need"", ""how do I pick system colors"", or ""my icons don't match the system style"". Cross-references: hig-platforms for platform-specific guidance, hig-patterns for interaction patterns, hig-components-layout for structural components, hig-components-content for display.",lib/raintree-technology-apple-hig-skills/skills/hig-foundations/SKILL.md
hig-patterns,"Apple Human Interface Guidelines interaction and UX patterns. Use this skill when the user asks about ""onboarding flow"", ""user onboarding"", ""app launch"", ""loading state"", ""drag and drop"", ""search pattern"", ""settings design"", ""notifications"", ""modality"", ""multitasking"", ""feedback pattern"", ""haptics"", ""undo redo"", ""file management"", data entry, sharing, collaboration, full screen, audio, video, haptic feedback, ratings, printing, help, or account management in Apple apps. Also use when the user says ""how should onboarding work"", ""my app takes too long to load"", ""should I use a modal here"", ""how do I handle errors"", ""when should I ask for permissions"", ""how to show progress"", or ""what's the right way to confirm a delete"". Cross-references: hig-foundations for underlying principles, hig-platforms for platform specifics, hig-components-layout for navigation, hig-components-content for data display.",lib/raintree-technology-apple-hig-skills/skills/hig-patterns/SKILL.md
hig-platforms,"Apple Human Interface Guidelines for platform-specific design. Use this skill when the user asks about ""designing for iOS"", ""iPad app design"", ""macOS design"", ""tvOS"", ""visionOS"", ""watchOS"", ""Apple platform"", ""which platform"", platform differences, platform-specific conventions, or multi-platform app design. Also use when the user says ""should I design differently for iPad vs iPhone"", ""how does my app work on visionOS"", ""what's different about macOS apps"", ""porting my app to another platform"", ""universal app design"", or ""what input methods does this platform use"". Cross-references: hig-foundations for shared design foundations, hig-patterns for interaction patterns, hig-components-layout for navigation structures, hig-components-content for content display.",lib/raintree-technology-apple-hig-skills/skills/hig-platforms/SKILL.md
hig-project-context,"Create or update a shared Apple design context document that other HIG skills use to tailor guidance. Use when the user says ""set up my project context,"" ""what platforms am I targeting,"" ""configure HIG settings,"" or when starting a new Apple platform project. Also activates when other HIG skills need project context but none exists yet. This skill creates .claude/apple-design-context.md so that hig-foundations, hig-platforms, hig-components-*, hig-inputs, and hig-technologies can provide targeted advice without repetitive questions.",lib/raintree-technology-apple-hig-skills/skills/hig-project-context/SKILL.md
ios-design-guidelines,"Apple Human Interface Guidelines for iPhone. Use when building, reviewing, or refactoring SwiftUI/UIKit interfaces for iOS. Triggers on tasks involving iPhone UI, iOS components, accessibility, Dynamic Type, Dark Mode, or HIG compliance.",lib/ehmo-platform-design-skills/skills/ios/SKILL.md
ios-developer,"Develop native iOS applications with Swift/SwiftUI. Masters iOS 18, SwiftUI, UIKit integration, Core Data, networking, and App Store optimization.",lib/sickn33-antigravity-awesome-skills/plugins/antigravity-awesome-skills-claude/skills/ios-developer/SKILL.md
ios-simulator-skill,"21 production-ready scripts for iOS app testing, building, and automation. Provides semantic UI navigation, build automation, accessibility testing, and simulator lifecycle management. Optimized for AI agents with minimal token output.",lib/conorluddy-ios-simulator-skill/ios-simulator-skill/SKILL.md
macos-menubar-tuist-app,"Build, refactor, or review SwiftUI macOS menubar apps that use Tuist.",lib/sickn33-antigravity-awesome-skills/plugins/antigravity-awesome-skills-claude/skills/macos-menubar-tuist-app/SKILL.md
macos-spm-app-packaging,"Scaffold, build, sign, and package SwiftPM macOS apps without Xcode projects.",lib/sickn33-antigravity-awesome-skills/plugins/antigravity-awesome-skills-claude/skills/macos-spm-app-packaging/SKILL.md
swift-concurrency-expert,Review and fix Swift concurrency issues such as actor isolation and Sendable violations.,lib/sickn33-antigravity-awesome-skills/plugins/antigravity-awesome-skills-claude/skills/swift-concurrency-expert/SKILL.md
swift-nio,"Expert guidance on SwiftNIO best practices, patterns, and implementation. Use when developers mention: (1) SwiftNIO, NIO, ByteBuffer, Channel, ChannelPipeline, ChannelHandler, EventLoop, NIOAsyncChannel, or NIOFileSystem, (2) EventLoopFuture, ServerBootstrap, or DatagramBootstrap, (3) TCP/UDP server or client implementation, (4) ByteToMessageDecoder or wire protocol codecs, (5) binary protocol parsing or serialization, (6) blocking the event loop issues.",lib/joannis-claude-skills/swift-nio/SKILL.md
swift-patterns,"Review, refactor, or build SwiftUI features with correct state management, modern API usage, optimal view composition, navigation patterns, performance optimization, and testing best practices.",lib/efremidze-swift-patterns-skill/swift-patterns/SKILL.md
swiftui-liquid-glass,Implement or review SwiftUI Liquid Glass APIs with correct fallbacks and modifier order.,lib/sickn33-antigravity-awesome-skills/plugins/antigravity-awesome-skills-claude/skills/swiftui-liquid-glass/SKILL.md
swiftui-performance-audit,Audit SwiftUI performance issues from code review and profiling evidence.,lib/sickn33-antigravity-awesome-skills/plugins/antigravity-awesome-skills-claude/skills/swiftui-performance-audit/SKILL.md
swiftui-view-refactor,"Refactor SwiftUI views into smaller components with stable, explicit data flow.",lib/sickn33-antigravity-awesome-skills/plugins/antigravity-awesome-skills-claude/skills/swiftui-view-refactor/SKILL.md
swiftui-wcag-accessibility-auditor,"Audit SwiftUI iOS feature code for accessibility against WCAG 2.2 Level A/AA and return patch-ready fixes. Use when reviewing SwiftUI views/screens (including auth, forms, settings, and custom controls) and you need both standards traceability (WCAG + WCAG2Mobile interpretation) and practical, minimal code changes in a concise priority-grouped Markdown format with user follow-up checks for code-indeterminate behavior.",lib/ramzesenok-ios-accessibility-audit-skill/swiftui-wcag-accessibility-auditor/SKILL.md
wendy,"Expert guidance on building and deploying apps to WendyOS edge devices. Use when developers mention: (1) Wendy or WendyOS, (2) wendy CLI commands, (3) wendy.json or entitlements, (4) deploying apps to edge devices, (5) remote debugging Swift on ARM64, (6) NVIDIA Jetson or Raspberry Pi apps, (7) cross-compiling Swift for ARM64.",lib/joannis-claude-skills/wendy/SKILL.md
