skill_id,description,score,phase
seo-google,"Google SEO APIs: Search Console (Search Analytics, URL Inspection, Sitemaps), PageSpeed Insights v5, CrUX field data with 25-week history, Indexing API v3, and GA4 organic traffic. Provides real Google field data for Core Web Vitals, indexation status, search performance, and organic traffic trends. Use when user says ""search console"", ""GSC"", ""PageSpeed"", ""CrUX"", ""field data"", ""indexing API"", ""GA4 organic"", ""URL inspection"", ""google api setup"", ""real CWV data"", ""impressions"", ""clicks"", ""CTR"", ""position data"", ""LCP"", ""INP"", ""CLS"", ""FCP"", ""TTFB"", or ""Lighthouse scores"".",100,2
seo-maps,"Maps intelligence for local SEO — geo-grid rank tracking, GBP profile auditing via API, review intelligence across Google/Tripadvisor/Trustpilot, cross-platform NAP verification (Google/Bing/Apple/OSM), competitor radius mapping, and LocalBusiness schema generation from API data. Three-tier capability: free (Overpass + Geoapify), DataForSEO (full intelligence), DataForSEO + Google (maximum coverage). Use when user says ""maps"", ""geo-grid"", ""rank tracking"", ""GBP audit"", ""review velocity"", ""competitor radius"", ""maps analysis"", ""local rank tracking"", ""Share of Local Voice"", or ""SoLV"".",100,2
serving-llms-vllm,"Serves LLMs with high throughput using vLLM's PagedAttention and continuous batching. Use when deploying production LLM APIs, optimizing inference latency/throughput, or serving models with limited GPU memory. Supports OpenAI-compatible endpoints, quantization (GPTQ/AWQ/FP8), and tensor parallelism.",100,2
shopify-apps,"Shopify app development - Remix, Admin API, checkout extensions",100,2
springboot-patterns,"Spring Boot architecture patterns, REST API design, layered services, data access, caching, async processing, and logging. Use for Java Spring Boot backend work.",100,2
stable-baselines3,"Production-ready reinforcement learning algorithms (PPO, SAC, DQN, TD3, DDPG, A2C) with scikit-learn-like API. Use for standard RL experiments, quick prototyping, and well-documented algorithm implementations. Best for single-agent RL with Gymnasium environments. For high-performance parallel training, multi-agent systems, or custom vectorized environments, use pufferlib instead.",100,2
swift-library-design,"Expert guidance on Swift library and framework design. Use when developers mention: (1) designing a Swift library or framework, (2) public API design patterns, (3) protocol-oriented architecture or associated types, (4) result builders or DSL design, (5) performance optimization for libraries, (6) @inlinable or @usableFromInline, (7) noncopyable types for APIs, (8) progressive disclosure in API design, (9) ResponseGenerator or builder patterns.",100,2
testing-api-for-broken-object-level-authorization,"Tests REST and GraphQL APIs for Broken Object Level Authorization (BOLA/IDOR) vulnerabilities where an authenticated user can access or modify resources belonging to other users by manipulating object identifiers in API requests. The tester intercepts API calls, identifies object ID parameters (numeric IDs, UUIDs, slugs), and systematically replaces them with IDs belonging to other users to determine if the server enforces per-object authorization. This is OWASP API Security Top 10 2023 risk API1. Activates for requests involving BOLA testing, IDOR in APIs, object-level authorization testing, or API access control bypass.",100,2
testing-api-security-with-owasp-top-10,Systematically assessing REST and GraphQL API endpoints against the OWASP API Security Top 10 risks using automated and manual testing techniques.,100,2
usfiscaldata,"Query the U.S. Treasury Fiscal Data API for federal financial data including national debt, government spending, revenue, interest rates, exchange rates, and savings bonds. Access 54 datasets and 182 data tables with no API key required. Use when working with U.S. federal fiscal data, national debt tracking (Debt to the Penny), Daily Treasury Statements, Monthly Treasury Statements, Treasury securities auctions, interest rates on Treasury securities, foreign exchange rates, savings bonds, or any U.S. government financial statistics.",100,2
varlock,"Secure environment variable management with Varlock. Use when handling secrets, API keys, credentials, or any sensitive configuration. Ensures secrets are never exposed in terminals, logs, traces, or Claude's context. Trigger phrases include ""environment variables"", ""secrets"", "".env"", ""API key"", ""credentials"", ""sensitive"", ""Varlock"".",100,2
woocommerce,"WooCommerce REST API - products, orders, customers, webhooks",100,2
workspace,"Dynamic multi-repo and monorepo awareness for Claude Code. Analyze workspace topology, track API contracts, and maintain cross-repo context.",100,2
