skill_id,description,score,phase
analyzing-cloud-storage-access-patterns,"Detect abnormal access patterns in AWS S3, GCS, and Azure Blob Storage by analyzing CloudTrail Data Events, GCS audit logs, and Azure Storage Analytics. Identifies after-hours bulk downloads, access from new IP addresses, unusual API calls (GetObject spikes), and potential data exfiltration using statistical baselines and time-series anomaly detection.",100,2
analyzing-malware-behavior-with-cuckoo-sandbox,"Executes malware samples in Cuckoo Sandbox to observe runtime behavior including process creation, file system modifications, registry changes, network communications, and API calls. Generates comprehensive behavioral reports for malware classification and IOC extraction. Activates for requests involving dynamic malware analysis, sandbox detonation, behavioral analysis, or automated malware execution.",100,2
api-design,"REST API design patterns including resource naming, status codes, pagination, filtering, error responses, versioning, and rate limiting for production APIs.",100,2
asc-app-create-ui,Create a new App Store Connect app record via browser automation. Use when there is no public API for app creation and you need an agent to drive the New App form.,100,2
auditing-tls-certificate-transparency-logs,"Monitors Certificate Transparency (CT) logs to detect unauthorized certificate issuance, discover subdomains via CT data, and alert on suspicious certificate activity for owned domains. Uses the crt.sh API and direct CT log querying based on RFC 6962 to build continuous monitoring pipelines that catch rogue certificates, track CA behavior, and map the external attack surface. Activates for requests involving certificate transparency monitoring, CT log auditing, subdomain discovery via certificates, or certificate issuance alerting.",100,2
auto-review-loop-llm,"Autonomous research review loop using any OpenAI-compatible LLM API. Configure via llm-chat MCP server or environment variables. Trigger with ""auto review loop llm"" or ""llm review"".",100,2
auto-review-loop-minimax,"Autonomous multi-round research review loop using MiniMax API. Use when you want to use MiniMax instead of Codex MCP for external review. Trigger with ""auto review loop minimax"" or ""minimax review"".",100,2
aws-aurora,"AWS Aurora Serverless v2, RDS Proxy, Data API, connection pooling",100,2
aws-serverless-eda,"AWS serverless and event-driven architecture expert based on Well-Architected Framework. Use when building serverless APIs, Lambda functions, REST APIs, microservices, or async workflows. Covers Lambda with TypeScript/Python, API Gateway (REST/HTTP), DynamoDB, Step Functions, EventBridge, SQS, SNS, and serverless patterns. Essential when user mentions serverless, Lambda, API Gateway, event-driven, async processing, queues, pub/sub, or wants to build scalable serverless applications with AWS best practices.",100,2
azure-aigateway,"Configure Azure API Management as an AI Gateway for AI models, MCP tools, and agents. WHEN: semantic caching, token limit, content safety, load balancing, AI model governance, MCP rate limiting, jailbreak detection, add Azure OpenAI backend, add AI Foundry model, test AI gateway, LLM policies, configure AI backend, token metrics, AI cost control, convert API to MCP, import OpenAPI to gateway.",100,2
azure-devops,"Manage Azure DevOps projects, work items, repos, PRs, pipelines, wikis, test plans, security alerts, variable groups, environments/approvals, branch policies, and attachments. Use when user asks to: manage sprints, create/update work items, list repos, create PRs, run pipelines, search code, manage wiki pages, check security alerts, manage variable groups, approve deployments, or configure branch policies. Covers 13 domains with 99 tools via REST API.",100,2
azure-hosted-copilot-sdk,"Build and deploy GitHub Copilot SDK apps to Azure. WHEN: build copilot app, create copilot app, copilot SDK, @github/copilot-sdk, scaffold copilot project, copilot-powered app, deploy copilot app, host on azure, azure model, BYOM, bring your own model, use my own model, azure openai model, DefaultAzureCredential, self-hosted model, copilot SDK service, chat app with copilot, copilot-sdk-service template, azd init copilot, CopilotClient, createSession, sendAndWait, GitHub Models API.",100,2
azure-mgmt-apicenter-dotnet,"Azure API Center SDK for .NET. Centralized API inventory management with governance, versioning, and discovery. Use for creating API services, workspaces, APIs, versions, definitions, environments, deployments, and metadata schemas. Triggers: ""API Center"", ""ApiCenterService"", ""ApiCenterWorkspace"", ""ApiCenterApi"", ""API inventory"", ""API governance"", ""API versioning"", ""API catalog"", ""API discovery"".",100,2
azure-mgmt-apimanagement-dotnet,"Azure Resource Manager SDK for API Management in .NET. Use for MANAGEMENT PLANE operations: creating/managing APIM services, APIs, products, subscriptions, policies, users, groups, gateways, and backends via Azure Resource Manager. Triggers: ""API Management"", ""APIM service"", ""create APIM"", ""manage APIs"", ""ApiManagementServiceResource"", ""API policies"", ""APIM products"", ""APIM subscriptions"".",100,2
azure-mgmt-applicationinsights-dotnet,"Azure Application Insights SDK for .NET. Application performance monitoring and observability resource management. Use for creating Application Insights components, web tests, workbooks, analytics items, and API keys. Triggers: ""Application Insights"", ""ApplicationInsights"", ""App Insights"", ""APM"", ""application monitoring"", ""web tests"", ""availability tests"", ""workbooks"".",100,2
backend-patterns,"Backend architecture patterns, API design, database optimization, and server-side best practices for Node.js, Express, and Next.js API routes.",100,2
benchling-integration,"Benchling R&D platform integration. Access registry (DNA, proteins), inventory, ELN entries, workflows via API, build Benchling Apps, query Data Warehouse, for lab data management automation.",100,2
build,"Build Solana applications with Helius infrastructure. Covers transaction sending (Sender), asset/NFT queries (DAS API), real-time streaming (WebSockets, Laserstream), event pipelines (webhooks), priority fees, wallet analysis, and agent onboarding.",100,2
chroma,"Open-source embedding database for AI applications. Store embeddings and metadata, perform vector and full-text search, filter by metadata. Simple 4-function API. Scales from notebooks to production clusters. Use for semantic search, RAG applications, or document retrieval. Best for local development and open-source projects.",100,2
claude-api,"Anthropic Claude API patterns for Python and TypeScript. Covers Messages API, streaming, tool use, vision, extended thinking, batches, prompt caching, and Claude Agent SDK. Use when building applications with the Claude API or Anthropic SDKs.",100,2
conducting-api-security-testing,"Conducts security testing of REST, GraphQL, and gRPC APIs to identify vulnerabilities in authentication, authorization, rate limiting, input validation, and business logic. The tester uses the OWASP API Security Top 10 as the testing framework, combining Burp Suite interception with Postman collections and custom scripts to test endpoint security at every privilege level. Activates for requests involving API security testing, REST API pentest, GraphQL security assessment, or API vulnerability testing.",100,2
database-lookup,"Search 78 public scientific, biomedical, materials science, and economic databases via their REST APIs and return structured JSON results. Covers physics/astronomy (NASA, NIST, SDSS, SIMBAD, Exoplanet Archive), earth/environment (USGS, NOAA, EPA, OpenWeatherMap), chemistry/drugs (PubChem, ChEMBL, DrugBank, FDA, KEGG, DailyMed, ZINC, BindingDB), materials science (Materials Project, COD), biology/genomics (Reactome, BRENDA, UniProt, STRING, Ensembl, NCBI Gene, GEO, GTEx, PDB, AlphaFold, InterPro, ChEBI, BioGRID, Gene Ontology, QuickGO, NCBI Protein/Taxonomy, dbSNP, SRA, ENA, gnomAD, UCSC Genome, ENCODE, JASPAR, MouseMine, PRIDE, LINCS L1000, Human Protein Atlas, Human Cell Atlas, RummaGEO, Metabolomics Workbench, EMDB, Addgene), disease/clinical (COSMIC, Open Targets, ClinPGx, ClinicalTrials.gov, OMIM, ClinVar, GDC/TCGA, cBioPortal, DisGeNET, GWAS Catalog, Monarch, HPO), regulatory (FDA, USPTO, SEC EDGAR), economics/finance (FRED, BEA, BLS, Federal Reserve, World Bank, ECB, US Treasury, Alpha Vantage, Data Commons), and demographics (US Census, Eurostat, WHO). Use this skill whenever the user wants to look up compounds, drugs, proteins, genes, pathways, enzymes, gene expression, variants, clinical trials, patents, SEC filings, economic indicators, crystal structures, astronomical objects, earthquakes, weather, or any data from a public database API. Also trigger when the user mentions any database by name or asks about molecular properties, drug-target interactions, binding affinities, protein interactions, pathway membership, pharmacogenomics, economic time series, materials properties, commercially available compounds, virtual screening, compound purchasability, chemical libraries, building blocks, cancer genomics, somatic mutations, tumor mutation profiles, nucleotide sequences, genome assemblies, sequencing reads, ENA accessions, INSDC data, or wants to cross-reference entities across sources.",100,2
design-an-interface,"Generate multiple radically different interface designs for a module using parallel sub-agents. Use when user wants to design an API, explore interface options, compare module shapes, or mentions ""design it twice"".",100,2
detecting-api-enumeration-attacks,Detect and prevent API enumeration attacks including BOLA and IDOR exploitation by monitoring sequential identifier access patterns and authorization failures.,100,2
detecting-broken-object-property-level-authorization,Detect and test for OWASP API3:2023 Broken Object Property Level Authorization vulnerabilities including excessive data exposure and mass assignment attacks.,100,2
detecting-email-account-compromise,"Detect compromised O365 and Google Workspace email accounts by analyzing inbox rule creation, suspicious sign-in locations, mail forwarding rules, and unusual API access patterns via Microsoft Graph and audit logs.",100,2
devin-agent,"Devin AI自律コーディングエージェント。V3 API + 公式CLI対応。Playbook/Snapshot/structured_output活用。Team以上プランで本領発揮。Triggers: devin, Devin, 自律コーディング, coding agent",100,2
django-patterns,"Django architecture patterns, REST API design with DRF, ORM best practices, caching, signals, middleware, and production-grade Django apps.",100,2
docs:update-docs,"Update and maintain project documentation for local code changes using multi-agent workflow with tech-writer agents. Covers docs/, READMEs, JSDoc, and API documentation.",100,2
documentation,"Creates, structures, and reviews technical documentation following the Diátaxis framework (tutorials, how-to guides, reference, and explanation pages). Use when a user needs to write or reorganize docs, structure a tutorial vs. a how-to guide, build reference docs or API documentation, create explanation pages, choose between Diátaxis documentation types, or improve existing documentation structure. Trigger terms include: documentation structure, Diátaxis, tutorials vs how-to guides, organize docs, user guide, reference docs, technical writing.",100,2
esm,"Comprehensive toolkit for protein language models including ESM3 (generative multimodal protein design across sequence, structure, and function) and ESM C (efficient protein embeddings and representations). Use this skill when working with protein sequences, structures, or function prediction; designing novel proteins; generating protein embeddings; performing inverse folding; or conducting protein engineering tasks. Supports both local model usage and cloud-based Forge API for scalable inference.",100,2
exploiting-broken-function-level-authorization,"Tests APIs for Broken Function Level Authorization (BFLA) vulnerabilities where regular users can invoke administrative functions or access privileged API endpoints by directly calling them. The tester identifies admin and privileged endpoints, then attempts to access them with regular user credentials by manipulating HTTP methods, URL paths, and request parameters. Maps to OWASP API5:2023 Broken Function Level Authorization. Activates for requests involving BFLA testing, admin endpoint bypass, function-level access control testing, or API privilege escalation.",100,2
exploiting-excessive-data-exposure-in-api,"Tests APIs for excessive data exposure where endpoints return more data than the client application needs, relying on the frontend to filter sensitive fields. The tester intercepts API responses and analyzes them for leaked PII, internal identifiers, debug information, or sensitive business data that the UI does not display but the API transmits. This maps to OWASP API3:2023 Broken Object Property Level Authorization. Activates for requests involving API data leakage testing, excessive data exposure, response filtering bypass, or API over-fetching.",100,2
gemini-interactions-api,"Use this skill when writing code that calls the Gemini API for text generation, multi-turn chat, multimodal understanding, image generation, streaming responses, background research tasks, function calling, structured output, or migrating from the old generateContent API. This skill covers the Interactions API, the recommended way to use Gemini models and agents in Python and TypeScript.",100,2
git:attach-review-to-pr,Add line-specific review comments to pull requests using GitHub CLI API,100,2
huggingface-accelerate,"Simplest distributed training API. 4 lines to add distributed support to any PyTorch script. Unified API for DeepSpeed/FSDP/Megatron/DDP. Automatic device placement, mixed precision (FP16/BF16/FP8). Interactive config, single launch command. HuggingFace ecosystem standard.",100,2
hummingbird,"Expert guidance on Hummingbird 2 web framework. Use when developers mention: (1) Hummingbird, HB, or Hummingbird 2, (2) Swift web server or HTTP server, (3) server-side Swift routing or middleware, (4) building REST APIs in Swift, (5) RequestContext or ChildRequestContext, (6) HummingbirdAuth or authentication middleware, (7) HummingbirdWebSocket, (8) HummingbirdFluent or database integration, (9) ResponseGenerator or EditedResponse.",100,2
implementing-api-abuse-detection-with-rate-limiting,"Implement API abuse detection using token bucket, sliding window, and adaptive rate limiting algorithms to prevent DDoS, brute force, and credential stuffing attacks.",100,2
implementing-api-rate-limiting-and-throttling,"Implements API rate limiting and throttling controls using token bucket, sliding window, and fixed window algorithms to protect against brute force attacks, credential stuffing, resource exhaustion, and API abuse. The engineer configures per-user, per-IP, and per-endpoint rate limits using Redis-backed counters, API gateway plugins, or application middleware, and implements proper HTTP 429 responses with Retry-After headers. Activates for requests involving rate limiting implementation, API throttling setup, request quota management, or API abuse prevention.",100,2
implementing-api-schema-validation-security,"Implement API schema validation using OpenAPI specifications and JSON Schema to enforce input/output contracts and prevent injection, data exposure, and mass assignment attacks.",100,2
implementing-api-security-posture-management,"Implement API Security Posture Management to continuously discover, classify, and score APIs based on risk while enforcing security policies across the API lifecycle.",100,2
implementing-api-security-testing-with-42crunch,Implement comprehensive API security testing using the 42Crunch platform to perform static audit and dynamic conformance scanning of OpenAPI specifications.,100,2
implementing-deception-based-detection-with-canarytoken,"Deploy and monitor Canary Tokens via the Thinkst Canary API for deception-based breach detection using web bug tokens, DNS tokens, document tokens, and AWS key tokens.",100,2
implementing-endpoint-detection-with-wazuh,"Deploy and configure Wazuh SIEM/XDR for endpoint detection including agent management, custom decoder and rule XML creation, alert querying via the Wazuh REST API, and automated response actions.",100,2
implementing-honeytokens-for-breach-detection,"Deploys canary tokens and honeytokens (fake AWS credentials, DNS canaries, document beacons, database records) that trigger alerts when accessed by attackers. Uses the Canarytokens API and custom webhook integrations for breach detection. Use when building deception-based early warning systems for intrusion detection.",100,2
implementing-network-traffic-analysis-with-arkime,"Deploy and query Arkime (formerly Moloch) for full packet capture network traffic analysis. Uses the Arkime API v3 to search sessions, download PCAPs, analyze connection patterns, detect beaconing behavior, and identify suspicious network flows. Monitors DNS queries, HTTP traffic, and TLS certificate anomalies across captured traffic.",100,2
implementing-soar-playbook-for-phishing,"Automate phishing incident response using Splunk SOAR REST API to create containers, add artifacts, and trigger playbooks",100,2
labarchive-integration,"Electronic lab notebook API integration. Access notebooks, manage entries/attachments, backup notebooks, integrate with Protocols.io/Jupyter/REDCap, for programmatic ELN workflows.",100,2
laravel-patterns,"Laravel architecture patterns, routing/controllers, Eloquent ORM, service layers, queues, events, caching, and API resources for production apps.",100,2
manus-agent,"Manus AI汎用エージェント。リサーチ・ドキュメント生成・ブラウザ操作の完全自動実行。REST API+Python SDK対応。100並列エージェントで大規模リサーチが得意。Triggers: manus, マヌス, リサーチエージェント, 調査自動化",100,2
mcp-server-patterns,"Build MCP servers with Node/TypeScript SDK — tools, resources, prompts, Zod validation, stdio vs Streamable HTTP. Use Context7 or official MCP docs for latest API.",100,2
medusa,"Medusa headless commerce - modules, workflows, API routes, admin UI",100,2
ms-teams-apps,"Microsoft Teams bots and AI agents - Claude/OpenAI, Adaptive Cards, Graph API",100,2
observe-whatsapp,"Observe and troubleshoot WhatsApp in Kapso: debug message delivery, inspect webhook deliveries/retries, triage API errors, and run health checks. Use when investigating production issues, message failures, or webhook delivery problems.",100,2
opentrons-integration,"Official Opentrons Protocol API for OT-2 and Flex robots. Use when writing protocols specifically for Opentrons hardware with full access to Protocol API v2 features. Best for production Opentrons protocols, official API compatibility. For multi-vendor automation or broader equipment control use pylabrobot.",100,2
paper-lookup,"Search 10 academic paper databases via their REST APIs to find research papers, preprints, and scholarly articles. Covers biomedical literature (PubMed, PMC full text), preprint servers (bioRxiv, medRxiv, arXiv), multidisciplinary indexes (OpenAlex, Crossref, Semantic Scholar), open access aggregators (CORE, Unpaywall). Use this skill whenever the user wants to search for research papers, find citations, look up articles by DOI or PMID, retrieve abstracts or full text, check open access availability, find preprints, explore citation graphs, search by author or keyword, or access any scholarly literature database. Also trigger when the user mentions PubMed, PMC, bioRxiv, medRxiv, arXiv, OpenAlex, Crossref, Semantic Scholar, CORE, Unpaywall, or asks about paper metadata, citation counts, journal articles, manuscript lookups, literature reviews, or systematic searches. Even if the user just says ""find papers on X"" or ""what's been published about Y"" or ""look up this DOI"", this skill should activate.",100,2
parallel-web,"Search the web, extract URL content, and run deep research using the Parallel Chat API and Extract API. Use for ALL web searches, research queries, and general information gathering. Provides synthesized summaries with citations.",100,2
performing-api-rate-limiting-bypass,"Tests API rate limiting implementations for bypass vulnerabilities by manipulating request headers, IP addresses, HTTP methods, API versions, and encoding schemes to circumvent request throttling controls. The tester identifies rate limit headers, determines enforcement mechanisms, and attempts bypasses including X-Forwarded-For spoofing, parameter pollution, case variation, and endpoint path manipulation. Maps to OWASP API4:2023 Unrestricted Resource Consumption. Activates for requests involving rate limit bypass, API throttling evasion, brute force protection testing, or API abuse prevention assessment.",100,2
performing-cloud-storage-forensic-acquisition,"Perform forensic acquisition and analysis of cloud storage services including Google Drive, OneDrive, Dropbox, and Box by collecting both API-based remote data and local sync client artifacts from endpoint devices.",100,2
perplexity-search,"Perform AI-powered web searches with real-time information using Perplexity models via LiteLLM and OpenRouter. This skill should be used when conducting web searches for current information, finding recent scientific literature, getting grounded answers with source citations, or accessing information beyond the model knowledge cutoff. Provides access to multiple Perplexity models including Sonar Pro, Sonar Pro Search (advanced agentic search), and Sonar Reasoning Pro through a single OpenRouter API key.",100,2
phantom,"Build frontend Solana applications with Phantom Connect SDK and Helius infrastructure. Covers React, React Native, and browser SDK integration, transaction signing via Helius Sender, API key proxying, token gating, NFT minting, crypto payments, real-time updates, and secure frontend architecture.",100,2
playwright-core,"Battle-tested Playwright patterns for E2E, API, component, visual, accessibility, and security testing. Covers locators, assertions, fixtures, network mocking, auth flows, debugging, and framework recipes for React, Next.js, Vue, and Angular. TypeScript and JavaScript.",100,2
podcast-generation,"Generate AI-powered podcast-style audio narratives using Azure OpenAI's GPT Realtime Mini model via WebSocket. Use when building text-to-speech features, audio narrative generation, podcast creation from content, or integrating with Azure OpenAI Realtime API for real audio output. Covers full-stack implementation from React frontend to Python FastAPI backend with WebSocket streaming.",100,2
producthunt,"Search and retrieve content from Product Hunt. Get posts, topics, users, and collections via the GraphQL API. Use when user mentions Product Hunt, PH, or product launches.",100,2
protocolsio-integration,"Integration with protocols.io API for managing scientific protocols. This skill should be used when working with protocols.io to search, create, update, or publish protocols; manage protocol steps and materials; handle discussions and comments; organize workspaces; upload and manage files; or integrate protocols.io functionality into workflows. Applicable for protocol discovery, collaborative protocol development, experiment tracking, lab protocol management, and scientific documentation.",100,2
pylabrobot,"Vendor-agnostic lab automation framework. Use when controlling multiple equipment types (Hamilton, Tecan, Opentrons, plate readers, pumps) or needing unified programming across different vendors. Best for complex workflows, multi-vendor setups, simulation. For Opentrons-only protocols with official API, opentrons-integration may be simpler.",100,2
rating-prompt-strategy,"When the user wants to improve their app's star rating, increase ratings volume, optimize when and how they prompt users for a review, or recover from a bad rating period. Use when the user mentions ""app rating"", ""star rating"", ""review prompt"", ""SKStoreReviewRequest"", ""In-App Review API"", ""ask for review"", ""low rating"", ""rating drop"", ""get more reviews"", or ""recover from 1-star"". For responding to reviews, see review-management. For overall ASO health, see aso-audit.",100,2
reddit,"Search and retrieve content from Reddit. Get posts, comments, subreddit info, and user profiles via the public JSON API. Use when user mentions Reddit, a subreddit, or r/ links.",100,2
reddit-ads,"Reddit Ads API - campaigns, targeting, conversions, agentic optimization",100,2
research-lookup,"Look up current research information using the Parallel Chat API (primary) or Perplexity sonar-pro-search (academic paper searches). Automatically routes queries to the best backend. Use for finding papers, gathering research data, and verifying scientific information.",100,2
semantic-scholar,"Search published venue papers (IEEE, ACM, Springer, etc.) via Semantic Scholar API. Complements /arxiv (preprints) with citation counts, venue metadata, and TLDR. Use when user says ""search semantic scholar"", ""find IEEE papers"", ""find journal papers"", ""venue papers"", ""citation search"", or wants published literature beyond arXiv preprints.",100,2
