skill_id,description,score,phase
add-new-opc-skill,"Checklist and automation guide for adding a new skill to the OPC Skills project. Ensures all required files, metadata, logos, and listings are created before release. Use when adding a new skill, publishing a skill, or preparing a skill for release.",100,5
aeon,"This skill should be used for time series machine learning tasks including classification, regression, clustering, forecasting, anomaly detection, segmentation, and similarity search. Use when working with temporal data, sequential patterns, or time-indexed observations requiring specialized algorithms beyond standard ML approaches. Particularly suited for univariate and multivariate time series analysis with scikit-learn compatible APIs.",100,2
ai-studio-image,Geracao de imagens humanizadas via Google AI Studio (Gemini). Fotos realistas estilo influencer ou educacional com iluminacao natural e imperfeicoes sutis.,100,4
algorithmic-art,"Algorithmic philosophies are computational aesthetic movements that are then expressed through code. Output .md files (philosophy), .html files (interactive viewer), and .js files (generative algorithms).",100,4
analyzing-golang-malware-with-ghidra,"Reverse engineer Go-compiled malware using Ghidra with specialized scripts for function recovery, string extraction, and type reconstruction in stripped Go binaries.",100,4
analyzing-ransomware-encryption-mechanisms,"Analyzes encryption algorithms, key management, and file encryption routines used by ransomware families to assess decryption feasibility, identify implementation weaknesses, and support recovery efforts. Covers AES, RSA, ChaCha20, and hybrid encryption schemes. Activates for requests involving ransomware cryptanalysis, encryption analysis, key recovery assessment, or ransomware decryption feasibility.",100,4
architecture-patterns,"Master proven backend architecture patterns including Clean Architecture, Hexagonal Architecture, and Domain-Driven Design to build maintainable, testable, and scalable systems.",100,1
auditing-gcp-iam-permissions,"Auditing Google Cloud Platform IAM permissions to identify overly permissive bindings, primitive role usage, service account key proliferation, and cross-project access risks using gcloud CLI, Policy Analyzer, and IAM Recommender.",100,4
azure-deploy,"Execute Azure deployments for ALREADY-PREPARED applications that have existing .azure/plan.md and infrastructure files. DO NOT use this skill when the user asks to CREATE a new application — use azure-prepare instead. This skill runs azd up, azd deploy, terraform apply, and az deployment commands with built-in error recovery. Requires .azure/plan.md from azure-prepare and validated status from azure-validate. WHEN: ""run azd up"", ""run azd deploy"", ""execute deployment"", ""push to production"", ""push to cloud"", ""go live"", ""ship it"", ""bicep deploy"", ""terraform apply"", ""publish to Azure"", ""launch on Azure"". DO NOT USE WHEN: ""create and deploy"", ""build and deploy"", ""create a new app"", ""set up infrastructure"", ""create and deploy to Azure using Terraform"" — use azure-prepare for these.",100,5
azure-mgmt-mongodbatlas-dotnet,Manage MongoDB Atlas Organizations as Azure ARM resources with unified billing through Azure Marketplace.,100,4
blockrun,BlockRun works with Claude Code and Google Antigravity.,100,4
characteristic-voice,"Use this skill whenever the user wants speech to sound more human, companion-like, or emotionally expressive. Triggers include: any mention of 'say like', 'talk like', 'speak like', 'companion voice', 'comfort me', 'cheer me up', 'sound more human', 'good night voice', 'good morning voice', or requests to add fillers, emotion, or personality to generated speech. Also use when the user wants to mimic a specific character's voice, apply speaking style presets (goodnight, morning, comfort, celebration, chatting), tune emotional parameters like warmth or tenderness, or make TTS output feel like a real person talking. If the user asks for a 'voice message', 'companion audio', 'character voice', or wants speech that sighs, laughs, hesitates, or sounds genuinely warm, use this skill. Do NOT use for plain text-to-speech without personality, music generation, sound effects, or general coding tasks unrelated to expressive speech.",100,2
competitor-tracking,"When the user wants to monitor competitor apps on an ongoing basis — tracking metadata changes, keyword shifts, screenshot updates, rating trends, or new features. Use when the user mentions ""competitor monitoring"", ""track competitors"", ""competitor alert"", ""competitor changed their title"", ""watch a competitor app"", ""competitor weekly report"", ""competitive intelligence"", or ""what changed in competitor's listing"". For a one-time deep competitive analysis, see competitor-analysis. For market-wide chart movements, see market-movers.",100,4
conducting-domain-persistence-with-dcsync,"Perform DCSync attacks to replicate Active Directory credentials and establish domain persistence by extracting KRBTGT, Domain Admin, and service account hashes for Golden Ticket creation.",100,4
configuring-identity-aware-proxy-with-google-iap,"Configuring Google Cloud Identity-Aware Proxy (IAP) to enforce per-request identity verification for Compute Engine, App Engine, Cloud Run, and GKE services using access levels, context-aware policies, and programmatic access with service accounts.",100,4
context-optimization,"Context optimization extends the effective capacity of limited context windows through strategic compression, masking, caching, and partitioning. The goal is not to magically increase context windows but to make better use of available capacity.",100,4
dbos-golang,"Guide for building reliable, fault-tolerant Go applications with DBOS durable workflows. Use when adding DBOS to existing Go code, creating workflows and steps, or using queues for concurrency control.",100,5
detecting-command-and-control-over-dns,"Detects command-and-control (C2) communications tunneled through DNS protocol including DNS tunneling tools (Iodine, dnscat2, dns2tcp, Cobalt Strike DNS beacon), domain generation algorithms (DGA), encoded payload delivery via TXT/CNAME records, and DNS beaconing patterns. Covers Shannon entropy analysis of query subdomains, statistical anomaly detection, ML-based DGA classification, passive DNS correlation, and Zeek/Suricata signature development. Activates for requests involving DNS-based C2 detection, DNS tunnel identification, suspicious DNS traffic investigation, or DGA domain classification.",100,4
detecting-golden-ticket-attacks-in-kerberos-logs,"Detect Golden Ticket attacks in Active Directory by analyzing Kerberos TGT anomalies including mismatched encryption types, impossible ticket lifetimes, non-existent accounts, and forged PAC signatures in domain controller event logs.",100,4
detecting-golden-ticket-forgery,"Detect Kerberos Golden Ticket forgery by analyzing Windows Event ID 4769 for RC4 encryption downgrades (0x17), abnormal ticket lifetimes, and krbtgt account anomalies in Splunk and Elastic SIEM",100,4
detecting-pass-the-hash-attacks,"Detect Pass-the-Hash attacks by analyzing NTLM authentication patterns, identifying Type 3 logons with NTLM where Kerberos is expected, and correlating with credential dumping.",100,4
detecting-service-account-abuse,"Detect abuse of service accounts through anomalous interactive logons, privilege escalation, lateral movement, and unauthorized access patterns.",100,4
django-access-review,django-access-review,100,4
django-pro,"Master Django 5.x with async views, DRF, Celery, and Django Channels. Build scalable web applications with proper architecture, testing, and deployment.",100,2
document-hunter,"Searches and retrieves documents from free public sources using automated browser navigation. Use when research needs primary source documents like court filings, government reports, or public records.",100,4
fp-pragmatic,"A practical, jargon-free guide to functional programming - the 80/20 approach that gets results without the academic overhead",100,5
fpf:decay,Manage evidence freshness by identifying stale decisions and providing governance actions,100,4
gene-database,"Query NCBI Gene via E-utilities/Datasets API. Search by symbol/ID, retrieve gene info (RefSeqs, GO, locations, phenotypes), batch lookups, for gene annotation and functional analysis.",100,4
geoffrey-hinton,"Agente que simula Geoffrey Hinton — Godfather of Deep Learning, Prêmio Turing 2018, criador do backpropagation e das Deep Belief Networks.",100,4
ginkgo-cloud-lab,"Submit and manage protocols on Ginkgo Bioworks Cloud Lab (cloud.ginkgo.bio), a web-based interface for autonomous lab execution on Reconfigurable Automation Carts (RACs). Use when the user wants to run cell-free protein expression (validation or optimization), generate fluorescent pixel art, or interact with Ginkgo Cloud Lab services. Covers protocol selection, input preparation, pricing, and ordering workflows.",100,4
github-workflow-automation,"Patterns for automating GitHub workflows with AI assistance, inspired by [Gemini CLI](https://github.com/google-gemini/gemini-cli) and modern DevOps practices.",100,4
go-concurrency-patterns,"Master Go concurrency with goroutines, channels, sync primitives, and context. Use when building concurrent Go applications, implementing worker pools, or debugging race conditions.",100,5
go-mode,"Autonomous goal execution — give a goal, get a plan, confirm, execute, report. You steer, Claude drives.",100,4
go-playwright,"Expert capability for robust, stealthy, and efficient browser automation using Playwright Go.",100,4
go-rod-master,Comprehensive guide for browser automation and web scraping with go-rod (Chrome DevTools Protocol) including stealth anti-bot-detection patterns.,100,2
goal-analyzer,"分析健康目标数据、识别目标模式、评估目标进度,并提供个性化目标管理建议。支持与营养、运动、睡眠等健康数据的关联分析。",100,4
godot-4-migration,"Specialized guide for migrating Godot 3.x projects to Godot 4 (GDScript 2.0), covering syntax changes, Tweens, and exports.",100,5
golang-pro,"Master Go 1.21+ with modern patterns, advanced concurrency, performance optimization, and production-ready microservices.",100,4
google-tts,"Convert documents and text to audio using Google Cloud Text-to-Speech. Use this skill when the user wants to: narrate a document, read aloud text, generate audio from a file, convert text to speech, create a recording of documentation or analysis, create a podcast from a document, or use Google TTS/text-to-speech. Trigger phrases: ""read this aloud"", ""narrate this"", ""create a recording"", ""text to speech"", ""TTS"", ""convert to audio"", ""audio from document"", ""listen to this"", ""generate audio"", ""google tts"", ""create a podcast"".",100,4
grpc-golang,"Build production-ready gRPC services in Go with mTLS, streaming, and observability. Use when designing Protobuf contracts with Buf or implementing secure service-to-service transport.",100,5
hunting-for-ntlm-relay-attacks,"Detect NTLM relay attacks by analyzing Windows Event 4624 logon type 3 with NTLMSSP authentication, identifying IP-to-hostname mismatches, Responder traffic signatures, SMB signing status, and suspicious authentication patterns across the domain.",100,4
hunting-for-registry-persistence-mechanisms,"Hunt for registry-based persistence mechanisms including Run keys, Winlogon modifications, IFEO injection, and COM hijacking in Windows environments.",100,4
idea-discovery,"Workflow 1: Full idea discovery pipeline. Orchestrates research-lit → idea-creator → novelty-check → research-review to go from a broad research direction to validated, pilot-tested ideas. Use when user says ""找idea全流程"", ""idea discovery pipeline"", ""从零开始找方向"", or wants the complete idea exploration workflow.",100,5
idea-discovery-robot,"Workflow 1 adaptation for robotics and embodied AI. Orchestrates robotics-aware literature survey, idea generation, novelty check, and critical review to go from a broad robotics direction to benchmark-grounded, simulation-first ideas. Use when user says ""robotics idea discovery"", ""机器人找idea"", ""embodied AI idea"", ""机器人方向探索"", ""sim2real 选题"", or wants ideas for manipulation, locomotion, navigation, drones, humanoids, or general robot learning.",100,5
implementing-container-image-minimal-base-with-distroless,"Reduce container attack surface by building application images on Google distroless base images that contain only the application runtime with no shell, package manager, or unnecessary OS utilities.",100,5
implementing-google-workspace-phishing-protection,"Configure Google Workspace advanced phishing and malware protection settings including pre-delivery scanning, attachment protection, spoofing detection, and Enhanced Safe Browsing.",100,4
implementing-google-workspace-sso-configuration,"Configure SAML 2.0 single sign-on for Google Workspace with a third-party identity provider, enabling centralized authentication and enforcing organization-wide access policies.",100,4
implementing-identity-governance-with-sailpoint,"Deploy SailPoint IdentityNow or IdentityIQ for identity governance and administration. Covers identity lifecycle management, access request workflows, certification campaigns, role mining, SOD policy",100,4
implementing-rsa-key-pair-management,"RSA (Rivest-Shamir-Adleman) is the most widely deployed asymmetric cryptographic algorithm, used for digital signatures, key exchange, and encryption. This skill covers generating, storing, rotating,",100,4
interpro-database,"Query InterPro for protein family, domain, and functional site annotations. Integrates Pfam, PANTHER, PRINTS, SMART, SUPERFAMILY, and 11 other member databases. Use for protein function prediction, domain architecture analysis, evolutionary classification, and GO term mapping.",100,4
kaizen:cause-and-effect,Systematic Fishbone analysis exploring problem causes across six categories,100,4
leiloeiro-edital,"Analise e auditoria de editais de leilao judicial e extrajudicial. Riscos ocultos, clausulas perigosas, debitos, ocupante e classificacao da oportunidade.",100,4
leiloeiro-juridico,"Analise juridica de leiloes: nulidades, bem de familia, alienacao fiduciaria, CPC arts 829-903, Lei 9514/97, onus reais, embargos e jurisprudencia.",100,4
makepad-reference,"CRITICAL: Use for Makepad troubleshooting and reference. Triggers on: troubleshoot, error, debug, fix, problem, issue, no matching field, parse error, widget not found, UI not updating, code quality, refactor, responsive layout, adaptive, api docs, reference, documentation, 故障排除, 错误, 调试, 问题, 修复",100,2
matematico-tao,"Matemático ultra-avançado inspirado em Terence Tao. Análise rigorosa de código e arquitetura com teoria matemática profunda: teoria da informação, teoria dos grafos, complexidade computacional, álgebra linear, análise estocástica, teoria das categorias, probabilidade bayesiana e lógica formal.",100,5
micro-saas-launcher,"You ship fast and iterate. You know the difference between a side project and a business. You've seen what works in the indie hacker community. You help people go from idea to paying customers in weeks, not years. You focus on sustainable, profitable businesses - not unicorn hunting.",100,4
minecraft-bukkit-pro,"Master Minecraft server plugin development with Bukkit, Spigot, and Paper APIs.",100,4
monetization,"Estrategia e implementacao de monetizacao para produtos digitais - Stripe, subscriptions, pricing experiments, freemium, upgrade flows, churn prevention, revenue optimization e modelos de negocio SaaS.",100,4
nanobanana,"Generate and edit images using Google Gemini 3 Pro Image (Nano Banana Pro). Supports text-to-image, image editing, various aspect ratios, and high-resolution output (2K/4K). Use when user wants to generate images, create images, use Gemini image generation, or do AI image generation.",100,4
netlify-ai-gateway,"Guide for using Netlify AI Gateway to access AI models. Use when adding AI capabilities or selecting/changing AI models. Must be read before choosing a model. Covers supported providers (OpenAI, Anthropic, Google), SDK setup, environment variables, and the list of available models.",100,5
notebooklm,"Interact with Google NotebookLM to query documentation with Gemini's source-grounded answers. Each question opens a fresh browser session, retrieves the answer exclusively from your uploaded documents, and closes.",100,4
onboarding-cro,"You are an expert in user onboarding and activation. Your goal is to help users reach their ""aha moment"" as quickly as possible and establish habits that lead to long-term retention.",100,5
paper-writing,"Workflow 3: Full paper writing pipeline. Orchestrates paper-plan → paper-figure → paper-write → paper-compile → auto-paper-improvement-loop to go from a narrative report to a polished, submission-ready PDF. Use when user says ""写论文全流程"", ""write paper pipeline"", ""从报告到PDF"", ""paper writing"", or wants the complete paper generation workflow.",100,5
paywall-upgrade-cro,"You are an expert in in-app paywalls and upgrade flows. Your goal is to convert free users to paid, or upgrade users to higher tiers, at moments when they've experienced enough value to justify the commitment.",100,4
performing-cryptographic-audit-of-application,"A cryptographic audit systematically reviews an application's use of cryptographic primitives, protocols, and key management to identify vulnerabilities such as weak algorithms, insecure modes, hardco",100,4
performing-entitlement-review-with-sailpoint-iiq,"Performs entitlement review and access certification campaigns using SailPoint IdentityIQ including manager certifications, targeted entitlement reviews, role-based access validation, SOD violation remediation, and automated revocation workflows. Activates for requests involving access reviews, entitlement certifications, SailPoint IIQ governance, or periodic user access recertification.",100,4
performing-nist-csf-maturity-assessment,"The NIST Cybersecurity Framework (CSF) 2.0, released in February 2024, provides a comprehensive taxonomy for managing cybersecurity risk through six core Functions - Govern, Identify, Protect, Detect, Respond, and Recover. This skill covers conducting a maturity assessment against the CSF using Implementation Tiers to measure organizational cybersecurity posture and create improvement roadmaps.",100,4
performing-privacy-impact-assessment,"Automates the Privacy Impact Assessment (PIA) workflow including data flow mapping, privacy risk scoring matrices, GDPR Article 35 DPIA and CCPA/CPRA alignment checks, data inventory cataloging, and remediation tracking. Implements the NIST Privacy Framework PRAM methodology and ICO DPIA guidance for systematic identification and mitigation of privacy risks across processing activities. Use when conducting privacy assessments for new systems, evaluating regulatory compliance posture, or building automated privacy governance programs.",100,5
performing-ransomware-response,"Executes a structured ransomware incident response from initial detection through containment, forensic analysis, decryption assessment, recovery, and post-incident hardening. Addresses ransom negotiation considerations, backup integrity verification, and regulatory notification requirements. Activates for requests involving ransomware response, ransomware recovery, crypto-ransomware, data encryption attack, ransom payment decision, or ransomware containment.",100,5
pol-probe-advisor,"Select the right Proof of Life (PoL) probe based on hypothesis, risk, and resources. Use this to match the validation method to the real learning goal, not tooling comfort.",100,4
qutip,"Quantum physics simulation library for open quantum systems. Use when studying master equations, Lindblad dynamics, decoherence, quantum optics, or cavity QED. Best for physics research, open system dynamics, and educational simulations. NOT for circuit-based quantum computing—use qiskit, cirq, or pennylane for quantum algorithms and hardware execution.",100,5
readme,"When the user wants to create or update a README.md file for a project. Also use when the user says ""write readme,"" ""create readme,"" ""document this project,"" ""project documentation,"" or asks for help with README.md. This skill creates absurdly thorough documentation covering local setup, architecture, and deployment.",100,4
scroll-experience,"You see scrolling as a narrative device, not just navigation. You create moments of delight as users scroll. You know when to use subtle animations and when to go cinematic. You balance performance with visual impact. You make websites feel like movies you control with your thumb.",100,4
sentencepiece,"Language-independent tokenizer treating text as raw Unicode. Supports BPE and Unigram algorithms. Fast (50k sentences/sec), lightweight (6MB memory), deterministic vocabulary. Used by T5, ALBERT, XLNet, mBART. Train on raw text without pre-tokenization. Use when you need multilingual support, CJK languages, or reproducible tokenization.",100,4
signup-flow-cro,"You are an expert in optimizing signup and registration flows. Your goal is to reduce friction, increase completion rates, and set users up for successful activation.",100,4
skill-router,Use when the user is unsure which skill to use or where to start. Interviews the user with targeted questions and recommends the best skill(s) from the installed library for their goal.,100,4
skill-sentinel,"Auditoria e evolucao do ecossistema de skills. Qualidade de codigo, seguranca, custos, gaps, duplicacoes, dependencias e relatorios de saude.",100,4
sred-work-summary,Go back through the previous year of work and create a Notion doc that groups relevant links into projects that can then be documented as SRED projects.,100,4
string-database,"Query STRING API for protein-protein interactions (59M proteins, 20B interactions). Network analysis, GO/KEGG enrichment, interaction discovery, 5000+ species, for systems biology.",100,4
temporal-golang-pro,"Use when building durable distributed systems with Temporal Go SDK. Covers deterministic workflow rules, mTLS worker configs, and advanced patterns.",100,5
transformer-lens-interpretability,"Provides guidance for mechanistic interpretability research using TransformerLens to inspect and manipulate transformer internals via HookPoints and activation caching. Use when reverse-engineering model algorithms, studying attention patterns, or performing activation patching experiments.",100,5
what-if-oracle,"Run structured What-If scenario analysis with multi-branch possibility exploration. Use this skill when the user asks speculative questions like ""what if..."", ""what would happen if..."", ""what are the possibilities"", ""explore scenarios"", ""scenario analysis"", ""possibility space"", ""what could go wrong"", ""best case / worst case"", ""risk analysis"", ""contingency planning"", ""strategic options"", or any question about uncertain futures. Also trigger when the user faces a fork-in-the-road decision, wants to stress-test an idea, or needs to think through consequences before committing.",100,4
yann-lecun-tecnico,"Sub-skill técnica de Yann LeCun. Cobre CNNs, LeNet, backpropagation, JEPA (I-JEPA, V-JEPA, MC-JEPA), AMI (Advanced Machinery of Intelligence), Self-Supervised Learning (SimCLR, MAE, BYOL), Energy-Based Models (EBMs) e código PyTorch completo.",100,4
yes-md,"6-layer AI governance: safety gates, evidence-based debugging, anti-slack detection, and machine-enforced hooks. Makes AI safe, thorough, and honest.",100,4
