skill_id,description,score,phase
fp-types-ref,"Quick reference for fp-ts types. Use when user asks which type to use, needs Option/Either/Task decision help, or wants fp-ts imports.",5,1
gdpr-data-handling,"Practical implementation guide for GDPR-compliant data processing, consent management, and privacy controls.",5,1
geniml,"This skill should be used when working with genomic interval data (BED files) for machine learning tasks. Use for training region embeddings (Region2Vec, BEDspace), single-cell ATAC-seq analysis (scEmbed), building consensus peaks (universes), or any ML-based analysis of genomic regions. Applies to BED file collections, scATAC-seq data, chromatin accessibility datasets, and region-based genomic feature learning.",5,1
gguf-quantization,"GGUF format and llama.cpp quantization for efficient CPU/GPU inference. Use when deploying models on consumer hardware, Apple Silicon, or when needing flexible quantization from 2-8 bit without GPU requirements.",5,1
gsap-scrolltrigger,"Official GSAP skill for ScrollTrigger — scroll-linked animations, pinning, scrub, triggers. Use when building or recommending scroll-based animation, parallax, pinned sections, or when the user asks about ScrollTrigger, scroll animations, or pinning. Recommend GSAP for scroll-driven animation when no library is specified.",5,1
help,"Shows available skills, common workflows, and quick reference for the plugin. Use when the user asks for help, what skills are available, or how to do something.",5,1
hig-components-dialogs,"Apple HIG guidance for presentation components including alerts, action sheets, popovers, sheets, and digit entry views.",5,1
hig-components-layout,Apple Human Interface Guidelines for layout and navigation components.,5,1
hig-components-search,"Apple HIG guidance for navigation-related components including search fields, page controls, and path controls.",5,1
hig-components-system,"Apple HIG guidance for system experience components: widgets, live activities, notifications, complications, home screen quick actions, top shelf, watch faces, app clips, and app shortcuts.",5,1
hosted-agents,"Build background agents in sandboxed environments. Use for hosted coding agents, sandboxed VMs, Modal sandboxes, and remote coding environments.",5,1
hosted-agents-v2-py,Build hosted agents using Azure AI Projects SDK with ImageBasedHostedAgentDefinition. Use when creating container-based agents in Azure AI Foundry.,5,1
humanizer,"Remove signs of AI-generated writing from text. Use when editing or reviewing text to make it sound more natural and human-written. Based on Wikipedia's comprehensive ""Signs of AI writing"" guide. Detects and fixes patterns including: inflated symbolism, promotional language, superficial -ing analyses, vague attributions, em dash overuse, rule of three, AI vocabulary words, negative parallelisms, and excessive conjunctive phrases.",5,1
implementing-gdpr-data-subject-access-request,"Automates GDPR Data Subject Access Request (DSAR) workflows including identity verification, PII discovery across databases and files using regex and NER, data mapping, response templating per Article 15 requirements, deadline tracking, and audit logging. Covers ICO/EDPB guidance compliance, exemption handling, and scalable batch processing. Use when building or auditing DSAR response capabilities under GDPR/UK GDPR.",5,1
implementing-log-integrity-with-blockchain,"Build an append-only log integrity chain using SHA-256 hash chaining for tamper detection. Each log entry is hashed with the previous entry's hash to create a blockchain-like structure where modifying any entry invalidates all subsequent hashes. Implements log ingestion, chain verification, tamper detection with pinpoint identification, and periodic checkpoint anchoring to external timestamping services.",5,1
implementing-pci-dss-compliance-controls,"PCI DSS 4.0.1 establishes 12 requirements across 6 control objectives for organizations that store, process, or transmit cardholder data. With PCI DSS 3.2.1 retiring April 2024 and 51 new requirements",5,1
jobgpt,"Job search automation, auto apply, resume generation, application tracking, salary intelligence, and recruiter outreach using the JobGPT MCP server.",5,1
kaizen,"Guide for continuous improvement, error proofing, and standardization. Use this skill when the user wants to improve code quality, refactor, or discuss process improvements.",5,1
kaizen:kaizen,"Use when Code implementation and refactoring, architecturing or designing systems, process and workflow improvements, error handling and validation. Provide tehniquest to avoid over-engineering and apply iterative improvements.",5,1
lamindb,"This skill should be used when working with LaminDB, an open-source data framework for biology that makes data queryable, traceable, reproducible, and FAIR. Use when managing biological datasets (scRNA-seq, spatial, flow cytometry, etc.), tracking computational workflows, curating and validating data with biological ontologies, building data lakehouses, or ensuring data lineage and reproducibility in biological research. Covers data management, annotation, ontologies (genes, cell types, diseases, tissues), schema validation, integrations with workflow managers (Nextflow, Snakemake) and MLOps platforms (W&B, MLflow), and deployment strategies.",5,1
latchbio-integration,"Latch platform for bioinformatics workflows. Build pipelines with Latch SDK, @workflow/@task decorators, deploy serverless workflows, LatchFile/LatchDir, Nextflow/Snakemake integration.",5,1
leiloeiro-avaliacao,"Avaliacao pericial de imoveis em leilao. Valor de mercado, liquidacao forcada, ABNT NBR 14653, metodos comparativo/renda/custo, CUB e margem de seguranca.",5,1
leiloeiro-mercado,"Analise de mercado imobiliario para leiloes. Liquidez, desagio tipico, ROI, estrategias de saida (flip/reforma/renda), Selic 2025 e benchmark CDI/FII.",5,1
lightning-factory-explainer,"Explain Bitcoin Lightning channel factories and the SuperScalar protocol — scalable Lightning onboarding using shared UTXOs, Decker-Wattenhofer trees, timeout-signature trees, MuSig2, and Taproot. No soft fork required.",5,1
llama-factory,"Expert guidance for fine-tuning LLMs with LLaMA-Factory - WebUI no-code, 100+ models, 2/3/4/5/6/8-bit QLoRA, multimodal support",5,1
macos-menubar-tuist-app,"Build, refactor, or review SwiftUI macOS menubar apps that use Tuist.",5,1
makepad-platform,"CRITICAL: Use for Makepad cross-platform support. Triggers on: makepad platform, makepad os, makepad macos, makepad windows, makepad linux, makepad android, makepad ios, makepad web, makepad wasm, makepad metal, makepad d3d11, makepad opengl, makepad webgl, OsType, CxOs, makepad 跨平台, makepad 平台支持",5,1
markdown-mermaid-writing,"Comprehensive markdown and Mermaid diagram writing skill. Use when creating any scientific document, report, analysis, or visualization. Establishes text-based diagrams as the default documentation standard with full style guides (markdown + mermaid), 24 diagram type references, and 9 document templates.",5,1
mastering-engineer,Guides audio mastering for streaming platforms including loudness optimization and tonal balance. Use when the user has approved tracks and wants to master audio files.,5,1
mcp:setup-codemap-cli,Guide for setup Codemap CLI for intelligent codebase visualization and navigation,5,1
mcp:setup-context7-mcp,Guide for setup Context7 MCP server to load documentation for specific technologies.,5,1
mcp:setup-serena-mcp,Guide for setup Serena MCP server for semantic code retrieval and editing capabilities,5,1
meeting-prep-cc,"Generate a pre-meeting prep brief in Claude Code. Researches participants, pulls vault context, builds agenda, surfaces sharp questions. Use when user says ""prep for this meeting,"" ""I have a call with,"" ""meeting tomorrow with,"" or ""prep brief for [name/company].""",5,1
memory-forensics,"Comprehensive techniques for acquiring, analyzing, and extracting artifacts from memory dumps for incident response and malware analysis.",5,1
mermaid-diagram,"Generate Mermaid diagrams from user requirements. Saves .mmd and .md files to figures/ directory with syntax verification. Supports flowcharts, sequence diagrams, class diagrams, ER diagrams, Gantt charts, and 18 more diagram types.",5,1
microservices-patterns,"Master microservices architecture patterns including service boundaries, inter-service communication, data management, and resilience patterns for building distributed systems.",5,1
mix-engineer,"Polishes raw Suno audio by processing per-stem WAVs (vocals, backing_vocals, drums, bass, guitar, keyboard, strings, brass, woodwinds, percussion, synth, other) with targeted cleanup, EQ, and compression, then remixing into a polished stereo WAV ready for mastering. Use after audio import and before mastering.",5,1
ml-paper-writing,"Write publication-ready ML/AI/Systems papers for NeurIPS, ICML, ICLR, ACL, AAAI, COLM, OSDI, NSDI, ASPLOS, SOSP. Use when drafting papers from research repos, structuring arguments, verifying citations, or preparing camera-ready submissions. Includes LaTeX templates, reviewer guidelines, and citation verification workflows.",5,1
mlops-engineer,"Build comprehensive ML pipelines, experiment tracking, and model registries with MLflow, Kubeflow, and modern MLOps tools.",5,1
monorepo-architect,"Expert in monorepo architecture, build systems, and dependency management at scale. Masters Nx, Turborepo, Bazel, and Lerna for efficient multi-project development. Use PROACTIVELY for monorepo setup,",5,1
monorepo-management,"Build efficient, scalable monorepos that enable code sharing, consistent tooling, and atomic changes across multiple packages and applications.",5,1
n8n-mcp-tools-expert,"Expert guide for using n8n-mcp MCP tools effectively. Use when searching for nodes, validating configurations, accessing templates, managing workflows, or using any n8n-mcp tool. Provides tool selection guidance, parameter formats, and common patterns.",5,1
n8n-node-configuration,"Operation-aware node configuration guidance. Use when configuring nodes, understanding property dependencies, determining required fields, choosing between get_node detail levels, or learning common configuration patterns by node type.",5,1
n8n-validation-expert,Expert guide for interpreting and fixing n8n validation errors.,5,1
n8n-workflow-patterns,Proven architectural patterns for building n8n workflows.,5,1
nda-review-jamie-tso,"Guide to review incoming one-way (unilateral) commercial NDAs in a jurisdiction-agnostic way, from either a Recipient or Discloser perspective (user-selected), producing a clause-by-clause issue log with preferred redlines, fallbacks, rationales, owners, and deadlines.",5,1
netlify-cli-and-deploy,"Guide for using the Netlify CLI and deploying sites. Use when installing the CLI, linking sites, deploying (Git-based or manual), managing environment variables, or running local development. Covers netlify dev, netlify deploy, Git vs non-Git workflows, and environment variable management.",5,1
netlify-config,"Reference for netlify.toml configuration. Use when configuring build settings, redirects, rewrites, headers, deploy contexts, environment variables, or any site-level configuration. Covers the complete netlify.toml syntax including redirects with splats/conditions, headers, deploy contexts, functions config, and edge functions config.",5,1
netlify-image-cdn,"Guide for using Netlify Image CDN for image optimization and transformation. Use when serving optimized images, creating responsive image markup, setting up user-uploaded image pipelines, or configuring image transformations. Covers the /.netlify/images endpoint, query parameters, remote image allowlisting, clean URL rewrites, and composing uploads with Functions + Blobs.",5,1
nnsight-remote-interpretability,"Provides guidance for interpreting and manipulating neural network internals using nnsight with optional NDIF remote execution. Use when needing to run interpretability experiments on massive models (70B+) without local GPU resources, or when working with any PyTorch architecture.",5,1
notification-licenciement-selim-brihi,"Guide pour la rédaction de notifications de licenciement conformes au droit du travail français. Utiliser ce skill quand l'utilisateur demande de rédiger, préparer, créer ou éditer une lettre de notification de licenciement, notamment pour faute grave, faute lourde ou motif personnel. Le skill guide la collecte d'informations précises et la rédaction d'une notification juridiquement solide avec tous les éléments obligatoires du droit français.",5,1
nx-workspace-patterns,"Configure and optimize Nx monorepo workspaces. Use when setting up Nx, configuring project boundaries, optimizing build caching, or implementing affected commands.",5,1
odoo-accounting-setup,"Expert guide for configuring Odoo Accounting: chart of accounts, journals, fiscal positions, taxes, payment terms, and bank reconciliation.",5,1
odoo-edi-connector,"Guide for implementing EDI (Electronic Data Interchange) with Odoo: X12, EDIFACT document mapping, partner onboarding, and automated order processing.",5,1
odoo-hr-payroll-setup,"Expert guide for Odoo HR and Payroll: salary structures, payslip rules, leave policies, employee contracts, and payroll journal entries.",5,1
odoo-inventory-optimizer,"Expert guide for Odoo Inventory: stock valuation (FIFO/AVCO), reordering rules, putaway strategies, routes, and multi-warehouse configuration.",5,1
odoo-module-developer,"Expert guide for creating custom Odoo modules. Covers __manifest__.py, model inheritance, ORM patterns, and module structure best practices.",5,1
odoo-project-timesheet,"Expert guide for Odoo Project and Timesheets: task stages, billable time tracking, timesheet approval, budget alerts, and invoicing from timesheets.",5,1
odoo-purchase-workflow,"Expert guide for Odoo Purchase: RFQ → PO → Receipt → Vendor Bill workflow, purchase agreements, vendor price lists, and 3-way matching.",5,1
odoo-xml-views-builder,"Expert at building Odoo XML views: Form, List, Kanban, Search, Calendar, and Graph. Generates correct XML for Odoo 14-17 with proper visibility syntax.",5,1
on-call-handoff-patterns,"Effective patterns for on-call shift transitions, ensuring continuity, context transfer, and reliable incident response across shifts.",5,1
os-scripting,"Operating system and shell scripting troubleshooting workflow for Linux, macOS, and Windows. Covers bash scripting, system administration, debugging, and automation.",5,1
paper-compile,"Compile LaTeX paper to PDF, fix errors, and verify output. Use when user says ""编译论文"", ""compile paper"", ""build PDF"", ""生成PDF"", or wants to compile LaTeX into a submission-ready PDF.",5,1
performing-disk-forensics-investigation,"Conducts disk forensics investigations using forensic imaging, file system analysis, artifact recovery, and timeline reconstruction to support incident response cases. Utilizes tools such as FTK Imager, Autopsy, and The Sleuth Kit for evidence acquisition, deleted file recovery, and artifact examination. Activates for requests involving disk forensics, hard drive analysis, forensic imaging, file recovery, evidence acquisition, or digital forensic investigation.",5,1
performing-dns-tunneling-detection,"Detects DNS tunneling by computing Shannon entropy of DNS query names, analyzing query length distributions, inspecting TXT record payloads, and identifying high subdomain cardinality. Uses scapy for packet capture analysis and statistical methods to distinguish legitimate DNS from covert channels. Use when hunting for data exfiltration.",5,1
performing-malware-persistence-investigation,Systematically investigate all persistence mechanisms on Windows and Linux systems to identify how malware survives reboots and maintains access.,5,1
performing-memory-forensics-with-volatility3-plugins,"Analyze memory dumps using Volatility3 plugins to detect injected code, rootkits, credential theft, and malware artifacts in Windows, Linux, and macOS memory images.",5,1
performing-privilege-escalation-on-linux,"Linux privilege escalation involves elevating from a low-privilege user account to root access on a compromised system. Red teams exploit misconfigurations, vulnerable services, kernel exploits, and w",5,1
performing-ssl-certificate-lifecycle-management,"SSL/TLS certificate lifecycle management encompasses the full process of requesting, issuing, deploying, monitoring, renewing, and revoking X.509 certificates. Poor certificate management is a leading",5,1
performing-timeline-reconstruction-with-plaso,"Build comprehensive forensic super-timelines using Plaso (log2timeline) to correlate events across file systems, logs, and artifacts into a unified chronological view.",5,1
performing-windows-artifact-analysis-with-eric-zimmerman-tools,"Perform comprehensive Windows forensic artifact analysis using Eric Zimmerman's open-source EZ Tools suite including KAPE, MFTECmd, PECmd, LECmd, JLECmd, and Timeline Explorer for parsing registry hives, prefetch files, event logs, and file system metadata.",5,1
phylogenetics,"Build and analyze phylogenetic trees using MAFFT (multiple alignment), IQ-TREE 2 (maximum likelihood), and FastTree (fast NJ/ML). Visualize with ETE3 or FigTree. For evolutionary analysis, microbial genomics, viral phylodynamics, protein family analysis, and molecular clock studies.",5,1
postmortem-writing,"Comprehensive guide to writing effective, blameless postmortems that drive organizational learning and prevent incident recurrence.",5,1
preset,"Intelligently deploys Azure OpenAI models to optimal regions by analyzing capacity across all available regions. Automatically checks current region first and shows alternatives if needed. USE FOR: quick deployment, optimal region, best region, automatic region selection, fast setup, multi-region capacity check, high availability deployment, deploy to best location. DO NOT USE FOR: custom SKU selection (use customize), specific version selection (use customize), custom capacity configuration (use customize), PTU deployments (use customize).",5,1
privacy-policy-malik-taiar,"Guide for drafting privacy policies compliant with GDPR. Includes CNIL 2020 recommendations, a reference template, and best practices. Use when drafting or revising a privacy policy for a website or application.",5,1
processing-stix-taxii-feeds,"Processes STIX 2.1 threat intelligence bundles delivered via TAXII 2.1 servers, normalizing objects into platform-native schemas and routing them to appropriate consuming systems. Use when onboarding new TAXII collection endpoints, automating bi-directional intelligence sharing with ISACs, or building pipeline validation for malformed STIX bundles. Activates for requests involving OASIS STIX, TAXII server configuration, MISP TAXII, or Cortex XSOAR feed integrations.",5,1
progressive-web-app,"Build Progressive Web Apps (PWAs) with offline support, installability, and caching strategies. Trigger whenever the user mentions PWA, service workers, web app manifests, Workbox, 'add to home screen', or wants their web app to work offline, feel native, or be installable.",5,1
prometheus-configuration,"Complete guide to Prometheus setup, metric collection, scrape configuration, and recording rules.",5,1
pymc,"Bayesian modeling with PyMC. Build hierarchical models, MCMC (NUTS), variational inference, LOO/WAIC comparison, posterior checks, for probabilistic programming and inference.",5,1
qiskit,"Qiskit is the world's most popular open-source quantum computing framework with 13M+ downloads. Build quantum circuits, optimize for hardware, execute on simulators or real quantum computers, and analyze results. Supports IBM Quantum (100+ qubit systems), IonQ, Amazon Braket, and other providers.",5,1
reflexion:critique,Comprehensive multi-perspective review using specialized judges with debate and consensus building,5,1
research-refine,"Turn a vague research direction into a problem-anchored, elegant, frontier-aware, implementation-oriented method plan via iterative GPT-5.4 review. Use when the user says ""refine my approach"", ""帮我细化方案"", ""decompose this problem"", ""打磨idea"", ""refine research plan"", ""细化研究方案"", or wants a concrete research method that stays simple, focused, and top-venue ready instead of a vague or overbuilt idea.",5,1
research-refine-pipeline,"Run an end-to-end workflow that chains `research-refine` and `experiment-plan`. Use when the user wants a one-shot pipeline from vague research direction to focused final proposal plus detailed experiment roadmap, or asks to ""串起来"", build a pipeline, do it end-to-end, or generate both the method and experiment plan together.",5,1
robius-app-architecture,"CRITICAL: Use for Robius app architecture patterns. Triggers on: Tokio, async, submit_async_request, 异步, 架构, SignalToUI, Cx::post_action, worker task, app structure, MatchEvent, handle_startup",5,1
sam-altman,"Agente que simula Sam Altman — CEO da OpenAI, ex-presidente da Y Combinator, arquiteto da era AGI.",5,1
scientific-visualization,"Meta-skill for publication-ready figures. Use when creating journal submission figures requiring multi-panel layouts, significance annotations, error bars, colorblind-safe palettes, and specific journal formatting (Nature, Science, Cell). Orchestrates matplotlib/seaborn/plotly with publication styles. For quick exploration use seaborn or plotly directly.",5,1
sdd:brainstorm,"Use when creating or developing, before writing code or implementation plans - refines rough ideas into fully-formed designs through collaborative questioning, alternative exploration, and incremental validation. Don't use during clear 'mechanical' processes",5,1
securing-aws-iam-permissions,"This skill guides practitioners through hardening AWS Identity and Access Management configurations to enforce least privilege access across cloud accounts. It covers IAM policy scoping, permission boundaries, Access Analyzer integration, and credential rotation strategies to reduce the blast radius of compromised identities.",5,1
securing-github-actions-workflows,"This skill covers hardening GitHub Actions workflows against supply chain attacks, credential theft, and privilege escalation. It addresses pinning actions to SHA digests, minimizing GITHUB_TOKEN permissions, protecting secrets from exfiltration, preventing script injection in workflow expressions, and implementing required reviewers for workflow changes.",5,1
service-mesh-observability,"Complete guide to observability patterns for Istio, Linkerd, and service mesh deployments.",5,1
skill-builder,"Automatically detect source types and build AI skills using Skill Seekers. Use when the user wants to create skills from documentation, repos, PDFs, videos, or other knowledge sources.",5,1
skill-creator-anthropic,"Guide for creating effective skills. This skill should be used when users want to create a new skill (or update an existing skill) that extends Claude's capabilities with specialized knowledge, workflows, or tool integrations.",5,1
skill-creator-ms,Guide for creating effective skills for AI coding agents working with Azure SDKs and Microsoft Foundry services. Use when creating new skills or updating existing skills.,5,1
skill-creator-openai,"Guide for creating effective skills. Use when users want to create a new skill (or update an existing skill) that extends the model's capabilities with specialized knowledge, workflows, or tool integrations.",5,1
skill-developer,"Comprehensive guide for creating and managing skills in Claude Code with auto-activation system, following Anthropic's official best practices including the 500-line rule and progressive disclosure pattern.",5,1
sop-creator,"Creates detailed Standard Operating Procedures (SOPs) for business processes. Use when user needs SOPs, process documentation, operational guides, workflow documentation, or step-by-step instructions for repeatable business processes.",5,1
sparse-autoencoder-training,"Provides guidance for training and analyzing Sparse Autoencoders (SAEs) using SAELens to decompose neural network activations into interpretable features. Use when discovering interpretable features, analyzing superposition, or studying monosemantic representations in language models.",5,1
startup-financial-modeling,"Build comprehensive 3-5 year financial models with revenue projections, cost structures, cash flow analysis, and scenario planning for early-stage startups.",5,1
steve-jobs,"Agente que simula Steve Jobs — cofundador da Apple, CEO da Pixar, fundador da NeXT, o maior designer de produtos tecnologicos da historia e o mais influente apresentador de produtos do mundo.",5,1
swiftui-view-refactor,"Refactor SwiftUI views into smaller components with stable, explicit data flow.",5,1
threejs-geometry,"Three.js geometry creation - built-in shapes, BufferGeometry, custom geometry, instancing. Use when creating 3D shapes, working with vertices, building custom meshes, or optimizing with instanced rendering.",5,1
threejs-shaders,"Three.js shaders - GLSL, ShaderMaterial, uniforms, custom effects. Use when creating custom visual effects, modifying vertices, writing fragment shaders, or extending built-in materials.",5,1
torchdrug,"PyTorch-native graph neural networks for molecules and proteins. Use when building custom GNN architectures for drug discovery, protein modeling, or knowledge graph reasoning. Best for custom model development, protein property prediction, retrosynthesis. For pre-trained models and diverse featurizers use deepchem; for benchmark datasets use pytdc.",5,1
turborepo-caching,"Configure Turborepo for efficient monorepo builds with local and remote caching. Use when setting up Turborepo, optimizing build pipelines, or implementing distributed caching.",5,1
