skill_id,description,score,phase
tutorial,Provides interactive guided album creation for new users. Use when the user is new to the plugin or asks for a walkthrough of the album creation process.,5,1
ubiquitous-language,"Extract a DDD-style ubiquitous language glossary from the current conversation, flagging ambiguities and proposing canonical terms. Saves to UBIQUITOUS_LANGUAGE.md. Use when user wants to define domain terms, build a glossary, harden terminology, create a ubiquitous language, or mentions ""domain model"" or ""DDD"".",5,1
unsloth,"Expert guidance for fast fine-tuning with Unsloth - 2-5x faster training, 50-80% less memory, LoRA/QLoRA optimization",5,1
user-segmentation,"Segment users from feedback data based on behavior, JTBD, and needs. Identifies at least 3 distinct user segments. Use when segmenting a user base, analyzing diverse user feedback, or building a segmentation model.",5,1
using-superpowers,"Use when starting any conversation - establishes how to find and use skills, requiring Skill tool invocation before ANY response including clarifying questions",5,1
uv-package-manager,"Comprehensive guide to using uv, an extremely fast Python package installer and resolver written in Rust, for modern Python project management and dependency workflows.",5,1
venue-templates,"Access comprehensive LaTeX templates, formatting requirements, and submission guidelines for major scientific publication venues (Nature, Science, PLOS, IEEE, ACM), academic conferences (NeurIPS, ICML, CVPR, CHI), research posters, and grant proposals (NSF, NIH, DOE, DARPA). This skill should be used when preparing manuscripts for journal submission, conference papers, research posters, or grant proposals and need venue-specific formatting requirements and templates.",5,1
videodb,"Video and audio perception, indexing, and editing. Ingest files/URLs/live streams, build visual/spoken indexes, search with timestamps, edit timelines, add overlays/subtitles, generate media, and create real-time alerts.",5,1
viral-generator-builder,"You understand why people share things. You build tools that create ""identity moments"" - results people want to show off. You know the difference between a tool people use once and one that spreads like wildfire. You optimize for the screenshot, the share, the ""OMG you have to try this"" moment.",5,1
voice-ai-development,"You are an expert in building real-time voice applications. You think in terms of latency budgets, audio quality, and user experience. You know that voice apps feel magical when fast and broken when slow.",5,1
web-artifacts-builder,"To build powerful frontend claude.ai artifacts, follow these steps:",5,1
wiki-ado-convert,"Converts VitePress/GFM wiki markdown to Azure DevOps Wiki-compatible format. Generates a Node.js build script that transforms Mermaid syntax, strips front matter, fixes links, and outputs ADO-compatible copies to dist/ado-wiki/.",5,1
wiki-architect,You are a documentation architect that produces structured wiki catalogues and onboarding guides from codebases.,5,1
wiki-onboarding,"Generate two complementary onboarding documents that together give any engineer — from newcomer to principal — a complete understanding of a codebase. Use when user asks for onboarding docs or getting-started guides, user runs /deep-wiki, or user wants to help new team members understand a codebase.",5,1
wiki-vitepress,"Transform generated wiki Markdown files into a polished VitePress static site with dark theme and interactive Mermaid diagrams. Use when user asks to ""build a site"" or ""package as VitePress"", user runs the /deep-wiki, or user wants a browsable HTML output from generated wiki pages.",5,1
writing-plans,"Use when you have a spec or requirements for a multi-step task, before touching code",5,1
xlsx-processing-openai,"Toolkit for comprehensive Spreadsheet reading, creation, editing, and analysis with visual quality control. Use to work with spreadsheets (.xlsx, .xlsm, .csv, .tsv) for: (1) Creating new spreadsheets with formulas and formatting, (2) Reading or analyzing tabular data, (3) Modifying existing spreadsheets while preserving formulas, (4) Building financial models with proper formatting, (5) Data visualization with in-sheet charts, or any other spreadsheet tasks.",5,1
