skill_id,description,score,phase
enhance-prompt,"Transforms vague UI ideas into polished, Stitch-optimized prompts. Enhances specificity, adds UI/UX keywords, injects design system context, and structures output for better generation results.",19,1
stitch-design,"Unified entry point for Stitch design work. Handles prompt enhancement (UI/UX keywords, atmosphere), design system synthesis (.stitch/DESIGN.md), and high-fidelity screen generation/editing via Stitch MCP.",19,1
ui-ux-designer,"Create interface designs, wireframes, and design systems. Masters user research, accessibility standards, and modern design tools.",17,1
antigravity-design-expert,"Core UI/UX engineering skill for building highly interactive, spatial, weightless, and glassmorphism-based web interfaces using GSAP and 3D CSS.",15,1
design-taste-frontend,"Senior UI/UX Engineer. Architect digital interfaces overriding default LLM biases. Enforces metric-based rules, strict component architecture, CSS hardware acceleration, and balanced design engineering.",15,1
iconsax-library,Extensive icon library and AI-driven icon generation skill for premium UI/UX design.,15,1
plan-design-review,"Designer's eye plan review — interactive, like CEO and Eng review. Rates each design dimension 0-10, explains what would make it a 10, then fixes the plan to get there. Works in plan mode. For live site visual audits, use /design-review. Use when asked to ""review the design plan"" or ""design critique"". Proactively suggest when the user has a plan with UI/UX components that should be reviewed before implementation.",15,1
stitch-design-taste,"Semantic Design System Skill for Google Stitch. Generates agent-friendly DESIGN.md files that enforce premium, anti-generic UI standards — strict typography, calibrated color, asymmetric layouts, perpetual micro-motion, and hardware-accelerated performance.",15,1
stitch-ui-design,"Expert guidance for crafting effective prompts in Google Stitch, the AI-powered UI design tool by Google Labs. This skill helps create precise, actionable prompts that generate high-quality UI designs for web and mobile applications.",15,1
ui-ux-pro-max,"Comprehensive design guide for web and mobile applications. Use when designing new UI components or pages, choosing color palettes and typography, or reviewing code for UX issues.",15,1
android-design-guidelines,"Material Design 3 and Android platform guidelines. Use when building Android apps with Jetpack Compose or XML layouts, implementing Material You, navigation, or accessibility. Triggers on tasks involving Android UI, Compose components, dynamic color, or Material Design compliance.",11,1
core-components,"Core component library and design system patterns. Use when building UI, using design tokens, or working with the component library.",11,1
design-consultation,"Design consultation: understands your product, researches the landscape, proposes a complete design system (aesthetic, typography, color, layout, spacing, motion), and generates font+color preview pages. Creates DESIGN.md as your project's design source of truth. For existing sites, use /plan-design-review to infer the system instead. Use when asked to ""design system"", ""brand guidelines"", or ""create DESIGN.md"". Proactively suggest when starting a new project's UI with no existing design system or DESIGN.md.",11,1
design-md,Analyze Stitch projects and synthesize a semantic design system into DESIGN.md files,11,1
feature-image,"Generate a branded social media image announcing a new feature or update. Analyzes git history, auto-detects brand from codebase (Tailwind, CSS vars, design tokens), replicates UI elements, and captures via Playwright. Use when the user wants to create an announcement image, says 'feature image,' 'announcement graphic,' 'social image for feature,' or wants to visually announce a code change.",11,1
figma-implement-design,"Translates Figma designs into production-ready application code with 1:1 visual fidelity. Use when implementing UI code from Figma files, when user mentions ""implement design"", ""generate code"", ""implement component"", provides Figma URLs, or asks to build components matching Figma specs. For Figma canvas writes via `use_figma`, use `figma-use`.",11,1
ios-design-guidelines,"Apple Human Interface Guidelines for iPhone. Use when building, reviewing, or refactoring SwiftUI/UIKit interfaces for iOS. Triggers on tasks involving iPhone UI, iOS components, accessibility, Dynamic Type, Dark Mode, or HIG compliance.",11,1
macos-design-guidelines,"Apple Human Interface Guidelines for Mac. Use when building macOS apps with SwiftUI or AppKit, implementing menu bars, toolbars, window management, or keyboard shortcuts. Triggers on tasks involving Mac UI, desktop apps, or Mac Catalyst.",11,1
makepad-dsl,"CRITICAL: Use for Makepad DSL syntax and inheritance. Triggers on: makepad dsl, live_design, makepad inheritance, makepad prototype, ""<Widget>"", ""Foo = { }"", makepad object, makepad property, makepad DSL 语法, makepad 继承, makepad 原型, 如何定义 makepad 组件",11,1
product-design,"Design de produto nivel Apple — sistemas visuais, UX flows, acessibilidade, linguagem visual proprietaria, design tokens, prototipagem e handoff. Cobre Figma, design systems, tipografia, cor, espacamento, motion design e principios de design cognitivo.",11,1
product-inventor,"Product Inventor e Design Alchemist de nivel maximo — combina Product Thinking, Design Systems, UI Engineering, Psicologia Cognitiva, Storytelling e execucao impecavel nivel Jobs/Apple.",11,1
radix-ui-design-system,"Build accessible design systems with Radix UI primitives. Headless component customization, theming strategies, and compound component patterns for production-grade UI libraries.",11,1
shadcn,"Manages shadcn/ui components and projects, providing context, documentation, and usage patterns for building modern design systems.",11,1
tvos-design-guidelines,"Apple Human Interface Guidelines for Apple TV. Use when building tvOS apps with focus-based navigation, Siri Remote input, or living room viewing experiences. Triggers on tasks involving Apple TV, tvOS, 10-foot UI, or media playback.",11,1
ui-visual-validator,"Rigorous visual validation expert specializing in UI testing, design system compliance, and accessibility verification.",11,1
visionos-design-guidelines,"Apple Human Interface Guidelines for Apple Vision Pro. Use when building spatial computing apps, implementing eye/hand input, or designing immersive experiences. Triggers on tasks involving visionOS, RealityKit, spatial UI, or mixed reality.",11,1
watchos-design-guidelines,"Apple Human Interface Guidelines for Apple Watch. Use when building watchOS apps, complications, or workout features. Triggers on tasks involving Watch UI, Digital Crown, glanceable interfaces, or wrist-based interactions.",11,1
accessibility-compliance-accessibility-audit,"You are an accessibility expert specializing in WCAG compliance, inclusive design, and assistive technology compatibility. Conduct audits, identify barriers, and provide remediation guidance.",9,1
agent-tool-builder,"You are an expert in the interface between LLMs and the outside world. You've seen tools that work beautifully and tools that cause agents to hallucinate, loop, or fail silently. The difference is almost always in the design, not the implementation.",9,1
ai-agents-architect,"I build AI systems that can act autonomously while remaining controllable. I understand that agents fail in unexpected ways - I design for graceful degradation and clear failure modes. I balance autonomy with oversight, knowing when an agent should ask for help vs proceed independently.",9,1
ai-native-cli,"Design spec with 98 rules for building CLI tools that AI agents can safely use. Covers structured JSON output, error handling, input contracts, safety guardrails, exit codes, and agent self-description.",9,1
architecture,"Architectural decision-making framework. Requirements analysis, trade-off evaluation, ADR documentation. Use when making architecture decisions or analyzing system design.",9,1
asc-cli-usage,"Guidance for using asc cli in this repo (flags, output formats, pagination, auth, and discovery). Use when asked to run or design asc commands or interact with App Store Connect via the CLI.",9,1
autonomous-agent-patterns,"Design patterns for building autonomous coding agents, inspired by [Cline](https://github.com/cline/cline) and [OpenAI Codex](https://github.com/openai/codex).",9,1
building-identity-governance-lifecycle-process,"Builds comprehensive identity governance and lifecycle management processes including joiner-mover-leaver automation, role mining, access request workflows, periodic recertification, and orphaned account remediation using IGA platforms. Activates for requests involving identity lifecycle management, JML processes, role-based access provisioning, or identity governance program design.",9,1
building-incident-response-playbook,"Designs and documents structured incident response playbooks that define step-by-step procedures for specific incident types aligned with NIST SP 800-61r3 and SANS PICERL frameworks. Covers playbook structure, decision trees, escalation criteria, RACI matrices, and integration with SOAR platforms. Activates for requests involving IR playbook creation, incident response procedure documentation, response runbook development, or SOAR playbook design.",9,1
content-modeling-best-practices,"Structured content modeling guidance for schema design, content architecture, content reuse, references versus embedded objects, separation of concerns, and taxonomies across Sanity and other headless CMSes. Use this skill when designing or refactoring content types, deciding field shapes, debating reusable versus nested content, planning omnichannel content models, or reviewing whether a schema is too page-shaped or presentation-driven.",9,1
customer-empathy,"Deep-dive into customer empathy and user journey thinking. Use when designing onboarding, improving UX, planning features, or trying to understand how to delight users faster.",9,1
database-driver-design,"Expert guidance on building Swift database client libraries. Use when developers mention: (1) building a database driver, (2) wire protocol implementation, (3) connection pooling design, (4) state machines for protocol handling, (5) NIO channel handlers for databases, (6) backpressure in result streaming, (7) actor executor alignment with NIO.",9,1
ddd-strategic-design,"Design DDD strategic artifacts including subdomains, bounded contexts, and ubiquitous language for complex business domains.",9,1
drizzle-orm-expert,"Expert in Drizzle ORM for TypeScript — schema design, relational queries, migrations, and serverless database integration. Use when building type-safe database layers with Drizzle.",9,1
event-sourcing-architect,"Expert in event sourcing, CQRS, and event-driven architecture patterns. Masters event store design, projection building, saga orchestration, and eventual consistency patterns. Use PROACTIVELY for event-sourced systems, audit trail requirements, or complex domain modeling with temporal queries.",9,1
event-store-design,"Design and implement event stores for event-sourced systems. Use when building event sourcing infrastructure, choosing event store technologies, or implementing event persistence patterns.",9,1
figma-create-design-system-rules,"Generates custom design system rules for the user's codebase. Use when user says ""create design system rules"", ""generate rules for my project"", ""set up design rules"", ""customize design system guidelines"", or wants to establish project-specific conventions for Figma-to-code workflows. Requires Figma MCP server connection.",9,1
figma-generate-design,"Use this skill alongside figma-use when the task involves translating an application page, view, or multi-section layout into Figma. Triggers: 'write to Figma', 'create in Figma from code', 'push page to Figma', 'take this app/page and build it in Figma', 'create a screen', 'build a landing page in Figma', 'update the Figma screen to match code'. This is the preferred workflow skill whenever the user wants to build or update a full page, screen, or view in Figma from code or a description. Discovers design system components, variables, and styles via search_design_system, imports them, and assembles screens incrementally section-by-section using design system tokens instead of hardcoded values.",9,1
figma-generate-library,"Build or update a professional-grade design system in Figma from a codebase. Use when the user wants to create variables/tokens, build component libraries, set up theming (light/dark modes), document foundations, or reconcile gaps between code and Figma. This skill teaches WHAT to build and in WHAT ORDER — it complements the `figma-use` skill which teaches HOW to call the Plugin API. Both skills should be loaded together.",9,1
graphql-architect,"Master modern GraphQL with federation, performance optimization, and enterprise security. Build scalable schemas, implement advanced caching, and design real-time systems.",9,1
hig-foundations,Apple Human Interface Guidelines design foundations.,9,1
hig-patterns,Apple Human Interface Guidelines interaction and UX patterns.,9,1
hig-platforms,Apple Human Interface Guidelines for platform-specific design.,9,1
hig-project-context,Create or update a shared Apple design context document that other HIG skills use to tailor guidance.,9,1
implementing-conditional-access-policies-azure-ad,"Configure Microsoft Entra ID (Azure AD) Conditional Access policies for zero trust access control. Covers signal-based policy design, device compliance requirements, risk-based authentication, named l",9,1
ipados-design-guidelines,"Apple Human Interface Guidelines for iPad. Use when building iPad-optimized interfaces, implementing multitasking, pointer support, keyboard shortcuts, or responsive layouts. Triggers on tasks involving iPad, Split View, Stage Manager, sidebar navigation, or trackpad support.",9,1
langgraph,"You are an expert in building production-grade AI agents with LangGraph. You understand that agents need explicit structure - graphs make the flow visible and debuggable. You design state carefully, use reducers appropriately, and always consider persistence for production.",9,1
lean-ux-canvas,"Guide teams through Lean UX Canvas v2. Use when framing a business problem, surfacing assumptions, and defining what to learn next.",9,1
makepad-router,"CRITICAL: Use for ALL Makepad/Robius questions including widgets, layout, events, and shaders. Triggers on: makepad, robius, live_design, app_main, Widget, View, Button, Label, Image, TextInput, ScrollView, RoundedView, SolidView, PortalList, Markdown, Html, TextFlow, layout, Flow, Walk, padding, margin, width, height, Fit, Fill, align, spacing, event, action, Hit, FingerDown, FingerUp, KeyDown, handle_event, click, tap, animator, animation, state, transition, hover, pressed, ease, shader, draw_bg, draw_text, Sdf2d, pixel, gradient, glow, shadow, font, text_style, font_size, glyph, typography, tokio, async, spawn, submit_async, SignalToUI, post_action, apply_over, TextOrImage, modal, collapsible, drag drop, AppState, persistence, theme, Scope, deploy, package, APK, IPA, WASM, cargo makepad, makepad widget, makepad 组件, makepad 按钮, makepad 布局, makepad 事件, makepad 动画, makepad 着色器, 创建组件, 自定义组件, 开发应用, 居中, 对齐, 点击事件, 悬停效果, 渐变, 阴影, 字体大小",9,1
memory-systems,"Design short-term, long-term, and graph-based memory architectures. Use when building agents that must persist across sessions, needing to maintain entity consistency across conversations, or implementing reasoning over accumulated knowledge.",9,1
nerdzao-elite,"Senior Elite Software Engineer (15+) and Senior Product Designer. Full workflow with planning, architecture, TDD, clean code, and pixel-perfect UX validation.",9,1
office-hours,"YC Office Hours — two modes. Startup mode: six forcing questions that expose demand reality, status quo, desperate specificity, narrowest wedge, observation, and future-fit. Builder mode: design thinking brainstorming for side projects, hackathons, learning, and open source. Saves a design doc. Use when asked to ""brainstorm this"", ""I have an idea"", ""help me think through this"", ""office hours"", or ""is this worth building"". Proactively suggest when the user describes a new product idea or is exploring whether something is worth building — before any code is written. Use before /plan-ceo-review or /plan-eng-review.",9,1
pdf-processing-openai,"Toolkit for comprehensive PDF reading, reviwing, and creation with visual quality control. Use to work with PDFs (.pdf files) for: (1) Reading or extracting content from existing PDFs, (2) Creating new PDF documents with professional formatting, (3) Generating reports, documents, or layouts that require precise typography and design, or any other PDF reading or generation tasks.",9,1
privacy-by-design,"Use when building apps that collect user data. Ensures privacy protections are built in from the start—data minimization, consent, encryption.",9,1
react:components,Converts Stitch designs into modular Vite and React components using system-level networking and AST-based validation.,9,1
scientific-slides,"Build slide decks and presentations for research talks. Use this for making PowerPoint slides, conference presentations, seminar talks, research presentations, thesis defense slides, or any scientific talk. Provides slide structure, design templates, timing guidance, and visual validation. Works with PowerPoint and LaTeX Beamer.",9,1
software-architecture,"Guide for quality focused software architecture. This skill should be used when users want to write code, design architecture, analyze code, in any case that relates to software development.",9,1
stitch-loop,Teaches agents to iteratively build websites using Stitch with an autonomous baton-passing loop pattern,9,1
swift-library-design,"Expert guidance on Swift library and framework design. Use when developers mention: (1) designing a Swift library or framework, (2) public API design patterns, (3) protocol-oriented architecture or associated types, (4) result builders or DSL design, (5) performance optimization for libraries, (6) @inlinable or @usableFromInline, (7) noncopyable types for APIs, (8) progressive disclosure in API design, (9) ResponseGenerator or builder patterns.",9,1
team-composition-analysis,"Design optimal team structures, hiring plans, compensation strategies, and equity allocation for early-stage startups from pre-seed through Series A.",9,1
telegram-bot-builder,"You build bots that people actually use daily. You understand that bots should feel like helpful assistants, not clunky interfaces. You know the Telegram ecosystem deeply - what's possible, what's popular, and what makes money. You design conversations that feel natural.",9,1
threat-modeling-expert,"Expert in threat modeling methodologies, security architecture review, and risk assessment. Masters STRIDE, PASTA, attack trees, and security requirement extraction. Use PROACTIVELY for security architecture reviews, threat identification, or building secure-by-design systems.",9,1
tool-design,"Build tools that agents can use effectively, including architectural reduction patterns. Use when creating new tools for agent systems, debugging tool-related failures or misuse, or optimizing existing tool sets for better agent performance.",9,1
web-design-guidelines,Review files for compliance with Web Interface Guidelines.,9,1
workflow-orchestration-patterns,"Master workflow orchestration architecture with Temporal, covering fundamental design decisions, resilience patterns, and best practices for building reliable distributed systems.",9,1
Creative Portfolio Resume,Balance visual design with ATS compatibility for creative roles,7,1
analyzing-memory-forensics-with-lime-and-volatility,"Performs Linux memory acquisition using LiME (Linux Memory Extractor) kernel module and analysis with Volatility 3 framework. Extracts process lists, network connections, bash history, loaded kernel modules, and injected code from Linux memory images. Use when performing incident response on compromised Linux systems.",7,1
angular-ui-patterns,"Modern Angular UI patterns for loading states, error handling, and data display. Use when building UI components, handling async data, or managing component states.",7,1
avalonia-layout-zafiro,"Guidelines for modern Avalonia UI layout using Zafiro.Avalonia, emphasizing shared styles, generic components, and avoiding XAML redundancy.",7,1
avalonia-zafiro-development,"Mandatory skills, conventions, and behavioral rules for Avalonia UI development using the Zafiro toolkit.",7,1
aws-dynamodb,"AWS DynamoDB single-table design, GSI patterns, SDK v3 TypeScript/Python",7,1
building-native-ui,"Complete guide for building beautiful apps with Expo Router. Covers fundamentals, styling, components, navigation, animations, patterns, and native tabs.",7,1
canvas-design,"These are instructions for creating design philosophies - aesthetic movements that are then EXPRESSED VISUALLY. Output only .md files, .pdf files, and .png files.",7,1
cirq,"Cirq is Google Quantum AI's open-source framework for designing, simulating, and running quantum circuits on quantum computers and simulators.",7,1
ckm:slides,"Create strategic HTML presentations with Chart.js, design tokens, responsive layouts, copywriting formulas, and contextual slide strategies.",7,1
creative-director,"AI creative director with recursive self-assessment. Generates concepts using world-class methodologies (SIT, TRIZ, Lateral Thinking, bisociation), scores against 6 weighted criteria with Cannes/D&AD/HumanKind calibration, and recursively refines until the 9+ threshold is reached. Accepts briefs in any format — text, voice transcript, PDF, or raw notes. Use when the user asks to generate creative concepts, brainstorm campaign ideas, develop a Big Idea or campaign platform, evaluate or critique existing creative work, find consumer insights, or shares a brief for ideation. Do not use for media planning, production budgeting, brand identity/logo design, copywriting final drafts, or market research data collection.",7,1
crewai,"You are an expert in designing collaborative AI agent teams with CrewAI. You think in terms of roles, responsibilities, and delegation. You design clear agent personas with specific expertise, create well-defined tasks with expected outputs, and orchestrate crews for optimal collaboration.",7,1
database-architect,"Expert database architect specializing in data layer design from scratch, technology selection, schema modeling, and scalable database architectures.",7,1
design-orchestration,"Orchestrates design workflows by routing work through brainstorming, multi-agent review, and execution readiness in the correct order.",7,1
design-review,"Designer's eye QA: finds visual inconsistency, spacing issues, hierarchy problems, AI slop patterns, and slow interactions — then fixes them. Iteratively fixes issues in source code, committing each fix atomically and re-verifying with before/after screenshots. For plan-mode design review (before implementation), use /plan-design-review. Use when asked to ""audit the design"", ""visual QA"", ""check if it looks good"", or ""design polish"". Proactively suggest when the user mentions visual inconsistencies or wants to polish the look of a live site.",7,1
design-spells,"Curated micro-interactions and design details that add ""magic"" and personality to websites and apps.",7,1
diffdock,"Diffusion-based molecular docking. Predict protein-ligand binding poses from PDB/SMILES, confidence scores, virtual screening, for structure-based drug design. Not for affinity prediction.",7,1
expo-ui-jetpack-compose,expo-ui-jetpack-compose,7,1
expo-ui-swift-ui,expo-ui-swift-ui,7,1
figma-automation,"Automate Figma tasks via Rube MCP (Composio): files, components, design tokens, comments, exports. Always search tools first for current schemas.",7,1
figma-code-connect-components,"Connects Figma design components to code components using Code Connect mapping tools. Use when user says ""code connect"", ""connect this component to code"", ""map this component"", ""link component to code"", ""create code connect mapping"", or wants to establish mappings between Figma designs and code implementations. For canvas writes via `use_figma`, use `figma-use`.",7,1
figma-create-new-file,"Create a new blank Figma file. Use when the user wants to create a new Figma design or FigJam file, or when you need a new file before calling use_figma. Handles plan resolution via whoami if needed. Usage — /figma-create-new-file [editorType] [fileName] (e.g. /figma-create-new-file figjam My Whiteboard)",7,1
frontend-design,"You are a frontend designer-engineer, not a layout generator.",7,1
generate-image,"Generate or edit images using AI models (FLUX, Nano Banana 2). Use for general-purpose image generation including photos, illustrations, artwork, visual assets, concept art, and any image that is not a technical diagram or schematic. For flowcharts, circuits, pathways, and technical diagrams, use the scientific-schematics skill instead.",7,1
glycoengineering,"Analyze and engineer protein glycosylation. Scan sequences for N-glycosylation sequons (N-X-S/T), predict O-glycosylation hotspots, and access curated glycoengineering tools (NetOGlyc, GlycoShield, GlycoWorkbench). For glycoprotein engineering, therapeutic antibody optimization, and vaccine design.",7,1
hig-components-controls,Check for .claude/apple-design-context.md before asking questions. Use existing context and only ask for information not already covered.,7,1
