skill_id,description,score,phase
hig-components-menus,Check for .claude/apple-design-context.md before asking questions. Use existing context and only ask for information not already covered.,7,1
hig-components-status,"Apple HIG guidance for status and progress UI components including progress indicators, status bars, and activity rings.",7,1
hig-inputs,Check for .claude/apple-design-context.md before asking questions. Use existing context and only ask for information not already covered.,7,1
hig-technologies,Check for .claude/apple-design-context.md before asking questions. Use existing context and only ask for information not already covered.,7,1
high-end-visual-design,"Teaches the AI to design like a high-end agency. Defines the exact fonts, spacing, shadows, card structures, and animations that make a website feel expensive. Blocks all the common defaults that make AI designs look cheap or generic.",7,1
implementing-velociraptor-for-ir-collection,"Deploy and configure Velociraptor for scalable endpoint forensic artifact collection during incident response using VQL queries, hunts, and pre-built artifact packs across Windows, Linux, and macOS environments.",7,1
industrial-brutalist-ui,"Raw mechanical interfaces fusing Swiss typographic print with military terminal aesthetics. Rigid grids, extreme type scale contrast, utilitarian color, analog degradation effects. For data-heavy dashboards, portfolios, or editorial sites that need to feel like declassified blueprints.",7,1
latex-posters,"Create professional research posters in LaTeX using beamerposter, tikzposter, or baposter. Support for conference presentations, academic posters, and scientific communication. Includes layout design, color schemes, multi-column formats, figure integration, and poster-specific best practices for visual communication.",7,1
lightning-architecture-review,"Review Bitcoin Lightning Network protocol designs, compare channel factory approaches, and analyze Layer 2 scaling tradeoffs. Covers trust models, on-chain footprint, consensus requirements, HTLC/PTLC compatibility, liveness, and watchtower support.",7,1
llm-application-dev-ai-assistant,"You are an AI assistant development expert specializing in creating intelligent conversational interfaces, chatbots, and AI-powered applications. Design comprehensive AI assistant solutions with natur",7,1
logo-creator,"Create logos using AI image generation. Discuss style/ratio, generate variations, iterate with user feedback, crop, remove background, and export as SVG. Use when user wants to create a logo, icon, favicon, brand mark, mascot, emblem, or design a logo.",7,1
magic-ui-generator,"Utilizes Magic by 21st.dev to generate, compare, and integrate multiple production-ready UI component variations.",7,1
makepad-basics,"CRITICAL: Use for Makepad getting started and app structure. Triggers on: makepad, makepad getting started, makepad tutorial, live_design!, app_main!, makepad project setup, makepad hello world, ""how to create makepad app"", makepad 入门, 创建 makepad 应用, makepad 教程, makepad 项目结构",7,1
mcp-builder,Create MCP (Model Context Protocol) servers that enable LLMs to interact with external services through well-designed tools. The quality of an MCP server is measured by how well it enables LLMs to accomplish real-world tasks.,7,1
mcp:build-mcp,"Guide for creating high-quality MCP (Model Context Protocol) servers that enable LLMs to interact with external services through well-designed tools. Use when building MCP servers to integrate external APIs or services, whether in Python (FastMCP) or Node/TypeScript (MCP SDK).",7,1
minimalist-ui,"Clean editorial-style interfaces. Warm monochrome palette, typographic contrast, flat bento grids, muted pastels. No gradients, no heavy shadows.",7,1
mobile-design,(Mobile-First · Touch-First · Platform-Respectful),7,1
nerdzao-elite-gemini-high,Modo Elite Coder + UX Pixel-Perfect otimizado especificamente para Gemini 3.1 Pro High. Workflow completo com foco em qualidade máxima e eficiência de tokens.,7,1
observability-monitoring-slo-implement,"You are an SLO (Service Level Objective) expert specializing in implementing reliability standards and error budget-based engineering practices. Design comprehensive SLO frameworks, establish meaningful SLIs, and create monitoring systems that balance reliability with feature velocity.",7,1
pakistan-payments-stack,"Design and implement production-grade Pakistani payment integrations (JazzCash, Easypaisa, bank/PSP rails, optional Raast) for SaaS with PKR billing, webhook reliability, and reconciliation.",7,1
performing-access-review-and-certification,"Conduct systematic access reviews and certifications to ensure users have appropriate access rights aligned with their roles. This skill covers review campaign design, reviewer selection, risk-based p",7,1
performing-threat-modeling-with-owasp-threat-dragon,"Use OWASP Threat Dragon to create data flow diagrams, identify threats using STRIDE and LINDDUN methodologies, and generate threat model reports for secure design review.",7,1
pymoo,"Multi-objective optimization framework. NSGA-II, NSGA-III, MOEA/D, Pareto fronts, constraint handling, benchmarks (ZDT, DTLZ), for engineering design and optimization problems.",7,1
redesign-existing-projects,"Upgrades existing websites and apps to premium quality. Audits current design, identifies generic AI patterns, and applies high-end design standards without breaking functionality. Works with any CSS framework or vanilla CSS.",7,1
robius-widget-patterns,"CRITICAL: Use for Robius widget patterns. Triggers on: apply_over, TextOrImage, modal, 可复用, 模态, collapsible, drag drop, reusable widget, widget design, pageflip, 组件设计, 组件模式",7,1
sadd:multi-agent-patterns,"Design multi-agent architectures for complex tasks. Use when single-agent context limits are exceeded, when tasks decompose naturally into subtasks, or when specializing agents improves quality.",7,1
shadcn-ui,"Expert guidance for integrating and building applications with shadcn/ui components, including component discovery, installation, customization, and best practices.",7,1
ui-skills,"Opinionated, evolving constraints to guide agents when building interfaces",7,1
ui-web,"Web UI - glassmorphism, Tailwind, dark mode, accessibility",7,1
user-journeys,"User experience flows - journey mapping, UX validation, error recovery",7,1
user-stories,"Create user stories following the 3 C's (Card, Conversation, Confirmation) and INVEST criteria with descriptions, design links, and acceptance criteria. Use when writing user stories, breaking down features into backlog items, or defining acceptance criteria.",7,1
00-andruia-consultant,Arquitecto de Soluciones Principal y Consultor Tecnológico de Andru.ia. Diagnostica y traza la hoja de ruta óptima para proyectos de IA en español.,5,1
10-andruia-skill-smith,"Ingeniero de Sistemas de Andru.ia. Diseña, redacta y despliega nuevas habilidades (skills) dentro del repositorio siguiendo el Estándar de Diamante.",5,1
20-andruia-niche-intelligence,"Estratega de Inteligencia de Dominio de Andru.ia. Analiza el nicho específico de un proyecto para inyectar conocimientos, regulaciones y estándares únicos del sector. Actívalo tras definir el nicho.",5,1
Academic CV Builder,"Format CVs for academic positions with publications, grants, and teaching",5,1
Executive Resume Writer,Create C-suite and VP level resumes emphasizing strategic leadership,5,1
LinkedIn Profile Optimizer,"Optimize LinkedIn profile for searchability, recruiter visibility, and engagement",5,1
Reference List Builder,Format professional references properly and prepare reference materials,5,1
Resume Section Builder,Create targeted resume sections optimized for different experience levels and roles,5,1
ablation-planner,"Use when main results pass result-to-claim (claim_supported=yes or partial) and ablation studies are needed for paper submission. Codex designs ablations from a reviewer's perspective, CC reviews feasibility and implements.",5,1
acquiring-disk-image-with-dd-and-dcfldd,Create forensically sound bit-for-bit disk images using dd and dcfldd while preserving evidence integrity through hash verification.,5,1
aegisops-ai,"Autonomous DevSecOps & FinOps Guardrails. Orchestrates Gemini 3 Flash to audit Linux Kernel patches, Terraform cost drifts, and K8s compliance.",5,1
agents-v2-py,Build container-based Foundry Agents with Azure AI Projects SDK (ImageBasedHostedAgentDefinition). Use when creating hosted agents with custom container images in Azure AI Foundry.,5,1
album-dashboard,"Shows a structured progress dashboard for an album with percentage complete per phase, blocking items, and status breakdown. Use for a quick visual overview of album progress.",5,1
alpha-vantage,"Access 20+ years of global financial data: equities, options, forex, crypto, commodities, economic indicators, and 50+ technical indicators.",5,1
analyzing-disk-image-with-autopsy,"Perform comprehensive forensic analysis of disk images using Autopsy to recover files, examine artifacts, and build investigation timelines.",5,1
analyzing-linux-kernel-rootkits,"Detect kernel-level rootkits in Linux memory dumps using Volatility3 linux plugins (check_syscall, lsmod, hidden_modules), rkhunter system scanning, and /proc vs /sys discrepancy analysis to identify hooked syscalls, hidden kernel modules, and tampered system structures.",5,1
analyzing-supply-chain-malware-artifacts,"Investigate supply chain attack artifacts including trojanized software updates, compromised build pipelines, and sideloaded dependencies to identify intrusion vectors and scope of compromise.",5,1
app-builder,"Main application building orchestrator. Creates full-stack applications from natural language requests. Determines project type, selects tech stack, coordinates agents.",5,1
appinsights-instrumentation,"Guidance for instrumenting webapps with Azure Application Insights. Provides telemetry patterns, SDK setup, and configuration references. WHEN: how to instrument app, App Insights SDK, telemetry patterns, what is App Insights, Application Insights guidance, instrumentation examples, APM best practices.",5,1
asc-notarization,"Archive, export, and notarize macOS apps using xcodebuild and asc. Use when you need to prepare a macOS app for distribution outside the App Store with Developer ID signing and Apple notarization.",5,1
asc-submission-health,"Preflight App Store submissions, submit builds, and monitor review status with asc. Use when shipping or troubleshooting review submissions.",5,1
asc-xcode-build,"Build, archive, export, and manage Xcode version/build numbers with asc and xcodebuild before uploading to App Store Connect. Use when you need to create an IPA or PKG for upload.",5,1
ask-questions-if-underspecified,Clarify requirements before implementing. Use when serious doubts arise.,5,1
axolotl,"Expert guidance for fine-tuning LLMs with Axolotl - YAML configs, 100+ models, LoRA/QLoRA, DPO/KTO/ORPO/GRPO, multimodal support",5,1
azure-ai-document-intelligence-dotnet,"Azure AI Document Intelligence SDK for .NET. Extract text, tables, and structured data from documents using prebuilt and custom models.",5,1
azure-ai-document-intelligence-ts,"Extract text, tables, and structured data from documents using prebuilt and custom models.",5,1
azure-ai-projects-py,Build AI applications on Microsoft Foundry using the azure-ai-projects SDK.,5,1
azure-ai-voicelive-dotnet,Azure AI Voice Live SDK for .NET. Build real-time voice AI applications with bidirectional WebSocket communication.,5,1
azure-ai-voicelive-py,Build real-time voice AI applications with bidirectional WebSocket communication.,5,1
azure-rbac,"Helps users find the right Azure RBAC role for an identity with least privilege access, then generate CLI commands and Bicep code to assign it. Also provides guidance on permissions required to grant roles. WHEN: bicep for role assignment, what role should I assign, least privilege role, RBAC role for, role to read blobs, role for managed identity, custom role definition, assign role to identity, what role do I need to grant access, permissions to assign roles.",5,1
azure-search-documents-dotnet,"Azure AI Search SDK for .NET (Azure.Search.Documents). Use for building search applications with full-text, vector, semantic, and hybrid search.",5,1
azure-search-documents-ts,"Build search applications with vector, hybrid, and semantic search capabilities.",5,1
bash-linux,"Bash/Linux terminal patterns. Critical commands, piping, error handling, scripting. Use when working on macOS or Linux systems.",5,1
bill-gates,"Agente que simula Bill Gates — cofundador da Microsoft, arquiteto da industria de software comercial, estrategista tecnologico global, investidor sistemico e filantropo baseado em dados.",5,1
brainstorming-research-ideas,"Guides researchers through structured ideation frameworks to discover high-impact research directions. Use when exploring new problem spaces, pivoting between projects, or seeking novel angles on existing work.",5,1
brand-guidelines-anthropic,"To access Anthropic's official brand identity and style resources, use this skill.",5,1
build,build,5,1
building-attack-pattern-library-from-cti-reports,Extract and catalog attack patterns from cyber threat intelligence reports into a structured STIX-based library mapped to MITRE ATT&CK for detection engineering and threat-informed defense.,5,1
building-incident-response-dashboard,"Builds real-time incident response dashboards in Splunk, Elastic, or Grafana to provide SOC analysts and leadership with situational awareness during active incidents, tracking affected systems, containment status, IOC spread, and response timeline. Use when IR teams need unified visibility during incident coordination and post-incident reporting.",5,1
building-incident-timeline-with-timesketch,"Build collaborative forensic incident timelines using Timesketch to ingest, normalize, and analyze multi-source event data for attack chain reconstruction and investigation documentation.",5,1
building-malware-incident-communication-template,"Build structured communication templates for malware incidents including stakeholder notifications, executive briefings, technical advisories, and regulatory disclosures with severity-based escalation procedures.",5,1
building-role-mining-for-rbac-optimization,"Apply bottom-up and top-down role mining techniques to discover optimal RBAC roles from existing user-permission assignments, reducing role explosion and enforcing least privilege.",5,1
building-soc-playbook-for-ransomware,"Builds a structured SOC incident response playbook for ransomware attacks covering detection, containment, eradication, and recovery phases with specific SIEM queries, isolation procedures, and decision trees. Use when SOC teams need formalized response procedures for ransomware incidents aligned to NIST SP 800-61 and MITRE ATT&CK ransomware techniques.",5,1
building-threat-feed-aggregation-with-misp,"Deploy MISP (Malware Information Sharing Platform) to aggregate, correlate, and distribute threat intelligence feeds from multiple sources for centralized IOC management and automated SIEM integration.",5,1
building-threat-intelligence-platform,"Building a Threat Intelligence Platform (TIP) involves deploying and integrating multiple CTI tools into a unified system for collecting, analyzing, enriching, and disseminating threat intelligence. T",5,1
business-model,"Generate a Business Model Canvas with all 9 building blocks. Use when creating a business model, documenting how a business creates value, or analyzing an existing business model.",5,1
busybox-on-windows,How to use a Win32 build of BusyBox to run many of the standard UNIX command line tools on Windows.,5,1
canva-automation,"Automate Canva tasks via Rube MCP (Composio): designs, exports, folders, brand templates, autofill. Always search tools first for current schemas.",5,1
capacity,"Discovers available Azure OpenAI model capacity across regions and projects. Analyzes quota limits, compares availability, and recommends optimal deployment locations based on capacity requirements. USE FOR: find capacity, check quota, where can I deploy, capacity discovery, best region for capacity, multi-project capacity search, quota analysis, model availability, region comparison, check TPM availability. DO NOT USE FOR: actual deployment (hand off to preset or customize after discovery), quota increase requests (direct user to Azure Portal), listing existing deployments.",5,1
cc-skill-project-guidelines-example,Project Guidelines Skill (Example),5,1
chat-widget,"Build a real-time support chat system with a floating widget for users and an admin dashboard for support staff. Use when the user wants live chat, customer support chat, real-time messaging, or in-app support.",5,1
claimable-postgres,Provision instant temporary Postgres databases via Claimable Postgres by Neon (pg.new). No login or credit card required. Use for quick Postgres environments and throwaway DATABASE_URL for prototyping.,5,1
claude-d3js-skill,"This skill provides guidance for creating sophisticated, interactive data visualisations using d3.js.",5,1
claude-settings-audit,"Analyze a repository to generate recommended Claude Code settings.json permissions. Use when setting up a new project, auditing existing settings, or determining which read-only bash commands to allow. Detects tech stack, build tools, and monorepo structure.",5,1
cobrapy,"Constraint-based metabolic modeling (COBRA). FBA, FVA, gene knockouts, flux sampling, SBML models, for systems biology and metabolic engineering analysis.",5,1
codex,"OpenAI Codex CLI wrapper — three modes. Code review: independent diff review via codex review with pass/fail gate. Challenge: adversarial mode that tries to break your code. Consult: ask codex anything with session continuity for follow-ups. The ""200 IQ autistic developer"" second opinion. Use when asked to ""codex review"", ""codex challenge"", ""ask codex"", ""second opinion"", or ""consult codex"".",5,1
compliance-anthropic,"Navigate privacy regulations (GDPR, CCPA), review DPAs, and handle data subject requests. Use when reviewing data processing agreements, responding to data subject access or deletion requests, assessing cross-border data transfer requirements, or evaluating privacy compliance.",5,1
conducting-memory-forensics-with-volatility,"Performs memory forensics analysis using Volatility 3 to extract evidence of malware execution, process injection, network connections, and credential theft from RAM dumps captured during incident response. Covers memory acquisition, process analysis, DLL inspection, and malware detection. Activates for requests involving memory forensics, RAM analysis, Volatility framework, memory dump investigation, volatile evidence analysis, or live memory acquisition.",5,1
configuring-network-segmentation-with-vlans,"Designs and implements VLAN-based network segmentation on managed switches to isolate network zones, enforce access control between segments, and reduce the attack surface by limiting lateral movement paths in enterprise network environments.",5,1
context-degradation,Language models exhibit predictable degradation patterns as context length increases. Understanding these patterns is essential for diagnosing failures and designing resilient systems.,5,1
context-driven-development,"Guide for implementing and maintaining context as a managed artifact alongside code, enabling consistent AI interactions and team alignment through structured project documentation.",5,1
cookie-policy-malik-taiar,"Guide for drafting cookie policies compliant with GDPR and the ePrivacy Directive. Includes CNIL 2020 recommendations, a reference template, and best practices. Use when drafting or revising a cookie policy for a website or application.",5,1
creative-thinking-for-research,"Applies cognitive science frameworks for creative thinking to CS and AI research ideation. Use when seeking genuinely novel research directions by leveraging combinatorial creativity, analogical reasoning, constraint manipulation, and other empirically grounded creative strategies.",5,1
data-engineer,"Build scalable data pipelines, modern data warehouses, and real-time streaming architectures. Implements Apache Spark, dbt, Airflow, and cloud-native data platforms.",5,1
ddd:setup-code-formating,Sets up code formatting rules and style guidelines in CLAUDE.md,5,1
deepchem,"Molecular ML with diverse featurizers and pre-built datasets. Use for property prediction (ADMET, toxicity) with traditional ML or GNNs when you want extensive featurization options and MoleculeNet benchmarks. Best for quick experiments with pre-trained models, diverse molecular representations. For graph-first PyTorch workflows use torchdrug; for benchmark datasets use pytdc.",5,1
deepspeed,"Expert guidance for distributed training with DeepSpeed - ZeRO optimization stages, pipeline parallelism, FP16/BF16/FP8, 1-bit Adam, sparse attention",5,1
detecting-anomalies-in-industrial-control-systems,"This skill covers deploying anomaly detection systems for industrial control environments using machine learning models trained on OT network baselines, physics-based process models, and behavioral analysis of industrial protocol communications. It addresses building normal behavior profiles for SCADA polling patterns, detecting deviations in Modbus/DNP3/OPC UA traffic, identifying rogue devices, and correlating network anomalies with physical process data from historians.",5,1
detecting-fileless-attacks-on-endpoints,"Detects fileless malware and in-memory attacks that execute entirely in RAM without writing persistent files to disk, evading traditional antivirus. Use when building detections for PowerShell-based attacks, reflective DLL injection, WMI persistence, and registry-resident malware. Activates for requests involving fileless malware detection, in-memory attacks, PowerShell exploitation, or living-off-the-land techniques.",5,1
detecting-privilege-escalation-attempts,"Detect privilege escalation attempts including token manipulation, UAC bypass, unquoted service paths, kernel exploits, and sudo/doas abuse across Windows and Linux.",5,1
detecting-stuxnet-style-attacks,"This skill covers detecting sophisticated cyber-physical attacks that follow the Stuxnet attack pattern of modifying PLC logic while spoofing sensor readings to hide the manipulation from operators. It addresses PLC logic integrity monitoring, physics-based process anomaly detection, engineering workstation compromise indicators, USB-borne attack vectors, and multi-stage attack chain detection spanning IT-to-OT lateral movement through to process manipulation.",5,1
detecting-t1548-abuse-elevation-control-mechanism,"Detect abuse of elevation control mechanisms including UAC bypass, sudo exploitation, and setuid/setgid manipulation by monitoring registry modifications, process elevation flags, and unusual parent-child process relationships.",5,1
differentiation-schemes,"Select and apply numerical differentiation schemes for PDE and ODE discretization — generate finite-difference stencils at arbitrary order and accuracy, choose between central, upwind, compact (Pade), and spectral methods, handle boundary stencils, and estimate truncation error scaling. Use when discretizing spatial derivatives, picking a scheme for advection- or diffusion-dominated problems, building custom stencils for nonstandard operators, or comparing dispersion and dissipation properties of candidate schemes, even if the user just says ""how do I approximate this derivative"" or ""my solution is too diffusive.""",5,1
director-readiness-advisor,"Guide the PM-to-Director transition across preparing, interviewing, landing, and recalibrating. Use when leadership scope is changing and you need practical coaching.",5,1
drugbank-database,"Access and analyze comprehensive drug information from the DrugBank database including drug properties, interactions, targets, pathways, chemical structures, and pharmacology data. This skill should be used when working with pharmaceutical data, drug discovery research, pharmacology studies, drug-drug interaction analysis, target identification, chemical similarity searches, ADMET predictions, or any task requiring detailed drug and drug target information from DrugBank.",5,1
electron-development,"Master Electron desktop app development with secure IPC, contextIsolation, preload scripts, multi-process architecture, electron-builder packaging, code signing, and auto-update.",5,1
embedding-strategies,Guide to selecting and optimizing embedding models for vector search applications.,5,1
environment-setup-guide,"Guide developers through setting up development environments with proper tools, dependencies, and configurations",5,1
error-handling-patterns,Build resilient applications with robust error handling strategies that gracefully handle failures and provide excellent debugging experiences.,5,1
experiment-tracking-swanlab,"Provides guidance for experiment tracking with SwanLab. Use when you need open-source run tracking, local or self-hosted dashboards, and lightweight media logging for ML workflows.",5,1
formula-derivation,"Structures and derives research formulas when the user wants to 推导公式, build a theory line, organize assumptions, turn scattered equations into a coherent derivation, or rewrite theory notes into a paper-ready formula document. Use when the derivation target is not yet fully fixed, the main object still needs to be chosen, or the user needs a coherent derivation package rather than a finished theorem proof.",5,1
fp-option-ref,"Quick reference for Option type. Use when user needs to handle nullable values, optional data, or wants to avoid null checks.",5,1
