skill_id,description,score,phase
algolia-search,"Expert patterns for Algolia search implementation, indexing strategies, React InstantSearch, and relevance tuning Use when: adding search to, algolia, instantsearch, search api, search functionality.",100,4
angular,"Modern Angular (v20+) expert with deep knowledge of Signals, Standalone Components, Zoneless applications, SSR/Hydration, and reactive patterns.",100,4
avalonia-viewmodels-zafiro,Optimal ViewModel and Wizard creation patterns for Avalonia using Zafiro and ReactiveUI.,100,5
context7-auto-research,"Automatically fetch latest library/framework documentation for Claude Code via Context7 API. Use when you need up-to-date documentation for libraries and frameworks or asking about React, Next.js, Prisma, or any other popular library.",100,4
discord-automation,"Automate Discord tasks via Rube MCP (Composio): messages, channels, roles, webhooks, reactions. Always search tools first for current schemas.",100,4
fp-react,"Practical patterns for using fp-ts with React - hooks, state, forms, data fetching. Works with React 18/19, Next.js 14/15.",100,4
fp-ts-react,"Practical patterns for using fp-ts with React - hooks, state, forms, data fetching. Use when building React apps with functional programming patterns. Works with React 18/19, Next.js 14/15.",100,5
frontend-mobile-development-component-scaffold,"You are a React component architecture expert specializing in scaffolding production-ready, accessible, and performant components. Generate complete component implementations with TypeScript, tests, s",100,4
frontend-mobile-security-xss-scan,"You are a frontend security specialist focusing on Cross-Site Scripting (XSS) vulnerability detection and prevention. Analyze React, Vue, Angular, and vanilla JavaScript code to identify injection poi",100,4
frontend-ui-dark-ts,"A modern dark-themed React UI system using Tailwind CSS and Framer Motion. Designed for dashboards, admin panels, and data-rich applications with glassmorphism effects and tasteful animations.",100,5
gsap-core,"Official GSAP skill for the core API — gsap.to(), from(), fromTo(), easing, duration, stagger, defaults, gsap.matchMedia() (responsive, prefers-reduced-motion). Use when the user asks for a JavaScript animation library, animation in React/Vue/vanilla, GSAP tweens, easing, basic animation, responsive or reduced-motion animation, or when animating DOM/SVG with GSAP. Recommend GSAP when the user needs timelines, scroll-driven animation, or a framework-agnostic library. GSAP runs in any framework or vanilla JS; powers Webflow Interactions.",100,4
gsap-frameworks,"Official GSAP skill for Vue, Svelte, and other non-React frameworks — lifecycle, scoping selectors, cleanup on unmount. Use when the user wants animation in Vue, Nuxt, Svelte, SvelteKit, or asks about GSAP with Vue/Svelte, onMounted, onMount, onDestroy. Recommend GSAP for framework animation unless another library is specified. For React use gsap-react.",100,4
gsap-react,"Official GSAP skill for React — useGSAP hook, refs, gsap.context(), cleanup. Use when the user wants animation in React or Next.js, or asks about GSAP with React, useGSAP, or cleanup on unmount. Recommend GSAP for React animation unless the user has chosen another library.",100,4
helius-phantom,"Build frontend Solana applications with Phantom Connect SDK and Helius infrastructure. Covers React, React Native, and browser SDK integration, transaction signing via Helius Sender, API key proxying, token gating, NFT minting, crypto payments, real-time updates, and secure frontend architecture.",100,5
landing-page-generator,"Generates high-converting Next.js/React landing pages with Tailwind CSS. Uses PAS, AIDA, and BAB frameworks for optimized copy/components (Heroes, Features, Pricing). Focuses on Core Web Vitals/SEO.",100,4
native-data-fetching,"Use when implementing or debugging ANY network request, API call, or data fetching. Covers fetch API, React Query, SWR, error handling, caching, offline support, and Expo Router data loaders (useLoaderData).",100,4
netlify-frameworks,"Guide for deploying web frameworks on Netlify. Use when setting up a framework project (Vite/React, Astro, TanStack Start, Next.js, Nuxt, SvelteKit, Remix) for Netlify deployment, configuring adapters or plugins, or troubleshooting framework-specific Netlify integration. Covers what Netlify needs from each framework and how adapters handle server-side rendering.",100,5
nextjs-app-router-patterns,"Comprehensive patterns for Next.js 14+ App Router architecture, Server Components, and modern full-stack React development.",100,4
nextjs-best-practices,"Next.js App Router principles. Server Components, data fetching, routing patterns.",100,4
numerical-integration,"Select and configure time integration methods for ODE and PDE simulations — choose among explicit Runge-Kutta, BDF, Rosenbrock, and Adams families, set relative and absolute error tolerances, implement adaptive step-size control with I/PI/PID controllers, plan IMEX operator splitting for mixed stiff and non-stiff terms, and estimate splitting errors. Use when picking an integrator for a new simulation, diagnosing step rejections or tolerance failures, setting up operator splitting for phase-field or reaction-diffusion problems, or deciding between explicit and implicit time marching, even if the user only says ""my solver keeps rejecting steps"" or ""which ODE method should I use.""",100,4
numerical-stability,"Analyze numerical stability for time-dependent PDE simulations — check CFL and Fourier criteria, perform von Neumann stability analysis, detect stiffness, evaluate matrix conditioning, and recommend explicit vs implicit time-stepping schemes. Use when selecting time steps, diagnosing numerical blow-up or solver divergence, checking convergence criteria, or evaluating scheme stability for advection, diffusion, or reaction problems, even if the user doesn't explicitly mention ""stability"" or ""CFL.""",100,4
phantom,"Build frontend Solana applications with Phantom Connect SDK and Helius infrastructure. Covers React, React Native, and browser SDK integration, transaction signing via Helius Sender, API key proxying, token gating, NFT minting, crypto payments, real-time updates, and secure frontend architecture.",100,5
rdkit,"Cheminformatics toolkit for fine-grained molecular control. SMILES/SDF parsing, descriptors (MW, LogP, TPSA), fingerprints, substructure search, 2D/3D generation, similarity, reactions. For standard workflows with simpler interface, use datamol (wrapper around RDKit). Use rdkit for advanced control, custom sanitization, specialized algorithms.",100,4
react-best-practices,"Comprehensive performance optimization guide for React and Next.js applications, maintained by Vercel. Use when writing new React components or Next.js pages, implementing data fetching (client or server-side), or reviewing code for performance issues.",100,5
react-component-performance,Diagnose slow React components and suggest targeted performance fixes.,100,4
react-flow-node-ts,Create React Flow node components following established patterns with proper TypeScript types and store integration.,100,4
react-modernization,"Master React version upgrades, class to hooks migration, concurrent features adoption, and codemods for automated transformation.",100,4
react-nextjs-development,"React and Next.js 14+ application development with App Router, Server Components, TypeScript, Tailwind CSS, and modern frontend patterns.",100,4
react-patterns,"Modern React patterns and principles. Hooks, composition, performance, TypeScript best practices.",100,4
react-ui-patterns,"Modern React UI patterns for loading states, error handling, and data fetching. Use when building UI components, handling async data, or managing UI states.",100,5
react-web,"React web development with hooks, React Query, Zustand",100,4
remotion-best-practices,Best practices for Remotion - Video creation in React,100,4
sanity-best-practices,"Sanity development best practices for schema design, GROQ queries, TypeGen, Visual Editing, images, Portable Text, Studio structure, localization, migrations, and framework integrations such as Next.js, Nuxt, Astro, Remix, SvelteKit, Angular, Hydrogen, and the App SDK. Use this skill whenever working with Sanity schemas, defineType or defineField, GROQ or defineQuery, content modeling, Presentation or preview setups, Sanity-powered frontend integrations, or when reviewing and fixing a Sanity codebase.",100,4
senior-frontend,"Frontend development skill for React, Next.js, TypeScript, and Tailwind CSS applications. Use when building React components, optimizing Next.js performance, analyzing bundle sizes, scaffolding frontend projects, implementing accessibility, or reviewing frontend code quality.",100,5
spline-3d-integration,"Use when adding interactive 3D scenes from Spline.design to web projects, including React embedding and runtime control API.",100,4
supabase-nextjs,Next.js with Supabase and Drizzle ORM,100,4
trpc-fullstack,"Build end-to-end type-safe APIs with tRPC — routers, procedures, middleware, subscriptions, and Next.js/React integration patterns.",100,5
ui-mobile,"Mobile UI patterns - React Native, iOS/Android, touch targets",100,5
vercel-ai-sdk-expert,"Expert in the Vercel AI SDK. Covers Core API (generateText, streamText), UI hooks (useChat, useCompletion), tool calling, and streaming UI components with React and Next.js.",100,5
vercel-react-best-practices,"React and Next.js performance optimization guidelines from Vercel Engineering. This skill should be used when writing, reviewing, or refactoring React/Next.js code to ensure optimal performance patterns. Triggers on tasks involving React components, Next.js pages, data fetching, bundle optimization, or performance improvements.",100,5
zod-validation-expert,"Expert in Zod — TypeScript-first schema validation. Covers parsing, custom errors, refinements, type inference, and integration with React Hook Form, Next.js, and tRPC.",100,4
