skill_id,description,src_path
research-ops,"Evidence-first current-state research workflow for ECC. Use when the user wants fresh facts, comparisons, enrichment, or a recommendation built from current public evidence and any supplied local context.",lib/affaan-m-everything-claude-code/skills/research-ops/SKILL.md
research-review,"Get a deep critical review of research from GPT via Codex MCP. Use when user says ""review my research"", ""help me review"", ""get external review"", or wants critical feedback on research ideas, papers, or experimental results.",lib/wanshuiyin-auto-claude-code-research-in-sleep/skills/research-review/SKILL.md
retention-optimization,"When the user wants to reduce churn, improve user engagement, or increase lifetime value. Also use when the user mentions ""retention"", ""churn"", ""users leaving"", ""engagement"", ""DAU/MAU"", ""user activation"", or ""why are users uninstalling"". For onboarding-specific issues, see app-launch. For monetization, see monetization-strategy.",lib/eronred-aso-skills/skills/retention-optimization/SKILL.md
reverse-engineer,"Expert reverse engineer specializing in binary analysis, disassembly, decompilation, and software analysis. Masters IDA Pro, Ghidra, radare2, x64dbg, and modern RE toolchains.",lib/sickn33-antigravity-awesome-skills/plugins/antigravity-awesome-skills-claude/skills/reverse-engineer/SKILL.md
review-management,"When the user wants to analyze, respond to, or improve their app reviews and ratings. Also use when the user mentions ""reviews"", ""ratings"", ""negative reviews"", ""how to get more reviews"", ""review response"", or ""my rating is dropping"". For broader ASO audit, see aso-audit. For retention issues causing bad reviews, see retention-optimization.",lib/eronred-aso-skills/skills/review-management/SKILL.md
roadmap-planning,"Plan a strategic roadmap across prioritization, epic definition, stakeholder alignment, and sequencing. Use when turning strategy into a release plan that teams can execute.",lib/deanpeters-product-manager-skills/skills/roadmap-planning/SKILL.md
sadd:do-competitively,"Execute tasks through competitive multi-agent generation, meta-judge evaluation specification, multi-judge evaluation, and evidence-based synthesis",lib/neolabhq-context-engineering-kit/plugins/sadd/skills/do-competitively/SKILL.md
sadd:judge,Launch a meta-judge then a judge sub-agent to evaluate results produced in the current conversation,lib/neolabhq-context-engineering-kit/plugins/sadd/skills/judge/SKILL.md
sadd:judge-with-debate,Evaluate solutions through multi-round debate between independent judges until consensus,lib/neolabhq-context-engineering-kit/plugins/sadd/skills/judge-with-debate/SKILL.md
sadd:launch-sub-agent,"Launch an intelligent sub-agent with automatic model selection based on task complexity, specialized agent matching, Zero-shot CoT reasoning, and mandatory self-critique verification",lib/neolabhq-context-engineering-kit/plugins/sadd/skills/launch-sub-agent/SKILL.md
sadd:subagent-driven-development,"Use when executing implementation plans with independent tasks in the current session or facing 3+ independent issues that can be investigated without shared state or dependencies - dispatches fresh subagent for each task with code review between tasks, enabling fast iteration with quality gates",lib/neolabhq-context-engineering-kit/plugins/sadd/skills/subagent-driven-development/SKILL.md
sadd:tree-of-thoughts,"Execute tasks through systematic exploration, pruning, and expansion using Tree of Thoughts methodology with meta-judge evaluation specifications and multi-agent evaluation",lib/neolabhq-context-engineering-kit/plugins/sadd/skills/tree-of-thoughts/SKILL.md
safety-guard,Use this skill to prevent destructive operations when working on production systems or running agents autonomously.,lib/affaan-m-everything-claude-code/skills/safety-guard/SKILL.md
saga-orchestration,Patterns for managing distributed transactions and long-running business processes.,lib/sickn33-antigravity-awesome-skills/plugins/antigravity-awesome-skills-claude/skills/saga-orchestration/SKILL.md
salesforce-automation,"Automate Salesforce tasks via Rube MCP (Composio): leads, contacts, accounts, opportunities, SOQL queries. Always search tools first for current schemas.",lib/sickn33-antigravity-awesome-skills/plugins/antigravity-awesome-skills-claude/skills/salesforce-automation/SKILL.md
santa-method,Multi-agent adversarial verification with convergence loop. Two independent review agents must both pass before output ships.,lib/affaan-m-everything-claude-code/skills/santa-method/SKILL.md
scaffold-exercises,"Create exercise directory structures with sections, problems, solutions, and explainers that pass linting. Use when user wants to scaffold exercises, create exercise stubs, or set up a new course section.",lib/mattpocock-skills/scaffold-exercises/SKILL.md
scala-pro,"Master enterprise-grade Scala development with functional programming, distributed systems, and big data processing. Expert in Apache Pekko, Akka, Spark, ZIO/Cats Effect, and reactive architectures.",lib/sickn33-antigravity-awesome-skills/plugins/antigravity-awesome-skills-claude/skills/scala-pro/SKILL.md
scanpy,"Standard single-cell RNA-seq analysis pipeline. Use for QC, normalization, dimensionality reduction (PCA/UMAP/t-SNE), clustering, differential expression, and visualization. Best for exploratory scRNA-seq analysis with established workflows. For deep learning models use scvi-tools; for data format questions use anndata.",lib/k-dense-ai-claude-scientific-skills/scientific-skills/scanpy/SKILL.md
scholar-evaluation,"Systematically evaluate scholarly work using the ScholarEval framework, providing structured assessment across research quality dimensions including problem formulation, methodology, analysis, and writing with quantitative scoring and actionable feedback.",lib/k-dense-ai-claude-scientific-skills/scientific-skills/scholar-evaluation/SKILL.md
scientific-brainstorming,"Creative research ideation and exploration. Use for open-ended brainstorming sessions, exploring interdisciplinary connections, challenging assumptions, or identifying research gaps. Best for early-stage research planning when you do not have specific observations yet. For formulating testable hypotheses from data use hypothesis-generation.",lib/k-dense-ai-claude-scientific-skills/scientific-skills/scientific-brainstorming/SKILL.md
scientific-schematics,"Create publication-quality scientific diagrams using Nano Banana 2 AI with smart iterative refinement. Uses Gemini 3.1 Pro Preview for quality review. Only regenerates if quality is below threshold for your document type. Specialized in neural network architectures, system diagrams, flowcharts, biological pathways, and complex scientific visualizations.",lib/k-dense-ai-claude-scientific-skills/scientific-skills/scientific-schematics/SKILL.md
scientific-visualization,"Meta-skill for publication-ready figures. Use when creating journal submission figures requiring multi-panel layouts, significance annotations, error bars, colorblind-safe palettes, and specific journal formatting (Nature, Science, Cell). Orchestrates matplotlib/seaborn/plotly with publication styles. For quick exploration use seaborn or plotly directly.",lib/k-dense-ai-claude-scientific-skills/scientific-skills/scientific-visualization/SKILL.md
scikit-learn,"Machine learning in Python with scikit-learn. Use when working with supervised learning (classification, regression), unsupervised learning (clustering, dimensionality reduction), model evaluation, hyperparameter tuning, preprocessing, or building ML pipelines. Provides comprehensive reference documentation for algorithms, preprocessing techniques, pipelines, and best practices.",lib/k-dense-ai-claude-scientific-skills/scientific-skills/scikit-learn/SKILL.md
scikit-survival,"Comprehensive toolkit for survival analysis and time-to-event modeling in Python using scikit-survival. Use this skill when working with censored survival data, performing time-to-event analysis, fitting Cox models, Random Survival Forests, Gradient Boosting models, or Survival SVMs, evaluating survival predictions with concordance index or Brier score, handling competing risks, or implementing any survival analysis workflow with the scikit-survival library.",lib/k-dense-ai-claude-scientific-skills/scientific-skills/scikit-survival/SKILL.md
scroll-experience,"Expert in building immersive scroll-driven experiences - parallax storytelling, scroll animations, interactive narratives, and cinematic web experiences. Like NY Times interactives, Apple product pages, and award-winning web experiences.",lib/sickn33-antigravity-awesome-skills/plugins/antigravity-awesome-skills-claude/skills/scroll-experience/SKILL.md
scvelo,"RNA velocity analysis with scVelo. Estimate cell state transitions from unspliced/spliced mRNA dynamics, infer trajectory directions, compute latent time, and identify driver genes in single-cell RNA-seq data. Complements Scanpy/scVI-tools for trajectory inference.",lib/k-dense-ai-claude-scientific-skills/scientific-skills/scvelo/SKILL.md
scvi-tools,"Deep generative models for single-cell omics. Use when you need probabilistic batch correction (scVI), transfer learning, differential expression with uncertainty, or multi-modal integration (TOTALVI, MultiVI). Best for advanced modeling, batch effects, multimodal data. For standard analysis pipelines use scanpy.",lib/k-dense-ai-claude-scientific-skills/scientific-skills/scvi-tools/SKILL.md
sdd:add-task,creates draft task file in .specs/tasks/draft/ with original user intent,lib/neolabhq-context-engineering-kit/plugins/sdd/skills/add-task/SKILL.md
sdd:brainstorm,"Use when creating or developing, before writing code or implementation plans - refines rough ideas into fully-formed designs through collaborative questioning, alternative exploration, and incremental validation. Don't use during clear 'mechanical' processes",lib/neolabhq-context-engineering-kit/plugins/sdd/skills/brainstorm/SKILL.md
sdd:create-ideas,Generate ideas in one shot using creative sampling,lib/neolabhq-context-engineering-kit/plugins/sdd/skills/create-ideas/SKILL.md
sdd:plan,"Refine, parallelize, and verify a draft task specification into a fully planned implementation-ready task",lib/neolabhq-context-engineering-kit/plugins/sdd/skills/plan/SKILL.md
seaborn,"Statistical visualization with pandas integration. Use for quick exploration of distributions, relationships, and categorical comparisons with attractive defaults. Best for box plots, violin plots, pair plots, heatmaps. Built on matplotlib. For interactive plots use plotly; for publication styling use scientific-visualization.",lib/k-dense-ai-claude-scientific-skills/scientific-skills/seaborn/SKILL.md
search-first,"Research-before-coding workflow. Search for existing tools, libraries, and patterns before writing custom code. Systematizes the ""search for existing solutions before implementing"" approach. Use when starting new features or adding functionality.",lib/affaan-m-everything-claude-code/.kiro/skills/search-first/SKILL.md
search-specialist,Expert web researcher using advanced search techniques and,lib/sickn33-antigravity-awesome-skills/plugins/antigravity-awesome-skills-claude/skills/search-specialist/SKILL.md
secrets-management,"Secure secrets management practices for CI/CD pipelines using Vault, AWS Secrets Manager, and other tools.",lib/sickn33-antigravity-awesome-skills/plugins/antigravity-awesome-skills-claude/skills/secrets-management/SKILL.md
seek-and-analyze-video,Seek and analyze video content using Memories.ai Large Visual Memory Model for persistent video intelligence,lib/sickn33-antigravity-awesome-skills/plugins/antigravity-awesome-skills-claude/skills/seek-and-analyze-video/SKILL.md
segment-anything-model,"Foundation model for image segmentation with zero-shot transfer. Use when you need to segment any object in images using points, boxes, or masks as prompts, or automatically generate all object masks in an image.",lib/orchestra-research-ai-research-skills/18-multimodal/segment-anything/SKILL.md
segment-automation,"Automate Segment tasks via Rube MCP (Composio): track events, identify users, manage groups, page views, aliases, batch operations. Always search tools first for current schemas.",lib/sickn33-antigravity-awesome-skills/plugins/antigravity-awesome-skills-claude/skills/segment-automation/SKILL.md
sendgrid-automation,"Automate SendGrid email delivery workflows including marketing campaigns (Single Sends), contact and list management, sender identity setup, and email analytics through Composio's SendGrid toolkit.",lib/sickn33-antigravity-awesome-skills/plugins/antigravity-awesome-skills-claude/skills/sendgrid-automation/SKILL.md
senior-architect,Complete toolkit for senior architect with modern tools and best practices.,lib/sickn33-antigravity-awesome-skills/plugins/antigravity-awesome-skills-claude/skills/senior-architect/SKILL.md
senior-fullstack,Complete toolkit for senior fullstack with modern tools and best practices.,lib/sickn33-antigravity-awesome-skills/plugins/antigravity-awesome-skills-claude/skills/senior-fullstack/SKILL.md
sentence-transformers,"Framework for state-of-the-art sentence, text, and image embeddings. Provides 5000+ pre-trained models for semantic similarity, clustering, and retrieval. Supports multilingual, domain-specific, and multimodal models. Use for generating embeddings for RAG, semantic search, or similarity tasks. Best for production embedding generation.",lib/orchestra-research-ai-research-skills/15-rag/sentence-transformers/SKILL.md
sentencepiece,"Language-independent tokenizer treating text as raw Unicode. Supports BPE and Unigram algorithms. Fast (50k sentences/sec), lightweight (6MB memory), deterministic vocabulary. Used by T5, ALBERT, XLNet, mBART. Train on raw text without pre-tokenization. Use when you need multilingual support, CJK languages, or reproducible tokenization.",lib/orchestra-research-ai-research-skills/02-tokenization/sentencepiece/SKILL.md
sentiment-analysis,"Analyze user feedback data to identify segments with sentiment scores, JTBD, and product satisfaction insights. Use when analyzing user feedback at scale, running sentiment analysis on reviews or surveys, or identifying satisfaction patterns.",lib/phuryn-pm-skills/pm-market-research/skills/sentiment-analysis/SKILL.md
sentry-automation,"Automate Sentry tasks via Rube MCP (Composio): manage issues/events, configure alerts, track releases, monitor projects and teams. Always search tools first for current schemas.",lib/sickn33-antigravity-awesome-skills/plugins/antigravity-awesome-skills-claude/skills/sentry-automation/SKILL.md
session-management,"Context preservation, tiered summarization, resumability",lib/alinaqi-claude-bootstrap/skills/session-management/SKILL.md
shap,"Model interpretability and explainability using SHAP (SHapley Additive exPlanations). Use this skill when explaining machine learning model predictions, computing feature importance, generating SHAP plots (waterfall, beeswarm, bar, scatter, force, heatmap), debugging models, analyzing model bias or fairness, comparing models, or implementing explainable AI. Works with tree-based models (XGBoost, LightGBM, Random Forest), deep learning (TensorFlow, PyTorch), linear models, and any black-box model.",lib/k-dense-ai-claude-scientific-skills/scientific-skills/shap/SKILL.md
sharp-edges,sharp-edges,lib/sickn33-antigravity-awesome-skills/plugins/antigravity-awesome-skills-claude/skills/sharp-edges/SKILL.md
ship,"Ship workflow: detect + merge base branch, run tests, review diff, bump VERSION, update CHANGELOG, commit, push, create PR. Use when asked to ""ship"", ""deploy"", ""push to main"", ""create a PR"", ""merge and push"", or ""get it deployed"". Proactively invoke this skill (do NOT push/PR directly) when the user says code is ready, asks about deploying, wants to push code up, or asks to create a PR. (gstack)",lib/garrytan-gstack/ship/SKILL.md
shopify-apps,"Shopify app development - Remix, Admin API, checkout extensions",lib/alinaqi-claude-bootstrap/skills/shopify-apps/SKILL.md
shopify-automation,"Automate Shopify tasks via Rube MCP (Composio): products, orders, customers, inventory, collections. Always search tools first for current schemas.",lib/sickn33-antigravity-awesome-skills/plugins/antigravity-awesome-skills-claude/skills/shopify-automation/SKILL.md
signup-flow-cro,"When the user wants to optimize signup, registration, account creation, or trial activation flows. Also use when the user mentions ""signup conversions,"" ""registration friction,"" ""signup form optimization,"" ""free trial signup,"" ""reduce signup dropoff,"" ""account creation flow,"" ""people aren't signing up,"" ""signup abandonment,"" ""trial conversion rate,"" ""nobody completes registration,"" ""too many steps to sign up,"" or ""simplify our signup."" Use this whenever the user has a signup or registration flow that isn't performing. For post-signup onboarding, see onboarding-cro. For lead capture forms (not account creation), see form-cro.",lib/coreyhaines31-marketingskills/skills/signup-flow-cro/SKILL.md
similarity-search-patterns,"Implement efficient similarity search with vector databases. Use when building semantic search, implementing nearest neighbor queries, or optimizing retrieval performance.",lib/sickn33-antigravity-awesome-skills/plugins/antigravity-awesome-skills-claude/skills/similarity-search-patterns/SKILL.md
simplify-code,"Review a diff for clarity and safe simplifications, then optionally apply low-risk fixes.",lib/sickn33-antigravity-awesome-skills/plugins/antigravity-awesome-skills-claude/skills/simplify-code/SKILL.md
simpy,"Process-based discrete-event simulation framework in Python. Use this skill when building simulations of systems with processes, queues, resources, and time-based events such as manufacturing systems, service operations, network traffic, logistics, or any system where entities interact with shared resources over time.",lib/k-dense-ai-claude-scientific-skills/scientific-skills/simpy/SKILL.md
skill-authoring-workflow,"Turn raw PM content into a compliant, publish-ready skill. Use when creating or updating a repo skill without breaking standards.",lib/deanpeters-product-manager-skills/skills/skill-authoring-workflow/SKILL.md
skill-builder,"Automatically detect source types and build AI skills using Skill Seekers. Use when the user wants to create skills from documentation, repos, PDFs, videos, or other knowledge sources.",lib/yusufkaraaslan-skill-seekers/distribution/claude-plugin/skills/skill-builder/SKILL.md
skill-check,"Validate Claude Code skills against the agentskills specification. Catches structural, semantic, and naming issues before users do.",lib/sickn33-antigravity-awesome-skills/plugins/antigravity-awesome-skills-claude/skills/skill-check/SKILL.md
skill-developer,"Comprehensive guide for creating and managing skills in Claude Code with auto-activation system, following Anthropic's official best practices including the 500-line rule and progressive disclosure pattern.",lib/sickn33-antigravity-awesome-skills/plugins/antigravity-awesome-skills-claude/skills/skill-developer/SKILL.md
skill-installer,"Instala, valida, registra e verifica novas skills no ecossistema. 10 checks de seguranca, copia, registro no orchestrator e verificacao pos-instalacao.",lib/sickn33-antigravity-awesome-skills/plugins/antigravity-awesome-skills-claude/skills/skill-installer/SKILL.md
skill-name,"Clear description of what this skill does and when to use it. Include trigger keywords and contexts inline, e.g. ""Use when user wants to X, Y, or Z.""",lib/resciencelab-opc-skills/template/SKILL.md
skill-rails-upgrade,Analyze Rails apps and provide upgrade assessments,lib/sickn33-antigravity-awesome-skills/plugins/antigravity-awesome-skills-claude/skills/skill-rails-upgrade/SKILL.md
skill-sentinel,"Auditoria e evolucao do ecossistema de skills. Qualidade de codigo, seguranca, custos, gaps, duplicacoes, dependencias e relatorios de saude.",lib/sickn33-antigravity-awesome-skills/plugins/antigravity-awesome-skills-claude/skills/skill-sentinel/SKILL.md
slack-automation,"Automate Slack workspace operations including messaging, search, channel management, and reaction workflows through Composio's Slack toolkit.",lib/sickn33-antigravity-awesome-skills/plugins/antigravity-awesome-skills-claude/skills/slack-automation/SKILL.md
slack-gif-creator,A toolkit providing utilities and knowledge for creating animated GIFs optimized for Slack.,lib/sickn33-antigravity-awesome-skills/skills/slack-gif-creator/SKILL.md
slo-implementation,"Framework for defining and implementing Service Level Indicators (SLIs), Service Level Objectives (SLOs), and error budgets.",lib/sickn33-antigravity-awesome-skills/plugins/antigravity-awesome-skills-claude/skills/slo-implementation/SKILL.md
snipgrapher,"Configures and uses snipgrapher to generate polished code snippet images, including syntax-highlighted PNGs, SVGs, and WebP exports with custom themes, profiles, and styling options. Use when the user wants to create code screenshots, turn code into shareable images, generate pretty code snippets for docs or social posts, produce syntax-highlighted images from source files, or explicitly mentions snipgrapher. Supports single-file renders, batch jobs, watch mode, and reusable named profiles via the snipgrapher CLI or npx.",lib/mcollina-skills/skills/snipgrapher/SKILL.md
social-graph-ranker,"Weighted social-graph ranking for warm intro discovery, bridge scoring, and network gap analysis across X and LinkedIn. Use when the user wants the reusable graph-ranking engine itself, not the broader outreach or network-maintenance workflow layered on top of it.",lib/affaan-m-everything-claude-code/skills/social-graph-ranker/SKILL.md
sop-creator,"Creates detailed Standard Operating Procedures (SOPs) for business processes. Use when user needs SOPs, process documentation, operational guides, workflow documentation, or step-by-step instructions for repeatable business processes.",lib/ognjengt-founder-skills/skills/sop-creator/SKILL.md
sparse-autoencoder-training,"Provides guidance for training and analyzing Sparse Autoencoders (SAEs) using SAELens to decompose neural network activations into interpretable features. Use when discovering interpretable features, analyzing superposition, or studying monosemantic representations in language models.",lib/orchestra-research-ai-research-skills/04-mechanistic-interpretability/saelens/SKILL.md
spec-to-code-compliance,"Verifies code implements exactly what documentation specifies for blockchain audits. Use when comparing code against whitepapers, finding gaps between specs and implementation, or performing compliance checks for protocol implementations.",lib/sickn33-antigravity-awesome-skills/plugins/antigravity-awesome-skills-claude/skills/spec-to-code-compliance/SKILL.md
speckit-updater,SpecKit Safe Update,lib/notmyself-claude-win11-speckit-update-skill/skills/speckit-updater/SKILL.md
speed,Launch RSVP speed reader for text,lib/seanzor-claude-speed-reader/.claude/skills/speed/SKILL.md
sprint-plan,"Plan a sprint with capacity estimation, story selection, dependency mapping, and risk identification. Use when preparing for sprint planning, estimating team capacity, selecting stories, or balancing sprint scope against velocity.",lib/phuryn-pm-skills/pm-execution/skills/sprint-plan/SKILL.md
square-automation,"Automate Square tasks via Rube MCP (Composio): payments, orders, invoices, locations. Always search tools first for current schemas.",lib/sickn33-antigravity-awesome-skills/plugins/antigravity-awesome-skills-claude/skills/square-automation/SKILL.md
sred-project-organizer,"Take a list of projects and their related documentation, and organize them into the SRED format for submission.",lib/sickn33-antigravity-awesome-skills/plugins/antigravity-awesome-skills-claude/skills/sred-project-organizer/SKILL.md
sred-work-summary,Go back through the previous year of work and create a Notion doc that groups relevant links into projects that can then be documented as SRED projects.,lib/sickn33-antigravity-awesome-skills/plugins/antigravity-awesome-skills-claude/skills/sred-work-summary/SKILL.md
stability-ai,"Geracao de imagens via Stability AI (SD3.5, Ultra, Core). Text-to-image, img2img, inpainting, upscale, remove-bg, search-replace. 15 estilos artisticos.",lib/sickn33-antigravity-awesome-skills/plugins/antigravity-awesome-skills-claude/skills/stability-ai/SKILL.md
stable-diffusion-image-generation,"State-of-the-art text-to-image generation with Stable Diffusion models via HuggingFace Diffusers. Use when generating images from text prompts, performing image-to-image translation, inpainting, or building custom diffusion pipelines.",lib/orchestra-research-ai-research-skills/18-multimodal/stable-diffusion/SKILL.md
stakeholder-map,"Build a stakeholder map using a power/interest grid, identify communication strategies per quadrant, and generate a communication plan. Use when managing stakeholders, preparing for a launch, aligning cross-functional teams, or planning stakeholder engagement.",lib/phuryn-pm-skills/pm-execution/skills/stakeholder-map/SKILL.md
startup-analyst,"Expert startup business analyst specializing in market sizing, financial modeling, competitive analysis, and strategic planning for early-stage companies.",lib/sickn33-antigravity-awesome-skills/plugins/antigravity-awesome-skills-claude/skills/startup-analyst/SKILL.md
startup-business-analyst-business-case,"Generate comprehensive investor-ready business case document with market, solution, financials, and strategy",lib/sickn33-antigravity-awesome-skills/plugins/antigravity-awesome-skills-claude/skills/startup-business-analyst-business-case/SKILL.md
