skill_id,description,src_path
ab-test-setup,"When the user wants to plan, design, or implement an A/B test or experiment, or build a growth experimentation program. Also use when the user mentions ""A/B test,"" ""split test,"" ""experiment,"" ""test this change,"" ""variant copy,"" ""multivariate test,"" ""hypothesis,"" ""should I test this,"" ""which version is better,"" ""test two versions,"" ""statistical significance,"" ""how long should I run this test,"" ""growth experiments,"" ""experiment velocity,"" ""experiment backlog,"" ""ICE score,"" ""experimentation program,"" or ""experiment playbook."" Use this whenever someone is comparing two approaches and wants to measure which performs better, or when they want to build a systematic experimentation practice. For tracking implementation, see analytics-tracking. For page-level conversion optimization, see page-cro.",lib/coreyhaines31-marketingskills/skills/ab-test-setup/SKILL.md
ablation-planner,"Use when main results pass result-to-claim (claim_supported=yes or partial) and ablation studies are needed for paper submission. Codex designs ablations from a reviewer's perspective, CC reviews feasibility and implements.",lib/wanshuiyin-auto-claude-code-research-in-sleep/skills/ablation-planner/SKILL.md
acceptance-orchestrator,"Use when a coding task should be driven end-to-end from issue intake through implementation, review, deployment, and acceptance verification with minimal human re-intervention.",lib/sickn33-antigravity-awesome-skills/plugins/antigravity-awesome-skills-claude/skills/acceptance-orchestrator/SKILL.md
activecampaign-automation,"Automate ActiveCampaign tasks via Rube MCP (Composio): manage contacts, tags, list subscriptions, automation enrollment, and tasks. Always search tools first for current schemas.",lib/sickn33-antigravity-awesome-skills/plugins/antigravity-awesome-skills-claude/skills/activecampaign-automation/SKILL.md
add-new-opc-skill,"Checklist and automation guide for adding a new skill to the OPC Skills project. Ensures all required files, metadata, logos, and listings are created before release. Use when adding a new skill, publishing a skill, or preparing a skill for release.",lib/resciencelab-opc-skills/.factory/skills/add-new-opc-skill/SKILL.md
advogado-criminal,"Advogado criminalista especializado em Maria da Penha, violencia domestica, feminicidio, direito penal brasileiro, medidas protetivas, inquerito policial e acao penal.",lib/sickn33-antigravity-awesome-skills/plugins/antigravity-awesome-skills-claude/skills/advogado-criminal/SKILL.md
advogado-especialista,"Advogado especialista em todas as areas do Direito brasileiro: familia, criminal, trabalhista, tributario, consumidor, imobiliario, empresarial, civil e constitucional.",lib/sickn33-antigravity-awesome-skills/plugins/antigravity-awesome-skills-claude/skills/advogado-especialista/SKILL.md
aeon,"This skill should be used for time series machine learning tasks including classification, regression, clustering, forecasting, anomaly detection, segmentation, and similarity search. Use when working with temporal data, sequential patterns, or time-indexed observations requiring specialized algorithms beyond standard ML approaches. Particularly suited for univariate and multivariate time series analysis with scikit-learn compatible APIs.",lib/k-dense-ai-claude-scientific-skills/scientific-skills/aeon/SKILL.md
agent-introspection-debugging,"Structured self-debugging workflow for AI agent failures using capture, diagnosis, contained recovery, and introspection reports.",lib/affaan-m-everything-claude-code/.agents/skills/agent-introspection-debugging/SKILL.md
agent-manager-skill,Manage multiple local CLI agents via tmux sessions (start/stop/monitor/assign) with cron-friendly scheduling.,lib/sickn33-antigravity-awesome-skills/plugins/antigravity-awesome-skills-claude/skills/agent-manager-skill/SKILL.md
agent-orchestration-improve-agent,"Systematic improvement of existing agents through performance analysis, prompt engineering, and continuous iteration.",lib/sickn33-antigravity-awesome-skills/plugins/antigravity-awesome-skills-claude/skills/agent-orchestration-improve-agent/SKILL.md
agent-orchestrator,"Meta-skill que orquestra todos os agentes do ecossistema. Scan automatico de skills, match por capacidades, coordenacao de workflows multi-skill e registry management.",lib/sickn33-antigravity-awesome-skills/plugins/antigravity-awesome-skills-claude/skills/agent-orchestrator/SKILL.md
agent-sort,"Build an evidence-backed ECC install plan for a specific repo by sorting skills, commands, rules, hooks, and extras into DAILY vs LIBRARY buckets using parallel repo-aware review passes. Use when ECC should be trimmed to what a project actually needs instead of loading the full bundle.",lib/affaan-m-everything-claude-code/.agents/skills/agent-sort/SKILL.md
agent-teams,Claude Code Agent Teams - default team-based development with strict TDD pipeline enforcement,lib/alinaqi-claude-bootstrap/skills/agent-teams/SKILL.md
agentfolio,"Skill for discovering and researching autonomous AI agents, tools, and ecosystems using the AgentFolio directory.",lib/sickn33-antigravity-awesome-skills/plugins/antigravity-awesome-skills-claude/skills/agentfolio/SKILL.md
agentic-engineering,"Operate as an agentic engineer using eval-first execution, decomposition, and cost-aware model routing. Use when AI agents perform most implementation work and humans enforce quality and risk controls.",lib/affaan-m-everything-claude-code/.kiro/skills/agentic-engineering/SKILL.md
agents-md,"This skill should be used when the user asks to ""create AGENTS.md"", ""update AGENTS.md"", ""maintain agent docs"", ""set up CLAUDE.md"", or needs to keep agent instructions concise. Enforces research-backed best practices for minimal, high-signal agent documentation.",lib/sickn33-antigravity-awesome-skills/plugins/antigravity-awesome-skills-claude/skills/agents-md/SKILL.md
ai-dev-jobs-mcp,"Search 8,400+ AI and ML jobs across 489 companies, inspect listings and employers, match roles, and view salary and market stats via AI Dev Jobs MCP",lib/sickn33-antigravity-awesome-skills/plugins/antigravity-awesome-skills-claude/skills/ai-dev-jobs-mcp/SKILL.md
ai-md,"Convert human-written CLAUDE.md into AI-native structured-label format. Battle-tested across 4 models. Same rules, fewer tokens, higher compliance.",lib/sickn33-antigravity-awesome-skills/plugins/antigravity-awesome-skills-claude/skills/ai-md/SKILL.md
ai-models,"Latest AI models reference - Claude, OpenAI, Gemini, Eleven Labs, Replicate",lib/alinaqi-claude-bootstrap/skills/ai-models/SKILL.md
ai-product,Every product will be AI-powered. The question is whether you'll build it right or ship a demo that falls apart in production.,lib/sickn33-antigravity-awesome-skills/plugins/antigravity-awesome-skills-claude/skills/ai-product/SKILL.md
ai-shaped-readiness-advisor,Assess whether your product work is AI-first or AI-shaped. Use when evaluating AI maturity and choosing the next team capability to build.,lib/deanpeters-product-manager-skills/skills/ai-shaped-readiness-advisor/SKILL.md
ai-studio-image,Geracao de imagens humanizadas via Google AI Studio (Gemini). Fotos realistas estilo influencer ou educacional com iluminacao natural e imperfeicoes sutis.,lib/sickn33-antigravity-awesome-skills/plugins/antigravity-awesome-skills-claude/skills/ai-studio-image/SKILL.md
ai-wrapper-product,"Expert in building products that wrap AI APIs (OpenAI, Anthropic, etc. ) into focused tools people will pay for. Not just ""ChatGPT but different"" - products that solve specific problems with AI.",lib/sickn33-antigravity-awesome-skills/plugins/antigravity-awesome-skills-claude/skills/ai-wrapper-product/SKILL.md
airtable-automation,"Automate Airtable tasks via Rube MCP (Composio): records, bases, tables, fields, views. Always search tools first for current schemas.",lib/sickn33-antigravity-awesome-skills/plugins/antigravity-awesome-skills-claude/skills/airtable-automation/SKILL.md
alpha-vantage,"Access 20+ years of global financial data: equities, options, forex, crypto, commodities, economic indicators, and 50+ technical indicators.",lib/sickn33-antigravity-awesome-skills/plugins/antigravity-awesome-skills-claude/skills/alpha-vantage/SKILL.md
altitude-horizon-framework,"Understand the PM-to-Director transition through altitude and horizon thinking. Use when diagnosing scope, time-horizon, or leadership-level gaps.",lib/deanpeters-product-manager-skills/skills/altitude-horizon-framework/SKILL.md
amplitude-automation,"Automate Amplitude tasks via Rube MCP (Composio): events, user activity, cohorts, user identification. Always search tools first for current schemas.",lib/sickn33-antigravity-awesome-skills/plugins/antigravity-awesome-skills-claude/skills/amplitude-automation/SKILL.md
analytics-tracking,"When the user wants to set up, improve, or audit analytics tracking and measurement. Also use when the user mentions ""set up tracking,"" ""GA4,"" ""Google Analytics,"" ""conversion tracking,"" ""event tracking,"" ""UTM parameters,"" ""tag manager,"" ""GTM,"" ""analytics implementation,"" ""tracking plan,"" ""how do I measure this,"" ""track conversions,"" ""attribution,"" ""Mixpanel,"" ""Segment,"" ""are my events firing,"" or ""analytics isn't working."" Use this whenever someone asks how to know if something is working or wants to measure marketing results. For A/B test measurement, see ab-test-setup.",lib/coreyhaines31-marketingskills/skills/analytics-tracking/SKILL.md
analyze-feature-requests,"Analyze and prioritize a list of feature requests by theme, strategic alignment, impact, effort, and risk. Use when reviewing customer feature requests, triaging a backlog, or making prioritization decisions.",lib/phuryn-pm-skills/pm-product-discovery/skills/analyze-feature-requests/SKILL.md
analyze-results,"Analyze ML experiment results, compute statistics, generate comparison tables and insights. Use when user says ""analyze results"", ""compare"", or needs to interpret experimental data.",lib/wanshuiyin-auto-claude-code-research-in-sleep/skills/analyze-results/SKILL.md
angular,"Modern Angular (v20+) expert with deep knowledge of Signals, Standalone Components, Zoneless applications, SSR/Hydration, and reactive patterns.",lib/sickn33-antigravity-awesome-skills/plugins/antigravity-awesome-skills-claude/skills/angular/SKILL.md
angular-state-management,"Master modern Angular state management with Signals, NgRx, and RxJS. Use when setting up global state, managing component stores, choosing between state solutions, or migrating from legacy patterns.",lib/sickn33-antigravity-awesome-skills/plugins/antigravity-awesome-skills-claude/skills/angular-state-management/SKILL.md
ansoff-matrix,"Generate an Ansoff Matrix analysis mapping growth strategies across market penetration, market development, product development, and diversification. Use when considering growth options, planning market expansion, or evaluating strategic growth paths.",lib/phuryn-pm-skills/pm-product-strategy/skills/ansoff-matrix/SKILL.md
antigravity-skill-orchestrator,"A meta-skill that understands task requirements, dynamically selects appropriate skills, tracks successful skill combinations using agent-memory-mcp, and prevents skill overuse for simple tasks.",lib/sickn33-antigravity-awesome-skills/plugins/antigravity-awesome-skills-claude/skills/antigravity-skill-orchestrator/SKILL.md
api-documentation-generator,"Generate comprehensive, developer-friendly API documentation from code, including endpoints, parameters, examples, and best practices",lib/sickn33-antigravity-awesome-skills/plugins/antigravity-awesome-skills-claude/skills/api-documentation-generator/SKILL.md
api-server-mcp,api server mcp,lib/kreuzberg-dev-kreuzberg/.ai-rulez/skills/api-server-mcp/SKILL.md
apify-actor-development,"Important: Before you begin, fill in the generatedBy property in the meta section of .actor/actor.json. Replace it with the tool and model you're currently using, such as ""Claude Code with Claude Sonnet 4.5"". This helps Apify monitor and improve AGENTS.md for specific AI tools and models.",lib/sickn33-antigravity-awesome-skills/plugins/antigravity-awesome-skills-claude/skills/apify-actor-development/SKILL.md
apify-actorization,"Actorization converts existing software into reusable serverless applications compatible with the Apify platform. Actors are programs packaged as Docker images that accept well-defined JSON input, perform an action, and optionally produce structured JSON output.",lib/sickn33-antigravity-awesome-skills/plugins/antigravity-awesome-skills-claude/skills/apify-actorization/SKILL.md
apify-audience-analysis,"Understand audience demographics, preferences, behavior patterns, and engagement quality across Facebook, Instagram, YouTube, and TikTok.",lib/sickn33-antigravity-awesome-skills/plugins/antigravity-awesome-skills-claude/skills/apify-audience-analysis/SKILL.md
apify-competitor-intelligence,"Analyze competitor strategies, content, pricing, ads, and market positioning across Google Maps, Booking.com, Facebook, Instagram, YouTube, and TikTok.",lib/sickn33-antigravity-awesome-skills/plugins/antigravity-awesome-skills-claude/skills/apify-competitor-intelligence/SKILL.md
apify-ecommerce,"Extract product data, prices, reviews, and seller information from any e-commerce platform using Apify's E-commerce Scraping Tool.",lib/sickn33-antigravity-awesome-skills/plugins/antigravity-awesome-skills-claude/skills/apify-ecommerce/SKILL.md
apify-influencer-discovery,"Find and evaluate influencers for brand partnerships, verify authenticity, and track collaboration performance across Instagram, Facebook, YouTube, and TikTok.",lib/sickn33-antigravity-awesome-skills/plugins/antigravity-awesome-skills-claude/skills/apify-influencer-discovery/SKILL.md
apify-lead-generation,Scrape leads from multiple platforms using Apify Actors.,lib/sickn33-antigravity-awesome-skills/plugins/antigravity-awesome-skills-claude/skills/apify-lead-generation/SKILL.md
apify-market-research,"Analyze market conditions, geographic opportunities, pricing, consumer behavior, and product validation across Google Maps, Facebook, Instagram, Booking.com, and TripAdvisor.",lib/sickn33-antigravity-awesome-skills/plugins/antigravity-awesome-skills-claude/skills/apify-market-research/SKILL.md
apify-trend-analysis,"Discover and track emerging trends across Google Trends, Instagram, Facebook, YouTube, and TikTok to inform content strategy.",lib/sickn33-antigravity-awesome-skills/plugins/antigravity-awesome-skills-claude/skills/apify-trend-analysis/SKILL.md
apify-ultimate-scraper,AI-driven data extraction from 55+ Actors across all major platforms. This skill automatically selects the best Actor for your task.,lib/sickn33-antigravity-awesome-skills/plugins/antigravity-awesome-skills-claude/skills/apify-ultimate-scraper/SKILL.md
app-analytics,"When the user wants to set up, interpret, or improve their app analytics and tracking. Also use when the user mentions ""analytics"", ""tracking"", ""metrics"", ""KPIs"", ""App Store Connect analytics"", ""install tracking"", ""funnel"", ""attribution"", or ""how is my app performing"". For A/B testing, see ab-test-store-listing. For retention metrics, see retention-optimization.",lib/eronred-aso-skills/skills/app-analytics/SKILL.md
app-builder,"Main application building orchestrator. Creates full-stack applications from natural language requests. Determines project type, selects tech stack, coordinates agents.",lib/sickn33-antigravity-awesome-skills/plugins/antigravity-awesome-skills-claude/skills/app-builder/SKILL.md
app-clips,"When the user wants to implement, optimize, or use App Clips for app discovery and conversion. Use when the user mentions ""App Clip"", ""app clip code"", ""mini app"", ""instant app"", ""App Clip card"", ""App Clip link"", ""no download required"", ""instant experience"", or wants to understand how App Clips appear in App Store search. For general App Store discoverability, see aso-audit. For marketing campaigns, see ua-campaign.",lib/eronred-aso-skills/skills/app-clips/SKILL.md
app-launch,"When the user wants to plan a launch strategy for a new app or major update. Also use when the user mentions ""app launch"", ""launch plan"", ""launch checklist"", ""pre-launch"", ""launch day"", or ""how to launch my app"". For ongoing ASO after launch, see aso-audit. For paid acquisition during launch, see ua-campaign.",lib/eronred-aso-skills/skills/app-launch/SKILL.md
app-store-featured,"When the user wants to get featured on the App Store or understand the editorial process. Also use when the user mentions ""get featured"", ""App Store editorial"", ""App of the Day"", ""Today tab"", ""Apple featuring"", or ""how to get Apple to feature my app"". For launch strategy, see app-launch. For ASO optimization, see aso-audit.",lib/eronred-aso-skills/skills/app-store-featured/SKILL.md
appdeploy,"Deploy web apps with backend APIs, database, and file storage. Use when the user asks to deploy or publish a website or web app and wants a public URL. Uses HTTP API via curl.",lib/sickn33-antigravity-awesome-skills/plugins/antigravity-awesome-skills-claude/skills/appdeploy/SKILL.md
application-performance-performance-optimization,"Optimize end-to-end application performance with profiling, observability, and backend/frontend tuning. Use when coordinating performance optimization across the stack.",lib/sickn33-antigravity-awesome-skills/plugins/antigravity-awesome-skills-claude/skills/application-performance-performance-optimization/SKILL.md
arboreto,"Infer gene regulatory networks (GRNs) from gene expression data using scalable algorithms (GRNBoost2, GENIE3). Use when analyzing transcriptomics data (bulk RNA-seq, single-cell RNA-seq) to identify transcription factor-target gene relationships and regulatory interactions. Supports distributed computation for large-scale datasets.",lib/k-dense-ai-claude-scientific-skills/scientific-skills/arboreto/SKILL.md
archive,"Archive session learnings, debugging solutions, and deployment logs to .archive/yyyy-mm-dd/ as indexed markdown with searchable tags. Use when completing a significant task, resolving a tricky bug, deploying, or when the user says ""archive this"". Maintains .archive/MEMORY.md index for cross-session knowledge reuse.",lib/resciencelab-opc-skills/skills/archive/SKILL.md
arm-cortex-expert,"Senior embedded software engineer specializing in firmware and driver development for ARM Cortex-M microcontrollers (Teensy, STM32, nRF52, SAMD).",lib/sickn33-antigravity-awesome-skills/plugins/antigravity-awesome-skills-claude/skills/arm-cortex-expert/SKILL.md
article-writing,"Write articles, guides, blog posts, tutorials, newsletter issues, and other long-form content in a distinctive voice derived from supplied examples or brand guidance. Use when the user wants polished written content longer than a paragraph, especially when voice consistency, structure, and credibility matter.",lib/affaan-m-everything-claude-code/.agents/skills/article-writing/SKILL.md
arxiv,"Search, download, and summarize academic papers from arXiv. Use when user says ""search arxiv"", ""download paper"", ""fetch arxiv"", ""arxiv search"", ""get paper pdf"", or wants to find and save papers from arXiv to the local paper library.",lib/wanshuiyin-auto-claude-code-research-in-sleep/skills/arxiv/SKILL.md
asana-automation,"Automate Asana tasks via Rube MCP (Composio): tasks, projects, sections, teams, workspaces. Always search tools first for current schemas.",lib/sickn33-antigravity-awesome-skills/plugins/antigravity-awesome-skills-claude/skills/asana-automation/SKILL.md
ask-questions-if-underspecified,Clarify requirements before implementing. Use when serious doubts arise.,lib/sickn33-antigravity-awesome-skills/plugins/antigravity-awesome-skills-claude/skills/ask-questions-if-underspecified/SKILL.md
aso-audit,"When the user wants to audit or optimize an App Store or Google Play listing. Also use when the user mentions 'ASO audit,' 'app store optimization,' 'optimize my app listing,' 'improve app visibility,' 'app store ranking,' 'audit my listing,' 'why aren't people downloading my app,' 'improve my app conversion,' 'keyword optimization for app,' or 'compare my app to competitors.' Use when the user shares an App Store or Google Play URL and wants to improve it.",lib/coreyhaines31-marketingskills/skills/aso-audit/SKILL.md
async-python-patterns,"Comprehensive guidance for implementing asynchronous Python applications using asyncio, concurrent programming patterns, and async/await for building high-performance, non-blocking systems.",lib/sickn33-antigravity-awesome-skills/plugins/antigravity-awesome-skills-claude/skills/async-python-patterns/SKILL.md
auri-core,"Auri: assistente de voz inteligente (Alexa + Claude claude-opus-4-20250805). Visao do produto, persona Vitoria Neural, stack AWS, modelo Free/Pro/Business/Enterprise, roadmap 4 fases, GTM, north star WAC e analise competitiva.",lib/sickn33-antigravity-awesome-skills/skills/auri-core/SKILL.md
auto-review-loop,"Autonomous multi-round research review loop. Repeatedly reviews via Codex MCP, implements fixes, and re-reviews until positive assessment or max rounds reached. Use when user says ""auto review loop"", ""review until it passes"", or wants autonomous iterative improvement.",lib/wanshuiyin-auto-claude-code-research-in-sleep/skills/auto-review-loop/SKILL.md
auto-review-loop-llm,"Autonomous research review loop using any OpenAI-compatible LLM API. Configure via llm-chat MCP server or environment variables. Trigger with ""auto review loop llm"" or ""llm review"".",lib/wanshuiyin-auto-claude-code-research-in-sleep/skills/auto-review-loop-llm/SKILL.md
auto-review-loop-minimax,"Autonomous multi-round research review loop using MiniMax API. Use when you want to use MiniMax instead of Codex MCP for external review. Trigger with ""auto review loop minimax"" or ""minimax review"".",lib/wanshuiyin-auto-claude-code-research-in-sleep/skills/auto-review-loop-minimax/SKILL.md
autogpt-agents,"Autonomous AI agent platform for building and deploying continuous agents. Use when creating visual workflow agents, deploying persistent autonomous agents, or building complex multi-step AI automation systems.",lib/orchestra-research-ai-research-skills/14-agents/autogpt/SKILL.md
automation-audit-ops,"Evidence-first automation inventory and overlap audit workflow for ECC. Use when the user wants to know which jobs, hooks, connectors, MCP servers, or wrappers are live, broken, redundant, or missing before fixing anything.",lib/affaan-m-everything-claude-code/skills/automation-audit-ops/SKILL.md
autonomous-agent-harness,"Transform Claude Code into a fully autonomous agent system with persistent memory, scheduled operations, computer use, and task queuing. Replaces standalone agent frameworks (Hermes, AutoGPT) by leveraging Claude Code's native crons, dispatch, MCP tools, and memory. Use when the user wants continuous autonomous operation, scheduled tasks, or a self-directing agent loop.",lib/affaan-m-everything-claude-code/skills/autonomous-agent-harness/SKILL.md
autonomous-agents,"Autonomous agents are AI systems that can independently decompose goals, plan actions, execute tools, and self-correct without constant human guidance. The challenge isn't making them capable - it's making them reliable. Every extra decision multiplies failure probability.",lib/sickn33-antigravity-awesome-skills/plugins/antigravity-awesome-skills-claude/skills/autonomous-agents/SKILL.md
avalonia-viewmodels-zafiro,Optimal ViewModel and Wizard creation patterns for Avalonia using Zafiro and ReactiveUI.,lib/sickn33-antigravity-awesome-skills/plugins/antigravity-awesome-skills-claude/skills/avalonia-viewmodels-zafiro/SKILL.md
avoid-ai-writing,Audit and rewrite content to remove 21 categories of AI writing patterns with a 43-entry replacement table,lib/sickn33-antigravity-awesome-skills/plugins/antigravity-awesome-skills-claude/skills/avoid-ai-writing/SKILL.md
awareness-stage-mapper,One sentence - what this skill does and when to invoke it,lib/sickn33-antigravity-awesome-skills/plugins/antigravity-awesome-skills-claude/skills/awareness-stage-mapper/SKILL.md
aws-cost-cleanup,Automated cleanup of unused AWS resources to reduce costs,lib/sickn33-antigravity-awesome-skills/plugins/antigravity-awesome-skills-claude/skills/aws-cost-cleanup/SKILL.md
aws-cost-optimizer,Comprehensive AWS cost analysis and optimization recommendations using AWS CLI and Cost Explorer,lib/sickn33-antigravity-awesome-skills/plugins/antigravity-awesome-skills-claude/skills/aws-cost-optimizer/SKILL.md
aws-dynamodb,"AWS DynamoDB single-table design, GSI patterns, SDK v3 TypeScript/Python",lib/alinaqi-claude-bootstrap/skills/aws-dynamodb/SKILL.md
azure-cosmosdb,"Azure Cosmos DB partition keys, consistency levels, change feed, SDK patterns",lib/alinaqi-claude-bootstrap/skills/azure-cosmosdb/SKILL.md
backend-development-feature-development,Orchestrate end-to-end backend feature development from requirements to deployment. Use when coordinating multi-phase feature delivery across teams and services.,lib/sickn33-antigravity-awesome-skills/plugins/antigravity-awesome-skills-claude/skills/backend-development-feature-development/SKILL.md
backtesting-frameworks,"Build robust, production-grade backtesting systems that avoid common pitfalls and produce reliable strategy performance estimates.",lib/sickn33-antigravity-awesome-skills/plugins/antigravity-awesome-skills-claude/skills/backtesting-frameworks/SKILL.md
bamboohr-automation,"Automate BambooHR tasks via Rube MCP (Composio): employees, time-off, benefits, dependents, employee updates. Always search tools first for current schemas.",lib/sickn33-antigravity-awesome-skills/plugins/antigravity-awesome-skills-claude/skills/bamboohr-automation/SKILL.md
