skill_id,description,src_path
constitutional-ai,"Anthropic's method for training harmless AI through self-improvement. Two-phase approach - supervised learning with self-critique/revision, then RLAIF (RL from AI Feedback). Use for safety alignment, reducing harmful outputs without human labels. Powers Claude's safety system.",lib/orchestra-research-ai-research-skills/07-safety-alignment/constitutional-ai/SKILL.md
content-engine,"Create platform-native content systems for X, LinkedIn, TikTok, YouTube, newsletters, and repurposed multi-platform campaigns. Use when the user wants social posts, threads, scripts, content calendars, or one source asset adapted cleanly across platforms.",lib/affaan-m-everything-claude-code/.agents/skills/content-engine/SKILL.md
content-idea-generator,"Generate content ideas rooted in positioning. Use when someone needs ""content ideas,"" ""what should I post,"" ""blog topics,"" ""LinkedIn ideas,"" or is stuck on what to create.",lib/brianrwagner-ai-marketing-skills/content-idea-generator/SKILL.md
context-agent,"Agente de contexto para continuidade entre sessoes. Salva resumos, decisoes, tarefas pendentes e carrega briefing automatico na sessao seguinte.",lib/sickn33-antigravity-awesome-skills/plugins/antigravity-awesome-skills-claude/skills/context-agent/SKILL.md
context-degradation,Language models exhibit predictable degradation patterns as context length increases. Understanding these patterns is essential for diagnosing failures and designing resilient systems.,lib/sickn33-antigravity-awesome-skills/plugins/antigravity-awesome-skills-claude/skills/context-degradation/SKILL.md
context-driven-development,"Guide for implementing and maintaining context as a managed artifact alongside code, enabling consistent AI interactions and team alignment through structured project documentation.",lib/sickn33-antigravity-awesome-skills/plugins/antigravity-awesome-skills-claude/skills/context-driven-development/SKILL.md
context-engineering-advisor,"Diagnose context stuffing vs. context engineering. Use when an AI workflow feels bloated, brittle, or hard to steer reliably.",lib/deanpeters-product-manager-skills/skills/context-engineering-advisor/SKILL.md
context-guardian,"Guardiao de contexto que preserva dados criticos antes da compactacao automatica. Snapshots, verificacao de integridade e zero perda de informacao.",lib/sickn33-antigravity-awesome-skills/plugins/antigravity-awesome-skills-claude/skills/context-guardian/SKILL.md
context-management-context-restore,Use when working with context management context restore,lib/sickn33-antigravity-awesome-skills/plugins/antigravity-awesome-skills-claude/skills/context-management-context-restore/SKILL.md
context-management-context-save,Use when working with context management context save,lib/sickn33-antigravity-awesome-skills/plugins/antigravity-awesome-skills-claude/skills/context-management-context-save/SKILL.md
context-manager,"Elite AI context engineering specialist mastering dynamic context management, vector databases, knowledge graphs, and intelligent memory systems.",lib/sickn33-antigravity-awesome-skills/plugins/antigravity-awesome-skills-claude/skills/context-manager/SKILL.md
conventions,../../SKILL.md,lib/ethos-link-rails-conventions/skills/conventions/SKILL.md
convert-file,"Convert any data file to another format: CSV, Parquet, JSON, Excel, GeoJSON, and more. Use when the user says ""convert to parquet"", ""save as xlsx"", ""export as JSON"", ""make this a CSV"", ""turn into parquet"", or any variation of format-to-format conversion for data files. Also triggers when the user wants to write Parquet, Excel, or other binary formats that Claude cannot produce natively.",lib/duckdb-duckdb-skills/skills/convert-file/SKILL.md
convertkit-automation,"Automate ConvertKit (Kit) tasks via Rube MCP (Composio): manage subscribers, tags, broadcasts, and broadcast stats. Always search tools first for current schemas.",lib/sickn33-antigravity-awesome-skills/plugins/antigravity-awesome-skills-claude/skills/convertkit-automation/SKILL.md
cost-optimization,"Strategies and patterns for optimizing cloud costs across AWS, Azure, and GCP.",lib/sickn33-antigravity-awesome-skills/plugins/antigravity-awesome-skills-claude/skills/cost-optimization/SKILL.md
cpp-pro,"Write idiomatic C++ code with modern features, RAII, smart pointers, and STL algorithms. Handles templates, move semantics, and performance optimization.",lib/sickn33-antigravity-awesome-skills/plugins/antigravity-awesome-skills-claude/skills/cpp-pro/SKILL.md
create-issue-gate,Use when starting a new implementation task and an issue must be created with strict acceptance criteria gating before execution.,lib/sickn33-antigravity-awesome-skills/plugins/antigravity-awesome-skills-claude/skills/create-issue-gate/SKILL.md
create-pr,"Alias for sentry-skills:pr-writer. Use when users explicitly ask for ""create-pr"" or reference the legacy skill name. Redirects to the canonical PR writing workflow.",lib/sickn33-antigravity-awesome-skills/plugins/antigravity-awesome-skills-claude/skills/create-pr/SKILL.md
create-prd,"Create a Product Requirements Document using a comprehensive 8-section template covering problem, objectives, segments, value propositions, solution, and release planning. Use when writing a PRD, documenting product requirements, preparing a feature spec, or reviewing an existing PRD.",lib/phuryn-pm-skills/pm-execution/skills/create-prd/SKILL.md
creative-thinking-for-research,"Applies cognitive science frameworks for creative thinking to CS and AI research ideation. Use when seeking genuinely novel research directions by leveraging combinatorial creativity, analogical reasoning, constraint manipulation, and other empirically grounded creative strategies.",lib/orchestra-research-ai-research-skills/21-research-ideation/creative-thinking-for-research/SKILL.md
crosspost,"Multi-platform content distribution across X, LinkedIn, Threads, and Bluesky. Adapts content per platform using content-engine patterns. Never posts identical content cross-platform. Use when the user wants to distribute content across social platforms.",lib/affaan-m-everything-claude-code/.agents/skills/crosspost/SKILL.md
crypto-bd-agent,"Production-tested patterns for building AI agents that autonomously discover, > evaluate, and acquire token listings for cryptocurrency exchanges.",lib/sickn33-antigravity-awesome-skills/plugins/antigravity-awesome-skills-claude/skills/crypto-bd-agent/SKILL.md
customaize-agent:apply-anthropic-skill-best-practices,Comprehensive guide for skill development based on Anthropic's official best practices - use for complex skills requiring detailed structure,lib/neolabhq-context-engineering-kit/plugins/customaize-agent/skills/apply-anthropic-skill-best-practices/SKILL.md
customaize-agent:create-command,"Interactive assistant for creating new Claude commands with proper structure, patterns, and MCP tool integration",lib/neolabhq-context-engineering-kit/plugins/customaize-agent/skills/create-command/SKILL.md
customaize-agent:create-rule,"Use when found gap or repetative issue, that produced by you or implemenataion agent. Esentially use it each time when you say ""You absolutly right, I should have done it differently."" -> need create rule for this issue so it not appears again.",lib/neolabhq-context-engineering-kit/plugins/customaize-agent/skills/create-rule/SKILL.md
customaize-agent:create-workflow-command,Create a workflow command that orchestrates multi-step execution through sub-agents with file-based task prompts,lib/neolabhq-context-engineering-kit/plugins/customaize-agent/skills/create-workflow-command/SKILL.md
customer-billing-ops,"Operate customer billing workflows such as subscriptions, refunds, churn triage, billing-portal recovery, and plan analysis using connected billing tools like Stripe. Use when the user needs to help a customer, inspect subscription state, or manage revenue-impacting billing operations.",lib/affaan-m-everything-claude-code/skills/customer-billing-ops/SKILL.md
customer-journey-mapping-workshop,"Run a customer journey mapping workshop with adaptive questions and outputs. Use when you need to map stages, actions, emotions, pain points, and opportunities for a persona and scenario.",lib/deanpeters-product-manager-skills/skills/customer-journey-mapping-workshop/SKILL.md
customer-support,"Elite AI-powered customer support specialist mastering conversational AI, automated ticketing, sentiment analysis, and omnichannel support experiences.",lib/sickn33-antigravity-awesome-skills/plugins/antigravity-awesome-skills-claude/skills/customer-support/SKILL.md
daily,Documentation and capabilities reference for Daily,lib/sickn33-antigravity-awesome-skills/plugins/antigravity-awesome-skills-claude/skills/daily/SKILL.md
daily-news-report,"Scrapes content based on a preset URL list, filters high-quality technical information, and generates daily Markdown reports.",lib/sickn33-antigravity-awesome-skills/plugins/antigravity-awesome-skills-claude/skills/daily-news-report/SKILL.md
dask,"Distributed computing for larger-than-RAM pandas/NumPy workflows. Use when you need to scale existing pandas/NumPy code beyond memory or across clusters. Best for parallel file processing, distributed ML, integration with existing pandas code. For out-of-core analytics on single machine use vaex; for in-memory speed use polars.",lib/k-dense-ai-claude-scientific-skills/scientific-skills/dask/SKILL.md
data-engineer,"Build scalable data pipelines, modern data warehouses, and real-time streaming architectures. Implements Apache Spark, dbt, Airflow, and cloud-native data platforms.",lib/sickn33-antigravity-awesome-skills/plugins/antigravity-awesome-skills-claude/skills/data-engineer/SKILL.md
data-quality-frameworks,"Implement data quality validation with Great Expectations, dbt tests, and data contracts. Use when building data quality pipelines, implementing validation rules, or establishing data contracts.",lib/sickn33-antigravity-awesome-skills/plugins/antigravity-awesome-skills-claude/skills/data-quality-frameworks/SKILL.md
data-scientist,"Expert data scientist for advanced analytics, machine learning, and statistical modeling. Handles complex data analysis, predictive modeling, and business intelligence.",lib/sickn33-antigravity-awesome-skills/plugins/antigravity-awesome-skills-claude/skills/data-scientist/SKILL.md
data-storytelling,Transform raw data into compelling narratives that drive decisions and inspire action.,lib/sickn33-antigravity-awesome-skills/plugins/antigravity-awesome-skills-claude/skills/data-storytelling/SKILL.md
database-admin,"Expert database administrator specializing in modern cloud databases, automation, and reliability engineering.",lib/sickn33-antigravity-awesome-skills/plugins/antigravity-awesome-skills-claude/skills/database-admin/SKILL.md
database-schema,"Schema awareness - read before coding, type generation, prevent column errors",lib/alinaqi-claude-bootstrap/skills/database-schema/SKILL.md
datamol,"Pythonic wrapper around RDKit with simplified interface and sensible defaults. Preferred for standard drug discovery including SMILES parsing, standardization, descriptors, fingerprints, clustering, 3D conformers, parallel processing. Returns native rdkit.Chem.Mol objects. For advanced control or custom parameters, use rdkit directly.",lib/k-dense-ai-claude-scientific-skills/scientific-skills/datamol/SKILL.md
dbos-python,"Guide for building reliable, fault-tolerant Python applications with DBOS durable workflows. Use when adding DBOS to existing Python code, creating workflows and steps, or using queues for concurrency control.",lib/sickn33-antigravity-awesome-skills/plugins/antigravity-awesome-skills-claude/skills/dbos-python/SKILL.md
de-ai-ify,"Remove AI-generated jargon and restore human voice to text. Built from analyzing 1,000+ AI vs human content pieces.",lib/brianrwagner-ai-marketing-skills/de-ai-ify/SKILL.md
debugging-strategies,"Transform debugging from frustrating guesswork into systematic problem-solving with proven strategies, powerful tools, and methodical approaches.",lib/sickn33-antigravity-awesome-skills/plugins/antigravity-awesome-skills-claude/skills/debugging-strategies/SKILL.md
debugging-toolkit-smart-debug,Use when working with debugging toolkit smart debug,lib/sickn33-antigravity-awesome-skills/plugins/antigravity-awesome-skills-claude/skills/debugging-toolkit-smart-debug/SKILL.md
deckset,Example for using Deckset to create Markdown presentations,lib/joannis-claude-skills/deckset/SKILL.md
deep-research,"Multi-source deep research using firecrawl and exa MCPs. Searches the web, synthesizes findings, and delivers cited reports with source attribution. Use when the user wants thorough research on any topic with evidence and citations.",lib/affaan-m-everything-claude-code/.agents/skills/deep-research/SKILL.md
deepchem,"Molecular ML with diverse featurizers and pre-built datasets. Use for property prediction (ADMET, toxicity) with traditional ML or GNNs when you want extensive featurization options and MoleculeNet benchmarks. Best for quick experiments with pre-trained models, diverse molecular representations. For graph-first PyTorch workflows use torchdrug; for benchmark datasets use pytdc.",lib/k-dense-ai-claude-scientific-skills/scientific-skills/deepchem/SKILL.md
deepspeed,"Expert guidance for distributed training with DeepSpeed - ZeRO optimization stages, pipeline parallelism, FP16/BF16/FP8, 1-bit Adam, sparse attention",lib/orchestra-research-ai-research-skills/08-distributed-training/deepspeed/SKILL.md
deeptools,"NGS analysis toolkit. BAM to bigWig conversion, QC (correlation, PCA, fingerprints), heatmaps/profiles (TSS, peaks), for ChIP-seq, RNA-seq, ATAC-seq visualization.",lib/k-dense-ai-claude-scientific-skills/scientific-skills/deeptools/SKILL.md
defi-protocol-templates,"Implement DeFi protocols with production-ready templates for staking, AMMs, governance, and lending systems. Use when building decentralized finance applications or smart contract protocols.",lib/sickn33-antigravity-awesome-skills/plugins/antigravity-awesome-skills-claude/skills/defi-protocol-templates/SKILL.md
defuddle,"Extract clean markdown content from web pages using Defuddle CLI, removing clutter and navigation to save tokens. Use instead of WebFetch when the user provides a URL to read or analyze, for online documentation, articles, blog posts, or any standard web page.",lib/sickn33-antigravity-awesome-skills/plugins/antigravity-awesome-skills-claude/skills/defuddle/SKILL.md
deployment-engineer,"Expert deployment engineer specializing in modern CI/CD pipelines, GitOps workflows, and advanced deployment automation.",lib/sickn33-antigravity-awesome-skills/plugins/antigravity-awesome-skills-claude/skills/deployment-engineer/SKILL.md
deployment-procedures,"Production deployment principles and decision-making. Safe deployment workflows, rollback strategies, and verification. Teaches thinking, not scripts.",lib/sickn33-antigravity-awesome-skills/plugins/antigravity-awesome-skills-claude/skills/deployment-procedures/SKILL.md
design-orchestration,"Orchestrates design workflows by routing work through brainstorming, multi-agent review, and execution readiness in the correct order.",lib/sickn33-antigravity-awesome-skills/plugins/antigravity-awesome-skills-claude/skills/design-orchestration/SKILL.md
design-taste-frontend,"Senior UI/UX Engineer. Architect digital interfaces overriding default LLM biases. Enforces metric-based rules, strict component architecture, CSS hardware acceleration, and balanced design engineering.",lib/leonxlnx-taste-skill/skills/taste-skill/SKILL.md
devcontainer-setup,"Creates devcontainers with Claude Code, language-specific tooling (Python/Node/Rust/Go), and persistent volumes. Use when adding devcontainer support to a project, setting up isolated development environments, or configuring sandboxed Claude Code workspaces.",lib/sickn33-antigravity-awesome-skills/plugins/antigravity-awesome-skills-claude/skills/devcontainer-setup/SKILL.md
dhdna-profiler,"Extract cognitive patterns and thinking fingerprints from any text. Use this skill when the user wants to analyze how someone thinks, understand cognitive style, profile writing or speech patterns, compare thinking styles between people, asks ""what's my thinking style"", ""analyze how this person reasons"", ""cognitive profile"", ""thinking pattern"", ""DHDNA"", ""digital DNA"", or wants to understand the mind behind any text. Also trigger when the user provides text and wants deeper insight into the author's reasoning patterns, decision-making style, or cognitive signature.",lib/k-dense-ai-claude-scientific-skills/scientific-skills/dhdna-profiler/SKILL.md
diary,Unified Diary System: A context-preserving automated logger for multi-project development.,lib/sickn33-antigravity-awesome-skills/skills/diary/SKILL.md
discord-automation,"Automate Discord tasks via Rube MCP (Composio): messages, channels, roles, webhooks, reactions. Always search tools first for current schemas.",lib/sickn33-antigravity-awesome-skills/plugins/antigravity-awesome-skills-claude/skills/discord-automation/SKILL.md
dispatching-parallel-agents,Use when facing 2+ independent tasks that can be worked on without shared state or sequential dependencies,lib/obra-superpowers/skills/dispatching-parallel-agents/SKILL.md
django-access-review,django-access-review,lib/sickn33-antigravity-awesome-skills/plugins/antigravity-awesome-skills-claude/skills/django-access-review/SKILL.md
dmux-workflows,"Multi-agent orchestration using dmux (tmux pane manager for AI agents). Patterns for parallel agent workflows across Claude Code, Codex, OpenCode, and other harnesses. Use when running multiple agent sessions in parallel or coordinating multi-agent development workflows.",lib/affaan-m-everything-claude-code/.agents/skills/dmux-workflows/SKILL.md
dnanexus-integration,"DNAnexus cloud genomics platform. Build apps/applets, manage data (upload/download), dxpy Python SDK, run workflows, FASTQ/BAM/VCF, for genomics pipeline development and execution.",lib/k-dense-ai-claude-scientific-skills/scientific-skills/dnanexus-integration/SKILL.md
docs:update-docs,"Update and maintain project documentation for local code changes using multi-agent workflow with tech-writer agents. Covers docs/, READMEs, JSDoc, and API documentation.",lib/neolabhq-context-engineering-kit/plugins/docs/skills/update-docs/SKILL.md
docs:write-concisely,"Apply writing rules to any documentation that humans will read. Makes your writing clearer, stronger, and more professional.",lib/neolabhq-context-engineering-kit/plugins/docs/skills/write-concisely/SKILL.md
documentation-templates,"Documentation templates and structure guidelines. README, API docs, code comments, and AI-friendly documentation.",lib/sickn33-antigravity-awesome-skills/plugins/antigravity-awesome-skills-claude/skills/documentation-templates/SKILL.md
docusign-automation,"Automate DocuSign tasks via Rube MCP (Composio): templates, envelopes, signatures, document management. Always search tools first for current schemas.",lib/sickn33-antigravity-awesome-skills/plugins/antigravity-awesome-skills-claude/skills/docusign-automation/SKILL.md
docx,"Use this skill whenever the user wants to create, read, edit, or manipulate Word documents (.docx files). Triggers include: any mention of 'Word doc', 'word document', '.docx', or requests to produce professional documents with formatting like tables of contents, headings, page numbers, or letterheads. Also use when extracting or reorganizing content from .docx files, inserting or replacing images in documents, performing find-and-replace in Word files, working with tracked changes or comments, or converting content into a polished Word document. If the user asks for a 'report', 'memo', 'letter', 'template', or similar deliverable as a Word or .docx file, use this skill. Do NOT use for PDFs, spreadsheets, Google Docs, or general coding tasks unrelated to document generation.",lib/k-dense-ai-claude-scientific-skills/scientific-skills/docx/SKILL.md
docx-official,"A user may ask you to create, edit, or analyze the contents of a .docx file. A .docx file is essentially a ZIP archive containing XML files and other resources that you can read or edit. You have different tools and workflows available for different tasks.",lib/sickn33-antigravity-awesome-skills/plugins/antigravity-awesome-skills-claude/skills/docx-official/SKILL.md
domain-hunter,"Search domains, compare prices, find promo codes, get purchase recommendations. Use when user wants to buy a domain, check domain prices, find domain deals, compare registrars, or search for .ai/.com domains.",lib/resciencelab-opc-skills/skills/domain-hunter/SKILL.md
dotnet-architect,"Expert .NET backend architect specializing in C#, ASP.NET Core, Entity Framework, Dapper, and enterprise application patterns.",lib/sickn33-antigravity-awesome-skills/plugins/antigravity-awesome-skills-claude/skills/dotnet-architect/SKILL.md
dotnet-backend-patterns,"Master C#/.NET patterns for building production-grade APIs, MCP servers, and enterprise backends with modern best practices (2024/2025).",lib/sickn33-antigravity-awesome-skills/plugins/antigravity-awesome-skills-claude/skills/dotnet-backend-patterns/SKILL.md
draw,"Vector graphics and diagram creation, format conversion (ODG/SVG/PDF) with LibreOffice Draw.",lib/sickn33-antigravity-awesome-skills/plugins/antigravity-awesome-skills-claude/skills/libreoffice/draw/SKILL.md
dropbox-automation,"Automate Dropbox file management, sharing, search, uploads, downloads, and folder operations via Rube MCP (Composio). Always search tools first for current schemas.",lib/sickn33-antigravity-awesome-skills/plugins/antigravity-awesome-skills-claude/skills/dropbox-automation/SKILL.md
duckdb-docs,Search DuckDB and DuckLake documentation and blog posts. Returns relevant doc chunks for a question or keyword using full-text search against a locally cached index.,lib/duckdb-duckdb-skills/skills/duckdb-docs/SKILL.md
dwarf-expert,"Provides expertise for analyzing DWARF debug files and understanding the DWARF debug format/standard (v3-v5). Triggers when understanding DWARF information, interacting with DWARF files, answering DWARF-related questions, or working with code that parses DWARF data.",lib/sickn33-antigravity-awesome-skills/plugins/antigravity-awesome-skills-claude/skills/dwarf-expert/SKILL.md
dx-optimizer,"Developer Experience specialist. Improves tooling, setup, and workflows. Use PROACTIVELY when setting up new projects, after team feedback, or when development friction is noticed.",lib/sickn33-antigravity-awesome-skills/plugins/antigravity-awesome-skills-claude/skills/dx-optimizer/SKILL.md
edit-article,"Edit and improve articles by restructuring sections, improving clarity, and tightening prose. Use when user wants to edit, revise, or improve an article draft.",lib/mattpocock-skills/edit-article/SKILL.md
elixir-pro,"Write idiomatic Elixir code with OTP patterns, supervision trees, and Phoenix LiveView. Masters concurrency, fault tolerance, and distributed systems.",lib/sickn33-antigravity-awesome-skills/plugins/antigravity-awesome-skills-claude/skills/elixir-pro/SKILL.md
elon-musk,"Agente que simula Elon Musk com profundidade psicologica e comunicacional de alta fidelidade. Ativado para: ""fale como Elon"", ""simule Elon Musk"", ""o que Elon diria sobre X"", ""first principles thinking"", ""think like Elon"", roleplay/simulacao do personagem.",lib/sickn33-antigravity-awesome-skills/plugins/antigravity-awesome-skills-claude/skills/elon-musk/SKILL.md
email-marketing-bible,"Comprehensive, data-backed email marketing knowledge base. 908 sources, 4,798 insights. Use when reviewing email setups, building automation flows, diagnosing deliverability, writing email copy, selecting platforms, or pulling benchmarks. Covers strategy, flows, deliverability, copywriting, segmentation, compliance, cold email, and 19 industry playbooks.",lib/cosmoblk-email-marketing-bible/SKILL.md
email-ops,"Evidence-first mailbox triage, drafting, send verification, and sent-mail-safe follow-up workflow for ECC. Use when the user wants to organize email, draft or send through the real mail surface, or prove what landed in Sent.",lib/affaan-m-everything-claude-code/skills/email-ops/SKILL.md
email-systems,"Email has the highest ROI of any marketing channel. $36 for every $1 spent. Yet most startups treat it as an afterthought - bulk blasts, no personalization, landing in spam folders.",lib/sickn33-antigravity-awesome-skills/plugins/antigravity-awesome-skills-claude/skills/email-systems/SKILL.md
embedding-strategies,Guide to selecting and optimizing embedding models for vector search applications.,lib/sickn33-antigravity-awesome-skills/plugins/antigravity-awesome-skills-claude/skills/embedding-strategies/SKILL.md
environment-setup-guide,"Guide developers through setting up development environments with proper tools, dependencies, and configurations",lib/sickn33-antigravity-awesome-skills/plugins/antigravity-awesome-skills-claude/skills/environment-setup-guide/SKILL.md
eol-message,"Write a clear, empathetic EOL announcement with rationale, customer impact, and next steps. Use when retiring a product, feature, or plan without creating avoidable confusion.",lib/deanpeters-product-manager-skills/skills/eol-message/SKILL.md
epic-breakdown-advisor,"Break down epics into user stories with Humanizing Work split patterns. Use when a backlog item is too large to estimate, sequence, or deliver safely.",lib/deanpeters-product-manager-skills/skills/epic-breakdown-advisor/SKILL.md
epic-hypothesis,"Frame an epic as a testable hypothesis with target user, expected outcome, and validation method. Use when defining a major initiative before roadmap, discovery, or delivery planning.",lib/deanpeters-product-manager-skills/skills/epic-hypothesis/SKILL.md
