skill_id,description,src_path
leiloeiro-avaliacao,"Avaliacao pericial de imoveis em leilao. Valor de mercado, liquidacao forcada, ABNT NBR 14653, metodos comparativo/renda/custo, CUB e margem de seguranca.",lib/sickn33-antigravity-awesome-skills/plugins/antigravity-awesome-skills-claude/skills/leiloeiro-avaliacao/SKILL.md
leiloeiro-edital,"Analise e auditoria de editais de leilao judicial e extrajudicial. Riscos ocultos, clausulas perigosas, debitos, ocupante e classificacao da oportunidade.",lib/sickn33-antigravity-awesome-skills/plugins/antigravity-awesome-skills-claude/skills/leiloeiro-edital/SKILL.md
leiloeiro-ia,"Especialista em leiloes judiciais e extrajudiciais de imoveis. Analise juridica, pericial e de mercado integrada. Orquestra os 5 modulos especializados.",lib/sickn33-antigravity-awesome-skills/plugins/antigravity-awesome-skills-claude/skills/leiloeiro-ia/SKILL.md
leiloeiro-juridico,"Analise juridica de leiloes: nulidades, bem de familia, alienacao fiduciaria, CPC arts 829-903, Lei 9514/97, onus reais, embargos e jurisprudencia.",lib/sickn33-antigravity-awesome-skills/plugins/antigravity-awesome-skills-claude/skills/leiloeiro-juridico/SKILL.md
leiloeiro-mercado,"Analise de mercado imobiliario para leiloes. Liquidez, desagio tipico, ROI, estrategias de saida (flip/reforma/renda), Selic 2025 e benchmark CDI/FII.",lib/sickn33-antigravity-awesome-skills/plugins/antigravity-awesome-skills-claude/skills/leiloeiro-mercado/SKILL.md
lightning-channel-factories,"Technical reference on Lightning Network channel factories, multi-party channels, LSP architectures, and Bitcoin Layer 2 scaling without soft forks. Covers Decker-Wattenhofer, timeout trees, MuSig2 key aggregation, HTLC/PTLC forwarding, and watchtower breach detection.",lib/sickn33-antigravity-awesome-skills/plugins/antigravity-awesome-skills-claude/skills/lightning-channel-factories/SKILL.md
linear,"Linear CLI for issue tracking and project management. Use when developers mention: (1) Linear issues or tickets, (2) issue tracking or task management, (3) WDY team issues, (4) closing, updating, or triaging tickets, (5) linking PRs to issues, (6) issue states (triage, backlog, started, completed).",lib/joannis-claude-skills/linear/SKILL.md
linear-automation,"Automate Linear tasks via Rube MCP (Composio): issues, projects, cycles, teams, labels. Always search tools first for current schemas.",lib/sickn33-antigravity-awesome-skills/plugins/antigravity-awesome-skills-claude/skills/linear-automation/SKILL.md
linear-claude-skill,"Manage Linear issues, projects, and teams",lib/sickn33-antigravity-awesome-skills/plugins/antigravity-awesome-skills-claude/skills/linear-claude-skill/SKILL.md
linkedin-authority-builder,"Build a LinkedIn content system for thought leadership. Use when someone needs to establish authority, attract inbound leads, or build a consistent content presence. Covers positioning, content pillars, formats, and posting rhythm.",lib/brianrwagner-ai-marketing-skills/linkedin-authority-builder/SKILL.md
linkedin-automation,"Automate LinkedIn tasks via Rube MCP (Composio): create posts, manage profile, company info, comments, and image uploads. Always search tools first for current schemas.",lib/sickn33-antigravity-awesome-skills/plugins/antigravity-awesome-skills-claude/skills/linkedin-automation/SKILL.md
linkedin-cli,"Use when automating LinkedIn via CLI: fetch profiles, search people/companies, send messages, manage connections, create posts, and Sales Navigator.",lib/sickn33-antigravity-awesome-skills/plugins/antigravity-awesome-skills-claude/skills/linkedin-cli/SKILL.md
linkedin-profile-optimizer,"Audit and rewrite your LinkedIn profile to attract the right people. Scores each section, rewrites headline and about copy, and includes an AI visibility checklist so you show up in ChatGPT, Perplexity, and Claude search. Use when someone says ""optimize my LinkedIn,"" ""LinkedIn profile help,"" ""rewrite my about section,"" or ""how do I show up in AI search.""",lib/brianrwagner-ai-marketing-skills/linkedin-profile-optimizer/SKILL.md
linkedin-writer,"Creates viral LinkedIn posts using proven formats, post templates, and voice matching. Use when user needs engaging, high-performing posts for LinkedIn.",lib/ognjengt-founder-skills/skills/linkedin-writer/SKILL.md
lint-and-validate,MANDATORY: Run appropriate validation tools after EVERY code change. Do not finish a task until the code is error-free.,lib/sickn33-antigravity-awesome-skills/plugins/antigravity-awesome-skills-claude/skills/lint-and-validate/SKILL.md
linux-troubleshooting,"Linux system troubleshooting workflow for diagnosing and resolving system issues, performance problems, and service failures.",lib/sickn33-antigravity-awesome-skills/plugins/antigravity-awesome-skills-claude/skills/linux-troubleshooting/SKILL.md
llava,"Large Language and Vision Assistant. Enables visual instruction tuning and image-based conversations. Combines CLIP vision encoder with Vicuna/LLaMA language models. Supports multi-turn image chat, visual question answering, and instruction following. Use for vision-language chatbots or image understanding tasks. Best for conversational image analysis.",lib/orchestra-research-ai-research-skills/18-multimodal/llava/SKILL.md
llm-structured-output,"Get reliable JSON, enums, and typed objects from LLMs using response_format, tool_use, and schema-constrained decoding across OpenAI, Anthropic, and Google APIs.",lib/sickn33-antigravity-awesome-skills/plugins/antigravity-awesome-skills-claude/skills/llm-structured-output/SKILL.md
loki-mode,"Version 2.35.0 | PRD to Production | Zero Human Intervention > Research-enhanced: OpenAI SDK, DeepMind, Anthropic, AWS Bedrock, Agent SDK, HN Production (2025)",lib/sickn33-antigravity-awesome-skills/plugins/antigravity-awesome-skills-claude/skills/loki-mode/SKILL.md
long-context,"Extend context windows of transformer models using RoPE, YaRN, ALiBi, and position interpolation techniques. Use when processing long documents (32k-128k+ tokens), extending pre-trained models beyond original context limits, or implementing efficient positional encodings. Covers rotary embeddings, attention biases, interpolation methods, and extrapolation strategies for LLMs.",lib/orchestra-research-ai-research-skills/19-emerging-techniques/long-context/SKILL.md
make-automation,"Automate Make (Integromat) tasks via Rube MCP (Composio): operations, enums, language and timezone lookups. Always search tools first for current schemas.",lib/sickn33-antigravity-awesome-skills/plugins/antigravity-awesome-skills-claude/skills/make-automation/SKILL.md
makepad-2.0-dsl,"CRITICAL: Use for Makepad 2.0 DSL syntax and property system. Triggers on: makepad dsl, script_mod!, makepad syntax, makepad property, makepad 2.0 syntax, colon syntax, merge operator, named instance, let binding, mod.widgets, register_widget, script_component, type_default, widgets_internal",lib/zhanghandong-makepad-skills/skills/makepad-2.0-dsl/SKILL.md
makepad-reference,"This category provides reference materials for debugging, code quality, and advanced layout patterns.",lib/sickn33-antigravity-awesome-skills/plugins/antigravity-awesome-skills-claude/skills/makepad-reference/SKILL.md
makepad-widgets,Version: makepad-widgets (dev branch) | Last Updated: 2026-01-19 > > Check for updates: https://crates.io/crates/makepad-widgets,lib/sickn33-antigravity-awesome-skills/plugins/antigravity-awesome-skills-claude/skills/makepad-widgets/SKILL.md
manage-skills,"Discover, list, create, edit, toggle, copy, move, and delete AI agent skills across 11 tools (Cursor, Claude, Agents, Windsurf, Copilot, Codex, Cline, Aider, Continue, Roo Code, Augment)",lib/sickn33-antigravity-awesome-skills/skills/manage-skills/SKILL.md
manim-video,"Build reusable Manim explainers for technical concepts, graphs, system diagrams, and product walkthroughs, then hand off to the wider ECC video stack if needed. Use when the user wants a clean animated explainer rather than a generic talking-head script.",lib/affaan-m-everything-claude-code/skills/manim-video/SKILL.md
markdown-mermaid-writing,"Comprehensive markdown and Mermaid diagram writing skill. Use when creating any scientific document, report, analysis, or visualization. Establishes text-based diagrams as the default documentation standard with full style guides (markdown + mermaid), 24 diagram type references, and 9 document templates.",lib/k-dense-ai-claude-scientific-skills/scientific-skills/markdown-mermaid-writing/SKILL.md
market-movers,"When the user wants to track App Store chart rank changes, find top gainers and losers, detect breakout apps entering the top 100, or identify apps dropping out of charts. Also use when the user mentions ""chart movers"", ""rank changes"", ""who's rising"", ""who's falling"", ""new chart entries"", ""top gainers"", or ""market shifts"". For broader market overview, see market-pulse. For competitive keyword analysis, see competitor-analysis.",lib/eronred-aso-skills/skills/market-movers/SKILL.md
market-pulse,"When the user wants a comprehensive App Store market overview, daily/weekly market briefing, or combined view of chart movements, trending keywords, featured apps, and new releases. Also use when the user mentions ""market overview"", ""what's happening on the App Store"", ""market briefing"", ""weekly report"", ""market trends"", or ""state of the market"". For chart-specific rank changes only, see market-movers. For keyword trends only, see keyword-research.",lib/eronred-aso-skills/skills/market-pulse/SKILL.md
market-research,"Conduct market research, competitive analysis, investor due diligence, and industry intelligence with source attribution and decision-oriented summaries. Use when the user wants market sizing, competitor comparisons, fund research, technology scans, or research that informs business decisions.",lib/affaan-m-everything-claude-code/.agents/skills/market-research/SKILL.md
market-research-reports,"Generate comprehensive market research reports (50+ pages) in the style of top consulting firms (McKinsey, BCG, Gartner). Features professional LaTeX formatting, extensive visual generation with scientific-schematics and generate-image, deep integration with research-lookup for data gathering, and multi-framework strategic analysis including Porter Five Forces, PESTLE, SWOT, TAM/SAM/SOM, and BCG Matrix.",lib/k-dense-ai-claude-scientific-skills/scientific-skills/market-research-reports/SKILL.md
market-segments,"Identify 3-5 potential customer segments with demographics, JTBD, and product fit analysis. Use when exploring market segments, identifying target audiences, evaluating new markets, or learning how to segment a market.",lib/phuryn-pm-skills/pm-market-research/skills/market-segments/SKILL.md
market-sizing,"Estimate market size using TAM, SAM, and SOM with top-down and bottom-up approaches. Use when sizing a market opportunity, estimating addressable market, preparing for investor pitches, or evaluating market entry.",lib/phuryn-pm-skills/pm-market-research/skills/market-sizing/SKILL.md
market-sizing-analysis,"Comprehensive market sizing methodologies for calculating Total Addressable Market (TAM), Serviceable Available Market (SAM), and Serviceable Obtainable Market (SOM) for startup opportunities.",lib/sickn33-antigravity-awesome-skills/plugins/antigravity-awesome-skills-claude/skills/market-sizing-analysis/SKILL.md
marketing-ideas,"When the user needs marketing ideas, inspiration, or strategies for their SaaS or software product. Also use when the user asks for 'marketing ideas,' 'growth ideas,' 'how to market,' 'marketing strategies,' 'marketing tactics,' 'ways to promote,' 'ideas to grow,' 'what else can I try,' 'I don't know how to market this,' 'brainstorm marketing,' or 'what marketing should I do.' Use this as a starting point whenever someone is stuck or looking for inspiration on how to grow. For specific channel execution, see the relevant skill (paid-ads, social-content, email-sequence, etc.).",lib/coreyhaines31-marketingskills/skills/marketing-ideas/SKILL.md
marketing-principles,"Apply timeless marketing and business principles to any problem. Use when someone needs strategic thinking, wants to evaluate a marketing decision, needs a framework for a tough choice, or mentions ""first principles,"" ""should I do X,"" ""what would work here,"" or wants to think through a marketing problem systematically.",lib/brianrwagner-ai-marketing-skills/marketing-principles/SKILL.md
markitdown,"Convert files and office documents to Markdown. Supports PDF, DOCX, PPTX, XLSX, images (with OCR), audio (with transcription), HTML, CSV, JSON, XML, ZIP, YouTube URLs, EPubs and more.",lib/k-dense-ai-claude-scientific-skills/scientific-skills/markitdown/SKILL.md
matchms,"Spectral similarity and compound identification for metabolomics. Use for comparing mass spectra, computing similarity scores (cosine, modified cosine), and identifying unknown compounds from spectral libraries. Best for metabolite identification, spectral matching, library searching. For full LC-MS/MS proteomics pipelines use pyopenms.",lib/k-dense-ai-claude-scientific-skills/scientific-skills/matchms/SKILL.md
matlab,"MATLAB and GNU Octave numerical computing for matrix operations, data analysis, visualization, and scientific computing. Use when writing MATLAB/Octave scripts for linear algebra, signal processing, image processing, differential equations, optimization, statistics, or creating scientific visualizations. Also use when the user needs help with MATLAB syntax, functions, or wants to convert between MATLAB and Python code. Scripts can be executed with MATLAB or the open-source GNU Octave interpreter.",lib/k-dense-ai-claude-scientific-skills/scientific-skills/matlab/SKILL.md
matplotlib,"Low-level plotting library for full customization. Use when you need fine-grained control over every plot element, creating novel plot types, or integrating with specific scientific workflows. Export to PNG/PDF/SVG for publication. For quick statistical plots use seaborn; for interactive plots use plotly; for publication-ready multi-panel figures with journal styling, use scientific-visualization.",lib/k-dense-ai-claude-scientific-skills/scientific-skills/matplotlib/SKILL.md
maxia,"Connect to MAXIA AI-to-AI marketplace on Solana. Discover, buy, sell AI services. Earn USDC. 13 MCP tools, A2A protocol, DeFi yields, sentiment analysis, rug detection.",lib/sickn33-antigravity-awesome-skills/plugins/antigravity-awesome-skills-claude/skills/maxia/SKILL.md
mcp-builder-ms,"Use this skill when building MCP servers to integrate external APIs or services, whether in Python (FastMCP) or Node/TypeScript (MCP SDK).",lib/sickn33-antigravity-awesome-skills/plugins/antigravity-awesome-skills-claude/skills/mcp-builder-ms/SKILL.md
mcp-cli,"Use MCP servers on-demand via the mcp CLI tool - discover tools, resources, and prompts without polluting context with pre-loaded MCP integrations",lib/obra-superpowers-lab/skills/mcp-cli/SKILL.md
mcp:build-mcp,"Guide for creating high-quality MCP (Model Context Protocol) servers that enable LLMs to interact with external services through well-designed tools. Use when building MCP servers to integrate external APIs or services, whether in Python (FastMCP) or Node/TypeScript (MCP SDK).",lib/neolabhq-context-engineering-kit/plugins/mcp/skills/build-mcp/SKILL.md
mcp:setup-codemap-cli,Guide for setup Codemap CLI for intelligent codebase visualization and navigation,lib/neolabhq-context-engineering-kit/plugins/mcp/skills/setup-codemap-cli/SKILL.md
mcp:setup-context7-mcp,Guide for setup Context7 MCP server to load documentation for specific technologies.,lib/neolabhq-context-engineering-kit/plugins/mcp/skills/setup-context7-mcp/SKILL.md
mcp:setup-serena-mcp,Guide for setup Serena MCP server for semantic code retrieval and editing capabilities,lib/neolabhq-context-engineering-kit/plugins/mcp/skills/setup-serena-mcp/SKILL.md
meeting-prep-cc,"Generate a pre-meeting prep brief in Claude Code. Researches participants, pulls vault context, builds agenda, surfaces sharp questions. Use when user says ""prep for this meeting,"" ""I have a call with,"" ""meeting tomorrow with,"" or ""prep brief for [name/company].""",lib/brianrwagner-ai-marketing-skills/meeting-prep/SKILL.md
memory-forensics,"Comprehensive techniques for acquiring, analyzing, and extracting artifacts from memory dumps for incident response and malware analysis.",lib/sickn33-antigravity-awesome-skills/plugins/antigravity-awesome-skills-claude/skills/memory-forensics/SKILL.md
memory-safety-patterns,"Cross-language patterns for memory-safe programming including RAII, ownership, smart pointers, and resource management.",lib/sickn33-antigravity-awesome-skills/plugins/antigravity-awesome-skills-claude/skills/memory-safety-patterns/SKILL.md
mermaid-diagram,"Generate Mermaid diagrams from user requirements. Saves .mmd and .md files to figures/ directory with syntax verification. Supports flowcharts, sequence diagrams, class diagrams, ER diagrams, Gantt charts, and 18 more diagram types.",lib/wanshuiyin-auto-claude-code-research-in-sleep/skills/mermaid-diagram/SKILL.md
mermaid-expert,"Create Mermaid diagrams for flowcharts, sequences, ERDs, and architectures. Masters syntax for all diagram types and styling.",lib/sickn33-antigravity-awesome-skills/plugins/antigravity-awesome-skills-claude/skills/mermaid-expert/SKILL.md
messages-ops,"Evidence-first live messaging workflow for ECC. Use when the user wants to read texts or DMs, recover a recent one-time code, inspect a thread before replying, or prove which message source was actually checked.",lib/affaan-m-everything-claude-code/skills/messages-ops/SKILL.md
micro-saas-launcher,"Expert in launching small, focused SaaS products fast - the indie hacker approach to building profitable software. Covers idea validation, MVP development, pricing, launch strategies, and growing to sustainable revenue. Ship in weeks, not months.",lib/sickn33-antigravity-awesome-skills/plugins/antigravity-awesome-skills-claude/skills/micro-saas-launcher/SKILL.md
microsoft-teams-automation,"Automate Microsoft Teams tasks via Rube MCP (Composio): send messages, manage channels, create meetings, handle chats, and search messages. Always search tools first for current schemas.",lib/sickn33-antigravity-awesome-skills/plugins/antigravity-awesome-skills-claude/skills/microsoft-teams-automation/SKILL.md
miles-rl-training,"Provides guidance for enterprise-grade RL training using miles, a production-ready fork of slime. Use when training large MoE models with FP8/INT4, needing train-inference alignment, or requiring speculative RL for maximum throughput.",lib/orchestra-research-ai-research-skills/06-post-training/miles/SKILL.md
mime-detection-routing,mime detection routing,lib/kreuzberg-dev-kreuzberg/.ai-rulez/skills/mime-detection-routing/SKILL.md
minecraft-bukkit-pro,"Master Minecraft server plugin development with Bukkit, Spigot, and Paper APIs.",lib/sickn33-antigravity-awesome-skills/plugins/antigravity-awesome-skills-claude/skills/minecraft-bukkit-pro/SKILL.md
miro-automation,"Automate Miro tasks via Rube MCP (Composio): boards, items, sticky notes, frames, sharing, connectors. Always search tools first for current schemas.",lib/sickn33-antigravity-awesome-skills/plugins/antigravity-awesome-skills-claude/skills/miro-automation/SKILL.md
mise-configurator,"Generate production-ready mise.toml setups for local development, CI/CD pipelines, and toolchain standardization.",lib/sickn33-antigravity-awesome-skills/plugins/antigravity-awesome-skills-claude/skills/mise-configurator/SKILL.md
mixpanel-automation,"Automate Mixpanel tasks via Rube MCP (Composio): events, segmentation, funnels, cohorts, user profiles, JQL queries. Always search tools first for current schemas.",lib/sickn33-antigravity-awesome-skills/plugins/antigravity-awesome-skills-claude/skills/mixpanel-automation/SKILL.md
ml-paper-writing,"Write publication-ready ML/AI papers for NeurIPS, ICML, ICLR, ACL, AAAI, COLM. Use when drafting papers from research repos, structuring arguments, verifying citations, or preparing camera-ready submissions. For systems venues (OSDI, NSDI, ASPLOS, SOSP), use systems-paper-writing instead.",lib/orchestra-research-ai-research-skills/20-ml-paper-writing/ml-paper-writing/SKILL.md
mlflow,"Track ML experiments, manage model registry with versioning, deploy models to production, and reproduce experiments with MLflow - framework-agnostic ML lifecycle platform",lib/orchestra-research-ai-research-skills/13-mlops/mlflow/SKILL.md
mlops-engineer,"Build comprehensive ML pipelines, experiment tracking, and model registries with MLflow, Kubeflow, and modern MLOps tools.",lib/sickn33-antigravity-awesome-skills/plugins/antigravity-awesome-skills-claude/skills/mlops-engineer/SKILL.md
model-hierarchy,"Cost-optimize AI agent operations by routing tasks to appropriate models based on complexity. Use this skill when: (1) deciding which model to use for a task, (2) spawning sub-agents, (3) considering cost efficiency, (4) the current model feels like overkill for the task. Triggers: ""model routing"", ""cost optimization"", ""which model"", ""too expensive"", ""spawn agent"".",lib/zscole-model-hierarchy-skill/SKILL.md
model-merging,"Merge multiple fine-tuned models using mergekit to combine capabilities without retraining. Use when creating specialized models by blending domain-specific expertise (math + coding + chat), improving performance beyond single models, or experimenting rapidly with model variants. Covers SLERP, TIES-Merging, DARE, Task Arithmetic, linear merging, and production deployment strategies.",lib/orchestra-research-ai-research-skills/19-emerging-techniques/model-merging/SKILL.md
molfeat,"Molecular featurization for ML (100+ featurizers). ECFP, MACCS, descriptors, pretrained models (ChemBERTa), convert SMILES to features, for QSAR and molecular ML.",lib/k-dense-ai-claude-scientific-skills/scientific-skills/molfeat/SKILL.md
monday-automation,"Automate Monday.com work management including boards, items, columns, groups, subitems, and updates via Rube MCP (Composio). Always search tools first for current schemas.",lib/sickn33-antigravity-awesome-skills/plugins/antigravity-awesome-skills-claude/skills/monday-automation/SKILL.md
monetization,"Estrategia e implementacao de monetizacao para produtos digitais - Stripe, subscriptions, pricing experiments, freemium, upgrade flows, churn prevention, revenue optimization e modelos de negocio SaaS.",lib/sickn33-antigravity-awesome-skills/plugins/antigravity-awesome-skills-claude/skills/monetization/SKILL.md
monitor-experiment,"Monitor running experiments, check progress, collect results. Use when user says ""check results"", ""is it done"", ""monitor"", or wants experiment output.",lib/wanshuiyin-auto-claude-code-research-in-sleep/skills/monitor-experiment/SKILL.md
monorepo-management,"Build efficient, scalable monorepos that enable code sharing, consistent tooling, and atomic changes across multiple packages and applications.",lib/sickn33-antigravity-awesome-skills/plugins/antigravity-awesome-skills-claude/skills/monorepo-management/SKILL.md
moodle-external-api-development,"This skill guides you through creating custom external web service APIs for Moodle LMS, following Moodle's external API framework and coding standards.",lib/sickn33-antigravity-awesome-skills/plugins/antigravity-awesome-skills-claude/skills/moodle-external-api-development/SKILL.md
moyu,"Anti-over-engineering guardrail that activates when an AI coding agent expands scope, adds abstractions, or changes files the user did not request.",lib/sickn33-antigravity-awesome-skills/plugins/antigravity-awesome-skills-claude/skills/moyu/SKILL.md
moyu-en,"Automatically activates when over-engineering patterns are detected: (1) Modifying code or files the user did not explicitly ask to change (2) Creating new abstraction layers (class, interface, factory, wrapper) without being asked (3) Adding comments, documentation, JSDoc, or type annotations without being asked (4) Introducing new dependencies without being asked (5) Rewriting entire files instead of making minimal edits (6) Diff scope significantly exceeding the user's request (7) User signals like ""too much"", ""don't change that"", ""only change X"", ""keep it simple"", ""stop"" (8) Adding error handling, validation, or defensive code for scenarios that cannot occur (9) Generating tests, configuration scaffolding, or documentation without being asked",lib/uucz-moyu/antigravity/moyu-en/SKILL.md
ms-teams-apps,"Microsoft Teams bots and AI agents - Claude/OpenAI, Adaptive Cards, Graph API",lib/alinaqi-claude-bootstrap/skills/ms-teams-apps/SKILL.md
mtls-configuration,"Configure mutual TLS (mTLS) for zero-trust service-to-service communication. Use when implementing zero-trust networking, certificate management, or securing internal service communication.",lib/sickn33-antigravity-awesome-skills/plugins/antigravity-awesome-skills-claude/skills/mtls-configuration/SKILL.md
multi-agent-brainstorming,"Simulate a structured peer-review process using multiple specialized agents to validate designs, surface hidden assumptions, and identify failure modes before implementation.",lib/sickn33-antigravity-awesome-skills/plugins/antigravity-awesome-skills-claude/skills/multi-agent-brainstorming/SKILL.md
nanobanana,"Generate and edit images using Google Gemini 3 Pro Image (Nano Banana Pro). Supports text-to-image, image editing, various aspect ratios, and high-resolution output (2K/4K). Use when user wants to generate images, create images, use Gemini image generation, or do AI image generation.",lib/resciencelab-opc-skills/skills/nanobanana/SKILL.md
nanobanana-ppt-skills,AI-powered PPT generation with document analysis and styled images,lib/sickn33-antigravity-awesome-skills/plugins/antigravity-awesome-skills-claude/skills/nanobanana-ppt-skills/SKILL.md
