skill_id,description,score,phase
analytics-tracking,"When the user wants to set up, improve, or audit analytics tracking and measurement. Also use when the user mentions ""set up tracking,"" ""GA4,"" ""Google Analytics,"" ""conversion tracking,"" ""event tracking,"" ""UTM parameters,"" ""tag manager,"" ""GTM,"" ""analytics implementation,"" ""tracking plan,"" ""how do I measure this,"" ""track conversions,"" ""attribution,"" ""Mixpanel,"" ""Segment,"" ""are my events firing,"" or ""analytics isn't working."" Use this whenever someone asks how to know if something is working or wants to measure marketing results. For A/B test measurement, see ab-test-setup.",100,4
ansoff-matrix,"Generate an Ansoff Matrix analysis mapping growth strategies across market penetration, market development, product development, and diversification. Use when considering growth options, planning market expansion, or evaluating strategic growth paths.",100,4
app-analytics,"When the user wants to set up, interpret, or improve their app analytics and tracking. Also use when the user mentions ""analytics"", ""tracking"", ""metrics"", ""KPIs"", ""App Store Connect analytics"", ""install tracking"", ""funnel"", ""attribution"", or ""how is my app performing"". For A/B testing, see ab-test-store-listing. For retention metrics, see retention-optimization.",100,4
auri-core,"Auri: assistente de voz inteligente (Alexa + Claude claude-opus-4-20250805). Visao do produto, persona Vitoria Neural, stack AWS, modelo Free/Pro/Business/Enterprise, roadmap 4 fases, GTM, north star WAC e analise competitiva.",100,4
beachhead-segment,"Identify the first beachhead market segment for a product launch. Evaluates segments against burning pain, willingness to pay, winnable market share, and referral potential. Use when choosing a first market, targeting an initial customer segment, or planning market entry strategy.",100,4
brainstorm-ideas-new,"Brainstorm feature ideas for a new product in initial discovery from PM, Designer, and Engineer perspectives. Use when starting product discovery for a new product, exploring features for a startup idea, or doing initial ideation.",100,4
business-analyst,"Master modern business analysis with AI-powered analytics, real-time dashboards, and data-driven insights. Build comprehensive KPI frameworks, predictive models, and strategic recommendations.",100,4
business-model,"Generate a Business Model Canvas with all 9 building blocks. Use when creating a business model, documenting how a business creates value, or analyzing an existing business model.",100,4
charlie,"Your AI CFO for bootstrapped startups, named after Charlie Munger who embodied the principle that capital discipline is a competitive advantage. Provides financial frameworks for cash management, runway calculations, unit economics (LTV:CAC), capital allocation, hiring ROI, burn rate analysis, working capital optimization, and forecasting. Use for questions like ""should we make this hire?"", ""how much runway do we need?"", ""what metrics should I track?"", ""how do I forecast revenue?"", or any strategic financial decision at a self-funded company.",100,4
chat-widget,"Build a real-time support chat system with a floating widget for users and an admin dashboard for support staff. Use when the user wants live chat, customer support chat, real-time messaging, or in-app support.",100,4
create-prd,"Create a Product Requirements Document using a comprehensive 8-section template covering problem, objectives, segments, value propositions, solution, and release planning. Use when writing a PRD, documenting product requirements, preparing a feature spec, or reviewing an existing PRD.",100,4
epic-hypothesis,"Frame an epic as a testable hypothesis with target user, expected outcome, and validation method. Use when defining a major initiative before roadmap, discovery, or delivery planning.",100,4
go-to-market-plan,"Analyzes the founder's business context to deliver 3 best go-to-market strategies tailored to their current stage, product, and market. Asks up to 10 diagnostic questions when needed to understand product readiness, target market clarity, competitive positioning, and distribution channels. Use when user needs go-to-market strategy, launch planning, market entry strategy, or actionable GTM roadmap.",100,4
google-analytics-automation,"Automate Google Analytics tasks via Rube MCP (Composio): run reports, list accounts/properties, funnels, pivots, key events. Always search tools first for current schemas.",100,4
growth-loops,"Identify growth loops (flywheels) for sustainable traction. Evaluates 5 loop types: Viral, Usage, Collaboration, User-Generated, and Referral. Use when designing growth mechanisms, building product-led traction, or understanding how growth loops work.",100,4
gtm-motions,"Identify the best GTM motions and tools across 7 motion types: Inbound, Outbound, Paid Digital, Community, Partners, ABM, and PLG. Use when selecting marketing channels, choosing between inbound and outbound strategy, or planning cross-channel campaigns.",100,4
gtm-strategy,"Create a go-to-market strategy covering marketing channels, messaging, success metrics, and launch timeline. Use when planning a product launch, creating a GTM plan from scratch, or defining a launch strategy for a new market.",100,4
ideal-customer-profile,"Identify the Ideal Customer Profile (ICP) from research data with demographics, behaviors, JTBD, and needs. Use when defining your ICP, analyzing PMF survey data, or understanding who your best customers are.",100,4
identify-assumptions-new,"Identify risky assumptions for a new product idea across 8 risk categories including Go-to-Market, Strategy, and Team. Use when evaluating startup risks, assessing a new product concept, or mapping assumptions for a new venture.",100,4
launch-strategy,"When the user wants to plan a product launch, feature announcement, or release strategy. Also use when the user mentions 'launch,' 'Product Hunt,' 'feature release,' 'announcement,' 'go-to-market,' 'beta launch,' 'early access,' 'waitlist,' 'product update,' 'how do I launch this,' 'launch checklist,' 'GTM plan,' or 'we're about to ship.' Use this whenever someone is preparing to release something publicly. For ongoing marketing after launch, see marketing-ideas.",100,4
lean-canvas,"Generate a Lean Canvas with problem, solution, metrics, cost structure, UVP, unfair advantage, channels, segments, and revenue. Use when exploring a lean startup canvas, testing a business hypothesis, or modeling a new venture.",100,4
outcome-roadmap,"Transform an output-focused roadmap into an outcome-focused one that communicates strategic intent. Rewrites initiatives as outcome statements reflecting user and business impacts. Use when shifting to outcome roadmaps, making a roadmap more strategic, or rewriting feature lists as outcomes.",100,4
positioning-basics,"Help founders and marketers nail their positioning. Use when someone mentions ""positioning,"" ""value proposition,"" ""who is this for,"" ""how do I describe my product,"" ""messaging,"" ""ICP,"" ""ideal customer,"" or is struggling to articulate what makes their product different.",100,4
posthog-analytics,"PostHog analytics, event tracking, feature flags, dashboards",100,4
prd-development,"Build a structured PRD that connects problem, users, solution, and success criteria. Use when turning discovery notes into an engineering-ready document for a major initiative.",100,4
prd-generator,"Generates professional PRD (Product Requirements Document) files optimized for AI coding tools. Takes a rough product idea, asks clarifying questions, and outputs a structured PDF ready to feed into AI coding assistants.",100,4
prd-to-plan,"Turn a PRD into a multi-phase implementation plan using tracer-bullet vertical slices, saved as a local Markdown file in ./plans/. Use when user wants to break down a PRD, create an implementation plan, plan phases from a PRD, or mentions ""tracer bullets"".",100,4
problem-statement,"Write a user-centered problem statement with who is blocked, what they are trying to do, why it matters, and how it feels. Use when framing discovery, prioritization, or a PRD.",100,4
product-strategy-session,"Run an end-to-end product strategy session across positioning, discovery, and roadmap planning. Use when a team needs validated direction before committing to execution.",100,4
product-vision,"Brainstorm an inspiring, achievable, and emotional product vision that motivates teams and aligns stakeholders. Use when defining or refining a product vision, creating a vision statement, or aligning the team around a shared direction.",100,4
roadmap-planning,"Plan a strategic roadmap across prioritization, epic definition, stakeholder alignment, and sequencing. Use when turning strategy into a release plan that teams can execute.",100,4
signup-flow-cro,"When the user wants to optimize signup, registration, account creation, or trial activation flows. Also use when the user mentions ""signup conversions,"" ""registration friction,"" ""signup form optimization,"" ""free trial signup,"" ""reduce signup dropoff,"" ""account creation flow,"" ""people aren't signing up,"" ""signup abandonment,"" ""trial conversion rate,"" ""nobody completes registration,"" ""too many steps to sign up,"" or ""simplify our signup."" Use this whenever the user has a signup or registration flow that isn't performing. For post-signup onboarding, see onboarding-cro. For lead capture forms (not account creation), see form-cro.",100,4
startup-analyst,"Expert startup business analyst specializing in market sizing, financial modeling, competitive analysis, and strategic planning for early-stage companies.",100,4
startup-canvas,Generate a Startup Canvas combining Product Strategy (9 sections) and Business Model (costs + revenue) for a new product. An alternative to BMC and Lean Canvas that separates strategy from business model. Use when launching a new product or evaluating a startup concept.,100,4
startup-metrics-framework,"Comprehensive guide to tracking, calculating, and optimizing key performance metrics for different startup business models from seed through Series A.",100,4
user-story-mapping,"Create a user story map that lays out activities, steps, tasks, and release slices. Use when planning a workflow, backlog, or MVP around the user journey.",100,4
value-prop-statements,"Generate value proposition statements for marketing, sales, and onboarding from existing value propositions. Use when writing marketing copy, creating sales messaging, or crafting onboarding messages.",100,4
