skill_id,description,score,phase
accessibility,"Design, implement, and audit inclusive digital products using WCAG 2.2 Level AA standards. Use this skill to generate semantic ARIA for Web and accessibility traits for Web and Native platforms (iOS/Android).",100,1
accessibility-compliance-accessibility-audit,"You are an accessibility expert specializing in WCAG compliance, inclusive design, and assistive technology compatibility. Conduct audits, identify barriers, and provide remediation guidance.",100,1
adaptyv,"How to use the Adaptyv Bio Foundry API and Python SDK for protein experiment design, submission, and results retrieval. Use this skill whenever the user mentions Adaptyv, Foundry API, protein binding assays, protein screening experiments, BLI/SPR assays, thermostability assays, or wants to submit protein sequences for experimental characterization. Also trigger when code imports `adaptyv`, `adaptyv_sdk`, or `FoundryClient`, or references `foundry-api-public.adaptyvbio.com`.",100,1
android-jetpack-compose-expert,"Expert guidance for building modern Android UIs with Jetpack Compose, covering state management, navigation, performance, and Material Design 3.",100,1
angular-ui-patterns,"Modern Angular UI patterns for loading states, error handling, and data display. Use when building UI components, handling async data, or managing component states.",100,1
antigravity-design-expert,"Core UI/UX engineering skill for building highly interactive, spatial, weightless, and glassmorphism-based web interfaces using GSAP and 3D CSS.",100,1
avalonia-layout-zafiro,"Guidelines for modern Avalonia UI layout using Zafiro.Avalonia, emphasizing shared styles, generic components, and avoiding XAML redundancy.",100,1
avalonia-zafiro-development,"Mandatory skills, conventions, and behavioral rules for Avalonia UI development using the Zafiro toolkit.",100,1
baseline-ui,"Validates animation durations, enforces typography scale, checks component accessibility, and prevents layout anti-patterns in Tailwind CSS projects. Use when building UI components, reviewing CSS utilities, styling React views, or enforcing design consistency.",100,1
brainstorming,"You MUST use this before any creative work - creating features, building components, adding functionality, or modifying behavior. Explores user intent, requirements and design before implementation.",100,1
brand-guidelines,"Write copy following Sentry brand guidelines. Use when writing UI text, error messages, empty states, onboarding flows, 404 pages, documentation, marketing copy, or any user-facing content. Covers both Plain Speech (default) and Sentry Voice tones.",100,1
building-native-ui,"Complete guide for building beautiful apps with Expo Router. Covers fundamentals, styling, components, navigation, animations, patterns, and native tabs.",100,1
canvas-design,"These are instructions for creating design philosophies - aesthetic movements that are then EXPRESSED VISUALLY. Output only .md files, .pdf files, and .png files.",100,1
ckm:banner-design,"Design banners for social media, ads, website heroes, creative assets, and print. Multiple art direction options with AI-generated visuals. Actions: design, create, generate banner. Platforms: Facebook, Twitter/X, LinkedIn, YouTube, Instagram, Google Display, website hero, print. Styles: minimalist, gradient, bold typography, photo-based, illustrated, geometric, retro, glassmorphism, 3D, neon, duotone, editorial, collage. Uses ui-ux-pro-max, frontend-design, ai-artist, ai-multimodal skills.",100,1
ckm:brand,"Brand voice, visual identity, messaging frameworks, asset management, brand consistency. Activate for branded content, tone of voice, marketing assets, brand compliance, style guides.",100,1
ckm:slides,"Create strategic HTML presentations with Chart.js, design tokens, responsive layouts, copywriting formulas, and contextual slide strategies.",100,1
ckm:ui-styling,"Create beautiful, accessible user interfaces with shadcn/ui components (built on Radix UI + Tailwind), Tailwind CSS utility-first styling, and canvas-based visual designs. Use when building user interfaces, implementing design systems, creating responsive layouts, adding accessible components (dialogs, dropdowns, forms, tables), customizing themes and colors, implementing dark mode, generating visual designs and posters, or establishing consistent styling patterns across applications.",100,1
click-path-audit,"Trace every user-facing button/touchpoint through its full state change sequence to find bugs where functions individually work but cancel each other out, produce wrong final state, or leave the UI in an inconsistent state. Use when: systematic debugging found no bugs but users report broken buttons, or after any major refactor touching shared state stores.",100,1
color-expert,"Use when working with color naming, color theory, color spaces, color definitions, or any task involving color knowledge - palettes, ramps, gradients, conversions, accessibility, perceptual matching, pigment mixing, print-vs-screen color, CSS color syntax, or historical color terminology. Use this skill whenever the user is choosing, comparing, generating, naming, converting, or explaining colors, even if they do not explicitly ask for ""color theory.""",100,1
core-components,"Core component library and design system patterns. Use when building UI, using design tokens, or working with the component library.",100,1
cro-optimization,"Analyzes landing pages and provides detailed CRO (Conversion Rate Optimization) recommendations. Use when user provides a landing page URL or HTML/CSS code and needs optimization advice to maximize conversions, signups, or sales. Extracts page elements, audits against proven CRO principles, and delivers actionable recommendations in report format.",100,1
customer-empathy,"Deep-dive into customer empathy and user journey thinking. Use when designing onboarding, improving UX, planning features, or trying to understand how to delight users faster.",100,1
database-driver-design,"Expert guidance on building Swift database client libraries. Use when developers mention: (1) building a database driver, (2) wire protocol implementation, (3) connection pooling design, (4) state machines for protocol handling, (5) NIO channel handlers for databases, (6) backpressure in result streaming, (7) actor executor alignment with NIO.",100,1
design-consultation,"Design consultation: understands your product, researches the landscape, proposes a complete design system (aesthetic, typography, color, layout, spacing, motion), and generates font+color preview pages. Creates DESIGN.md as your project's design source of truth. For existing sites, use /plan-design-review to infer the system instead. Use when asked to ""design system"", ""brand guidelines"", or ""create DESIGN.md"". Proactively suggest when starting a new project's UI with no existing design system or DESIGN.md. (gstack)",100,1
design-html,"Design finalization: generates production-quality Pretext-native HTML/CSS. Works with approved mockups from /design-shotgun, CEO plans from /plan-ceo-review, design review context from /plan-design-review, or from scratch with a user description. Text actually reflows, heights are computed, layouts are dynamic. 30KB overhead, zero deps. Smart API routing: picks the right Pretext patterns for each design type. Use when: ""finalize this design"", ""turn this into HTML"", ""build me a page"", ""implement this design"", or after any planning skill. Proactively suggest when user has approved a design or has a plan ready. (gstack) Voice triggers (speech-to-text aliases): ""build the design"", ""code the mockup"", ""make it real"".",100,1
design-md,Analyze Stitch projects and synthesize a semantic design system into DESIGN.md files,100,1
design-shotgun,"Design shotgun: generate multiple AI design variants, open a comparison board, collect structured feedback, and iterate. Standalone design exploration you can run anytime. Use when: ""explore designs"", ""show me options"", ""design variants"", ""visual brainstorm"", or ""I don't like how this looks"". Proactively suggest when the user describes a UI feature but hasn't seen what it could look like. (gstack)",100,1
design-spells,"Curated micro-interactions and design details that add ""magic"" and personality to websites and apps.",100,1
design-system,"Use this skill to generate or audit design systems, check visual consistency, and review PRs that touch styling.",100,1
diffdock,"Diffusion-based molecular docking. Predict protein-ligand binding poses from PDB/SMILES, confidence scores, virtual screening, for structure-based drug design. Not for affinity prediction.",100,1
enhance-prompt,"Transforms vague UI ideas into polished, Stitch-optimized prompts. Enhances specificity, adds UI/UX keywords, injects design system context, and structures output for better generation results.",100,1
esm,"Comprehensive toolkit for protein language models including ESM3 (generative multimodal protein design across sequence, structure, and function) and ESM C (efficient protein embeddings and representations). Use this skill when working with protein sequences, structures, or function prediction; designing novel proteins; generating protein embeddings; performing inverse folding; or conducting protein engineering tasks. Supports both local model usage and cloud-based Forge API for scalable inference.",100,1
expo-tailwind-setup,Set up Tailwind CSS v4 in Expo with react-native-css and NativeWind v5 for universal styling,100,1
expo-ui-jetpack-compose,expo-ui-jetpack-compose,100,1
expo-ui-swift-ui,expo-ui-swift-ui,100,1
fixing-accessibility,"Audit and fix HTML accessibility issues including ARIA labels, keyboard navigation, focus management, color contrast, and form errors. Use when adding interactive controls, forms, dialogs, or reviewing WCAG compliance.",100,1
fixing-metadata,"Audit and fix HTML metadata including page titles, meta descriptions, canonical URLs, Open Graph tags, Twitter cards, favicons, JSON-LD structured data, and robots directives. Use when adding SEO metadata, fixing social share previews, reviewing Open Graph tags, setting up canonical URLs, or shipping new pages that need correct meta tags.",100,1
fixing-motion-performance,"Audit and fix animation performance issues including layout thrashing, compositor properties, scroll-linked motion, and blur effects. Use when animations stutter, transitions jank, or reviewing CSS/JS animation performance.",100,1
glycoengineering,"Analyze and engineer protein glycosylation. Scan sequences for N-glycosylation sequons (N-X-S/T), predict O-glycosylation hotspots, and access curated glycoengineering tools (NetOGlyc, GlycoShield, GlycoWorkbench). For glycoprotein engineering, therapeutic antibody optimization, and vaccine design.",100,1
gpt-taste,"Elite UX/UI & Advanced GSAP Motion Engineer. Enforces Python-driven true randomization for layout variance, strict AIDA page structure, wide editorial typography (bans 6-line wraps), gapless bento grids, strict GSAP ScrollTriggers (pinning, stacking, scrubbing), inline micro-images, and massive section spacing.",100,1
gstack-openclaw-office-hours,"Use when asked to brainstorm, evaluate whether an idea is worth building, run office hours, or think through a new product idea or design direction before any code is written.",100,1
high-end-visual-design,"Teaches the AI to design like a high-end agency. Defines the exact fonts, spacing, shadows, card structures, and animations that make a website feel expensive. Blocks all the common defaults that make AI designs look cheap or generic.",100,1
iconsax-library,Extensive icon library and AI-driven icon generation skill for premium UI/UX design.,100,1
ipados-design-guidelines,"Apple Human Interface Guidelines for iPad. Use when building iPad-optimized interfaces, implementing multitasking, pointer support, keyboard shortcuts, or responsive layouts. Triggers on tasks involving iPad, Split View, Stage Manager, sidebar navigation, or trackpad support.",100,1
jpa-patterns,"JPA/Hibernate patterns for entity design, relationships, query optimization, transactions, auditing, indexing, pagination, and pooling in Spring Boot.",100,1
kpi-dashboard-design,Comprehensive patterns for designing effective Key Performance Indicator (KPI) dashboards that drive business decisions.,100,1
latex-posters,"Create professional research posters in LaTeX using beamerposter, tikzposter, or baposter. Support for conference presentations, academic posters, and scientific communication. Includes layout design, color schemes, multi-column formats, figure integration, and poster-specific best practices for visual communication.",100,1
lean-ux-canvas,"Guide teams through Lean UX Canvas v2. Use when framing a business problem, surfacing assumptions, and defining what to learn next.",100,1
logo-creator,"Create logos using AI image generation. Discuss style/ratio, generate variations, iterate with user feedback, crop, remove background, and export as SVG. Use when user wants to create a logo, icon, favicon, brand mark, mascot, emblem, or design a logo.",100,1
macos-design-guidelines,"Apple Human Interface Guidelines for Mac. Use when building macOS apps with SwiftUI or AppKit, implementing menu bars, toolbars, window management, or keyboard shortcuts. Triggers on tasks involving Mac UI, desktop apps, or Mac Catalyst.",100,1
magic-animator,"AI-powered animation tool for creating motion in logos, UI, icons, and social media assets.",100,1
magic-ui-generator,"Utilizes Magic by 21st.dev to generate, compare, and integrate multiple production-ready UI component variations.",100,1
medusa,"Medusa headless commerce - modules, workflows, API routes, admin UI",100,1
minimalist-ui,"Clean editorial-style interfaces. Warm monochrome palette, typographic contrast, flat bento grids, muted pastels. No gradients, no heavy shadows.",100,1
notion-template-business,"Expert in building and selling Notion templates as a business - not just making templates, but building a sustainable digital product business. Covers template design, pricing, marketplaces, marketing, and scaling to real revenue.",100,1
pptx-posters,"Create research posters using HTML/CSS that can be exported to PDF or PPTX. Use this skill ONLY when the user explicitly requests PowerPoint/PPTX poster format. For standard research posters, use latex-posters instead. This skill provides modern web-based poster design with responsive layouts and easy visual integration.",100,1
pymoo,"Multi-objective optimization framework. NSGA-II, NSGA-III, MOEA/D, Pareto fronts, constraint handling, benchmarks (ZDT, DTLZ), for engineering design and optimization problems.",100,1
python-patterns,"Python-specific design patterns and best practices including protocols, dataclasses, context managers, decorators, async/await, type hints, and package organization. Use when working with Python code to apply Pythonic patterns.",100,1
radix-ui-design-system,"Build accessible design systems with Radix UI primitives. Headless component customization, theming strategies, and compound component patterns for production-grade UI libraries.",100,1
rayden-code,"Generate React code with Rayden UI components using correct props, tokens, and premium layout patterns",100,1
react-ui-patterns,"Modern React UI patterns for loading states, error handling, and data fetching. Use when building UI components, handling async data, or managing UI states.",100,1
redesign-existing-projects,"Upgrades existing websites and apps to premium quality. Audits current design, identifies generic AI patterns, and applies high-end design standards without breaking functionality. Works with any CSS framework or vanilla CSS.",100,1
scientific-critical-thinking,"Evaluate scientific claims and evidence quality. Use for assessing experimental design validity, identifying biases and confounders, applying evidence grading frameworks (GRADE, Cochrane Risk of Bias), or teaching critical analysis. Best for understanding evidence quality, identifying flaws. For formal peer review writing use peer-review.",100,1
scientific-slides,"Build slide decks and presentations for research talks. Use this for making PowerPoint slides, conference presentations, seminar talks, research presentations, thesis defense slides, or any scientific talk. Provides slide structure, design templates, timing guidance, and visual validation. Works with PowerPoint and LaTeX Beamer.",100,1
shadcn,"Manages shadcn/ui components and projects, providing context, documentation, and usage patterns for building modern design systems.",100,1
shadcn-ui,"Expert guidance for integrating and building applications with shadcn/ui components, including component discovery, installation, customization, and best practices.",100,1
spline-3d-integration,"Use when adding interactive 3D scenes from Spline.design to web projects, including React embedding and runtime control API.",100,1
stitch-ui-design,"Expert guidance for crafting effective prompts in Google Stitch, the AI-powered UI design tool by Google Labs. This skill helps create precise, actionable prompts that generate high-quality UI designs for web and mobile applications.",100,1
swiftui-ui-patterns,"Apply proven SwiftUI UI patterns for navigation, sheets, async state, and reusable screens.",100,1
tailwind-design-system,"Build production-ready design systems with Tailwind CSS, including design tokens, component variants, responsive patterns, and accessibility.",100,1
tvos-design-guidelines,"Apple Human Interface Guidelines for Apple TV. Use when building tvOS apps with focus-based navigation, Siri Remote input, or living room viewing experiences. Triggers on tasks involving Apple TV, tvOS, 10-foot UI, or media playback.",100,1
ui-a11y,Audit a StyleSeed-based component or page for WCAG 2.2 AA issues and apply practical accessibility fixes where the code makes them safe.,100,1
ui-component,"Generate a new UI component that follows StyleSeed Toss conventions for structure, tokens, accessibility, and component ergonomics.",100,1
ui-demo,"Record polished UI demo videos using Playwright. Use when the user asks to create a demo, walkthrough, screen recording, or tutorial video of a web application. Produces WebM videos with visible cursor, natural pacing, and professional feel.",100,1
ui-mobile,"Mobile UI patterns - React Native, iOS/Android, touch targets",100,1
ui-page,"Scaffold a new mobile-first page using StyleSeed Toss layout patterns, section rhythm, and existing shell components.",100,1
ui-pattern,"Generate reusable UI patterns such as card sections, grids, lists, forms, and chart wrappers using StyleSeed Toss primitives.",100,1
ui-review,"Review UI code for StyleSeed design-system compliance, accessibility, mobile ergonomics, spacing discipline, and implementation quality.",100,1
ui-setup,"Interactive StyleSeed setup wizard for choosing app type, brand color, visual style, typography, and the first screen scaffold.",100,1
ui-tokens,"List, add, and update StyleSeed design tokens while keeping JSON sources, CSS variables, and dark-mode values in sync.",100,1
ui-ux-designer,"Create interface designs, wireframes, and design systems. Masters user research, accessibility standards, and modern design tools.",100,1
ui-web,"Web UI - glassmorphism, Tailwind, dark mode, accessibility",100,1
user-journeys,"User experience flows - journey mapping, UX validation, error recovery",100,1
user-stories,"Create user stories following the 3 C's (Card, Conversation, Confirmation) and INVEST criteria with descriptions, design links, and acceptance criteria. Use when writing user stories, breaking down features into backlog items, or defining acceptance criteria.",100,1
ux-audit,Audit screens against Nielsen's heuristics and mobile UX best practices using the StyleSeed Toss design language as the implementation context.,100,1
ux-copy,"Generate UX microcopy in StyleSeed's Toss-inspired voice for buttons, empty states, errors, toasts, confirmations, and form guidance.",100,1
ux-feedback,"Add loading, empty, error, and success feedback states to StyleSeed components and pages with practical mobile-first rules.",100,1
ux-flow,"Design user flows and screen structure using StyleSeed UX patterns such as progressive disclosure, hub-and-spoke navigation, and information pyramids.",100,1
uxui-principles,"Evaluate interfaces against 168 research-backed UX/UI principles, detect antipatterns, and inject UX context into AI coding sessions.",100,1
visionos-design-guidelines,"Apple Human Interface Guidelines for Apple Vision Pro. Use when building spatial computing apps, implementing eye/hand input, or designing immersive experiences. Triggers on tasks involving visionOS, RealityKit, spatial UI, or mixed reality.",100,1
vizcom,AI-powered product design tool for transforming sketches into full-fidelity 3D renders.,100,1
watchos-design-guidelines,"Apple Human Interface Guidelines for Apple Watch. Use when building watchOS apps, complications, or workout features. Triggers on tasks involving Watch UI, Digital Crown, glanceable interfaces, or wrist-based interactions.",100,1
