skill_id,description,src_path
sales-enablement,"Create sales collateral such as decks, one-pagers, objection docs, demo scripts, playbooks, and proposal templates. Use when a sales team needs assets that help reps move deals forward and close.",src/antigravity-awesome-skills/skills/sales-enablement/SKILL.md
case-study-builder,"Turn client wins into formatted case studies for proposals, social proof, and sales conversations. Use when someone needs to document results, build credibility, or create reusable proof assets.",src/ai-marketing-skills/case-study-builder/SKILL.md
linkedin-cli,"Use when automating LinkedIn via CLI: fetch profiles, search people/companies, send messages, manage connections, create posts, and Sales Navigator.",src/antigravity-awesome-skills/skills/linkedin-cli/SKILL.md
nda-triage-anthropic,"Screen incoming NDAs and classify them as GREEN (standard), YELLOW (needs review), or RED (significant issues). Use when a new NDA comes in from sales or business development, when assessing NDA risk level, or when deciding whether an NDA needs full counsel review.",src/lawvable-awesome-legal-skills/skills/nda-triage-anthropic/SKILL.md
odoo-sales-crm-expert,"Expert guide for Odoo Sales and CRM: pipeline stages, quotation templates, pricelists, sales teams, lead scoring, and forecasting.",src/antigravity-awesome-skills/plugins/antigravity-bundle-odoo-erp/skills/odoo-sales-crm-expert/SKILL.md
sales-automator,"Draft cold emails, follow-ups, and proposal templates. Creates pricing pages, case studies, and sales scripts. Use PROACTIVELY for sales outreach or lead nurturing.",src/antigravity-awesome-skills/skills/sales-automator/SKILL.md
value-prop-statements,"Generate value proposition statements for marketing, sales, and onboarding from existing value propositions. Use when writing marketing copy, creating sales messaging, or crafting onboarding messages.",src/pm-skills/pm-marketing-growth/skills/value-prop-statements/SKILL.md
salesforce-automation,"Automate Salesforce tasks via Rube MCP (Composio): leads, contacts, accounts, opportunities, SOQL queries. Always search tools first for current schemas.",src/antigravity-awesome-skills/skills/salesforce-automation/SKILL.md
