"id","description","path","triggers","src","primary_hub","assigned_hubs","match_score","is_primary"
"implementing-envelope-encryption-with-aws-kms","Envelope encryption is a strategy where data is encrypted with a data encryption key (DEK), and the DEK itself is encrypted with a master key (KEK) managed by AWS KMS. This approach allows encrypting","skill-manage/src/mukul975-Anthropic-Cybersecurity-Skills/skills/implementing-envelope-encryption-with-aws-kms/SKILL.md","implementing;envelope;encryption;with;aws","external:mukul975-Anthropic-Cybersecurity-Skills","business/product-strategy","business/product-strategy","7","true"
"implementing-mimecast-targeted-attack-protection","Deploy Mimecast Targeted Threat Protection including URL Protect, Attachment Protect, Impersonation Protect, and Internal Email Protect to defend against advanced phishing and spearphishing attacks.","skill-manage/src/mukul975-Anthropic-Cybersecurity-Skills/skills/implementing-mimecast-targeted-attack-protection/SKILL.md","implementing;mimecast;targeted;attack;protection","external:mukul975-Anthropic-Cybersecurity-Skills","business/product-strategy","business/product-strategy","5","true"
"implementing-ransomware-backup-strategy",">","skill-manage/src/mukul975-Anthropic-Cybersecurity-Skills/skills/implementing-ransomware-backup-strategy/SKILL.md","implementing;ransomware;backup;strategy","external:mukul975-Anthropic-Cybersecurity-Skills","business/product-strategy","business/product-strategy","7","true"
"incident-runbook-templates","Production-ready templates for incident response runbooks covering detection, triage, mitigation, resolution, and communication.","skill-manage/src/antigravity-awesome-skills/skills/incident-runbook-templates/SKILL.md","incident;runbook;templates","external:antigravity-awesome-skills","business/product-strategy","business/product-strategy","5","true"
"integrate-whatsapp","Connect WhatsApp to your product with Kapso: onboard customers with setup links, detect connections, receive events via webhooks, and send messages/templates/media. Also manage WhatsApp Flows (create/update/publish, data endpoints, encryption). Use when integrating WhatsApp end-to-end.","skill-manage/src/gokapso-agent-skills/skills/integrate-whatsapp/SKILL.md","integrate;whatsapp","external:gokapso-agent-skills","business/product-strategy","business/product-strategy","7","true"
"interview-script","Create a structured customer interview script with JTBD probing questions, warm-up, core exploration, and wrap-up sections. Follows The Mom Test principles — no leading questions, no pitching, focus on past behavior. Use when preparing for user interviews, creating interview guides, or planning discovery research.","skill-manage/src/pm-skills/pm-product-discovery/skills/interview-script/SKILL.md","interview;script","external:pm-skills","business/product-strategy","business/product-strategy","100","true"
"Job Description Analyzer","Analyze job postings, calculate match scores, identify gaps, and create application strategy","skill-manage/src/Paramchoudhary-ResumeSkills/.agents/skills/job-description-analyzer/SKILL.md","Job Description Analyzer","external:Paramchoudhary-ResumeSkills","business/product-strategy","business/product-strategy","7","true"
"jobs-to-be-done","Uncover customer jobs, pains, and gains in a structured JTBD format. Use when clarifying unmet needs, repositioning a product, or improving discovery and messaging.","skill-manage/src/Product-Manager-Skills/skills/jobs-to-be-done/SKILL.md","jobs;to;be;done","external:Product-Manager-Skills","business/product-strategy","business/product-strategy","13","true"
"launch-strategy","You are an expert in SaaS product launches and feature announcements. Your goal is to help users plan launches that build momentum, capture attention, and convert interest into users.","skill-manage/src/antigravity-awesome-skills/plugins/antigravity-bundle-startup-founder/skills/launch-strategy/SKILL.md","launch;strategy","external:antigravity-awesome-skills","business/product-strategy","business/product-strategy","11","true"
"lean-canvas","Generate a Lean Canvas with problem, solution, metrics, cost structure, UVP, unfair advantage, channels, segments, and revenue. Use when exploring a lean startup canvas, testing a business hypothesis, or modeling a new venture.","skill-manage/src/pm-skills/pm-product-strategy/skills/lean-canvas/SKILL.md","lean;canvas","external:pm-skills","business/product-strategy","business/product-strategy","100","true"
"manus","Delegate complex, long-running tasks to Manus AI agent for autonomous execution. Use when user says 'use manus', 'delegate to manus', 'send to manus', 'have manus do', 'ask manus', 'check manus sessions', or when tasks require deep web research, market analysis, product comparisons, stock analysis, competitive research, document generation, data analysis, or multi-step workflows that benefit from autonomous agent execution with parallel processing.","skill-manage/src/sanjay3290-ai-skills/skills/manus/SKILL.md","manus","external:sanjay3290-ai-skills","business/product-strategy","business/product-strategy","11","true"
"market-segments","Identify 3-5 potential customer segments with demographics, JTBD, and product fit analysis. Use when exploring market segments, identifying target audiences, evaluating new markets, or learning how to segment a market.","skill-manage/src/pm-skills/pm-market-research/skills/market-segments/SKILL.md","market;segments","external:pm-skills","business/product-strategy","business/product-strategy","11","true"
"metrics-dashboard","Define and design a product metrics dashboard with key metrics, data sources, visualization types, and alert thresholds. Use when creating a metrics dashboard, defining KPIs, setting up product analytics, or building a data monitoring plan.","skill-manage/src/pm-skills/pm-product-discovery/skills/metrics-dashboard/SKILL.md","metrics;dashboard","external:pm-skills","business/product-strategy","business/product-strategy","7","true"
"miles-rl-training","Provides guidance for enterprise-grade RL training using miles, a production-ready fork of slime. Use when training large MoE models with FP8/INT4, needing train-inference alignment, or requiring speculative RL for maximum throughput.","skill-manage/src/Orchestra-Research-AI-research-SKILLs/06-post-training/miles/SKILL.md","miles;rl;training","external:Orchestra-Research-AI-research-SKILLs","business/product-strategy","business/product-strategy","9","true"
"model-merging","Merge multiple fine-tuned models using mergekit to combine capabilities without retraining. Use when creating specialized models by blending domain-specific expertise (math + coding + chat), improving performance beyond single models, or experimenting rapidly with model variants. Covers SLERP, TIES-Merging, DARE, Task Arithmetic, linear merging, and production deployment strategies.","skill-manage/src/Orchestra-Research-AI-research-SKILLs/19-emerging-techniques/model-merging/SKILL.md","model;merging","external:Orchestra-Research-AI-research-SKILLs","business/product-strategy","business/product-strategy","5","true"
"monetization-strategy","Brainstorm 3-5 monetization strategies with audience fit, risks, and validation experiments. Use when exploring revenue models, evaluating pricing strategies, or deciding how to monetize a product.","skill-manage/src/pm-skills/pm-product-strategy/skills/monetization-strategy/SKILL.md","monetization;strategy","external:pm-skills","business/product-strategy","business/product-strategy","20","true"
"ocr-caching-strategy","ocr caching strategy","skill-manage/src/kreuzberg-dev-kreuzberg/.ai-rulez/domains/ocr-integration/skills/ocr-caching-strategy/SKILL.md","ocr;caching;strategy","external:kreuzberg-dev-kreuzberg","business/product-strategy","business/product-strategy","7","true"
"okx","Build Solana applications combining OKX DEX aggregation, token intelligence, and market data with Helius infrastructure. Covers DEX swaps (500+ liquidity sources), token discovery, smart money signals, meme token analysis, transaction submission via Sender, fee optimization, shred-level streaming via LaserStream, and wallet intelligence.","skill-manage/src/helius-labs-core-ai/helius-cursor/skills/okx/SKILL.md","okx","external:helius-labs-core-ai","business/product-strategy","business/product-strategy","5","true"
"onboarding-optimization","When the user wants to improve their app's onboarding experience, increase activation rate, reduce Day 1 drop-off, or optimize the first-run flow. Use when the user mentions ""onboarding"", ""first-run"", ""activation"", ""tutorial"", ""day 1 retention"", ""new user flow"", ""permission prompts"", ""sign-up conversion"", ""onboarding funnel"", or ""users dropping off early"". For overall retention strategy, see retention-optimization. For paywall placement, see monetization-strategy.","skill-manage/src/aso-skills/skills/onboarding-optimization/SKILL.md","onboarding;optimization","external:aso-skills","business/product-strategy","business/product-strategy","7","true"
"opportunity-solution-tree","Build an Opportunity Solution Tree (OST) to structure product discovery — map a desired outcome to opportunities, solutions, and experiments. Based on Teresa Torres' Continuous Discovery Habits. Use when structuring discovery work, mapping opportunities to solutions, or deciding what to build next.","skill-manage/src/pm-skills/pm-product-discovery/skills/opportunity-solution-tree/SKILL.md","opportunity;solution;tree","external:pm-skills","business/product-strategy","business/product-strategy","100","true"
"outcome-roadmap","Transform an output-focused roadmap into an outcome-focused one that communicates strategic intent. Rewrites initiatives as outcome statements reflecting user and business impacts. Use when shifting to outcome roadmaps, making a roadmap more strategic, or rewriting feature lists as outcomes.","skill-manage/src/pm-skills/pm-execution/skills/outcome-roadmap/SKILL.md","outcome;roadmap","external:pm-skills","business/product-strategy","business/product-strategy","7","true"
"outreach-specialist","Crafts high-converting outreach messages and email sequences for cold outreach, LinkedIn DMs, and follow-ups. Use when user needs personalized outreach messages that book calls and get replies.","skill-manage/src/founder-skills/skills/outreach-specialist/SKILL.md","outreach;specialist","external:founder-skills","business/product-strategy","business/product-strategy","5","true"
"paywall-upgrade-cro","You are an expert in in-app paywalls and upgrade flows. Your goal is to convert free users to paid, or upgrade users to higher tiers, at moments when they've experienced enough value to justify the commitment.","skill-manage/src/antigravity-awesome-skills/skills/paywall-upgrade-cro/SKILL.md","paywall;upgrade;cro","external:antigravity-awesome-skills","business/product-strategy","business/product-strategy","100","true"
"personal-tool-builder","You believe the best tools come from real problems. You've built dozens of personal tools - some stayed personal, others became products used by thousands. You know that building for yourself means you have perfect product-market fit with at least one user.","skill-manage/src/antigravity-awesome-skills/skills/personal-tool-builder/SKILL.md","personal;tool;builder","external:antigravity-awesome-skills","business/product-strategy","business/product-strategy","13","true"
"pol-probe","Define a Proof of Life probe to test a risky hypothesis cheaply. Use when you need harsh truth before building real product.","skill-manage/src/Product-Manager-Skills/skills/pol-probe/SKILL.md","pol;probe","external:Product-Manager-Skills","business/product-strategy","business/product-strategy","7","true"
"porters-five-forces","Perform Porter's Five Forces analysis — competitive rivalry, supplier power, buyer power, threat of substitutes, and threat of new entrants. Use when analyzing industry dynamics, assessing competitive forces, or evaluating market attractiveness.","skill-manage/src/pm-skills/pm-product-strategy/skills/porters-five-forces/SKILL.md","porters;five;forces","external:pm-skills","business/product-strategy","business/product-strategy","6","true"
"positioning-workshop","Run a positioning workshop that surfaces target customer, unmet need, category, benefits, and differentiation. Use when your product messaging feels fuzzy, generic, or misaligned.","skill-manage/src/Product-Manager-Skills/skills/positioning-workshop/SKILL.md","positioning;workshop","external:Product-Manager-Skills","business/product-strategy","business/product-strategy","15","true"
"prd-development","Build a structured PRD that connects problem, users, solution, and success criteria. Use when turning discovery notes into an engineering-ready document for a major initiative.","skill-manage/src/Product-Manager-Skills/skills/prd-development/SKILL.md","prd;development","external:Product-Manager-Skills","business/product-strategy","business/product-strategy","11","true"
"prd-generator","Generates professional PRD (Product Requirements Document) files optimized for AI coding tools. Takes a rough product idea, asks clarifying questions, and outputs a structured PDF ready to feed into AI coding assistants.","skill-manage/src/founder-skills/skills/prd-generator/SKILL.md","prd;generator","external:founder-skills","business/product-strategy","business/product-strategy","11","true"
"prd-to-issues","Break a PRD into independently-grabbable GitHub issues using tracer-bullet vertical slices. Use when user wants to convert a PRD to issues, create implementation tickets, or break down a PRD into work items.","skill-manage/src/mattpocock-skills/prd-to-issues/SKILL.md","prd;to;issues","external:mattpocock-skills","business/product-strategy","business/product-strategy","7","true"
"prd-to-plan","Turn a PRD into a multi-phase implementation plan using tracer-bullet vertical slices, saved as a local Markdown file in ./plans/. Use when user wants to break down a PRD, create an implementation plan, plan phases from a PRD, or mentions ""tracer bullets"".","skill-manage/src/mattpocock-skills/prd-to-plan/SKILL.md","prd;to;plan","external:mattpocock-skills","business/product-strategy","business/product-strategy","7","true"
"pre-mortem","Run a pre-mortem risk analysis on a PRD or launch plan. Categorizes risks as Tigers (real problems), Paper Tigers (overblown concerns), and Elephants (unspoken worries), then classifies as launch-blocking, fast-follow, or track. Use when preparing for launch, stress-testing a product plan, or identifying what could go wrong.","skill-manage/src/pm-skills/pm-execution/skills/pre-mortem/SKILL.md","pre;mortem","external:pm-skills","business/product-strategy","business/product-strategy","11","true"
"press-and-pr","When the user wants to get press coverage, media mentions, or editorial features for their app — including writing press releases, pitching journalists, getting on ""best apps"" lists, or building an app press kit. Use when the user mentions ""press"", ""PR"", ""media coverage"", ""TechCrunch"", ""journalist"", ""press release"", ""app press kit"", ""get featured in media"", ""editorial coverage"", ""review from a blogger"", or ""app launch announcement"". For Apple editorial featuring, see app-store-featured. For launch strategy, see app-launch.","skill-manage/src/aso-skills/skills/press-and-pr/SKILL.md","press;and;pr","external:aso-skills","business/product-strategy","business/product-strategy","7","true"
"press-release","Write an Amazon-style press release that defines customer value before building. Use when aligning stakeholders on a new product, feature, or strategic bet.","skill-manage/src/Product-Manager-Skills/skills/press-release/SKILL.md","press;release","external:Product-Manager-Skills","business/product-strategy","business/product-strategy","9","true"
"pricing-strategist","Builds comprehensive pricing strategies by reading business context and asking targeted questions interactively. Use when user needs pricing plans, tier structures, price points, pricing model recommendations, or any pricing-related strategy for their product or service.","skill-manage/src/founder-skills/skills/pricing-strategist/SKILL.md","pricing;strategist","external:founder-skills","business/product-strategy","business/product-strategy","11","true"
"prioritization-advisor","Choose a prioritization framework based on stage, team context, and stakeholder needs. Use when deciding between RICE, ICE, value/effort, or another scoring approach.","skill-manage/src/Product-Manager-Skills/skills/prioritization-advisor/SKILL.md","prioritization;advisor","external:Product-Manager-Skills","business/product-strategy","business/product-strategy","5","true"
"prioritize-assumptions","Prioritize assumptions using an Impact × Risk matrix and suggest experiments for each. Use when triaging a list of assumptions, deciding what to test first, or applying the assumption prioritization canvas.","skill-manage/src/pm-skills/pm-product-discovery/skills/prioritize-assumptions/SKILL.md","prioritize;assumptions","external:pm-skills","business/product-strategy","business/product-strategy","100","true"
"prioritize-features","Prioritize a backlog of feature ideas based on impact, effort, risk, and strategic alignment with top 5 recommendations. Use when prioritizing a feature backlog, making scope decisions, or ranking product ideas.","skill-manage/src/pm-skills/pm-product-discovery/skills/prioritize-features/SKILL.md","prioritize;features","external:pm-skills","business/product-strategy","business/product-strategy","11","true"
"problem-statement","Write a user-centered problem statement with who is blocked, what they are trying to do, why it matters, and how it feels. Use when framing discovery, prioritization, or a PRD.","skill-manage/src/Product-Manager-Skills/skills/problem-statement/SKILL.md","problem;statement","external:Product-Manager-Skills","business/product-strategy","business/product-strategy","15","true"
"product-hunt-launch-plan","Creates a comprehensive, personalized Product Hunt launch plan to rank #1. Use when user needs a step-by-step Product Hunt launch strategy, launch checklist, or wants to maximize their Product Hunt success.","skill-manage/src/founder-skills/skills/product-hunt-launch-plan/SKILL.md","product;hunt;launch;plan","external:founder-skills","business/product-strategy","business/product-strategy","13","true"
"production-code-audit","Autonomously deep-scan entire codebase line-by-line, understand architecture and patterns, then systematically transform it to production-grade, corporate-level professional quality with optimizations","skill-manage/src/antigravity-awesome-skills/skills/production-code-audit/SKILL.md","production;code;audit","external:antigravity-awesome-skills","business/product-strategy","business/product-strategy","5","true"
"product-manager-skills","PM skill for Claude Code, Codex, Cursor, and Windsurf. Diagnoses SaaS metrics, critiques PRDs, plans roadmaps, runs discovery, coaches PM career transitions, and pressure-tests AI product decisions. Six knowledge domains, 12 templates, 30+ frameworks, and an opinionated interaction style that labels assumptions and names tradeoffs.","skill-manage/src/Digidai-product-manager-skills/SKILL.md","product;manager;skills","external:Digidai-product-manager-skills","business/product-strategy","business/product-strategy","15","true"
"product-manager-toolkit","Essential tools and frameworks for modern product management, from discovery to delivery.","skill-manage/src/antigravity-awesome-skills/plugins/antigravity-bundle-startup-founder/skills/product-manager-toolkit/SKILL.md","product;manager;toolkit","external:antigravity-awesome-skills","business/product-strategy","business/product-strategy","11","true"
"product-name","Brainstorm 5 unique, memorable product names with rationale aligned to brand values and target audience. Use when naming a new product, rebranding, or exploring product name ideas.","skill-manage/src/pm-skills/pm-marketing-growth/skills/product-name/SKILL.md","product;name","external:pm-skills","business/product-strategy","business/product-strategy","11","true"
"product-strategy","Create a comprehensive product strategy using the 9-section Product Strategy Canvas — vision, segments, costs, value propositions, trade-offs, metrics, growth, capabilities, and defensibility. Use when building a product strategy, creating a strategic plan, or defining product direction.","skill-manage/src/pm-skills/pm-product-strategy/skills/product-strategy/SKILL.md","product;strategy","external:pm-skills","business/product-strategy","business/product-strategy","20","true"
"product-strategy-session","Run an end-to-end product strategy session across positioning, discovery, and roadmap planning. Use when a team needs validated direction before committing to execution.","skill-manage/src/Product-Manager-Skills/skills/product-strategy-session/SKILL.md","product;strategy;session","external:Product-Manager-Skills","business/product-strategy","business/product-strategy","28","true"
"product-vision","Brainstorm an inspiring, achievable, and emotional product vision that motivates teams and aligns stakeholders. Use when defining or refining a product vision, creating a vision statement, or aligning the team around a shared direction.","skill-manage/src/pm-skills/pm-product-strategy/skills/product-vision/SKILL.md","product;vision","external:pm-skills","business/product-strategy","business/product-strategy","22","true"
"proto-persona","Create a proto-persona from current research, market signals, and team knowledge. Use when you need a working customer profile before deeper validation.","skill-manage/src/Product-Manager-Skills/skills/proto-persona/SKILL.md","proto;persona","external:Product-Manager-Skills","business/product-strategy","business/product-strategy","13","true"
"recommendation-canvas","Evaluate an AI product idea across outcomes, hypotheses, risks, and positioning. Use when deciding whether an AI solution deserves investment or recommendation.","skill-manage/src/Product-Manager-Skills/skills/recommendation-canvas/SKILL.md","recommendation;canvas","external:Product-Manager-Skills","business/product-strategy","business/product-strategy","11","true"
"referral-program","You are an expert in viral growth and referral marketing with access to referral program data and third-party tools. Your goal is to help design and optimize programs that turn customers into growth engines.","skill-manage/src/antigravity-awesome-skills/skills/referral-program/SKILL.md","referral;program","external:antigravity-awesome-skills","business/product-strategy","business/product-strategy","100","true"
"release-notes","Generate user-facing release notes from tickets, PRDs, or changelogs. Creates clear, engaging summaries organized by category (new features, improvements, fixes). Use when writing release notes, creating changelogs, announcing product updates, or summarizing what shipped.","skill-manage/src/pm-skills/pm-execution/skills/release-notes/SKILL.md","release;notes","external:pm-skills","business/product-strategy","business/product-strategy","9","true"
"researchers-biographical","Researches personal backgrounds, interviews, motivations, and humanizing details. Use when research needs biographical context about people involved in the album's subject.","skill-manage/src/bitwize-music-studio-claude-ai-music-skills/skills/researchers-biographical/SKILL.md","researchers;biographical","external:bitwize-music-studio-claude-ai-music-skills","business/product-strategy","business/product-strategy","7","true"
"researchers-verifier","Performs quality control, citation validation, and fact-checking before human review. Use after research is complete to verify all sources and claims before production.","skill-manage/src/bitwize-music-studio-claude-ai-music-skills/skills/researchers-verifier/SKILL.md","researchers;verifier","external:bitwize-music-studio-claude-ai-music-skills","business/product-strategy","business/product-strategy","5","true"
"retention-optimization","When the user wants to reduce churn, improve user engagement, or increase lifetime value. Also use when the user mentions ""retention"", ""churn"", ""users leaving"", ""engagement"", ""DAU/MAU"", ""user activation"", or ""why are users uninstalling"". For onboarding-specific issues, see app-launch. For monetization, see monetization-strategy.","skill-manage/src/aso-skills/skills/retention-optimization/SKILL.md","retention;optimization","external:aso-skills","business/product-strategy","business/product-strategy","7","true"
"roadmap-planning","Plan a strategic roadmap across prioritization, epic definition, stakeholder alignment, and sequencing. Use when turning strategy into a release plan that teams can execute.","skill-manage/src/Product-Manager-Skills/skills/roadmap-planning/SKILL.md","roadmap;planning","external:Product-Manager-Skills","business/product-strategy","business/product-strategy","27","true"
"Salary Negotiation Prep","Research market rates, build negotiation strategy, and create counter-offer scripts","skill-manage/src/Paramchoudhary-ResumeSkills/skills/salary-negotiation-prep/SKILL.md","Salary Negotiation Prep","external:Paramchoudhary-ResumeSkills","business/product-strategy","business/product-strategy","11","true"
