"id","description","path","triggers","src","primary_hub","assigned_hubs","match_score","is_primary"
"ab-test-store-listing","When the user wants to A/B test App Store product page elements to improve conversion rate. Also use when the user mentions ""A/B test"", ""product page optimization"", ""test my screenshots"", ""test my icon"", ""conversion rate optimization"", ""CPP"", or ""custom product pages"". For screenshot design, see screenshot-optimization. For metadata optimization, see metadata-optimization.","skill-manage/src/aso-skills/skills/ab-test-store-listing/SKILL.md","ab;test;store;listing","external:aso-skills","business/product-strategy","business/product-strategy","7","true"
"acquisition-channel-advisor","Evaluate acquisition channels using unit economics, customer quality, and scalability. Use when deciding whether to scale, test, or kill a growth channel.","skill-manage/src/Product-Manager-Skills/skills/acquisition-channel-advisor/SKILL.md","acquisition;channel;advisor","external:Product-Manager-Skills","business/product-strategy","business/product-strategy","100","true"
"ai-shaped-readiness-advisor","Assess whether your product work is AI-first or AI-shaped. Use when evaluating AI maturity and choosing the next team capability to build.","skill-manage/src/Product-Manager-Skills/skills/ai-shaped-readiness-advisor/SKILL.md","ai;shaped;readiness;advisor","external:Product-Manager-Skills","business/product-strategy","business/product-strategy","7","true"
"ai-wrapper-product","You know AI wrappers get a bad rap, but the good ones solve real problems. You build products where AI is the engine, not the gimmick. You understand prompt engineering is product development. You balance costs with user experience. You create AI products people actually pay for and use daily.","skill-manage/src/antigravity-awesome-skills/skills/ai-wrapper-product/SKILL.md","ai;wrapper;product","external:antigravity-awesome-skills","business/product-strategy","business/product-strategy","7","true"
"analytics-product","Analytics de produto — PostHog, Mixpanel, eventos, funnels, cohorts, retencao, north star metric, OKRs e dashboards de produto.","skill-manage/src/antigravity-awesome-skills/skills/analytics-product/SKILL.md","analytics;product","external:antigravity-awesome-skills","business/product-strategy","business/product-strategy","7","true"
"analyze-feature-requests","Analyze and prioritize a list of feature requests by theme, strategic alignment, impact, effort, and risk. Use when reviewing customer feature requests, triaging a backlog, or making prioritization decisions.","skill-manage/src/pm-skills/pm-product-discovery/skills/analyze-feature-requests/SKILL.md","analyze;feature;requests","external:pm-skills","business/product-strategy","business/product-strategy","5","true"
"analyzing-typosquatting-domains-with-dnstwist","Detect typosquatting, homograph phishing, and brand impersonation domains using dnstwist to generate domain permutations and identify registered lookalike domains targeting your organization.","skill-manage/src/mukul975-Anthropic-Cybersecurity-Skills/skills/analyzing-typosquatting-domains-with-dnstwist/SKILL.md","analyzing;typosquatting;domains;with;dnstwist","external:mukul975-Anthropic-Cybersecurity-Skills","business/product-strategy","business/product-strategy","5","true"
"ansoff-matrix","Generate an Ansoff Matrix analysis mapping growth strategies across market penetration, market development, product development, and diversification. Use when considering growth options, planning market expansion, or evaluating strategic growth paths.","skill-manage/src/pm-skills/pm-product-strategy/skills/ansoff-matrix/SKILL.md","ansoff;matrix","external:pm-skills","business/product-strategy","business/product-strategy","16","true"
"apify-ecommerce","Extract product data, prices, reviews, and seller information from any e-commerce platform using Apify's E-commerce Scraping Tool.","skill-manage/src/antigravity-awesome-skills/skills/apify-ecommerce/SKILL.md","apify;ecommerce","external:antigravity-awesome-skills","business/product-strategy","business/product-strategy","7","true"
"apify-market-research","Analyze market conditions, geographic opportunities, pricing, consumer behavior, and product validation across Google Maps, Facebook, Instagram, Booking.com, and TripAdvisor.","skill-manage/src/antigravity-awesome-skills/skills/apify-market-research/SKILL.md","apify;market;research","external:antigravity-awesome-skills","business/product-strategy","business/product-strategy","11","true"
"app-analytics","When the user wants to set up, interpret, or improve their app analytics and tracking. Also use when the user mentions ""analytics"", ""tracking"", ""metrics"", ""KPIs"", ""App Store Connect analytics"", ""install tracking"", ""funnel"", ""attribution"", or ""how is my app performing"". For A/B testing, see ab-test-store-listing. For retention metrics, see retention-optimization.","skill-manage/src/aso-skills/skills/app-analytics/SKILL.md","app;analytics","external:aso-skills","business/product-strategy","business/product-strategy","100","true"
"app-icon-optimization","When the user wants to design, test, or improve their app icon to increase tap-through rate and conversions in App Store search and browse. Use when the user mentions ""app icon"", ""icon design"", ""icon A/B test"", ""icon variants"", ""tap-through rate"", ""icon conversion"", ""icon refresh"", or wants to know what makes a good app icon. For screenshot optimization, see screenshot-optimization. For full listing A/B tests, see ab-test-store-listing.","skill-manage/src/aso-skills/skills/app-icon-optimization/SKILL.md","app;icon;optimization","external:aso-skills","business/product-strategy","business/product-strategy","100","true"
"app-launch","When the user wants to plan a launch strategy for a new app or major update. Also use when the user mentions ""app launch"", ""launch plan"", ""launch checklist"", ""pre-launch"", ""launch day"", or ""how to launch my app"". For ongoing ASO after launch, see aso-audit. For paid acquisition during launch, see ua-campaign.","skill-manage/src/aso-skills/skills/app-launch/SKILL.md","app;launch","external:aso-skills","business/product-strategy","business/product-strategy","7","true"
"apple-search-ads","When the user wants to set up, optimize, or scale Apple Search Ads (ASA) campaigns — including keyword bidding, match types, campaign structure, Creative Product Sets, CPP routing, and ROAS optimization. Use when the user mentions ""Apple Search Ads"", ""ASA"", ""Search Ads"", ""Search tab ads"", ""Today tab ads"", ""CPT"", ""TTR"", ""Search Match"", ""exact match"", ""broad match"", ""CPP in ads"", ""ASA bidding"", or ""Search Ads budget"". For Meta/Google UAC/TikTok paid UA, see ua-campaign.","skill-manage/src/aso-skills/skills/apple-search-ads/SKILL.md","apple;search;ads","external:aso-skills","business/product-strategy","business/product-strategy","7","true"
"app-store-featured","When the user wants to get featured on the App Store or understand the editorial process. Also use when the user mentions ""get featured"", ""App Store editorial"", ""App of the Day"", ""Today tab"", ""Apple featuring"", or ""how to get Apple to feature my app"". For launch strategy, see app-launch. For ASO optimization, see aso-audit.","skill-manage/src/aso-skills/skills/app-store-featured/SKILL.md","app;store;featured","external:aso-skills","business/product-strategy","business/product-strategy","7","true"
"asc-metrics","When the user wants to analyze their own app's actual performance data from App Store Connect — real downloads, revenue, IAP, subscriptions, trials, or country breakdowns synced via Appeeky Connect. Use when the user asks about ""my downloads"", ""my revenue"", ""how is my app performing"", ""ASC data"", ""sales and trends"", ""my subscription numbers"", ""App Store Connect metrics"", or wants to compare periods or top markets. For third-party app estimates, see app-analytics. For subscription analytics depth, see monetization-strategy.","skill-manage/src/aso-skills/skills/asc-metrics/SKILL.md","asc;metrics","external:aso-skills","business/product-strategy","business/product-strategy","9","true"
"auri-core","Auri: assistente de voz inteligente (Alexa + Claude claude-opus-4-20250805). Visao do produto, persona Vitoria Neural, stack AWS, modelo Free/Pro/Business/Enterprise, roadmap 4 fases, GTM, north star WAC e analise competitiva.","skill-manage/src/antigravity-awesome-skills/skills/auri-core/SKILL.md","auri;core","external:antigravity-awesome-skills","business/product-strategy","business/product-strategy","11","true"
"azure-diagnostics","Debug Azure production issues on Azure using AppLens, Azure Monitor, resource health, and safe triage. WHEN: debug production issues, troubleshoot container apps, troubleshoot functions, troubleshoot AKS, kubectl cannot connect, kube-system/CoreDNS failures, pod pending, crashloop, node not ready, upgrade failures, analyze logs, KQL, insights, image pull failures, cold start issues, health probe failures, resource health, root cause of errors.","skill-manage/src/microsoft-skills/.github/plugins/azure-skills/skills/azure-diagnostics/SKILL.md","azure;diagnostics","external:microsoft-skills","business/product-strategy","business/product-strategy","5","true"
"backend-dev-guidelines","You are a senior backend engineer operating production-grade services under strict architectural and reliability constraints. Use when routes, controllers, services, repositories, express middleware, or prisma database access.","skill-manage/src/antigravity-awesome-skills/plugins/antigravity-bundle-full-stack-developer/skills/backend-dev-guidelines/SKILL.md","backend;dev;guidelines","external:antigravity-awesome-skills","business/product-strategy","business/product-strategy","5","true"
"backtesting-frameworks","Build robust, production-grade backtesting systems that avoid common pitfalls and produce reliable strategy performance estimates.","skill-manage/src/antigravity-awesome-skills/skills/backtesting-frameworks/SKILL.md","backtesting;frameworks","external:antigravity-awesome-skills","business/product-strategy","business/product-strategy","9","true"
"beachhead-segment","Identify the first beachhead market segment for a product launch. Evaluates segments against burning pain, willingness to pay, winnable market share, and referral potential. Use when choosing a first market, targeting an initial customer segment, or planning market entry strategy.","skill-manage/src/pm-skills/pm-go-to-market/skills/beachhead-segment/SKILL.md","beachhead;segment","external:pm-skills","business/product-strategy","business/product-strategy","15","true"
"blog-writing-guide","This skill enforces Sentry's blog writing standards across every post — whether you're helping an engineer write their first blog post or a marketer draft a product announcement.","skill-manage/src/antigravity-awesome-skills/skills/blog-writing-guide/SKILL.md","blog;writing;guide","external:antigravity-awesome-skills","business/product-strategy","business/product-strategy","9","true"
"brainstorm-experiments-existing","Design experiments to test assumptions for an existing product — prototypes, A/B tests, spikes, and other low-effort validation methods. Use when validating assumptions, testing feature ideas cheaply, or planning product experiments.","skill-manage/src/pm-skills/pm-product-discovery/skills/brainstorm-experiments-existing/SKILL.md","brainstorm;experiments;existing","external:pm-skills","business/product-strategy","business/product-strategy","100","true"
"brainstorm-experiments-new","Design lean startup experiments (pretotypes) for a new product. Creates XYZ hypotheses and suggests low-effort validation methods like landing pages, explainer videos, and pre-orders. Use when validating a new product idea, creating pretotypes, or testing market demand.","skill-manage/src/pm-skills/pm-product-discovery/skills/brainstorm-experiments-new/SKILL.md","brainstorm;experiments;new","external:pm-skills","business/product-strategy","business/product-strategy","15","true"
"brainstorm-ideas-existing","Brainstorm product ideas for an existing product using multi-perspective ideation from PM, Designer, and Engineer viewpoints. Use when generating new feature ideas, brainstorming solutions for an identified opportunity, or ideating with a product trio.","skill-manage/src/pm-skills/pm-product-discovery/skills/brainstorm-ideas-existing/SKILL.md","brainstorm;ideas;existing","external:pm-skills","business/product-strategy","business/product-strategy","15","true"
"brainstorm-ideas-new","Brainstorm feature ideas for a new product in initial discovery from PM, Designer, and Engineer perspectives. Use when starting product discovery for a new product, exploring features for a startup idea, or doing initial ideation.","skill-manage/src/pm-skills/pm-product-discovery/skills/brainstorm-ideas-new/SKILL.md","brainstorm;ideas;new","external:pm-skills","business/product-strategy","business/product-strategy","15","true"
"brainstorm-okrs","Brainstorm team-level OKRs aligned with company objectives — qualitative objectives with measurable key results. Use when setting quarterly OKRs, aligning team goals with company strategy, drafting objectives, or learning how to write effective OKRs.","skill-manage/src/pm-skills/pm-execution/skills/brainstorm-okrs/SKILL.md","brainstorm;okrs","external:pm-skills","business/product-strategy","business/product-strategy","11","true"
"brand-copywriter","Writes marketing copy using proven copywriting frameworks. Use when user needs copy for ads (Facebook, Instagram, TikTok, YouTube), landing pages, sales pages, email sequences, LinkedIn posts, product descriptions, or any marketing content.","skill-manage/src/founder-skills/skills/brand-copywriter/SKILL.md","brand;copywriter","external:founder-skills","business/product-strategy","business/product-strategy","9","true"
"c4-context","Expert C4 Context-level documentation specialist. Creates high-level system context diagrams, documents personas, user journeys, system features, and external dependencies.","skill-manage/src/antigravity-awesome-skills/skills/c4-context/SKILL.md","c4;context","external:antigravity-awesome-skills","business/product-strategy","business/product-strategy","5","true"
"characteristic-voice","Use this skill whenever the user wants speech to sound more human, companion-like, or emotionally expressive. Triggers include: any mention of 'say like', 'talk like', 'speak like', 'companion voice', 'comfort me', 'cheer me up', 'sound more human', 'good night voice', 'good morning voice', or requests to add fillers, emotion, or personality to generated speech. Also use when the user wants to mimic a specific character's voice, apply speaking style presets (goodnight, morning, comfort, celebration, chatting), tune emotional parameters like warmth or tenderness, or make TTS output feel like a real person talking. If the user asks for a 'voice message', 'companion audio', 'character voice', or wants speech that sighs, laughs, hesitates, or sounds genuinely warm, use this skill. Do NOT use for plain text-to-speech without personality, music generation, sound effects, or general coding tasks unrelated to expressive speech.","skill-manage/src/NoizAI-skills/skills/characteristic-voice/SKILL.md","characteristic;voice","external:NoizAI-skills","business/product-strategy","business/product-strategy","5","true"
"cold-outreach-sequence","Build personalized cold outreach sequences for LinkedIn and email. Use when someone needs to reach prospects, warm up cold leads, or build a systematic outreach engine. Covers research, connection requests, follow-ups, and conversion.","skill-manage/src/ai-marketing-skills/cold-outreach-sequence/SKILL.md","cold;outreach;sequence","external:ai-marketing-skills","business/product-strategy","business/product-strategy","5","true"
"company-research","Create a company research brief with executive quotes, product strategy, and org context. Use when preparing for interviews, competitive analysis, partnerships, or market-entry work.","skill-manage/src/Product-Manager-Skills/skills/company-research/SKILL.md","company;research","external:Product-Manager-Skills","business/product-strategy","business/product-strategy","17","true"
"conventions","Skill extracted from C:\Users\ASUS\production\skill-manage\src\ethos-link-rails-conventions\skills\conventions\SKILL.md","skill-manage/src/ethos-link-rails-conventions/skills/conventions/SKILL.md","conventions","external:ethos-link-rails-conventions","business/product-strategy","business/product-strategy","5","true"
"Cover Letter Generator","Create personalized, compelling cover letters from resume and job description","skill-manage/src/Paramchoudhary-ResumeSkills/skills/cover-letter-generator/SKILL.md","Cover Letter Generator","external:Paramchoudhary-ResumeSkills","business/product-strategy","business/product-strategy","5","true"
"create-prd","Create a Product Requirements Document using a comprehensive 8-section template covering problem, objectives, segments, value propositions, solution, and release planning. Use when writing a PRD, documenting product requirements, preparing a feature spec, or reviewing an existing PRD.","skill-manage/src/pm-skills/pm-execution/skills/create-prd/SKILL.md","create;prd","external:pm-skills","business/product-strategy","business/product-strategy","11","true"
"customer-journey-map","Create an end-to-end customer journey map with stages, touchpoints, emotions, pain points, and opportunities. Use when mapping the customer experience, identifying friction points, improving onboarding, or visualizing the user journey.","skill-manage/src/pm-skills/pm-market-research/skills/customer-journey-map/SKILL.md","customer;journey;map","external:pm-skills","business/product-strategy","business/product-strategy","5","true"
"customer-journey-mapping-workshop","Run a customer journey mapping workshop with adaptive questions and outputs. Use when you need to map stages, actions, emotions, pain points, and opportunities for a persona and scenario.","skill-manage/src/Product-Manager-Skills/skills/customer-journey-mapping-workshop/SKILL.md","customer;journey;mapping;workshop","external:Product-Manager-Skills","business/product-strategy","business/product-strategy","13","true"
"deployment-procedures","Production deployment principles and decision-making. Safe deployment workflows, rollback strategies, and verification. Teaches thinking, not scripts.","skill-manage/src/antigravity-awesome-skills/skills/deployment-procedures/SKILL.md","deployment;procedures","external:antigravity-awesome-skills","business/product-strategy","business/product-strategy","5","true"
"design-spells","Curated micro-interactions and design details that add ""magic"" and personality to websites and apps.","skill-manage/src/antigravity-awesome-skills/skills/design-spells/SKILL.md","design;spells","external:antigravity-awesome-skills","business/product-strategy","business/product-strategy","5","true"
"discord-bot-architect","Specialized skill for building production-ready Discord bots. Covers Discord.js (JavaScript) and Pycord (Python), gateway intents, slash commands, interactive components, rate limiting, and sharding.","skill-manage/src/antigravity-awesome-skills/skills/discord-bot-architect/SKILL.md","discord;bot;architect","external:antigravity-awesome-skills","business/product-strategy","business/product-strategy","5","true"
"discovery-interview-prep","Plan customer discovery interviews with the right goal, segment, constraints, and method. Use when preparing interviews for problem validation, churn research, or new product ideas.","skill-manage/src/Product-Manager-Skills/skills/discovery-interview-prep/SKILL.md","discovery;interview;prep","external:Product-Manager-Skills","business/product-strategy","business/product-strategy","15","true"
"distributed-debugging-debug-trace","You are a debugging expert specializing in setting up comprehensive debugging environments, distributed tracing, and diagnostic tools. Configure debugging workflows, implement tracing solutions, and establish troubleshooting practices for development and production environments.","skill-manage/src/antigravity-awesome-skills/skills/distributed-debugging-debug-trace/SKILL.md","distributed;debugging;debug;trace","external:antigravity-awesome-skills","business/product-strategy","business/product-strategy","5","true"
"dummy-dataset","Generate realistic dummy datasets for testing with customizable columns, constraints, and output formats (CSV, JSON, SQL, Python script). Use when creating test data, building mock datasets, or generating sample data for development and demos.","skill-manage/src/pm-skills/pm-execution/skills/dummy-dataset/SKILL.md","dummy;dataset","external:pm-skills","business/product-strategy","business/product-strategy","100","true"
"eol-message","Write a clear, empathetic EOL announcement with rationale, customer impact, and next steps. Use when retiring a product, feature, or plan without creating avoidable confusion.","skill-manage/src/Product-Manager-Skills/skills/eol-message/SKILL.md","eol;message","external:Product-Manager-Skills","business/product-strategy","business/product-strategy","7","true"
"epic-hypothesis","Frame an epic as a testable hypothesis with target user, expected outcome, and validation method. Use when defining a major initiative before roadmap, discovery, or delivery planning.","skill-manage/src/Product-Manager-Skills/skills/epic-hypothesis/SKILL.md","epic;hypothesis","external:Product-Manager-Skills","business/product-strategy","business/product-strategy","15","true"
"executive-onboarding-playbook","Plan a VP or CPO 30-60-90 day diagnostic onboarding path. Use when entering a new executive product role and avoiding premature change.","skill-manage/src/Product-Manager-Skills/skills/executive-onboarding-playbook/SKILL.md","executive;onboarding;playbook","external:Product-Manager-Skills","business/product-strategy","business/product-strategy","7","true"
"exploiting-constrained-delegation-abuse","Exploit Kerberos Constrained Delegation misconfigurations in Active Directory to impersonate privileged users via S4U2self and S4U2proxy extensions for lateral movement and privilege escalation.","skill-manage/src/mukul975-Anthropic-Cybersecurity-Skills/skills/exploiting-constrained-delegation-abuse/SKILL.md","exploiting;constrained;delegation;abuse","external:mukul975-Anthropic-Cybersecurity-Skills","business/product-strategy","business/product-strategy","5","true"
"feature-investment-advisor","Evaluate feature investments using revenue impact, cost structure, ROI, and strategy. Use when deciding whether a feature deserves investment.","skill-manage/src/Product-Manager-Skills/skills/feature-investment-advisor/SKILL.md","feature;investment;advisor","external:Product-Manager-Skills","business/product-strategy","business/product-strategy","7","true"
"go-to-market-plan","Analyzes the founder's business context to deliver 3 best go-to-market strategies tailored to their current stage, product, and market. Asks up to 10 diagnostic questions when needed to understand product readiness, target market clarity, competitive positioning, and distribution channels. Use when user needs go-to-market strategy, launch planning, market entry strategy, or actionable GTM roadmap.","skill-manage/src/founder-skills/skills/go-to-market-plan/SKILL.md","go;to;market;plan","external:founder-skills","business/product-strategy","business/product-strategy","23","true"
"growth-loops","Identify growth loops (flywheels) for sustainable traction. Evaluates 5 loop types: Viral, Usage, Collaboration, User-Generated, and Referral. Use when designing growth mechanisms, building product-led traction, or understanding how growth loops work.","skill-manage/src/pm-skills/pm-go-to-market/skills/growth-loops/SKILL.md","growth;loops","external:pm-skills","business/product-strategy","business/product-strategy","7","true"
"helius-okx","Build Solana applications combining OKX DEX aggregation, token intelligence, and market data with Helius infrastructure. Covers DEX swaps (500+ liquidity sources), token discovery, smart money signals, meme token analysis, transaction submission via Sender, fee optimization, shred-level streaming via LaserStream, and wallet intelligence.","skill-manage/src/helius-labs-core-ai/helius-skills/helius-okx/SKILL.md","helius;okx","external:helius-labs-core-ai","business/product-strategy","business/product-strategy","5","true"
"identify-assumptions-existing","Identify risky assumptions for a feature idea in an existing product across Value, Usability, Viability, and Feasibility. Uses multi-perspective devil's advocate thinking. Use when stress-testing a feature idea, doing risk assessment, or preparing for assumption mapping.","skill-manage/src/pm-skills/pm-product-discovery/skills/identify-assumptions-existing/SKILL.md","identify;assumptions;existing","external:pm-skills","business/product-strategy","business/product-strategy","100","true"
"identify-assumptions-new","Identify risky assumptions for a new product idea across 8 risk categories including Go-to-Market, Strategy, and Team. Use when evaluating startup risks, assessing a new product concept, or mapping assumptions for a new venture.","skill-manage/src/pm-skills/pm-product-discovery/skills/identify-assumptions-new/SKILL.md","identify;assumptions;new","external:pm-skills","business/product-strategy","business/product-strategy","100","true"
