"id","description","path","triggers","src","primary_hub","assigned_hubs","match_score","is_primary"
"sales-enablement","When the user wants to create sales collateral, pitch decks, one-pagers, objection handling docs, or demo scripts. Also use when the user mentions 'sales deck,' 'pitch deck,' 'one-pager,' 'leave-behind,' 'objection handling,' 'deal-specific ROI analysis,' 'demo script,' 'talk track,' 'sales playbook,' 'proposal template,' 'buyer persona card,' 'help my sales team,' 'sales materials,' or 'what should I give my sales reps.' Use this for any document or asset that helps a sales team close deals. For competitor comparison pages and battle cards, see competitor-alternatives. For marketing website copy, see copywriting. For cold outreach emails, see cold-email.","skill-manage/src/marketingskills/skills/sales-enablement/SKILL.md","sales;enablement","external:marketingskills","business/product-strategy","business/product-strategy","9","true"
"screenshot-optimization","When the user wants to design, optimize, or evaluate App Store screenshots and preview videos. Also use when the user mentions ""screenshots"", ""app preview"", ""product page design"", ""screenshot design"", ""creative assets"", or ""what should my screenshots show"". For A/B testing screenshots, see ab-test-store-listing. For full ASO audit, see aso-audit.","skill-manage/src/aso-skills/skills/screenshot-optimization/SKILL.md","screenshot;optimization","external:aso-skills","business/product-strategy","business/product-strategy","100","true"
"screenshots","Generate marketing screenshots of your app using Playwright. Use when the user wants to create screenshots for Product Hunt, social media, landing pages, or documentation.","skill-manage/src/antigravity-awesome-skills/skills/screenshots/SKILL.md","screenshots","external:antigravity-awesome-skills","business/product-strategy","business/product-strategy","9","true"
"seasonal-aso","When the user wants to optimize their App Store listing for seasonal events, holidays, or trending moments — including keyword opportunities, metadata updates, screenshot theming, and timing strategy. Use when the user mentions ""seasonal"", ""holiday"", ""Christmas"", ""New Year"", ""Valentine's Day"", ""summer"", ""back to school"", ""seasonal keywords"", ""trending now"", ""limited time"", or wants to capitalize on a calendar event. For general keyword research, see keyword-research. For full metadata rewrites, see metadata-optimization.","skill-manage/src/aso-skills/skills/seasonal-aso/SKILL.md","seasonal;aso","external:aso-skills","business/product-strategy","business/product-strategy","7","true"
"sentiment-analysis","Analyze user feedback data to identify segments with sentiment scores, JTBD, and product satisfaction insights. Use when analyzing user feedback at scale, running sentiment analysis on reviews or surveys, or identifying satisfaction patterns.","skill-manage/src/pm-skills/pm-market-research/skills/sentiment-analysis/SKILL.md","sentiment;analysis","external:pm-skills","business/product-strategy","business/product-strategy","7","true"
"server-management","Server management principles and decision-making. Process management, monitoring strategy, and scaling decisions. Teaches thinking, not commands.","skill-manage/src/antigravity-awesome-skills/skills/server-management/SKILL.md","server;management","external:antigravity-awesome-skills","business/product-strategy","business/product-strategy","7","true"
"startup-canvas","Generate a Startup Canvas combining Product Strategy (9 sections) and Business Model (costs + revenue) for a new product. An alternative to BMC and Lean Canvas that separates strategy from business model. Use when launching a new product or evaluating a startup concept.","skill-manage/src/pm-skills/pm-product-strategy/skills/startup-canvas/SKILL.md","startup;canvas","external:pm-skills","business/product-strategy","business/product-strategy","16","true"
"summarize-interview","Summarize a customer interview transcript into a structured template with JTBD, satisfaction signals, and action items. Use when processing interview recordings or transcripts, synthesizing discovery interviews, or creating interview summaries.","skill-manage/src/pm-skills/pm-product-discovery/skills/summarize-interview/SKILL.md","summarize;interview","external:pm-skills","business/product-strategy","business/product-strategy","5","true"
"swot-analysis","Perform a detailed SWOT analysis — strengths, weaknesses, opportunities, and threats with actionable recommendations. Use when doing strategic assessment, competitive analysis, or evaluating a product or business position.","skill-manage/src/pm-skills/pm-product-strategy/skills/swot-analysis/SKILL.md","swot;analysis","external:pm-skills","business/product-strategy","business/product-strategy","12","true"
"tam-sam-som-calculator","Calculate TAM, SAM, and SOM with explicit assumptions, methods, and caveats. Use when sizing a market for a product idea, business case, or executive review.","skill-manage/src/Product-Manager-Skills/skills/tam-sam-som-calculator/SKILL.md","tam;sam;som;calculator","external:Product-Manager-Skills","business/product-strategy","business/product-strategy","11","true"
"test-scenarios","Create comprehensive test scenarios from user stories with test objectives, starting conditions, user roles, step-by-step actions, and expected outcomes. Use when writing QA test cases, creating test plans, defining acceptance tests, or preparing for feature validation.","skill-manage/src/pm-skills/pm-execution/skills/test-scenarios/SKILL.md","test;scenarios","external:pm-skills","business/product-strategy","business/product-strategy","100","true"
"user-personas","Create refined user personas from research data — 3 personas with JTBD, pains, gains, and unexpected insights. Use when building personas from survey data, creating user profiles from research, or segmenting users for product decisions.","skill-manage/src/pm-skills/pm-market-research/skills/user-personas/SKILL.md","user;personas","external:pm-skills","business/product-strategy","business/product-strategy","9","true"
"user-stories","Create user stories following the 3 C's (Card, Conversation, Confirmation) and INVEST criteria with descriptions, design links, and acceptance criteria. Use when writing user stories, breaking down features into backlog items, or defining acceptance criteria.","skill-manage/src/pm-skills/pm-execution/skills/user-stories/SKILL.md","user;stories","external:pm-skills","business/product-strategy","business/product-strategy","5","true"
"user-story","Create user stories with Mike Cohn format and Gherkin acceptance criteria. Use when turning user needs into development-ready work with clear outcomes and testable conditions.","skill-manage/src/Product-Manager-Skills/skills/user-story/SKILL.md","user;story","external:Product-Manager-Skills","business/product-strategy","business/product-strategy","100","true"
"user-story-mapping","Create a user story map that lays out activities, steps, tasks, and release slices. Use when planning a workflow, backlog, or MVP around the user journey.","skill-manage/src/Product-Manager-Skills/skills/user-story-mapping/SKILL.md","user;story;mapping","external:Product-Manager-Skills","business/product-strategy","business/product-strategy","100","true"
"user-story-mapping-workshop","Run a user story mapping workshop with adaptive questions and a structured map output. Use when you need backbone activities, tasks, and release slices for a workflow.","skill-manage/src/Product-Manager-Skills/skills/user-story-mapping-workshop/SKILL.md","user;story;mapping;workshop","external:Product-Manager-Skills","business/product-strategy","business/product-strategy","100","true"
"value-proposition","Design a detailed value proposition using a 6-part JTBD template — Who, Why, What before, How, What after, Alternatives. Use when creating a value proposition, analyzing customer value delivery, or articulating why customers should choose your product.","skill-manage/src/pm-skills/pm-product-strategy/skills/value-proposition/SKILL.md","value;proposition","external:pm-skills","business/product-strategy","business/product-strategy","12","true"
"vizcom","AI-powered product design tool for transforming sketches into full-fidelity 3D renders.","skill-manage/src/antigravity-awesome-skills/skills/vizcom/SKILL.md","vizcom","external:antigravity-awesome-skills","business/product-strategy","business/product-strategy","7","true"
"vp-cpo-readiness-advisor","Guide the transition to VP or CPO across preparing, interviewing, landing, and recalibrating. Use when executive product scope is changing fast.","skill-manage/src/Product-Manager-Skills/skills/vp-cpo-readiness-advisor/SKILL.md","vp;cpo;readiness;advisor","external:Product-Manager-Skills","business/product-strategy","business/product-strategy","9","true"
"workshop-facilitation","Facilitate workshop sessions in a one-step, multi-turn flow. Use when an interactive skill needs consistent pacing, options, and progress tracking.","skill-manage/src/Product-Manager-Skills/skills/workshop-facilitation/SKILL.md","workshop;facilitation","external:Product-Manager-Skills","business/product-strategy","business/product-strategy","7","true"
"write-a-prd","Create a PRD through user interview, codebase exploration, and module design, then submit as a GitHub issue. Use when user wants to write a PRD, create a product requirements document, or plan a new feature.","skill-manage/src/mattpocock-skills/write-a-prd/SKILL.md","write;a;prd","external:mattpocock-skills","business/product-strategy","business/product-strategy","15","true"
"wwas","Create product backlog items in Why-What-Acceptance format — independent, valuable, testable items with strategic context. Use when writing structured backlog items, breaking features into work items, or using the WWA format.","skill-manage/src/pm-skills/pm-execution/skills/wwas/SKILL.md","wwas","external:pm-skills","business/product-strategy","business/product-strategy","7","true"
