skill_id,description,src_path
performing-entitlement-review-with-sailpoint-iiq,"Performs entitlement review and access certification campaigns using SailPoint IdentityIQ including manager certifications, targeted entitlement reviews, role-based access validation, SOD violation remediation, and automated revocation workflows. Activates for requests involving access reviews, entitlement certifications, SailPoint IIQ governance, or periodic user access recertification.",lib/mukul975-anthropic-cybersecurity-skills/skills/performing-entitlement-review-with-sailpoint-iiq/SKILL.md
performing-lateral-movement-detection,"Detects lateral movement techniques including Pass-the-Hash, PsExec, WMI execution, RDP pivoting, and SMB-based spreading using SIEM correlation of Windows event logs, network flow data, and endpoint telemetry mapped to MITRE ATT&CK Lateral Movement (TA0008) techniques.",lib/mukul975-anthropic-cybersecurity-skills/skills/performing-lateral-movement-detection/SKILL.md
performing-malware-persistence-investigation,Systematically investigate all persistence mechanisms on Windows and Linux systems to identify how malware survives reboots and maintains access.,lib/mukul975-anthropic-cybersecurity-skills/skills/performing-malware-persistence-investigation/SKILL.md
performing-malware-triage-with-yara,"Performs rapid malware triage and classification using YARA rules to match file patterns, strings, byte sequences, and structural characteristics against known malware families and suspicious indicators. Covers rule writing, scanning, and integration with analysis pipelines. Activates for requests involving YARA rule creation, malware classification, pattern matching, sample triage, or signature-based detection.",lib/mukul975-anthropic-cybersecurity-skills/skills/performing-malware-triage-with-yara/SKILL.md
performing-memory-forensics-with-volatility3,"Analyze volatile memory dumps using Volatility 3 to extract running processes, network connections, loaded modules, and evidence of malicious activity.",lib/mukul975-anthropic-cybersecurity-skills/skills/performing-memory-forensics-with-volatility3/SKILL.md
performing-network-forensics-with-wireshark,"Capture and analyze network traffic using Wireshark and tshark to reconstruct network events, extract artifacts, and identify malicious communications.",lib/mukul975-anthropic-cybersecurity-skills/skills/performing-network-forensics-with-wireshark/SKILL.md
performing-network-packet-capture-analysis,"Perform forensic analysis of network packet captures (PCAP/PCAPNG) using Wireshark, tshark, and tcpdump to reconstruct network communications, extract transferred files, identify malicious traffic, and establish evidence of data exfiltration or command-and-control activity.",lib/mukul975-anthropic-cybersecurity-skills/skills/performing-network-packet-capture-analysis/SKILL.md
performing-network-traffic-analysis-with-tshark,"Automate network traffic analysis using tshark and pyshark for protocol statistics, suspicious flow detection, DNS anomaly identification, and IOC extraction from PCAP files",lib/mukul975-anthropic-cybersecurity-skills/skills/performing-network-traffic-analysis-with-tshark/SKILL.md
performing-nist-csf-maturity-assessment,"The NIST Cybersecurity Framework (CSF) 2.0, released in February 2024, provides a comprehensive taxonomy for managing cybersecurity risk through six core Functions - Govern, Identify, Protect, Detect, Respond, and Recover. This skill covers conducting a maturity assessment against the CSF using Implementation Tiers to measure organizational cybersecurity posture and create improvement roadmaps.",lib/mukul975-anthropic-cybersecurity-skills/skills/performing-nist-csf-maturity-assessment/SKILL.md
performing-privacy-impact-assessment,"Automates the Privacy Impact Assessment (PIA) workflow including data flow mapping, privacy risk scoring matrices, GDPR Article 35 DPIA and CCPA/CPRA alignment checks, data inventory cataloging, and remediation tracking. Implements the NIST Privacy Framework PRAM methodology and ICO DPIA guidance for systematic identification and mitigation of privacy risks across processing activities. Use when conducting privacy assessments for new systems, evaluating regulatory compliance posture, or building automated privacy governance programs.",lib/mukul975-anthropic-cybersecurity-skills/skills/performing-privacy-impact-assessment/SKILL.md
performing-service-account-credential-rotation,"Automate credential rotation for service accounts across Active Directory, cloud platforms, and application databases to eliminate stale secrets and reduce compromise risk.",lib/mukul975-anthropic-cybersecurity-skills/skills/performing-service-account-credential-rotation/SKILL.md
performing-static-malware-analysis-with-pe-studio,"Performs static analysis of Windows PE (Portable Executable) malware samples using PEStudio to examine file headers, imports, strings, resources, and indicators without executing the binary. Identifies suspicious characteristics including packing, anti-analysis techniques, and malicious imports. Activates for requests involving static malware analysis, PE file inspection, Windows executable analysis, or pre-execution malware triage.",lib/mukul975-anthropic-cybersecurity-skills/skills/performing-static-malware-analysis-with-pe-studio/SKILL.md
performing-steganography-detection,"Detect and extract hidden data embedded in images, audio, and other media files using steganalysis tools to uncover covert communication channels.",lib/mukul975-anthropic-cybersecurity-skills/skills/performing-steganography-detection/SKILL.md
performing-timeline-reconstruction-with-plaso,"Build comprehensive forensic super-timelines using Plaso (log2timeline) to correlate events across file systems, logs, and artifacts into a unified chronological view.",lib/mukul975-anthropic-cybersecurity-skills/skills/performing-timeline-reconstruction-with-plaso/SKILL.md
performing-windows-artifact-analysis-with-eric-zimmerman-tools,"Perform comprehensive Windows forensic artifact analysis using Eric Zimmerman's open-source EZ Tools suite including KAPE, MFTECmd, PECmd, LECmd, JLECmd, and Timeline Explorer for parsing registry hives, prefetch files, event logs, and file system metadata.",lib/mukul975-anthropic-cybersecurity-skills/skills/performing-windows-artifact-analysis-with-eric-zimmerman-tools/SKILL.md
perplexity-search,"Perform AI-powered web searches with real-time information using Perplexity models via LiteLLM and OpenRouter. This skill should be used when conducting web searches for current information, finding recent scientific literature, getting grounded answers with source citations, or accessing information beyond the model knowledge cutoff. Provides access to multiple Perplexity models including Sonar Pro, Sonar Pro Search (advanced agentic search), and Sonar Reasoning Pro through a single OpenRouter API key.",lib/k-dense-ai-claude-scientific-skills/scientific-skills/perplexity-search/SKILL.md
personal-tool-builder,"You believe the best tools come from real problems. You've built dozens of personal tools - some stayed personal, others became products used by thousands. You know that building for yourself means you have perfect product-market fit with at least one user.",lib/sickn33-antigravity-awesome-skills/plugins/antigravity-awesome-skills-claude/skills/personal-tool-builder/SKILL.md
pestle-analysis,"Perform a PESTLE analysis covering Political, Economic, Social, Technological, Legal, and Environmental factors. Use when assessing the macro environment, doing strategic planning, or evaluating external factors affecting your business.",lib/phuryn-pm-skills/pm-product-strategy/skills/pestle-analysis/SKILL.md
phase-gated-debugging,Use when debugging any bug. Enforces a 5-phase protocol where code edits are blocked until root cause is confirmed. Prevents premature fix attempts.,lib/sickn33-antigravity-awesome-skills/plugins/antigravity-awesome-skills-claude/skills/phase-gated-debugging/SKILL.md
php-pro,"Write idiomatic PHP code with generators, iterators, SPL data structures, and modern OOP features. Use PROACTIVELY for high-performance PHP applications.",lib/sickn33-antigravity-awesome-skills/plugins/antigravity-awesome-skills-claude/skills/php-pro/SKILL.md
phylogenetics,"Build and analyze phylogenetic trees using MAFFT (multiple alignment), IQ-TREE 2 (maximum likelihood), and FastTree (fast NJ/ML). Visualize with ETE3 or FigTree. For evolutionary analysis, microbial genomics, viral phylodynamics, protein family analysis, and molecular clock studies.",lib/k-dense-ai-claude-scientific-skills/scientific-skills/phylogenetics/SKILL.md
plagiarism-checker,Scans lyrics for phrases that may match existing songs using web search and LLM knowledge. Use before release to check for unintentional borrowing.,lib/bitwize-music-studio-claude-ai-music-skills/skills/plagiarism-checker/SKILL.md
plaid-fintech,"Create a linktoken for Plaid Link, exchange publictoken for accesstoken. Link tokens are short-lived, one-time use. Access tokens don't expire but may need updating when users change passwords.",lib/sickn33-antigravity-awesome-skills/plugins/antigravity-awesome-skills-claude/skills/plaid-fintech/SKILL.md
plan-ceo-review,"CEO/founder-mode plan review. Rethink the problem, find the 10-star product, challenge premises, expand scope when it creates a better product. Four modes: SCOPE EXPANSION (dream big), SELECTIVE EXPANSION (hold scope + cherry-pick expansions), HOLD SCOPE (maximum rigor), SCOPE REDUCTION (strip to essentials). Use when asked to ""think bigger"", ""expand scope"", ""strategy review"", ""rethink this"", or ""is this ambitious enough"". Proactively suggest when the user is questioning scope or ambition of a plan, or when the plan feels like it could be thinking bigger. (gstack)",lib/garrytan-gstack/plan-ceo-review/SKILL.md
plan-my-day,"Generate an energy-optimized, time-blocked daily plan based on circadian rhythm research and GTD principles",lib/brianrwagner-ai-marketing-skills/plan-my-day/SKILL.md
plan-writing,"Structured task planning with clear breakdowns, dependencies, and verification criteria. Use when implementing features, refactoring, or any multi-step work.",lib/sickn33-antigravity-awesome-skills/plugins/antigravity-awesome-skills-claude/skills/plan-writing/SKILL.md
planning-with-files,"Work like Manus: Use persistent markdown files as your ""working memory on disk.""",lib/sickn33-antigravity-awesome-skills/plugins/antigravity-awesome-skills-claude/skills/planning-with-files/SKILL.md
plotly,"Interactive visualization library. Use when you need hover info, zoom, pan, or web-embeddable charts. Best for dashboards, exploratory analysis, and presentations. For static publication figures use matplotlib or scientific-visualization.",lib/k-dense-ai-claude-scientific-skills/scientific-skills/plotly/SKILL.md
plugin-architecture-patterns,plugin architecture patterns,lib/kreuzberg-dev-kreuzberg/.ai-rulez/skills/plugin-architecture-patterns/SKILL.md
plugin-configuration,plugin configuration,lib/kreuzberg-dev-kreuzberg/.ai-rulez/domains/plugin-system/skills/plugin-configuration/SKILL.md
plugin-discovery,plugin discovery,lib/kreuzberg-dev-kreuzberg/.ai-rulez/domains/plugin-system/skills/plugin-discovery/SKILL.md
plugin-error-handling,plugin error handling,lib/kreuzberg-dev-kreuzberg/.ai-rulez/domains/plugin-system/skills/plugin-error-handling/SKILL.md
plugin-lifecycle-management,plugin lifecycle management,lib/kreuzberg-dev-kreuzberg/.ai-rulez/domains/plugin-system/skills/plugin-lifecycle-management/SKILL.md
plugin-trait-implementation,plugin trait implementation,lib/kreuzberg-dev-kreuzberg/.ai-rulez/domains/plugin-system/skills/plugin-trait-implementation/SKILL.md
pol-probe-advisor,"Select the right Proof of Life (PoL) probe based on hypothesis, risk, and resources. Use this to match the validation method to the real learning goal, not tooling comfort.",lib/deanpeters-product-manager-skills/skills/pol-probe-advisor/SKILL.md
polars,"Fast in-memory DataFrame library for datasets that fit in RAM. Use when pandas is too slow but data still fits in memory. Lazy evaluation, parallel execution, Apache Arrow backend. Best for 1-100GB datasets, ETL pipelines, faster pandas replacement. For larger-than-RAM data use dask or vaex.",lib/k-dense-ai-claude-scientific-skills/scientific-skills/polars/SKILL.md
polars-bio,"High-performance genomic interval operations and bioinformatics file I/O on Polars DataFrames. Overlap, nearest, merge, coverage, complement, subtract for BED/VCF/BAM/GFF intervals. Streaming, cloud-native, faster bioframe alternative.",lib/k-dense-ai-claude-scientific-skills/scientific-skills/polars-bio/SKILL.md
popup-cro,"When the user wants to create or optimize popups, modals, overlays, slide-ins, or banners for conversion purposes. Also use when the user mentions ""exit intent,"" ""popup conversions,"" ""modal optimization,"" ""lead capture popup,"" ""email popup,"" ""announcement banner,"" ""overlay,"" ""collect emails with a popup,"" ""exit popup,"" ""scroll trigger,"" ""sticky bar,"" or ""notification bar."" Use this for any overlay or interrupt-style conversion element. For forms outside of popups, see form-cro. For general page conversion optimization, see page-cro.",lib/coreyhaines31-marketingskills/skills/popup-cro/SKILL.md
posix-shell-pro,"Expert in strict POSIX sh scripting for maximum portability across Unix-like systems. Specializes in shell scripts that run on any POSIX-compliant shell (dash, ash, sh, bash --posix).",lib/sickn33-antigravity-awesome-skills/plugins/antigravity-awesome-skills-claude/skills/posix-shell-pro/SKILL.md
post-processor-integration,post processor integration,lib/kreuzberg-dev-kreuzberg/.ai-rulez/domains/document-extraction/skills/post-processor-integration/SKILL.md
posthog-analytics,"PostHog analytics, event tracking, feature flags, dashboards",lib/alinaqi-claude-bootstrap/skills/posthog-analytics/SKILL.md
posthog-automation,"Automate PostHog tasks via Rube MCP (Composio): events, feature flags, projects, user profiles, annotations. Always search tools first for current schemas.",lib/sickn33-antigravity-awesome-skills/plugins/antigravity-awesome-skills-claude/skills/posthog-automation/SKILL.md
postmark-automation,"Automate Postmark email delivery tasks via Rube MCP (Composio): send templated emails, manage templates, monitor delivery stats and bounces. Always search tools first for current schemas.",lib/sickn33-antigravity-awesome-skills/plugins/antigravity-awesome-skills-claude/skills/postmark-automation/SKILL.md
postmortem-writing,"Comprehensive guide to writing effective, blameless postmortems that drive organizational learning and prevent incident recurrence.",lib/sickn33-antigravity-awesome-skills/plugins/antigravity-awesome-skills-claude/skills/postmortem-writing/SKILL.md
powershell-windows,"PowerShell Windows patterns. Critical pitfalls, operator syntax, error handling.",lib/sickn33-antigravity-awesome-skills/plugins/antigravity-awesome-skills-claude/skills/powershell-windows/SKILL.md
pptx-official,"A user may ask you to create, edit, or analyze the contents of a .pptx file. A .pptx file is essentially a ZIP archive containing XML files and other resources that you can read or edit. You have different tools and workflows available for different tasks.",lib/sickn33-antigravity-awesome-skills/plugins/antigravity-awesome-skills-claude/skills/pptx-official/SKILL.md
pr-writer,Create pull requests following Sentry's engineering practices.,lib/sickn33-antigravity-awesome-skills/plugins/antigravity-awesome-skills-claude/skills/pr-writer/SKILL.md
pre-generation-check,"Validates all pre-generation gates before sending tracks to Suno. Checks sources verified, lyrics reviewed, pronunciation resolved, explicit flag set, style prompt complete, and artist names cleared. Use before generating tracks on Suno or when the user says ""pre-gen check"" or ""ready to generate"".",lib/bitwize-music-studio-claude-ai-music-skills/skills/pre-generation-check/SKILL.md
preset,"Intelligently deploys Azure OpenAI models to optimal regions by analyzing capacity across all available regions. Automatically checks current region first and shows alternatives if needed. USE FOR: quick deployment, optimal region, best region, automatic region selection, fast setup, multi-region capacity check, high availability deployment, deploy to best location. DO NOT USE FOR: custom SKU selection (use customize), specific version selection (use customize), custom capacity configuration (use customize), PTU deployments (use customize).",lib/microsoft-skills/.github/plugins/azure-skills/skills/microsoft-foundry/models/deploy-model/preset/SKILL.md
press-release,"Write an Amazon-style press release that defines customer value before building. Use when aligning stakeholders on a new product, feature, or strategic bet.",lib/deanpeters-product-manager-skills/skills/press-release/SKILL.md
pricing-strategist,"Builds comprehensive pricing strategies by reading business context and asking targeted questions interactively. Use when user needs pricing plans, tier structures, price points, pricing model recommendations, or any pricing-related strategy for their product or service.",lib/ognjengt-founder-skills/skills/pricing-strategist/SKILL.md
pricing-strategy,"When the user wants help with pricing decisions, packaging, or monetization strategy. Also use when the user mentions 'pricing,' 'pricing tiers,' 'freemium,' 'free trial,' 'packaging,' 'price increase,' 'value metric,' 'Van Westendorp,' 'willingness to pay,' 'monetization,' 'how much should I charge,' 'my pricing is wrong,' 'pricing page,' 'annual vs monthly,' 'per seat pricing,' or 'should I offer a free plan.' Use this whenever someone is figuring out what to charge or how to structure their plans. For in-app upgrade screens, see paywall-upgrade-cro.",lib/coreyhaines31-marketingskills/skills/pricing-strategy/SKILL.md
prioritization-advisor,"Choose a prioritization framework based on stage, team context, and stakeholder needs. Use when deciding between RICE, ICE, value/effort, or another scoring approach.",lib/deanpeters-product-manager-skills/skills/prioritization-advisor/SKILL.md
priority-selection-system,priority selection system,lib/kreuzberg-dev-kreuzberg/.ai-rulez/domains/plugin-system/skills/priority-selection-system/SKILL.md
privacy-policy,"Draft a detailed privacy policy covering data types, jurisdiction, GDPR and compliance considerations, and clauses needing legal review. Use when creating a privacy policy, updating data protection documentation, or preparing for compliance.",lib/phuryn-pm-skills/pm-toolkit/skills/privacy-policy/SKILL.md
problem-framing-canvas,Guide teams through MITRE's Problem Framing Canvas. Use when you need a clearer problem statement before jumping to solutions.,lib/deanpeters-product-manager-skills/skills/problem-framing-canvas/SKILL.md
product-hunt-launch-plan,"Creates a comprehensive, personalized Product Hunt launch plan to rank",lib/ognjengt-founder-skills/skills/product-hunt-launch-plan/SKILL.md
product-lens,"Use this skill to validate the ""why"" before building, run product diagnostics, and convert vague ideas into specs.",lib/affaan-m-everything-claude-code/skills/product-lens/SKILL.md
product-manager-toolkit,"Essential tools and frameworks for modern product management, from discovery to delivery.",lib/sickn33-antigravity-awesome-skills/plugins/antigravity-awesome-skills-claude/skills/product-manager-toolkit/SKILL.md
product-name,"Brainstorm 5 unique, memorable product names with rationale aligned to brand values and target audience. Use when naming a new product, rebranding, or exploring product name ideas.",lib/phuryn-pm-skills/pm-marketing-growth/skills/product-name/SKILL.md
product-vision,"Brainstorm an inspiring, achievable, and emotional product vision that motivates teams and aligns stakeholders. Use when defining or refining a product vision, creating a vision statement, or aligning the team around a shared direction.",lib/phuryn-pm-skills/pm-product-strategy/skills/product-vision/SKILL.md
production-code-audit,"Autonomously deep-scan entire codebase line-by-line, understand architecture and patterns, then systematically transform it to production-grade, corporate-level professional quality with optimizations",lib/sickn33-antigravity-awesome-skills/plugins/antigravity-awesome-skills-claude/skills/production-code-audit/SKILL.md
professional-proofreader,"Use when a user asks to ""proofread"", ""review and correct"", ""fix grammar"", ""improve readability while keeping my voice"", and to proofread a document file and save an updated version.",lib/sickn33-antigravity-awesome-skills/plugins/antigravity-awesome-skills-claude/skills/professional-proofreader/SKILL.md
progressive-estimation,Estimate AI-assisted and hybrid human+agent development work with research-backed PERT statistics and calibration feedback loops,lib/sickn33-antigravity-awesome-skills/plugins/antigravity-awesome-skills-claude/skills/progressive-estimation/SKILL.md
progressive-web-app,"Build Progressive Web Apps (PWAs) with offline support, installability, and caching strategies. Trigger whenever the user mentions PWA, service workers, web app manifests, Workbox, 'add to home screen', or wants their web app to work offline, feel native, or be installable.",lib/sickn33-antigravity-awesome-skills/plugins/antigravity-awesome-skills-claude/skills/progressive-web-app/SKILL.md
project-development,"This skill covers the principles for identifying tasks suited to LLM processing, designing effective project architectures, and iterating rapidly using agent-assisted development.",lib/sickn33-antigravity-awesome-skills/plugins/antigravity-awesome-skills-claude/skills/project-development/SKILL.md
project-skill-audit,Audit a project and recommend the highest-value skills to add or update.,lib/sickn33-antigravity-awesome-skills/skills/project-skill-audit/SKILL.md
project-tooling,"gh, vercel, supabase, render CLI and deployment platform setup",lib/alinaqi-claude-bootstrap/skills/project-tooling/SKILL.md
prompt-library,A comprehensive collection of battle-tested prompts inspired by [awesome-chatgpt-prompts](https://github.com/f/awesome-chatgpt-prompts) and community best practices.,lib/sickn33-antigravity-awesome-skills/plugins/antigravity-awesome-skills-claude/skills/prompt-library/SKILL.md
prompt-request-bus,Prompt Request Bus,lib/shunsukehayashi-agent-skill-bus/skills/prompt-request-bus/SKILL.md
pronunciation-specialist,"Scans lyrics for pronunciation risks and prevents Suno mispronunciations. Use when writing lyrics with proper nouns, technical terms, homographs, or non-English words.",lib/bitwize-music-studio-claude-ai-music-skills/skills/pronunciation-specialist/SKILL.md
proto-persona,"Create a proto-persona from current research, market signals, and team knowledge. Use when you need a working customer profile before deeper validation.",lib/deanpeters-product-manager-skills/skills/proto-persona/SKILL.md
protocolsio-integration,"Integration with protocols.io API for managing scientific protocols. This skill should be used when working with protocols.io to search, create, update, or publish protocols; manage protocol steps and materials; handle discussions and comments; organize workspaces; upload and manage files; or integrate protocols.io functionality into workflows. Applicable for protocol discovery, collaborative protocol development, experiment tracking, lab protocol management, and scientific documentation.",lib/k-dense-ai-claude-scientific-skills/scientific-skills/protocolsio-integration/SKILL.md
psmmode-tuning,psmmode tuning,lib/kreuzberg-dev-kreuzberg/.ai-rulez/domains/ocr-integration/skills/psmmode-tuning/SKILL.md
pufferlib,"High-performance reinforcement learning framework optimized for speed and scale. Use when you need fast parallel training, vectorized environments, multi-agent systems, or integration with game environments (Atari, Procgen, NetHack). Achieves 2-10x speedups over standard implementations. For quick prototyping or standard algorithm implementations with extensive documentation, use stable-baselines3 instead.",lib/k-dense-ai-claude-scientific-skills/scientific-skills/pufferlib/SKILL.md
pylabrobot,"Vendor-agnostic lab automation framework. Use when controlling multiple equipment types (Hamilton, Tecan, Opentrons, plate readers, pumps) or needing unified programming across different vendors. Best for complex workflows, multi-vendor setups, simulation. For Opentrons-only protocols with official API, opentrons-integration may be simpler.",lib/k-dense-ai-claude-scientific-skills/scientific-skills/pylabrobot/SKILL.md
pymatgen,"Materials science toolkit. Crystal structures (CIF, POSCAR), phase diagrams, band structure, DOS, Materials Project integration, format conversion, for computational materials science.",lib/k-dense-ai-claude-scientific-skills/scientific-skills/pymatgen/SKILL.md
pymc,"Bayesian modeling with PyMC. Build hierarchical models, MCMC (NUTS), variational inference, LOO/WAIC comparison, posterior checks, for probabilistic programming and inference.",lib/k-dense-ai-claude-scientific-skills/scientific-skills/pymc/SKILL.md
pyopenms,"Complete mass spectrometry analysis platform. Use for proteomics workflows feature detection, peptide identification, protein quantification, and complex LC-MS/MS pipelines. Supports extensive file formats and algorithms. Best for proteomics, comprehensive MS data processing. For simple spectral comparison and metabolite ID use matchms.",lib/k-dense-ai-claude-scientific-skills/scientific-skills/pyopenms/SKILL.md
pysam,"Genomic file toolkit. Read/write SAM/BAM/CRAM alignments, VCF/BCF variants, FASTA/FASTQ sequences, extract regions, calculate coverage, for NGS data processing pipelines.",lib/k-dense-ai-claude-scientific-skills/scientific-skills/pysam/SKILL.md
