skill_id,description,src_path
2d-games,"2D game development principles. Sprites, tilemaps, physics, camera.",lib/sickn33-antigravity-awesome-skills/plugins/antigravity-awesome-skills-claude/skills/game-development/2d-games/SKILL.md
3d-games,"3D game development principles. Rendering, shaders, physics, cameras.",lib/sickn33-antigravity-awesome-skills/plugins/antigravity-awesome-skills-claude/skills/game-development/3d-games/SKILL.md
3d-web-experience,You bring the third dimension to the web. You know when 3D enhances and when it's just showing off. You balance visual impact with performance. You make 3D accessible to users who've never touched a 3D app. You create moments of wonder without sacrificing usability.,lib/sickn33-antigravity-awesome-skills/plugins/antigravity-awesome-skills-claude/skills/3d-web-experience/SKILL.md
Academic CV Builder,"Format CVs for academic positions with publications, grants, and teaching",lib/paramchoudhary-resumeskills/skills/academic-cv-builder/SKILL.md
Career Changer Translator,"Translate skills from one industry to another, identify transferable skills",lib/paramchoudhary-resumeskills/skills/career-changer-translator/SKILL.md
Cover Letter Generator,"Create personalized, compelling cover letters from resume and job description",lib/paramchoudhary-resumeskills/skills/cover-letter-generator/SKILL.md
Executive Resume Writer,Create C-suite and VP level resumes emphasizing strategic leadership,lib/paramchoudhary-resumeskills/.agents/skills/executive-resume-writer/SKILL.md
Interview Prep Generator,"Generate STAR stories, practice questions, and talking points from resume",lib/paramchoudhary-resumeskills/.agents/skills/interview-prep-generator/SKILL.md
Job Description Analyzer,"Analyze job postings, calculate match scores, identify gaps, and create application strategy",lib/paramchoudhary-resumeskills/.agents/skills/job-description-analyzer/SKILL.md
LinkedIn Profile Optimizer,"Optimize LinkedIn profile for searchability, recruiter visibility, and engagement",lib/paramchoudhary-resumeskills/.agents/skills/linkedin-profile-optimizer/SKILL.md
Offer Comparison Analyzer,Compare multiple job offers side-by-side with total compensation analysis,lib/paramchoudhary-resumeskills/.agents/skills/offer-comparison-analyzer/SKILL.md
Portfolio Case Study Writer,Transform resume bullets into detailed portfolio case studies,lib/paramchoudhary-resumeskills/.agents/skills/portfolio-case-study-writer/SKILL.md
Reference List Builder,Format professional references properly and prepare reference materials,lib/paramchoudhary-resumeskills/.agents/skills/reference-list-builder/SKILL.md
Resume ATS Optimizer,"Optimize resumes for Applicant Tracking Systems, check ATS compatibility, and analyze keyword match",lib/paramchoudhary-resumeskills/skills/resume-ats-optimizer/SKILL.md
Resume Formatter,Ensure ATS-friendly formatting and create clean scannable layouts,lib/paramchoudhary-resumeskills/skills/resume-formatter/SKILL.md
Resume Section Builder,Create targeted resume sections optimized for different experience levels and roles,lib/paramchoudhary-resumeskills/skills/resume-section-builder/SKILL.md
Resume Tailor,Customize resume for specific job postings while maintaining truthfulness,lib/paramchoudhary-resumeskills/skills/resume-tailor/SKILL.md
Resume Version Manager,"Track different resume versions, maintain master resume, manage tailored versions",lib/paramchoudhary-resumeskills/skills/resume-version-manager/SKILL.md
Salary Negotiation Prep,"Research market rates, build negotiation strategy, and create counter-offer scripts",lib/paramchoudhary-resumeskills/skills/salary-negotiation-prep/SKILL.md
Tech Resume Optimizer,"Optimize resumes for software engineering, PM, and technical roles",lib/paramchoudhary-resumeskills/skills/tech-resume-optimizer/SKILL.md
ablation-planner,"Use when main results pass result-to-claim (claim_supported=yes or partial) and ablation studies are needed for paper submission. Codex designs ablations from a reviewer's perspective, CC reviews feasibility and implements.",lib/wanshuiyin-auto-claude-code-research-in-sleep/skills/ablation-planner/SKILL.md
about,"Provides information about the bitwize-music plugin, its version, and its creator. Use when the user asks about the plugin, its purpose, version, or capabilities.",lib/bitwize-music-studio-claude-ai-music-skills/skills/about/SKILL.md
academic-plotting,"Generates publication-quality figures for ML papers from research context. Given a paper section or description, extracts system components and relationships to generate architecture diagrams via Gemini. Given experiment results or data, auto-selects chart type and generates data-driven figures via matplotlib/seaborn. Use when creating any figure for a conference paper.",lib/orchestra-research-ai-research-skills/20-ml-paper-writing/academic-plotting/SKILL.md
acceptance-orchestrator,"Use when a coding task should be driven end-to-end from issue intake through implementation, review, deployment, and acceptance verification with minimal human re-intervention.",lib/sickn33-antigravity-awesome-skills/plugins/antigravity-awesome-skills-claude/skills/acceptance-orchestrator/SKILL.md
acquiring-disk-image-with-dd-and-dcfldd,Create forensically sound bit-for-bit disk images using dd and dcfldd while preserving evidence integrity through hash verification.,lib/mukul975-anthropic-cybersecurity-skills/skills/acquiring-disk-image-with-dd-and-dcfldd/SKILL.md
activecampaign-automation,"Automate ActiveCampaign tasks via Rube MCP (Composio): manage contacts, tags, list subscriptions, automation enrollment, and tasks. Always search tools first for current schemas.",lib/sickn33-antigravity-awesome-skills/plugins/antigravity-awesome-skills-claude/skills/activecampaign-automation/SKILL.md
add-new-opc-skill,"Checklist and automation guide for adding a new skill to the OPC Skills project. Ensures all required files, metadata, logos, and listings are created before release. Use when adding a new skill, publishing a skill, or preparing a skill for release.",lib/resciencelab-opc-skills/.factory/skills/add-new-opc-skill/SKILL.md
address-github-comments,Use when you need to address review or issue comments on an open GitHub Pull Request using the gh CLI.,lib/sickn33-antigravity-awesome-skills/plugins/antigravity-awesome-skills-claude/skills/address-github-comments/SKILL.md
advanced-evaluation,"This skill should be used when the user asks to ""implement LLM-as-judge"", ""compare model outputs"", ""create evaluation rubrics"", ""mitigate evaluation bias"", or mentions direct scoring, pairwise comparison, position bias, evaluation pipelines, or automated quality assessment.",lib/sickn33-antigravity-awesome-skills/plugins/antigravity-awesome-skills-claude/skills/advanced-evaluation/SKILL.md
advogado-criminal,"Advogado criminalista especializado em Maria da Penha, violencia domestica, feminicidio, direito penal brasileiro, medidas protetivas, inquerito policial e acao penal.",lib/sickn33-antigravity-awesome-skills/plugins/antigravity-awesome-skills-claude/skills/advogado-criminal/SKILL.md
advogado-especialista,"Advogado especialista em todas as areas do Direito brasileiro: familia, criminal, trabalhista, tributario, consumidor, imobiliario, empresarial, civil e constitucional.",lib/sickn33-antigravity-awesome-skills/plugins/antigravity-awesome-skills-claude/skills/advogado-especialista/SKILL.md
aeo-optimization,"AI Engine Optimization - semantic triples, page templates, content clusters for AI citations",lib/alinaqi-claude-bootstrap/skills/aeo-optimization/SKILL.md
aeon,"This skill should be used for time series machine learning tasks including classification, regression, clustering, forecasting, anomaly detection, segmentation, and similarity search. Use when working with temporal data, sequential patterns, or time-indexed observations requiring specialized algorithms beyond standard ML approaches. Particularly suited for univariate and multivariate time series analysis with scikit-learn compatible APIs.",lib/k-dense-ai-claude-scientific-skills/scientific-skills/aeon/SKILL.md
agent-manager-skill,Manage multiple local CLI agents via tmux sessions (start/stop/monitor/assign) with cron-friendly scheduling.,lib/sickn33-antigravity-awesome-skills/plugins/antigravity-awesome-skills-claude/skills/agent-manager-skill/SKILL.md
agent-memory-mcp,"A hybrid memory system that provides persistent, searchable knowledge management for AI agents (Architecture, Patterns, Decisions).",lib/sickn33-antigravity-awesome-skills/plugins/antigravity-awesome-skills-claude/skills/agent-memory-mcp/SKILL.md
agent-memory-systems,You are a cognitive architect who understands that memory makes agents intelligent. You've built memory systems for agents handling millions of interactions. You know that the hard part isn't storing - it's retrieving the right memory at the right time.,lib/sickn33-antigravity-awesome-skills/plugins/antigravity-awesome-skills-claude/skills/agent-memory-systems/SKILL.md
agent-orchestration-improve-agent,"Systematic improvement of existing agents through performance analysis, prompt engineering, and continuous iteration.",lib/sickn33-antigravity-awesome-skills/plugins/antigravity-awesome-skills-claude/skills/agent-orchestration-improve-agent/SKILL.md
agent-orchestration-multi-agent-optimize,"Optimize multi-agent systems with coordinated profiling, workload distribution, and cost-aware orchestration. Use when improving agent performance, throughput, or reliability.",lib/sickn33-antigravity-awesome-skills/plugins/antigravity-awesome-skills-claude/skills/agent-orchestration-multi-agent-optimize/SKILL.md
agent-orchestrator,"Meta-skill que orquestra todos os agentes do ecossistema. Scan automatico de skills, match por capacidades, coordenacao de workflows multi-skill e registry management.",lib/sickn33-antigravity-awesome-skills/plugins/antigravity-awesome-skills-claude/skills/agent-orchestrator/SKILL.md
agentfolio,"Skill for discovering and researching autonomous AI agents, tools, and ecosystems using the AgentFolio directory.",lib/sickn33-antigravity-awesome-skills/plugins/antigravity-awesome-skills-claude/skills/agentfolio/SKILL.md
agentic-engineering,"Operate as an agentic engineer using eval-first execution, decomposition, and cost-aware model routing. Use when AI agents perform most implementation work and humans enforce quality and risk controls.",lib/affaan-m-everything-claude-code/.kiro/skills/agentic-engineering/SKILL.md
agents-md,"This skill should be used when the user asks to ""create AGENTS.md"", ""update AGENTS.md"", ""maintain agent docs"", ""set up CLAUDE.md"", or needs to keep agent instructions concise. Enforces research-backed best practices for minimal, high-signal agent documentation.",lib/sickn33-antigravity-awesome-skills/plugins/antigravity-awesome-skills-claude/skills/agents-md/SKILL.md
ai-agent-development,"AI agent development workflow for building autonomous agents, multi-agent systems, and agent orchestration with CrewAI, LangGraph, and custom agents.",lib/sickn33-antigravity-awesome-skills/plugins/antigravity-awesome-skills-claude/skills/ai-agent-development/SKILL.md
ai-discoverability-audit,"Audit how a brand appears in AI-powered search (ChatGPT, Perplexity, Claude, Gemini). Use when user mentions ""AI search,"" ""how do I show up in ChatGPT,"" ""AI discoverability,"" ""AEO,"" ""LLM visibility,"" or wants to understand their brand's AI presence.",lib/brianrwagner-ai-marketing-skills/ai-discoverability-audit/SKILL.md
ai-engineer,"Build production-ready LLM applications, advanced RAG systems, and intelligent agents. Implements vector search, multimodal AI, agent orchestration, and enterprise AI integrations.",lib/sickn33-antigravity-awesome-skills/plugins/antigravity-awesome-skills-claude/skills/ai-engineer/SKILL.md
ai-md,"Convert human-written CLAUDE.md into AI-native structured-label format. Battle-tested across 4 models. Same rules, fewer tokens, higher compliance.",lib/sickn33-antigravity-awesome-skills/plugins/antigravity-awesome-skills-claude/skills/ai-md/SKILL.md
ai-ml,"AI and machine learning workflow covering LLM application development, RAG implementation, agent architecture, ML pipelines, and AI-powered features.",lib/sickn33-antigravity-awesome-skills/plugins/antigravity-awesome-skills-claude/skills/ai-ml/SKILL.md
ai-models,"Latest AI models reference - Claude, OpenAI, Gemini, Eleven Labs, Replicate",lib/alinaqi-claude-bootstrap/skills/ai-models/SKILL.md
ai-product,"You are an AI product engineer who has shipped LLM features to millions of users. You've debugged hallucinations at 3am, optimized prompts to reduce costs by 80%, and built safety systems that caught thousands of harmful outputs. You know that demos are easy and production is hard.",lib/sickn33-antigravity-awesome-skills/plugins/antigravity-awesome-skills-claude/skills/ai-product/SKILL.md
ai-shaped-readiness-advisor,Assess whether your product work is AI-first or AI-shaped. Use when evaluating AI maturity and choosing the next team capability to build.,lib/deanpeters-product-manager-skills/skills/ai-shaped-readiness-advisor/SKILL.md
ai-studio-image,Geracao de imagens humanizadas via Google AI Studio (Gemini). Fotos realistas estilo influencer ou educacional com iluminacao natural e imperfeicoes sutis.,lib/sickn33-antigravity-awesome-skills/plugins/antigravity-awesome-skills-claude/skills/ai-studio-image/SKILL.md
ai-wrapper-product,"You know AI wrappers get a bad rap, but the good ones solve real problems. You build products where AI is the engine, not the gimmick. You understand prompt engineering is product development. You balance costs with user experience. You create AI products people actually pay for and use daily.",lib/sickn33-antigravity-awesome-skills/plugins/antigravity-awesome-skills-claude/skills/ai-wrapper-product/SKILL.md
airtable-automation,"Automate Airtable tasks via Rube MCP (Composio): records, bases, tables, fields, views. Always search tools first for current schemas.",lib/sickn33-antigravity-awesome-skills/plugins/antigravity-awesome-skills-claude/skills/airtable-automation/SKILL.md
album-art-director,"Creates visual concepts for album artwork and generates AI art prompts. Use during planning for concept discussion, or after all tracks are Final for actual artwork generation.",lib/bitwize-music-studio-claude-ai-music-skills/skills/album-art-director/SKILL.md
album-conceptualizer,"Designs album concepts, tracklist architecture, and thematic planning through 7 structured phases. Use when planning a new album or reworking an existing album concept.",lib/bitwize-music-studio-claude-ai-music-skills/skills/album-conceptualizer/SKILL.md
album-dashboard,"Shows a structured progress dashboard for an album with percentage complete per phase, blocking items, and status breakdown. Use for a quick visual overview of album progress.",lib/bitwize-music-studio-claude-ai-music-skills/skills/album-dashboard/SKILL.md
alpha-vantage,"Access 20+ years of global financial data: equities, options, forex, crypto, commodities, economic indicators, and 50+ technical indicators.",lib/sickn33-antigravity-awesome-skills/plugins/antigravity-awesome-skills-claude/skills/alpha-vantage/SKILL.md
altitude-horizon-framework,"Understand the PM-to-Director transition through altitude and horizon thinking. Use when diagnosing scope, time-horizon, or leadership-level gaps.",lib/deanpeters-product-manager-skills/skills/altitude-horizon-framework/SKILL.md
amplitude-automation,"Automate Amplitude tasks via Rube MCP (Composio): events, user activity, cohorts, user identification. Always search tools first for current schemas.",lib/sickn33-antigravity-awesome-skills/plugins/antigravity-awesome-skills-claude/skills/amplitude-automation/SKILL.md
analyze-project,"Forensic root cause analyzer for Antigravity sessions. Classifies scope deltas, rework patterns, root causes, hotspots, and auto-improves prompts/health.",lib/sickn33-antigravity-awesome-skills/skills/analyze-project/SKILL.md
analyze-results,"Analyze ML experiment results, compute statistics, generate comparison tables and insights. Use when user says ""analyze results"", ""compare"", or needs to interpret experimental data.",lib/wanshuiyin-auto-claude-code-research-in-sleep/skills/analyze-results/SKILL.md
analyzing-active-directory-acl-abuse,"Detect dangerous ACL misconfigurations in Active Directory using ldap3 to identify GenericAll, WriteDACL, and WriteOwner abuse paths",lib/mukul975-anthropic-cybersecurity-skills/skills/analyzing-active-directory-acl-abuse/SKILL.md
analyzing-bootkit-and-rootkit-samples,"Analyzes bootkit and advanced rootkit malware that infects the Master Boot Record (MBR), Volume Boot Record (VBR), or UEFI firmware to gain persistence below the operating system. Covers boot sector analysis, UEFI module inspection, and anti-rootkit detection techniques. Activates for requests involving bootkit analysis, MBR malware investigation, UEFI persistence analysis, or pre-OS malware detection.",lib/mukul975-anthropic-cybersecurity-skills/skills/analyzing-bootkit-and-rootkit-samples/SKILL.md
analyzing-cloud-storage-access-patterns,"Detect abnormal access patterns in AWS S3, GCS, and Azure Blob Storage by analyzing CloudTrail Data Events, GCS audit logs, and Azure Storage Analytics. Identifies after-hours bulk downloads, access from new IP addresses, unusual API calls (GetObject spikes), and potential data exfiltration using statistical baselines and time-series anomaly detection.",lib/mukul975-anthropic-cybersecurity-skills/skills/analyzing-cloud-storage-access-patterns/SKILL.md
analyzing-disk-image-with-autopsy,"Perform comprehensive forensic analysis of disk images using Autopsy to recover files, examine artifacts, and build investigation timelines.",lib/mukul975-anthropic-cybersecurity-skills/skills/analyzing-disk-image-with-autopsy/SKILL.md
analyzing-email-headers-for-phishing-investigation,"Parse and analyze email headers to trace the origin of phishing emails, verify sender authenticity, and identify spoofing through SPF, DKIM, and DMARC validation.",lib/mukul975-anthropic-cybersecurity-skills/skills/analyzing-email-headers-for-phishing-investigation/SKILL.md
analyzing-linux-kernel-rootkits,"Detect kernel-level rootkits in Linux memory dumps using Volatility3 linux plugins (check_syscall, lsmod, hidden_modules), rkhunter system scanning, and /proc vs /sys discrepancy analysis to identify hooked syscalls, hidden kernel modules, and tampered system structures.",lib/mukul975-anthropic-cybersecurity-skills/skills/analyzing-linux-kernel-rootkits/SKILL.md
analyzing-lnk-file-and-jump-list-artifacts,"Analyze Windows LNK shortcut files and Jump List artifacts to establish evidence of file access, program execution, and user activity using LECmd, JLECmd, and manual binary parsing of the Shell Link Binary format.",lib/mukul975-anthropic-cybersecurity-skills/skills/analyzing-lnk-file-and-jump-list-artifacts/SKILL.md
analyzing-malware-behavior-with-cuckoo-sandbox,"Executes malware samples in Cuckoo Sandbox to observe runtime behavior including process creation, file system modifications, registry changes, network communications, and API calls. Generates comprehensive behavioral reports for malware classification and IOC extraction. Activates for requests involving dynamic malware analysis, sandbox detonation, behavioral analysis, or automated malware execution.",lib/mukul975-anthropic-cybersecurity-skills/skills/analyzing-malware-behavior-with-cuckoo-sandbox/SKILL.md
analyzing-malware-persistence-with-autoruns,"Use Sysinternals Autoruns to systematically identify and analyze malware persistence mechanisms across registry keys, scheduled tasks, services, drivers, and startup locations on Windows systems.",lib/mukul975-anthropic-cybersecurity-skills/skills/analyzing-malware-persistence-with-autoruns/SKILL.md
analyzing-malware-sandbox-evasion-techniques,"Detect sandbox evasion techniques in malware samples by analyzing timing checks, VM artifact queries, user interaction detection, and sleep inflation patterns from Cuckoo/AnyRun behavioral reports",lib/mukul975-anthropic-cybersecurity-skills/skills/analyzing-malware-sandbox-evasion-techniques/SKILL.md
analyzing-memory-forensics-with-lime-and-volatility,"Performs Linux memory acquisition using LiME (Linux Memory Extractor) kernel module and analysis with Volatility 3 framework. Extracts process lists, network connections, bash history, loaded kernel modules, and injected code from Linux memory images. Use when performing incident response on compromised Linux systems.",lib/mukul975-anthropic-cybersecurity-skills/skills/analyzing-memory-forensics-with-lime-and-volatility/SKILL.md
analyzing-mft-for-deleted-file-recovery,"Analyze the NTFS Master File Table ($MFT) to recover metadata and content of deleted files by examining MFT record entries, $LogFile, $UsnJrnl, and MFT slack space using MFTECmd, analyzeMFT, and X-Ways Forensics.",lib/mukul975-anthropic-cybersecurity-skills/skills/analyzing-mft-for-deleted-file-recovery/SKILL.md
analyzing-network-covert-channels-in-malware,"Detect and analyze covert communication channels used by malware including DNS tunneling, ICMP exfiltration, steganographic HTTP, and protocol abuse for C2 and data exfiltration.",lib/mukul975-anthropic-cybersecurity-skills/skills/analyzing-network-covert-channels-in-malware/SKILL.md
analyzing-network-traffic-of-malware,"Analyzes network traffic generated by malware during sandbox execution or live incident response to identify C2 protocols, data exfiltration channels, payload downloads, and lateral movement patterns using Wireshark, Zeek, and Suricata. Activates for requests involving malware network analysis, C2 traffic decoding, malware PCAP analysis, or network-based malware detection.",lib/mukul975-anthropic-cybersecurity-skills/skills/analyzing-network-traffic-of-malware/SKILL.md
analyzing-outlook-pst-for-email-forensics,"Analyze Microsoft Outlook PST and OST files for email forensic evidence including message content, headers, attachments, deleted items, and metadata using libpff, pst-utils, and forensic email analysis tools for legal investigations and incident response.",lib/mukul975-anthropic-cybersecurity-skills/skills/analyzing-outlook-pst-for-email-forensics/SKILL.md
analyzing-packed-malware-with-upx-unpacker,"Identifies and unpacks UPX-packed and other packed malware samples to expose the original executable code for static analysis. Covers both standard UPX unpacking and handling modified UPX headers that prevent automated decompression. Activates for requests involving malware unpacking, UPX decompression, packer removal, or preparing packed samples for analysis.",lib/mukul975-anthropic-cybersecurity-skills/skills/analyzing-packed-malware-with-upx-unpacker/SKILL.md
analyzing-prefetch-files-for-execution-history,"Parse Windows Prefetch files to determine program execution history including run counts, timestamps, and referenced files for forensic investigation.",lib/mukul975-anthropic-cybersecurity-skills/skills/analyzing-prefetch-files-for-execution-history/SKILL.md
analyzing-slack-space-and-file-system-artifacts,"Examine file system slack space, MFT entries, USN journal, and alternate data streams to recover hidden data and reconstruct file activity on NTFS volumes.",lib/mukul975-anthropic-cybersecurity-skills/skills/analyzing-slack-space-and-file-system-artifacts/SKILL.md
analyzing-supply-chain-malware-artifacts,"Investigate supply chain attack artifacts including trojanized software updates, compromised build pipelines, and sideloaded dependencies to identify intrusion vectors and scope of compromise.",lib/mukul975-anthropic-cybersecurity-skills/skills/analyzing-supply-chain-malware-artifacts/SKILL.md
analyzing-uefi-bootkit-persistence,"Analyzes UEFI bootkit persistence mechanisms including firmware implants in SPI flash, EFI System Partition (ESP) modifications, Secure Boot bypass techniques, and UEFI variable manipulation. Covers detection of known bootkit families (BlackLotus, LoJax, MosaicRegressor, MoonBounce, CosmicStrand), ESP partition forensic inspection, chipsec-based firmware integrity verification, and Secure Boot configuration auditing. Activates for requests involving UEFI malware analysis, firmware persistence investigation, boot chain integrity verification, or Secure Boot bypass detection.",lib/mukul975-anthropic-cybersecurity-skills/skills/analyzing-uefi-bootkit-persistence/SKILL.md
analyzing-usb-device-connection-history,"Investigate USB device connection history from Windows registry, event logs, and setupapi logs to track removable media usage and potential data exfiltration.",lib/mukul975-anthropic-cybersecurity-skills/skills/analyzing-usb-device-connection-history/SKILL.md
analyzing-windows-lnk-files-for-artifacts,"Parse Windows LNK shortcut files to extract target paths, timestamps, volume information, and machine identifiers for forensic timeline reconstruction.",lib/mukul975-anthropic-cybersecurity-skills/skills/analyzing-windows-lnk-files-for-artifacts/SKILL.md
analyzing-windows-registry-for-artifacts,"Extract and analyze Windows Registry hives to uncover user activity, installed software, autostart entries, and evidence of system compromise.",lib/mukul975-anthropic-cybersecurity-skills/skills/analyzing-windows-registry-for-artifacts/SKILL.md
analyzing-windows-shellbag-artifacts,"Analyze Windows Shellbag registry artifacts to reconstruct folder browsing activity, detect access to removable media and network shares, and establish user interaction with directories even after deletion using SBECmd and ShellBags Explorer.",lib/mukul975-anthropic-cybersecurity-skills/skills/analyzing-windows-shellbag-artifacts/SKILL.md
