skill_id,description,src_path
git-pushing,"Stage all changes, create a conventional commit, and push to the remote branch. Use when explicitly asks to push changes (""push this"", ""commit and push""), mentions saving work to remote (""save to github"", ""push to remote""), or completes a feature and wants to share it.",lib/sickn33-antigravity-awesome-skills/plugins/antigravity-awesome-skills-claude/skills/git-pushing/SKILL.md
git-workflow,"Git workflow patterns including branching strategies, commit conventions, merge vs rebase, conflict resolution, and collaborative development best practices for teams of all sizes.",lib/affaan-m-everything-claude-code/skills/git-workflow/SKILL.md
git:analyze-issue,Analyze a GitHub issue and create a detailed technical specification,lib/neolabhq-context-engineering-kit/plugins/git/skills/analyze-issue/SKILL.md
git:attach-review-to-pr,Add line-specific review comments to pull requests using GitHub CLI API,lib/neolabhq-context-engineering-kit/plugins/git/skills/attach-review-to-pr/SKILL.md
git:commit,Create well-formatted commits with conventional commit messages and emoji,lib/neolabhq-context-engineering-kit/plugins/git/skills/commit/SKILL.md
git:compare-worktrees,Compare files and directories between git worktrees or worktree and current branch,lib/neolabhq-context-engineering-kit/plugins/git/skills/compare-worktrees/SKILL.md
git:create-pr,Create pull requests using GitHub CLI with proper templates and formatting,lib/neolabhq-context-engineering-kit/plugins/git/skills/create-pr/SKILL.md
git:create-worktree,Create and setup git worktrees for parallel development with automatic dependency installation,lib/neolabhq-context-engineering-kit/plugins/git/skills/create-worktree/SKILL.md
git:load-issues,Load all open issues from GitHub and save them as markdown files,lib/neolabhq-context-engineering-kit/plugins/git/skills/load-issues/SKILL.md
git:merge-worktree,"Merge changes from worktrees into current branch with selective file checkout, cherry-picking, interactive patch selection, or manual merge",lib/neolabhq-context-engineering-kit/plugins/git/skills/merge-worktree/SKILL.md
github,"Use the `gh` CLI for issues, pull requests, Actions runs, and GitHub API queries.",lib/sickn33-antigravity-awesome-skills/plugins/antigravity-awesome-skills-claude/skills/github/SKILL.md
github-issue-creator,"Convert raw notes, error logs, voice dictation, or screenshots into crisp GitHub-flavored markdown issue reports. Use when the user pastes bug info, error messages, or informal descriptions and wants a structured GitHub issue. Supports images/GIFs for visual evidence.",lib/microsoft-skills/.github/skills/github-issue-creator/SKILL.md
github-pr-creation,"Creates GitHub Pull Requests with automated validation and task tracking. Use when user wants to create PR, open pull request, submit for review, or check if ready for PR. Analyzes commits, validates task completion, generates Conventional Commits title and description, suggests labels. NOTE - for merging existing PRs, use github-pr-merge instead.",lib/fvadicamo-dev-agent-skills/skills/github-pr-creation/SKILL.md
github-pr-review,"Handles PR review comments and feedback resolution. Use when user wants to resolve PR comments, handle review feedback, fix review comments, address PR review, check review status, respond to reviewer, verify PR readiness, review PR comments, analyze review feedback, evaluate PR comments, assess review suggestions, or triage PR comments. Fetches comments via GitHub CLI, classifies by severity, applies fixes with user confirmation, commits with proper format, replies to threads.",lib/fvadicamo-dev-agent-skills/skills/github-pr-review/SKILL.md
github-workflow-automation,"Patterns for automating GitHub workflows with AI assistance, inspired by [Gemini CLI](https://github.com/google-gemini/gemini-cli) and modern DevOps practices.",lib/sickn33-antigravity-awesome-skills/plugins/antigravity-awesome-skills-claude/skills/github-workflow-automation/SKILL.md
gitlab-automation,"Automate GitLab project management, issues, merge requests, pipelines, branches, and user operations via Rube MCP (Composio). Always search tools first for current schemas.",lib/sickn33-antigravity-awesome-skills/plugins/antigravity-awesome-skills-claude/skills/gitlab-automation/SKILL.md
godot-4-migration,"Specialized guide for migrating Godot 3.x projects to Godot 4 (GDScript 2.0), covering syntax changes, Tweens, and exports.",lib/sickn33-antigravity-awesome-skills/plugins/antigravity-awesome-skills-claude/skills/godot-4-migration/SKILL.md
google-tts,"Convert documents and text to audio using Google Cloud Text-to-Speech. Use this skill when the user wants to: narrate a document, read aloud text, generate audio from a file, convert text to speech, create a recording of documentation or analysis, create a podcast from a document, or use Google TTS/text-to-speech. Trigger phrases: ""read this aloud"", ""narrate this"", ""create a recording"", ""text to speech"", ""TTS"", ""convert to audio"", ""audio from document"", ""listen to this"", ""generate audio"", ""google tts"", ""create a podcast"".",lib/sanjay3290-ai-skills/skills/google-tts/SKILL.md
google-workspace-ops,"Operate across Google Drive, Docs, Sheets, and Slides as one workflow surface for plans, trackers, decks, and shared documents. Use when the user needs to find, summarize, edit, migrate, or clean up Google Workspace assets without dropping to raw tool calls.",lib/affaan-m-everything-claude-code/skills/google-workspace-ops/SKILL.md
googlesheets-automation,"Automate Google Sheets operations (read, write, format, filter, manage spreadsheets) via Rube MCP (Composio). Read/write data, manage tabs, apply formatting, and search rows programmatically.",lib/sickn33-antigravity-awesome-skills/plugins/antigravity-awesome-skills-claude/skills/googlesheets-automation/SKILL.md
grammar-check,"Identify grammar, logical, and flow errors in text and suggest targeted fixes without rewriting the entire text. Use when proofreading content, checking writing quality, or reviewing a draft.",lib/phuryn-pm-skills/pm-toolkit/skills/grammar-check/SKILL.md
growth-engine,"Motor de crescimento para produtos digitais -- growth hacking, SEO, ASO, viral loops, email marketing, CRM, referral programs e aquisicao organica.",lib/sickn33-antigravity-awesome-skills/plugins/antigravity-awesome-skills-claude/skills/growth-engine/SKILL.md
grpo-rl-training,Expert guidance for GRPO/RL fine-tuning with TRL for reasoning and task-specific model training,lib/orchestra-research-ai-research-skills/06-post-training/grpo-rl-training/SKILL.md
gstack-upgrade,"Upgrade gstack to the latest version. Detects global vs vendored install, runs the upgrade, and shows what's new. Use when asked to ""upgrade gstack"", ""update gstack"", or ""get latest version"".",lib/garrytan-gstack/gstack-upgrade/SKILL.md
gtars,"High-performance toolkit for genomic interval analysis in Rust with Python bindings. Use when working with genomic regions, BED files, coverage tracks, overlap detection, tokenization for ML models, or fragment analysis in computational genomics and machine learning applications.",lib/k-dense-ai-claude-scientific-skills/scientific-skills/gtars/SKILL.md
guard,"Full safety mode: destructive command warnings + directory-scoped edits. Combines /careful (warns before rm -rf, DROP TABLE, force-push, etc.) with /freeze (blocks edits outside a specified directory). Use for maximum safety when touching prod or debugging live systems. Use when asked to ""guard mode"", ""full safety"", ""lock it down"", or ""maximum safety"". (gstack)",lib/garrytan-gstack/guard/SKILL.md
hand-drawn-diagrams,"Create hand-drawn Excalidraw diagrams, flows, explainers, wireframes, and page mockups. Default to monochrome sketch output; allow restrained color only for page mockups when the user explicitly wants webpage-like fidelity.",lib/muthuishere-hand-drawn-diagrams/SKILL.md
haskell-pro,"Expert Haskell engineer specializing in advanced type systems, pure",lib/sickn33-antigravity-awesome-skills/plugins/antigravity-awesome-skills-claude/skills/haskell-pro/SKILL.md
healthcare-cdss-patterns,"Clinical Decision Support System (CDSS) development patterns. Drug interaction checking, dose validation, clinical scoring (NEWS2, qSOFA), alert severity classification, and integration into EMR workflows.",lib/affaan-m-everything-claude-code/skills/healthcare-cdss-patterns/SKILL.md
help,"Shows available skills, common workflows, and quick reference for the plugin. Use when the user asks for help, what skills are available, or how to do something.",lib/bitwize-music-studio-claude-ai-music-skills/skills/help/SKILL.md
helpdesk-automation,"Automate HelpDesk tasks via Rube MCP (Composio): list tickets, manage views, use canned responses, and configure custom fields. Always search tools first for current schemas.",lib/sickn33-antigravity-awesome-skills/plugins/antigravity-awesome-skills-claude/skills/helpdesk-automation/SKILL.md
hierarchical-agent-memory,"Scoped CLAUDE.md memory system that reduces context token spend. Creates directory-level context files, tracks savings via dashboard, and routes agents to the right sub-context.",lib/sickn33-antigravity-awesome-skills/plugins/antigravity-awesome-skills-claude/skills/hierarchical-agent-memory/SKILL.md
hig-components-content,"Apple Human Interface Guidelines for content display components. Use this skill when the user asks about ""charts component"", ""collection view"", ""image view"", ""web view"", ""color well"", ""image well"", ""activity view"", ""lockup"", ""data visualization"", ""content display"", displaying images, rendering web content, color pickers, or presenting collections of items in Apple apps. Also use when the user says ""how should I display charts"", ""what's the best way to show images"", ""should I use a web view"", ""how do I build a grid of items"", ""what component shows media"", or ""how do I present a share sheet"". Cross-references: hig-foundations for color/typography/accessibility, hig-patterns for data visualization patterns, hig-components-layout for structural containers, hig-platforms for platform-specific component behavior.",lib/raintree-technology-apple-hig-skills/skills/hig-components-content/SKILL.md
hig-technologies,"Apple HIG guidance for Apple technology integrations: Siri, Apple Pay, HealthKit, HomeKit, ARKit, machine learning, generative AI, iCloud, Sign in with Apple, SharePlay, CarPlay, Game Center, in-app purchase, NFC, Wallet, VoiceOver, Maps, Mac Catalyst, and more. Use when asked about: ""Siri integration"", ""Apple Pay"", ""HealthKit"", ""HomeKit"", ""ARKit"", ""augmented reality"", ""machine learning"", ""generative AI"", ""iCloud sync"", ""Sign in with Apple"", ""SharePlay"", ""CarPlay"", ""in-app purchase"", ""NFC"", ""VoiceOver"", ""Maps"", ""Mac Catalyst"". Also use when the user says ""how do I integrate Siri,"" ""what are the Apple Pay guidelines,"" ""how should my AR experience work,"" ""how do I use Sign in with Apple,"" or asks about any Apple framework or service integration. Cross-references: hig-inputs for input methods, hig-components-system for widgets.",lib/raintree-technology-apple-hig-skills/skills/hig-technologies/SKILL.md
histolab,"Lightweight WSI tile extraction and preprocessing. Use for basic slide processing tissue detection, tile extraction, stain normalization for H&E images. Best for simple pipelines, dataset preparation, quick tile-based analysis. For advanced spatial proteomics, multiplexed imaging, or deep learning pipelines use pathml.",lib/k-dense-ai-claude-scientific-skills/scientific-skills/histolab/SKILL.md
hocr-parsing-and-conversion,hocr parsing and conversion,lib/kreuzberg-dev-kreuzberg/.ai-rulez/domains/ocr-integration/skills/hocr-parsing-and-conversion/SKILL.md
home-assistant-manager,"Expert-level Home Assistant configuration management with efficient deployment workflows (git and rapid scp iteration), remote CLI access via SSH and hass-cli, automation verification protocols, log analysis, reload vs restart optimization, and comprehensive Lovelace dashboard management for tablet-optimized UIs. Includes template patterns, card types, debugging strategies, and real-world examples.",lib/komal-skynet-claude-skill-homeassistant/SKILL.md
homepage-audit,"Full conversion audit for any homepage or landing page. Use when someone asks to ""review my homepage,"" ""audit my landing page,"" ""why isn't my page converting,"" ""check my website,"" or wants feedback on their marketing page. Requires URL or screenshot before proceeding.",lib/brianrwagner-ai-marketing-skills/homepage-audit/SKILL.md
hosted-agents,"Build background agents in sandboxed environments. Use for hosted coding agents, sandboxed VMs, Modal sandboxes, and remote coding environments.",lib/sickn33-antigravity-awesome-skills/plugins/antigravity-awesome-skills-claude/skills/hosted-agents/SKILL.md
hqq-quantization,"Half-Quadratic Quantization for LLMs without calibration data. Use when quantizing models to 4/3/2-bit precision without needing calibration datasets, for fast quantization workflows, or when deploying with vLLM or HuggingFace Transformers.",lib/orchestra-research-ai-research-skills/10-optimization/hqq/SKILL.md
hr-pro,"Professional, ethical HR partner for hiring, onboarding/offboarding, PTO and leave, performance, compliant policies, and employee relations.",lib/sickn33-antigravity-awesome-skills/plugins/antigravity-awesome-skills-claude/skills/hr-pro/SKILL.md
hubspot-automation,"Automate HubSpot CRM operations (contacts, companies, deals, tickets, properties) via Rube MCP using Composio integration.",lib/sickn33-antigravity-awesome-skills/plugins/antigravity-awesome-skills-claude/skills/hubspot-automation/SKILL.md
hubspot-integration,Authentication for single-account integrations,lib/sickn33-antigravity-awesome-skills/plugins/antigravity-awesome-skills-claude/skills/hubspot-integration/SKILL.md
hugging-face-cli,"Use the Hugging Face Hub CLI (`hf`) to download, upload, and manage models, datasets, and Spaces.",lib/sickn33-antigravity-awesome-skills/plugins/antigravity-awesome-skills-claude/skills/hugging-face-cli/SKILL.md
hugging-face-community-evals,Run local evaluations for Hugging Face Hub models with inspect-ai or lighteval.,lib/sickn33-antigravity-awesome-skills/plugins/antigravity-awesome-skills-claude/skills/hugging-face-community-evals/SKILL.md
hugging-face-dataset-viewer,"Query Hugging Face datasets through the Dataset Viewer API for splits, rows, search, filters, and parquet links.",lib/sickn33-antigravity-awesome-skills/plugins/antigravity-awesome-skills-claude/skills/hugging-face-dataset-viewer/SKILL.md
hugging-face-evaluation,"Add and manage evaluation results in Hugging Face model cards. Supports extracting eval tables from README content, importing scores from Artificial Analysis API, and running custom model evaluations with vLLM/lighteval. Works with the model-index metadata format.",lib/sickn33-antigravity-awesome-skills/plugins/antigravity-awesome-skills-claude/skills/hugging-face-evaluation/SKILL.md
hugging-face-jobs,"Run workloads on Hugging Face Jobs with managed CPUs, GPUs, TPUs, secrets, and Hub persistence.",lib/sickn33-antigravity-awesome-skills/plugins/antigravity-awesome-skills-claude/skills/hugging-face-jobs/SKILL.md
hugging-face-model-trainer,"Train or fine-tune TRL language models on Hugging Face Jobs, including SFT, DPO, GRPO, and GGUF export.",lib/sickn33-antigravity-awesome-skills/plugins/antigravity-awesome-skills-claude/skills/hugging-face-model-trainer/SKILL.md
hugging-face-paper-publisher,"Publish and manage research papers on Hugging Face Hub. Supports creating paper pages, linking papers to models/datasets, claiming authorship, and generating professional markdown-based research articles.",lib/sickn33-antigravity-awesome-skills/plugins/antigravity-awesome-skills-claude/skills/hugging-face-paper-publisher/SKILL.md
hugging-face-papers,Read and analyze Hugging Face paper pages or arXiv papers with markdown and papers API metadata.,lib/sickn33-antigravity-awesome-skills/plugins/antigravity-awesome-skills-claude/skills/hugging-face-papers/SKILL.md
hugging-face-tool-builder,"Your purpose is now is to create reusable command line scripts and utilities for using the Hugging Face API, allowing chaining, piping and intermediate processing where helpful. You can access the API directly, as well as use the hf command line tool.",lib/sickn33-antigravity-awesome-skills/plugins/antigravity-awesome-skills-claude/skills/hugging-face-tool-builder/SKILL.md
hugging-face-vision-trainer,"Train or fine-tune vision models on Hugging Face Jobs for detection, classification, and SAM or SAM2 segmentation.",lib/sickn33-antigravity-awesome-skills/plugins/antigravity-awesome-skills-claude/skills/hugging-face-vision-trainer/SKILL.md
huggingface-accelerate,"Simplest distributed training API. 4 lines to add distributed support to any PyTorch script. Unified API for DeepSpeed/FSDP/Megatron/DDP. Automatic device placement, mixed precision (FP16/BF16/FP8). Interactive config, single launch command. HuggingFace ecosystem standard.",lib/orchestra-research-ai-research-skills/08-distributed-training/accelerate/SKILL.md
humanizer,"Remove signs of AI-generated writing from text. Use when editing or reviewing text to make it sound more natural and human-written. Based on Wikipedia's comprehensive ""Signs of AI writing"" guide. Detects and fixes patterns including: inflated symbolism, promotional language, superficial -ing analyses, vague attributions, em dash overuse, rule of three, AI vocabulary words, passive voice, negative parallelisms, and filler phrases.",lib/blader-humanizer/SKILL.md
hunting-for-ntlm-relay-attacks,"Detect NTLM relay attacks by analyzing Windows Event 4624 logon type 3 with NTLMSSP authentication, identifying IP-to-hostname mismatches, Responder traffic signatures, SMB signing status, and suspicious authentication patterns across the domain.",lib/mukul975-anthropic-cybersecurity-skills/skills/hunting-for-ntlm-relay-attacks/SKILL.md
hybrid-cloud-architect,Expert hybrid cloud architect specializing in complex multi-cloud solutions across AWS/Azure/GCP and private clouds (OpenStack/VMware).,lib/sickn33-antigravity-awesome-skills/plugins/antigravity-awesome-skills-claude/skills/hybrid-cloud-architect/SKILL.md
hybrid-cloud-networking,"Configure secure, high-performance connectivity between on-premises and cloud environments using VPN, Direct Connect, and ExpressRoute.",lib/sickn33-antigravity-awesome-skills/plugins/antigravity-awesome-skills-claude/skills/hybrid-cloud-networking/SKILL.md
hybrid-search-implementation,"Combine vector and keyword search for improved retrieval. Use when implementing RAG systems, building search engines, or when neither approach alone provides sufficient recall.",lib/sickn33-antigravity-awesome-skills/plugins/antigravity-awesome-skills-claude/skills/hybrid-search-implementation/SKILL.md
i18n-localization,"Internationalization and localization patterns. Detecting hardcoded strings, managing translations, locale files, RTL support.",lib/sickn33-antigravity-awesome-skills/plugins/antigravity-awesome-skills-claude/skills/i18n-localization/SKILL.md
image-ocr-processing,image ocr processing,lib/kreuzberg-dev-kreuzberg/.ai-rulez/domains/ocr-integration/skills/image-ocr-processing/SKILL.md
imaging-data-commons,"Query and download public cancer imaging data from NCI Imaging Data Commons using idc-index. Use for accessing large-scale radiology (CT, MR, PET) and pathology datasets for AI training or research. No authentication required. Query by metadata, visualize in browser, check licenses.",lib/k-dense-ai-claude-scientific-skills/scientific-skills/imaging-data-commons/SKILL.md
implementing-anti-ransomware-group-policy,"Configures Windows Group Policy Objects (GPO) to prevent ransomware execution and limit its spread. Implements AppLocker rules, Software Restriction Policies, Controlled Folder Access, attack surface reduction rules, and network protection settings. Activates for requests involving Windows GPO hardening against ransomware, AppLocker configuration, Controlled Folder Access setup, or endpoint protection via Group Policy.",lib/mukul975-anthropic-cybersecurity-skills/skills/implementing-anti-ransomware-group-policy/SKILL.md
implementing-attack-path-analysis-with-xm-cyber,"Deploy XM Cyber's continuous exposure management platform to map attack paths, identify choke points, and prioritize the 2% of exposures that threaten critical assets.",lib/mukul975-anthropic-cybersecurity-skills/skills/implementing-attack-path-analysis-with-xm-cyber/SKILL.md
implementing-aws-macie-for-data-classification,"Implement Amazon Macie to automatically discover, classify, and protect sensitive data in S3 buckets using machine learning and pattern matching for PII, financial data, and credentials detection.",lib/mukul975-anthropic-cybersecurity-skills/skills/implementing-aws-macie-for-data-classification/SKILL.md
implementing-azure-ad-privileged-identity-management,"Configure Microsoft Entra Privileged Identity Management to enforce just-in-time role activation, approval workflows, and access reviews for Azure AD privileged roles.",lib/mukul975-anthropic-cybersecurity-skills/skills/implementing-azure-ad-privileged-identity-management/SKILL.md
implementing-code-signing-for-artifacts,"This skill covers implementing code signing for build artifacts to ensure integrity and authenticity throughout the software supply chain. It addresses signing binaries, packages, and containers using GPG, Sigstore, and platform-specific signing tools, establishing trust chains, and verifying signatures in deployment pipelines.",lib/mukul975-anthropic-cybersecurity-skills/skills/implementing-code-signing-for-artifacts/SKILL.md
implementing-deception-based-detection-with-canarytoken,"Deploy and monitor Canary Tokens via the Thinkst Canary API for deception-based breach detection using web bug tokens, DNS tokens, document tokens, and AWS key tokens.",lib/mukul975-anthropic-cybersecurity-skills/skills/implementing-deception-based-detection-with-canarytoken/SKILL.md
implementing-delinea-secret-server-for-pam,"Implements Delinea Secret Server for privileged access management (PAM) including secret vault configuration, role-based access policies, automated password rotation, session recording, and integration with Active Directory and cloud platforms. Activates for requests involving PAM deployment, privileged credential vaulting, secret server administration, or password rotation automation.",lib/mukul975-anthropic-cybersecurity-skills/skills/implementing-delinea-secret-server-for-pam/SKILL.md
implementing-endpoint-dlp-controls,"Implements endpoint Data Loss Prevention (DLP) controls to detect and prevent sensitive data exfiltration through email, USB, cloud storage, and printing. Use when deploying DLP agents, creating content inspection policies, or preventing unauthorized data movement from endpoints. Activates for requests involving DLP, data exfiltration prevention, content inspection, or sensitive data protection on endpoints.",lib/mukul975-anthropic-cybersecurity-skills/skills/implementing-endpoint-dlp-controls/SKILL.md
implementing-google-workspace-sso-configuration,"Configure SAML 2.0 single sign-on for Google Workspace with a third-party identity provider, enabling centralized authentication and enforcing organization-wide access policies.",lib/mukul975-anthropic-cybersecurity-skills/skills/implementing-google-workspace-sso-configuration/SKILL.md
implementing-hashicorp-vault-dynamic-secrets,"Implements HashiCorp Vault dynamic secrets engines for database credentials, AWS IAM keys, and PKI certificates with automatic generation, lease management, and credential rotation to eliminate static secrets in application configurations. Activates for requests involving Vault secrets engine configuration, dynamic database credentials, ephemeral cloud credentials, or automated secret rotation.",lib/mukul975-anthropic-cybersecurity-skills/skills/implementing-hashicorp-vault-dynamic-secrets/SKILL.md
implementing-identity-governance-with-sailpoint,"Deploy SailPoint IdentityNow or IdentityIQ for identity governance and administration. Covers identity lifecycle management, access request workflows, certification campaigns, role mining, SOD policy",lib/mukul975-anthropic-cybersecurity-skills/skills/implementing-identity-governance-with-sailpoint/SKILL.md
implementing-llms-litgpt,"Implements and trains LLMs using Lightning AI's LitGPT with 20+ pretrained architectures (Llama, Gemma, Phi, Qwen, Mistral). Use when need clean model implementations, educational understanding of architectures, or production fine-tuning with LoRA/QLoRA. Single-file implementations, no abstraction layers.",lib/orchestra-research-ai-research-skills/01-model-architecture/litgpt/SKILL.md
implementing-log-integrity-with-blockchain,"Build an append-only log integrity chain using SHA-256 hash chaining for tamper detection. Each log entry is hashed with the previous entry's hash to create a blockchain-like structure where modifying any entry invalidates all subsequent hashes. Implements log ingestion, chain verification, tamper detection with pinpoint identification, and periodic checkpoint anchoring to external timestamping services.",lib/mukul975-anthropic-cybersecurity-skills/skills/implementing-log-integrity-with-blockchain/SKILL.md
implementing-microsegmentation-with-guardicore,"Implementing microsegmentation using Akamai Guardicore Segmentation to map application dependencies, create granular network policies, visualize east-west traffic flows, and enforce least-privilege communication between workloads across data centers and cloud.",lib/mukul975-anthropic-cybersecurity-skills/skills/implementing-microsegmentation-with-guardicore/SKILL.md
