skill_id,description,src_path
claude-scientific-skills,Scientific research and analysis skills,lib/sickn33-antigravity-awesome-skills/plugins/antigravity-awesome-skills-claude/skills/claude-scientific-skills/SKILL.md
claude-settings-audit,"Analyze a repository to generate recommended Claude Code settings.json permissions. Use when setting up a new project, auditing existing settings, or determining which read-only bash commands to allow. Detects tech stack, build tools, and monorepo structure.",lib/sickn33-antigravity-awesome-skills/skills/claude-settings-audit/SKILL.md
claude-speed-reader,-Speed read Claude's responses at 600+ WPM using RSVP with Spritz-style ORP highlighting,lib/sickn33-antigravity-awesome-skills/plugins/antigravity-awesome-skills-claude/skills/claude-speed-reader/SKILL.md
claude-win11-speckit-update-skill,Windows 11 system management,lib/sickn33-antigravity-awesome-skills/plugins/antigravity-awesome-skills-claude/skills/claude-win11-speckit-update-skill/SKILL.md
clean-code,"This skill embodies the principles of ""Clean Code"" by Robert C. Martin (Uncle Bob). Use it to transform ""code that works"" into ""code that is clean.""",lib/sickn33-antigravity-awesome-skills/plugins/antigravity-awesome-skills-claude/skills/clean-code/SKILL.md
clickup-automation,"Automate ClickUp project management including tasks, spaces, folders, lists, comments, and team operations via Rube MCP (Composio). Always search tools first for current schemas.",lib/sickn33-antigravity-awesome-skills/plugins/antigravity-awesome-skills-claude/skills/clickup-automation/SKILL.md
clinical-decision-support,"Generate professional clinical decision support (CDS) documents for pharmaceutical and clinical research settings, including patient cohort analyses (biomarker-stratified with outcomes) and treatment recommendation reports (evidence-based guidelines with decision algorithms). Supports GRADE evidence grading, statistical analysis (hazard ratios, survival curves, waterfall plots), biomarker integration, and regulatory compliance. Outputs publication-ready LaTeX/PDF format optimized for drug development, clinical research, and evidence synthesis.",lib/k-dense-ai-claude-scientific-skills/scientific-skills/clinical-decision-support/SKILL.md
clinical-reports,"Write comprehensive clinical reports including case reports (CARE guidelines), diagnostic reports (radiology/pathology/lab), clinical trial reports (ICH-E3, SAE, CSR), and patient documentation (SOAP, H&P, discharge summaries). Full support with templates, regulatory compliance (HIPAA, FDA, ICH-GCP), and validation tools.",lib/k-dense-ai-claude-scientific-skills/scientific-skills/clinical-reports/SKILL.md
clip,"OpenAI's model connecting vision and language. Enables zero-shot image classification, image-text matching, and cross-modal retrieval. Trained on 400M image-text pairs. Use for image search, content moderation, or vision-language tasks without fine-tuning. Best for general-purpose image understanding.",lib/orchestra-research-ai-research-skills/18-multimodal/clip/SKILL.md
clipboard,"Copies track content (lyrics, style prompts, streaming lyrics) to the system clipboard. Use when the user needs to paste lyrics or style prompts into Suno or other external tools.",lib/bitwize-music-studio-claude-ai-music-skills/skills/clipboard/SKILL.md
close-automation,"Automate Close CRM tasks via Rube MCP (Composio): create leads, manage calls/SMS, handle tasks, and track notes. Always search tools first for current schemas.",lib/sickn33-antigravity-awesome-skills/plugins/antigravity-awesome-skills-claude/skills/close-automation/SKILL.md
closed-loop-delivery,"Use when a coding task must be completed against explicit acceptance criteria with minimal user re-intervention across implementation, review feedback, deployment, and runtime verification.",lib/sickn33-antigravity-awesome-skills/plugins/antigravity-awesome-skills-claude/skills/closed-loop-delivery/SKILL.md
cloudformation-best-practices,"CloudFormation template optimization, nested stacks, drift detection, and production-ready patterns. Use when writing or reviewing CF templates.",lib/sickn33-antigravity-awesome-skills/plugins/antigravity-awesome-skills-claude/skills/cloudformation-best-practices/SKILL.md
cobrapy,"Constraint-based metabolic modeling (COBRA). FBA, FVA, gene knockouts, flux sampling, SBML models, for systems biology and metabolic engineering analysis.",lib/k-dense-ai-claude-scientific-skills/scientific-skills/cobrapy/SKILL.md
coda-automation,"Automate Coda tasks via Rube MCP (Composio): manage docs, pages, tables, rows, formulas, permissions, and publishing. Always search tools first for current schemas.",lib/sickn33-antigravity-awesome-skills/plugins/antigravity-awesome-skills-claude/skills/coda-automation/SKILL.md
code-deduplication,Prevent semantic code duplication with capability index and check-before-write,lib/alinaqi-claude-bootstrap/skills/code-deduplication/SKILL.md
code-documentation-code-explain,"You are a code education expert specializing in explaining complex code through clear narratives, visual diagrams, and step-by-step breakdowns. Transform difficult concepts into understandable explanations for developers at all levels.",lib/sickn33-antigravity-awesome-skills/plugins/antigravity-awesome-skills-claude/skills/code-documentation-code-explain/SKILL.md
code-documentation-doc-generate,"You are a documentation expert specializing in creating comprehensive, maintainable documentation from code. Generate API docs, architecture diagrams, user guides, and technical references using AI-powered analysis and industry best practices.",lib/sickn33-antigravity-awesome-skills/plugins/antigravity-awesome-skills-claude/skills/code-documentation-doc-generate/SKILL.md
code-graph,"AST-based code graph for fast symbol lookup, dependency analysis, and blast radius via codebase-memory-mcp MCP server",lib/alinaqi-claude-bootstrap/skills/code-graph/SKILL.md
code-refactoring-context-restore,Use when working with code refactoring context restore,lib/sickn33-antigravity-awesome-skills/plugins/antigravity-awesome-skills-claude/skills/code-refactoring-context-restore/SKILL.md
code-refactoring-tech-debt,"You are a technical debt expert specializing in identifying, quantifying, and prioritizing technical debt in software projects. Analyze the codebase to uncover debt, assess its impact, and create acti",lib/sickn33-antigravity-awesome-skills/plugins/antigravity-awesome-skills-claude/skills/code-refactoring-tech-debt/SKILL.md
code-review,Mandatory code reviews via /code-review before commits and deploys,lib/alinaqi-claude-bootstrap/skills/code-review/SKILL.md
code-review-ai-ai-review,"You are an expert AI-powered code review specialist combining automated static analysis, intelligent pattern recognition, and modern DevOps practices. Leverage AI tools (GitHub Copilot, Qodo, GPT-5, C",lib/sickn33-antigravity-awesome-skills/plugins/antigravity-awesome-skills-claude/skills/code-review-ai-ai-review/SKILL.md
code-review-excellence,"Transform code reviews from gatekeeping to knowledge sharing through constructive feedback, systematic analysis, and collaborative improvement.",lib/sickn33-antigravity-awesome-skills/plugins/antigravity-awesome-skills-claude/skills/code-review-excellence/SKILL.md
code-review:review-local-changes,Comprehensive review of local uncommitted changes using specialized agents with code improvement suggestions,lib/neolabhq-context-engineering-kit/plugins/code-review/skills/review-local-changes/SKILL.md
code-review:review-pr,Comprehensive pull request review using specialized agents,lib/neolabhq-context-engineering-kit/plugins/code-review/skills/review-pr/SKILL.md
code-reviewer,Elite code review expert specializing in modern AI-powered code,lib/sickn33-antigravity-awesome-skills/plugins/antigravity-awesome-skills-claude/skills/code-reviewer/SKILL.md
code-simplifier,"Simplifies and refines code for clarity, consistency, and maintainability while preserving all functionality. Use when asked to ""simplify code"", ""clean up code"", ""refactor for clarity"", ""improve readability"", or review recently modified code for elegance. Focuses on project-specific best practices.",lib/sickn33-antigravity-awesome-skills/plugins/antigravity-awesome-skills-claude/skills/code-simplifier/SKILL.md
coding-agent-router,Coding Agent Router,lib/shunsukehayashi-agent-skill-bus/skills/coding-agent-router/SKILL.md
cold-outreach-sequence,"Build personalized cold outreach sequences for LinkedIn and email. Use when someone needs to reach prospects, warm up cold leads, or build a systematic outreach engine. Covers research, connection requests, follow-ups, and conversion.",lib/brianrwagner-ai-marketing-skills/cold-outreach-sequence/SKILL.md
comm-lit-review,"Communications-domain literature review and related-work search with database-aware source control. Use when the task is about communications, wireless, networking, satellite/NTN, Wi-Fi, cellular, transport protocols, congestion control, routing, scheduling, MAC/PHY, rate adaptation, channel estimation, beamforming, or communication-system research and the user wants papers, prior art, a survey, related work, or a landscape summary. Prioritize IEEE Xplore and ScienceDirect, prefer formal publications over preprints, and separate foundational work from recent progress.",lib/wanshuiyin-auto-claude-code-research-in-sleep/skills/skills-codex/comm-lit-review/SKILL.md
comm-lit-review-claude-single,"Communications-domain literature review with Claude-style knowledge-base-first retrieval. Use when the task is about communications, wireless, networking, satellite/NTN, Wi-Fi, cellular, transport protocols, congestion control, routing, scheduling, MAC/PHY, rate adaptation, channel estimation, beamforming, or communication-system research and the user wants papers, related work, a survey, or a landscape summary. Search Zotero, Obsidian, and local paper folders first when available, then search IEEE Xplore, ScienceDirect, ACM Digital Library, and broader web in that order.",lib/wanshuiyin-auto-claude-code-research-in-sleep/skills/comm-lit-review/SKILL.md
commit-hygiene,"Atomic commits, PR size limits, commit thresholds, stacked PRs",lib/alinaqi-claude-bootstrap/skills/commit-hygiene/SKILL.md
comprehensive-review-full-review,Use when working with comprehensive review full review,lib/sickn33-antigravity-awesome-skills/plugins/antigravity-awesome-skills-claude/skills/comprehensive-review-full-review/SKILL.md
computer-vision-expert,"SOTA Computer Vision Expert (2026). Specialized in YOLO26, Segment Anything 3 (SAM 3), Vision Language Models, and real-time spatial analysis.",lib/sickn33-antigravity-awesome-skills/plugins/antigravity-awesome-skills-claude/skills/computer-vision-expert/SKILL.md
concise-planning,"Use when a user asks for a plan for a coding task, to generate a clear, actionable, and atomic checklist.",lib/sickn33-antigravity-awesome-skills/plugins/antigravity-awesome-skills-claude/skills/concise-planning/SKILL.md
conducting-malware-incident-response,"Responds to malware infections across enterprise endpoints by identifying the malware family, determining infection vectors, assessing spread, and executing eradication procedures. Covers the full lifecycle from detection through containment, analysis, removal, and recovery. Activates for requests involving malware response, malware eradication, trojan removal, worm containment, malware triage, or infected endpoint remediation.",lib/mukul975-anthropic-cybersecurity-skills/skills/conducting-malware-incident-response/SKILL.md
conducting-post-incident-lessons-learned,"Facilitate structured post-incident reviews to identify root causes, document what worked and failed, and produce actionable recommendations to improve future incident response.",lib/mukul975-anthropic-cybersecurity-skills/skills/conducting-post-incident-lessons-learned/SKILL.md
conductor-implement,Execute tasks from a track's implementation plan following TDD workflow,lib/sickn33-antigravity-awesome-skills/plugins/antigravity-awesome-skills-claude/skills/conductor-implement/SKILL.md
conductor-manage,"Manage track lifecycle: archive, restore, delete, rename, and cleanup",lib/sickn33-antigravity-awesome-skills/plugins/antigravity-awesome-skills-claude/skills/conductor-manage/SKILL.md
conductor-new-track,Create a new track with specification and phased implementation plan,lib/sickn33-antigravity-awesome-skills/plugins/antigravity-awesome-skills-claude/skills/conductor-new-track/SKILL.md
conductor-revert,"Git-aware undo by logical work unit (track, phase, or task)",lib/sickn33-antigravity-awesome-skills/plugins/antigravity-awesome-skills-claude/skills/conductor-revert/SKILL.md
conductor-status,"Display project status, active tracks, and next actions",lib/sickn33-antigravity-awesome-skills/plugins/antigravity-awesome-skills-claude/skills/conductor-status/SKILL.md
conductor-validator,"Validates Conductor project artifacts for completeness, consistency, and correctness. Use after setup, when diagnosing issues, or before implementation to verify project context.",lib/sickn33-antigravity-awesome-skills/plugins/antigravity-awesome-skills-claude/skills/conductor-validator/SKILL.md
config-loading-precedence,config loading precedence,lib/kreuzberg-dev-kreuzberg/.ai-rulez/skills/config-loading-precedence/SKILL.md
configuration-management,configuration management,lib/kreuzberg-dev-kreuzberg/.ai-rulez/domains/document-extraction/skills/configuration-management/SKILL.md
configure,"Sets up or edits the plugin configuration file interactively. Use on first-time setup, when config is missing, or when the user wants to change settings.",lib/bitwize-music-studio-claude-ai-music-skills/skills/configure/SKILL.md
configuring-certificate-authority-with-openssl,"A Certificate Authority (CA) is the trust anchor in a PKI hierarchy, responsible for issuing, signing, and revoking digital certificates. This skill covers building a two-tier CA hierarchy (Root CA +",lib/mukul975-anthropic-cybersecurity-skills/skills/configuring-certificate-authority-with-openssl/SKILL.md
configuring-identity-aware-proxy-with-google-iap,"Configuring Google Cloud Identity-Aware Proxy (IAP) to enforce per-request identity verification for Compute Engine, App Engine, Cloud Run, and GKE services using access levels, context-aware policies, and programmatic access with service accounts.",lib/mukul975-anthropic-cybersecurity-skills/skills/configuring-identity-aware-proxy-with-google-iap/SKILL.md
configuring-multi-factor-authentication-with-duo,"Deploy Cisco Duo multi-factor authentication across enterprise applications, VPN, RDP, and SSH access points. This skill covers Duo integration methods, adaptive authentication policies, device trust",lib/mukul975-anthropic-cybersecurity-skills/skills/configuring-multi-factor-authentication-with-duo/SKILL.md
confluence-automation,"Automate Confluence page creation, content search, space management, labels, and hierarchy navigation via Rube MCP (Composio). Always search tools first for current schemas.",lib/sickn33-antigravity-awesome-skills/plugins/antigravity-awesome-skills-claude/skills/confluence-automation/SKILL.md
connect-chrome,"Launch real Chrome controlled by gstack with the Side Panel extension auto-loaded. One command: connects Claude to a visible Chrome window where you can watch every action in real time. The extension shows a live activity feed in the Side Panel. Use when asked to ""connect chrome"", ""open chrome"", ""real browser"", ""launch chrome"", ""side panel"", or ""control my browser"".",lib/garrytan-gstack/connect-chrome/SKILL.md
consciousness-council,"Run a multi-perspective Mind Council deliberation on any question, decision, or creative challenge. Use this skill whenever the user wants diverse viewpoints, needs help making a tough decision, asks for a council/panel/board discussion, wants to explore a problem from multiple angles, requests devil's advocate analysis, or says things like ""what would different experts think about this"", ""help me think through this from all sides"", ""council mode"", ""mind council"", or ""deliberate on this"". Also trigger when the user faces a dilemma, trade-off, or complex choice with no obvious answer.",lib/k-dense-ai-claude-scientific-skills/scientific-skills/consciousness-council/SKILL.md
constant-time-analysis,Analyze cryptographic code to detect operations that leak secret data through execution timing variations.,lib/sickn33-antigravity-awesome-skills/plugins/antigravity-awesome-skills-claude/skills/constant-time-analysis/SKILL.md
constitutional-ai,"Anthropic's method for training harmless AI through self-improvement. Two-phase approach - supervised learning with self-critique/revision, then RLAIF (RL from AI Feedback). Use for safety alignment, reducing harmful outputs without human labels. Powers Claude's safety system.",lib/orchestra-research-ai-research-skills/07-safety-alignment/constitutional-ai/SKILL.md
content-engine,"Create platform-native content systems for X, LinkedIn, TikTok, YouTube, newsletters, and repurposed multi-platform campaigns. Use when the user wants social posts, threads, scripts, content calendars, or one source asset adapted cleanly across platforms.",lib/affaan-m-everything-claude-code/.agents/skills/content-engine/SKILL.md
context-agent,"Agente de contexto para continuidade entre sessoes. Salva resumos, decisoes, tarefas pendentes e carrega briefing automatico na sessao seguinte.",lib/sickn33-antigravity-awesome-skills/plugins/antigravity-awesome-skills-claude/skills/context-agent/SKILL.md
context-compression,"When agent sessions generate millions of tokens of conversation history, compression becomes mandatory. The naive approach is aggressive compression to minimize tokens per request.",lib/sickn33-antigravity-awesome-skills/plugins/antigravity-awesome-skills-claude/skills/context-compression/SKILL.md
context-degradation,Language models exhibit predictable degradation patterns as context length increases. Understanding these patterns is essential for diagnosing failures and designing resilient systems.,lib/sickn33-antigravity-awesome-skills/plugins/antigravity-awesome-skills-claude/skills/context-degradation/SKILL.md
context-driven-development,"Guide for implementing and maintaining context as a managed artifact alongside code, enabling consistent AI interactions and team alignment through structured project documentation.",lib/sickn33-antigravity-awesome-skills/plugins/antigravity-awesome-skills-claude/skills/context-driven-development/SKILL.md
context-engineering-advisor,"Diagnose context stuffing vs. context engineering. Use when an AI workflow feels bloated, brittle, or hard to steer reliably.",lib/deanpeters-product-manager-skills/skills/context-engineering-advisor/SKILL.md
context-guardian,"Guardiao de contexto que preserva dados criticos antes da compactacao automatica. Snapshots, verificacao de integridade e zero perda de informacao.",lib/sickn33-antigravity-awesome-skills/plugins/antigravity-awesome-skills-claude/skills/context-guardian/SKILL.md
context-management-context-restore,Use when working with context management context restore,lib/sickn33-antigravity-awesome-skills/plugins/antigravity-awesome-skills-claude/skills/context-management-context-restore/SKILL.md
context-management-context-save,Use when working with context management context save,lib/sickn33-antigravity-awesome-skills/plugins/antigravity-awesome-skills-claude/skills/context-management-context-save/SKILL.md
context-manager,"Elite AI context engineering specialist mastering dynamic context management, vector databases, knowledge graphs, and intelligent memory systems.",lib/sickn33-antigravity-awesome-skills/plugins/antigravity-awesome-skills-claude/skills/context-manager/SKILL.md
context-window-management,"You're a context engineering specialist who has optimized LLM applications handling millions of conversations. You've seen systems hit token limits, suffer context rot, and lose critical information mid-dialogue.",lib/sickn33-antigravity-awesome-skills/plugins/antigravity-awesome-skills-claude/skills/context-window-management/SKILL.md
conversation-memory,"Persistent memory systems for LLM conversations including short-term, long-term, and entity-based memory Use when: conversation memory, remember, memory persistence, long-term memory, chat history.",lib/sickn33-antigravity-awesome-skills/plugins/antigravity-awesome-skills-claude/skills/conversation-memory/SKILL.md
convertkit-automation,"Automate ConvertKit (Kit) tasks via Rube MCP (Composio): manage subscribers, tags, broadcasts, and broadcast stats. Always search tools first for current schemas.",lib/sickn33-antigravity-awesome-skills/plugins/antigravity-awesome-skills-claude/skills/convertkit-automation/SKILL.md
cost-optimization,"Strategies and patterns for optimizing cloud costs across AWS, Azure, and GCP.",lib/sickn33-antigravity-awesome-skills/plugins/antigravity-awesome-skills-claude/skills/cost-optimization/SKILL.md
cpp-pro,"Write idiomatic C++ code with modern features, RAII, smart pointers, and STL algorithms. Handles templates, move semantics, and performance optimization.",lib/sickn33-antigravity-awesome-skills/plugins/antigravity-awesome-skills-claude/skills/cpp-pro/SKILL.md
create-branch,"Create a git branch following Sentry naming conventions. Use when asked to ""create a branch"", ""new branch"", ""start a branch"", ""make a branch"", ""switch to a new branch"", or when starting new work on the default branch.",lib/sickn33-antigravity-awesome-skills/plugins/antigravity-awesome-skills-claude/skills/create-branch/SKILL.md
create-issue-gate,Use when starting a new implementation task and an issue must be created with strict acceptance criteria gating before execution.,lib/sickn33-antigravity-awesome-skills/plugins/antigravity-awesome-skills-claude/skills/create-issue-gate/SKILL.md
create-pr,"Alias for sentry-skills:pr-writer. Use when users explicitly ask for ""create-pr"" or reference the legacy skill name. Redirects to the canonical PR writing workflow.",lib/sickn33-antigravity-awesome-skills/plugins/antigravity-awesome-skills-claude/skills/create-pr/SKILL.md
creative-thinking-for-research,"Applies cognitive science frameworks for creative thinking to CS and AI research ideation. Use when seeking genuinely novel research directions by leveraging combinatorial creativity, analogical reasoning, constraint manipulation, and other empirically grounded creative strategies.",lib/orchestra-research-ai-research-skills/21-research-ideation/creative-thinking-for-research/SKILL.md
crewai-multi-agent,"Multi-agent orchestration framework for autonomous AI collaboration. Use when building teams of specialized agents working together on complex tasks, when you need role-based agent collaboration with memory, or for production workflows requiring sequential/hierarchical execution. Built without LangChain dependencies for lean, fast execution.",lib/orchestra-research-ai-research-skills/14-agents/crewai/SKILL.md
crosspost,"Multi-platform content distribution across X, LinkedIn, Threads, and Bluesky. Adapts content per platform using content-engine patterns. Never posts identical content cross-platform. Use when the user wants to distribute content across social platforms.",lib/affaan-m-everything-claude-code/.agents/skills/crosspost/SKILL.md
crypto-bd-agent,"Production-tested patterns for building AI agents that autonomously discover, > evaluate, and acquire token listings for cryptocurrency exchanges.",lib/sickn33-antigravity-awesome-skills/plugins/antigravity-awesome-skills-claude/skills/crypto-bd-agent/SKILL.md
customaize-agent:apply-anthropic-skill-best-practices,Comprehensive guide for skill development based on Anthropic's official best practices - use for complex skills requiring detailed structure,lib/neolabhq-context-engineering-kit/plugins/customaize-agent/skills/apply-anthropic-skill-best-practices/SKILL.md
customaize-agent:context-engineering,"Understand the components, mechanics, and constraints of context in agent systems. Use when writing, editing, or optimizing commands, skills, or sub-agents prompts.",lib/neolabhq-context-engineering-kit/plugins/customaize-agent/skills/context-engineering/SKILL.md
customaize-agent:create-agent,"Comprehensive guide for creating Claude Code agents with proper structure, triggering conditions, system prompts, and validation - combines official Anthropic best practices with proven patterns",lib/neolabhq-context-engineering-kit/plugins/customaize-agent/skills/create-agent/SKILL.md
customaize-agent:create-command,"Interactive assistant for creating new Claude commands with proper structure, patterns, and MCP tool integration",lib/neolabhq-context-engineering-kit/plugins/customaize-agent/skills/create-command/SKILL.md
customaize-agent:create-rule,"Use when found gap or repetative issue, that produced by you or implemenataion agent. Esentially use it each time when you say ""You absolutly right, I should have done it differently."" -> need create rule for this issue so it not appears again.",lib/neolabhq-context-engineering-kit/plugins/customaize-agent/skills/create-rule/SKILL.md
customaize-agent:create-workflow-command,Create a workflow command that orchestrates multi-step execution through sub-agents with file-based task prompts,lib/neolabhq-context-engineering-kit/plugins/customaize-agent/skills/create-workflow-command/SKILL.md
customer-journey-mapping-workshop,"Run a customer journey mapping workshop with adaptive questions and outputs. Use when you need to map stages, actions, emotions, pain points, and opportunities for a persona and scenario.",lib/deanpeters-product-manager-skills/skills/customer-journey-mapping-workshop/SKILL.md
