skill_id,description,score,phase
performing-hash-cracking-with-hashcat,"Hash cracking is an essential skill for penetration testers and security auditors to evaluate password strength. Hashcat is the world's fastest password recovery tool, supporting over 300 hash types w",75,1
performing-http-parameter-pollution-attack,"Execute HTTP Parameter Pollution attacks to bypass input validation, WAF rules, and security controls by injecting duplicate parameters that are processed differently by front-end and back-end systems.",75,1
performing-initial-access-with-evilginx3,Perform authorized initial access using EvilGinx3 adversary-in-the-middle phishing framework to capture session tokens and bypass multi-factor authentication during red team engagements.,75,1
performing-ios-app-security-assessment,"Performs comprehensive iOS application security assessments using Frida for dynamic instrumentation, Objection for runtime exploration, SSL pinning bypass for traffic interception, keychain extraction for credential analysis, and IPA static analysis for binary-level review. Use when conducting authorized iOS penetration tests, evaluating mobile app security posture against OWASP MASTG, or assessing iOS app data protection and transport security controls. Activates for requests involving iOS app pentesting, Frida-based iOS instrumentation, mobile app SSL pinning bypass, or IPA reverse engineering.",75,1
performing-iot-security-assessment,"Performs comprehensive security assessments of IoT devices and their ecosystems by testing hardware interfaces, firmware, network communications, cloud APIs, and companion mobile applications. The tester uses firmware extraction and analysis, hardware debugging via UART and JTAG, network protocol analysis, and runtime exploitation to identify vulnerabilities across all layers of the IoT stack. Activates for requests involving IoT security testing, embedded device assessment, firmware security analysis, or smart device penetration testing.",75,1
performing-ip-reputation-analysis-with-shodan,"Analyze IP address reputation using the Shodan API to identify open ports, running services, known vulnerabilities, and hosting context for threat intelligence enrichment and incident triage.",75,1
performing-jwt-none-algorithm-attack,Execute and test the JWT none algorithm attack to bypass signature verification by manipulating the alg header field in JSON Web Tokens.,75,1
performing-kerberoasting-attack,Kerberoasting is a post-exploitation technique that targets service accounts in Active Directory by requesting Kerberos TGS (Ticket Granting Service) tickets for accounts with Service Principal Names,75,1
performing-kubernetes-cis-benchmark-with-kube-bench,"Audit Kubernetes cluster security posture against CIS benchmarks using kube-bench with automated checks for control plane, worker nodes, and RBAC.",75,1
performing-kubernetes-etcd-security-assessment,"Assess the security posture of Kubernetes etcd clusters by evaluating encryption at rest, TLS configuration, access controls, backup encryption, and network isolation.",75,1
performing-kubernetes-penetration-testing,"Kubernetes penetration testing systematically evaluates cluster security by simulating attacker techniques against the API server, kubelet, etcd, pods, RBAC, network policies, and secrets. Using tools",75,1
performing-lateral-movement-detection,"Detects lateral movement techniques including Pass-the-Hash, PsExec, WMI execution, RDP pivoting, and SMB-based spreading using SIEM correlation of Windows event logs, network flow data, and endpoint telemetry mapped to MITRE ATT&CK Lateral Movement (TA0008) techniques.",75,1
performing-lateral-movement-with-wmiexec,"Perform lateral movement across Windows networks using WMI-based remote execution techniques including Impacket wmiexec.py, CrackMapExec, and native WMI commands for stealthy post-exploitation during red team engagements.",75,1
performing-linux-log-forensics-investigation,"Perform forensic investigation of Linux system logs including syslog, auth.log, systemd journal, kern.log, and application logs to reconstruct user activity, detect unauthorized access, and establish event timelines on compromised Linux systems.",75,1
performing-log-analysis-for-forensic-investigation,"Collect, parse, and correlate system, application, and security logs to reconstruct events and establish timelines during forensic investigations.",75,1
performing-log-source-onboarding-in-siem,"Perform structured log source onboarding into SIEM platforms by configuring collectors, parsers, normalization, and validation for complete security visibility.",75,1
performing-malware-persistence-investigation,Systematically investigate all persistence mechanisms on Windows and Linux systems to identify how malware survives reboots and maintains access.,75,1
performing-malware-triage-with-yara,"Performs rapid malware triage and classification using YARA rules to match file patterns, strings, byte sequences, and structural characteristics against known malware families and suspicious indicators. Covers rule writing, scanning, and integration with analysis pipelines. Activates for requests involving YARA rule creation, malware classification, pattern matching, sample triage, or signature-based detection.",75,1
performing-memory-forensics-with-volatility3,"Analyze volatile memory dumps using Volatility 3 to extract running processes, network connections, loaded modules, and evidence of malicious activity.",75,1
performing-memory-forensics-with-volatility3-plugins,"Analyze memory dumps using Volatility3 plugins to detect injected code, rootkits, credential theft, and malware artifacts in Windows, Linux, and macOS memory images.",75,1
performing-network-forensics-with-wireshark,"Capture and analyze network traffic using Wireshark and tshark to reconstruct network events, extract artifacts, and identify malicious communications.",75,1
performing-network-packet-capture-analysis,"Perform forensic analysis of network packet captures (PCAP/PCAPNG) using Wireshark, tshark, and tcpdump to reconstruct network communications, extract transferred files, identify malicious traffic, and establish evidence of data exfiltration or command-and-control activity.",75,1
performing-network-traffic-analysis-with-tshark,"Automate network traffic analysis using tshark and pyshark for protocol statistics, suspicious flow detection, DNS anomaly identification, and IOC extraction from PCAP files",75,1
performing-network-traffic-analysis-with-zeek,"Deploy Zeek network security monitor to capture, parse, and analyze network traffic metadata for threat detection, anomaly identification, and forensic investigation.",75,1
performing-nist-csf-maturity-assessment,"The NIST Cybersecurity Framework (CSF) 2.0, released in February 2024, provides a comprehensive taxonomy for managing cybersecurity risk through six core Functions - Govern, Identify, Protect, Detect, Respond, and Recover. This skill covers conducting a maturity assessment against the CSF using Implementation Tiers to measure organizational cybersecurity posture and create improvement roadmaps.",75,1
performing-oil-gas-cybersecurity-assessment,"This skill covers conducting cybersecurity assessments specific to oil and gas facilities including upstream (exploration/production), midstream (pipeline/transport), and downstream (refining/distribution) operations. It addresses SCADA systems controlling pipeline operations, DCS for refinery process control, safety instrumented systems for hazardous processes, remote terminal units at unmanned wellhead sites, and compliance with API 1164, TSA Pipeline Security Directives, IEC 62443, and NIST Cybersecurity Framework for critical infrastructure.",75,1
performing-open-source-intelligence-gathering,"Open Source Intelligence (OSINT) gathering is the first active phase of a red team engagement, where operators collect publicly available information about the target organization to identify attack s",75,1
performing-ot-vulnerability-assessment-with-claroty,"This skill covers performing vulnerability assessments in OT environments using the Claroty xDome platform for comprehensive asset discovery, risk scoring, vulnerability correlation, and remediation prioritization. It addresses passive vulnerability identification through traffic analysis, active safe querying of OT devices, integration with CVE databases and ICS-CERT advisories, and risk-based prioritization that accounts for operational impact and compensating controls.",75,1
performing-ot-vulnerability-scanning-safely,"Perform vulnerability scanning in OT/ICS environments safely using passive monitoring, native protocol queries, and carefully controlled active scanning with Tenable OT Security to identify vulnerabilities without disrupting industrial processes or crashing legacy controllers.",75,1
performing-packet-injection-attack,"Crafts and injects custom network packets using Scapy, hping3, and Nemesis during authorized security assessments to test firewall rules, IDS detection, protocol handling, and network stack resilience against malformed and spoofed traffic.",75,1
performing-paste-site-monitoring-for-credentials,"Monitor paste sites like Pastebin and GitHub Gists for leaked credentials, API keys, and sensitive data dumps using automated scraping and keyword matching to detect breaches early.",75,1
performing-phishing-simulation-with-gophish,"GoPhish is an open-source phishing simulation framework used by security teams to conduct authorized phishing awareness campaigns. It provides campaign management, email template creation, landing pag",75,1
performing-physical-intrusion-assessment,"Conduct authorized physical penetration testing using tailgating, badge cloning, lock bypassing, and rogue device deployment to evaluate facility security controls.",75,1
performing-plc-firmware-security-analysis,"This skill covers analyzing Programmable Logic Controller (PLC) firmware for security vulnerabilities including hardcoded credentials, insecure update mechanisms, backdoor functions, memory corruption flaws, and undocumented debug interfaces. It addresses firmware extraction from common PLC platforms (Siemens S7, Allen-Bradley, Schneider Modicon), static analysis of firmware images, dynamic analysis in emulated environments, and comparison against known-good baselines to detect tampering.",75,1
performing-post-quantum-cryptography-migration,"Assesses organizational readiness for post-quantum cryptography migration per NIST FIPS 203/204/205 standards. Performs cryptographic inventory scanning to identify quantum-vulnerable algorithms (RSA, ECDH, ECDSA), evaluates hybrid TLS configurations with X25519MLKEM768, and validates CRYSTALS-Kyber (ML-KEM) and CRYSTALS-Dilithium (ML-DSA) readiness. Implements crypto-agility assessment using oqs-provider for OpenSSL. Use when planning or executing the transition from classical to post-quantum cryptographic algorithms across enterprise infrastructure.",75,1
performing-power-grid-cybersecurity-assessment,"This skill covers conducting cybersecurity assessments of electric power grid infrastructure including generation facilities, transmission substations, distribution systems, and energy management system (EMS) control centers. It addresses NERC CIP compliance verification, substation automation security, IEC 61850 protocol analysis, synchrophasor (PMU) network security, and the unique threat landscape targeting power grid operations as demonstrated by Industroyer/CrashOverride and related attacks.",75,1
performing-privacy-impact-assessment,"Automates the Privacy Impact Assessment (PIA) workflow including data flow mapping, privacy risk scoring matrices, GDPR Article 35 DPIA and CCPA/CPRA alignment checks, data inventory cataloging, and remediation tracking. Implements the NIST Privacy Framework PRAM methodology and ICO DPIA guidance for systematic identification and mitigation of privacy risks across processing activities. Use when conducting privacy assessments for new systems, evaluating regulatory compliance posture, or building automated privacy governance programs.",75,1
performing-privilege-escalation-assessment,"Performs privilege escalation assessments on compromised Linux and Windows systems to identify paths from low-privilege access to root or SYSTEM-level control. The tester enumerates misconfigurations, vulnerable services, kernel exploits, SUID binaries, unquoted service paths, and credential stores to demonstrate the full impact of an initial compromise. Activates for requests involving privilege escalation testing, local exploitation, post-compromise escalation, or OS-level security assessment.",75,1
performing-privilege-escalation-on-linux,"Linux privilege escalation involves elevating from a low-privilege user account to root access on a compromised system. Red teams exploit misconfigurations, vulnerable services, kernel exploits, and w",75,1
performing-privileged-account-discovery,"Discover and inventory all privileged accounts across enterprise infrastructure including domain admins, local admins, service accounts, database admins, cloud IAM roles, and application admin account",75,1
performing-purple-team-atomic-testing,"Executes Atomic Red Team tests mapped to MITRE ATT&CK techniques, performs coverage gap analysis across the ATT&CK matrix, and runs detection validation loops to measure blue team visibility. Covers Invoke-AtomicRedTeam PowerShell execution, ATT&CK Navigator layer generation for heatmaps, Sigma rule correlation, and continuous atomic testing pipelines. Activates for requests involving purple team exercises, atomic test execution, ATT&CK coverage assessment, detection engineering validation, or adversary emulation testing.",75,1
performing-purple-team-exercise,"Performs purple team exercises by coordinating red team adversary emulation with blue team detection validation using MITRE ATT&CK-mapped attack scenarios, real-time detection testing, and collaborative gap remediation. Use when SOC teams need to validate detection capabilities, improve analyst skills, and close detection gaps through structured offensive-defensive collaboration.",75,1
performing-ransomware-response,"Executes a structured ransomware incident response from initial detection through containment, forensic analysis, decryption assessment, recovery, and post-incident hardening. Addresses ransom negotiation considerations, backup integrity verification, and regulatory notification requirements. Activates for requests involving ransomware response, ransomware recovery, crypto-ransomware, data encryption attack, ransom payment decision, or ransomware containment.",75,1
performing-ransomware-tabletop-exercise,"Plans and facilitates tabletop exercises simulating ransomware incidents to test organizational readiness, decision-making, and communication procedures. Designs realistic scenarios based on current ransomware threat actors (LockBit, ALPHV/BlackCat, Cl0p), injects covering double extortion, backup destruction, and regulatory notification requirements. Evaluates participant responses against NIST CSF and CISA guidelines. Activates for requests involving ransomware tabletop, incident response exercise, or ransomware readiness drill.",75,1
performing-red-team-phishing-with-gophish,"Automate GoPhish phishing simulation campaigns using the Python gophish library. Creates email templates with tracking pixels, configures SMTP sending profiles, builds target groups from CSV, launches campaigns, and analyzes results including open rates, click rates, and credential submission statistics for security awareness assessment.",75,1
performing-red-team-with-covenant,"Conduct red team operations using the Covenant C2 framework for authorized adversary simulation, including listener setup, grunt deployment, task execution, and lateral movement tracking.",75,1
performing-s7comm-protocol-security-analysis,"Perform security analysis of Siemens S7comm and S7CommPlus protocols used by SIMATIC S7 PLCs to identify vulnerabilities including replay attacks, integrity bypass, unauthorized CPU stop commands, and program download manipulation exploiting weaknesses in S7-300, S7-400, S7-1200, and S7-1500 controllers.",75,1
performing-sca-dependency-scanning-with-snyk,"This skill covers implementing Software Composition Analysis (SCA) using Snyk to detect vulnerable open-source dependencies in CI/CD pipelines. It addresses scanning package manifests and lockfiles, automated fix pull request generation, license compliance checking, continuous monitoring of deployed applications, and integration with GitHub, GitLab, and Jenkins pipelines.",75,1
performing-scada-hmi-security-assessment,"Perform security assessments of SCADA Human-Machine Interface (HMI) systems to identify vulnerabilities in web-based HMIs, thin-client configurations, authentication mechanisms, and communication channels between HMI and PLCs, aligned with IEC 62443 and NIST SP 800-82 guidelines.",75,1
performing-second-order-sql-injection,Detect and exploit second-order SQL injection vulnerabilities where malicious input is stored in a database and later executed in an unsafe SQL query during a different application operation.,75,1
performing-security-headers-audit,"Auditing HTTP security headers including CSP, HSTS, X-Frame-Options, and cookie attributes to identify missing or misconfigured browser-level protections.",75,1
performing-serverless-function-security-review,"Performing security reviews of serverless functions across AWS Lambda, Azure Functions, and GCP Cloud Functions to identify overly permissive execution roles, insecure environment variables, injection vulnerabilities, and missing runtime protections.",75,1
performing-service-account-audit,"Audit service accounts across enterprise infrastructure to identify orphaned, over-privileged, and non-compliant accounts. This skill covers discovery of service accounts in Active Directory, cloud pl",75,1
performing-service-account-credential-rotation,"Automate credential rotation for service accounts across Active Directory, cloud platforms, and application databases to eliminate stale secrets and reduce compromise risk.",75,1
performing-soap-web-service-security-testing,"Perform security testing of SOAP web services by analyzing WSDL definitions and testing for XML injection, XXE, WS-Security bypass, and SOAPAction spoofing.",75,1
performing-soc-tabletop-exercise,"Performs tabletop exercises for SOC teams simulating security incidents through discussion-based scenarios to test incident response procedures, communication workflows, and decision-making under pressure without impacting production systems. Use when organizations need to validate IR playbooks, train analysts, or meet compliance requirements for incident response testing.",75,1
performing-ssl-certificate-lifecycle-management,"SSL/TLS certificate lifecycle management encompasses the full process of requesting, issuing, deploying, monitoring, renewing, and revoking X.509 certificates. Poor certificate management is a leading",75,1
performing-ssl-stripping-attack,"Simulates SSL stripping attacks using sslstrip, Bettercap, and mitmproxy in authorized environments to test HSTS enforcement, certificate validation, and HTTPS upgrade mechanisms that protect users from downgrade attacks on encrypted connections.",75,1
performing-ssl-tls-security-assessment,"Assess SSL/TLS server configurations using the sslyze Python library to evaluate cipher suites, certificate chains, protocol versions, HSTS headers, and known vulnerabilities like Heartbleed and ROBOT.",75,1
performing-ssrf-vulnerability-exploitation,"Test for Server-Side Request Forgery vulnerabilities by probing cloud metadata endpoints, internal network services, and protocol handlers through user-controllable URL parameters. Tests AWS/GCP/Azure metadata APIs (169.254.169.254), internal port scanning via HTTP, URL scheme bypass techniques, and DNS rebinding detection.",75,1
performing-steganography-detection,"Detect and extract hidden data embedded in images, audio, and other media files using steganalysis tools to uncover covert communication channels.",75,1
performing-thick-client-application-penetration-test,"Conduct a thick client application penetration test to identify insecure local storage, hardcoded credentials, DLL hijacking, memory manipulation, and insecure API communication in desktop applications using dnSpy, Procmon, and Burp Suite.",75,1
performing-threat-emulation-with-atomic-red-team,"Executes Atomic Red Team tests for MITRE ATT&CK technique validation using the atomic-operator Python framework. Loads test definitions from YAML atomics, runs attack simulations, and validates detection coverage. Use when testing SIEM detection rules, validating EDR coverage, or conducting purple team exercises.",75,1
performing-threat-hunting-with-elastic-siem,"Performs proactive threat hunting in Elastic Security SIEM using KQL/EQL queries, detection rules, and Timeline investigation to identify threats that evade automated detection. Use when SOC teams need to hunt for specific ATT&CK techniques, investigate anomalous behaviors, or validate detection coverage gaps using Elasticsearch and Kibana Security.",75,1
performing-threat-hunting-with-yara-rules,"Use YARA pattern-matching rules to hunt for malware, suspicious files, and indicators of compromise across filesystems and memory dumps. Covers rule authoring, yara-python scanning, and integration with threat intel feeds.",75,1
performing-threat-intelligence-sharing-with-misp,"Use PyMISP to create, enrich, and share threat intelligence events on a MISP platform, including IOC management, feed integration, STIX export, and community sharing workflows.",75,1
performing-threat-landscape-assessment-for-sector,"Conduct a sector-specific threat landscape assessment by analyzing threat actor targeting patterns, common attack vectors, and industry-specific vulnerabilities to inform organizational risk management.",75,1
performing-threat-modeling-with-owasp-threat-dragon,"Use OWASP Threat Dragon to create data flow diagrams, identify threats using STRIDE and LINDDUN methodologies, and generate threat model reports for secure design review.",75,1
performing-timeline-reconstruction-with-plaso,"Build comprehensive forensic super-timelines using Plaso (log2timeline) to correlate events across file systems, logs, and artifacts into a unified chronological view.",75,1
performing-user-behavior-analytics,"Performs User and Entity Behavior Analytics (UEBA) to detect anomalous user activities including impossible travel, unusual access patterns, privilege abuse, and insider threats using SIEM-based behavioral baselines and statistical analysis. Use when SOC teams need to identify compromised accounts or insider threats through deviation from established behavioral norms.",75,1
performing-vlan-hopping-attack,Simulates VLAN hopping attacks using switch spoofing and double tagging techniques in authorized environments to test VLAN segmentation effectiveness and validate switch port security configurations against Layer 2 bypass attacks.,75,1
performing-vulnerability-scanning-with-nessus,"Performs authenticated and unauthenticated vulnerability scanning using Tenable Nessus to identify known vulnerabilities, misconfigurations, default credentials, and missing patches across network infrastructure, servers, and applications. The scanner correlates findings with CVE databases and CVSS scores to produce prioritized remediation guidance. Activates for requests involving vulnerability scanning, Nessus assessment, patch compliance checking, or automated vulnerability detection.",75,1
performing-web-application-firewall-bypass,"Bypass Web Application Firewall protections using encoding techniques, HTTP method manipulation, parameter pollution, and payload obfuscation to deliver SQL injection, XSS, and other attack payloads past WAF detection rules.",75,1
performing-web-application-penetration-test,"Performs systematic security testing of web applications following the OWASP Web Security Testing Guide (WSTG) methodology to identify vulnerabilities in authentication, authorization, input validation, session management, and business logic. The tester uses Burp Suite as the primary interception proxy alongside manual testing techniques to find flaws that automated scanners miss. Activates for requests involving web app pentest, OWASP testing, application security assessment, or web vulnerability testing.",75,1
performing-web-application-scanning-with-nikto,"Nikto is an open-source web server and web application scanner that tests against over 7,000 potentially dangerous files/programs, checks for outdated versions of over 1,250 servers, and identifies ve",75,1
performing-web-application-vulnerability-triage,Triage web application vulnerability findings from DAST/SAST scanners using OWASP risk rating methodology to separate true positives from false positives and prioritize remediation.,75,1
performing-web-cache-deception-attack,Execute web cache deception attacks by exploiting path normalization discrepancies between CDN caching layers and origin servers to cache and retrieve sensitive authenticated content.,75,1
performing-web-cache-poisoning-attack,Exploiting web cache mechanisms to serve malicious content to other users by poisoning cached responses through unkeyed headers and parameters during authorized security tests.,75,1
performing-wifi-password-cracking-with-aircrack,"Captures WPA/WPA2 handshakes and performs offline password cracking using aircrack-ng, hashcat, and dictionary attacks during authorized wireless security assessments to evaluate passphrase strength and wireless network security posture.",75,1
