skill_id,description,score,phase
hunting-for-dcsync-attacks,Detect DCSync attacks by analyzing Windows Event ID 4662 for unauthorized DS-Replication-Get-Changes requests from non-domain-controller accounts.,75,1
hunting-for-defense-evasion-via-timestomping,Detect NTFS timestamp manipulation (MITRE T1070.006) by comparing $STANDARD_INFORMATION vs $FILE_NAME timestamps in the MFT. Uses analyzeMFT and Python to identify files with anomalous temporal patterns indicating anti-forensic timestomping activity.,75,1
hunting-for-dns-based-persistence,"Hunt for DNS-based persistence mechanisms including DNS hijacking, dangling CNAME records, wildcard DNS abuse, and unauthorized zone modifications using passive DNS databases, SecurityTrails API, and DNS audit log analysis.",75,1
hunting-for-dns-tunneling-with-zeek,"Detect DNS tunneling and data exfiltration by analyzing Zeek dns.log for high-entropy subdomain queries, excessive query volume, long query lengths, and unusual DNS record types indicating covert channel communication.",75,1
hunting-for-domain-fronting-c2-traffic,Detect domain fronting C2 traffic by analyzing SNI vs HTTP Host header mismatches in proxy logs and TLS certificate discrepancies using pyOpenSSL for certificate inspection,75,1
hunting-for-lateral-movement-via-wmi,"Detect WMI-based lateral movement by analyzing Windows Event ID 4688 process creation and Sysmon Event ID 1 for WmiPrvSE.exe child process patterns, remote process execution, and WMI event subscription persistence.",75,1
hunting-for-living-off-the-cloud-techniques,"Hunt for adversary abuse of legitimate cloud services for C2, data staging, and exfiltration including abuse of Azure, AWS, GCP services, and SaaS platforms.",75,1
hunting-for-living-off-the-land-binaries,Proactively hunt for adversary abuse of legitimate system binaries (LOLBins) to execute malicious payloads while evading detection.,75,1
hunting-for-lolbins-execution-in-endpoint-logs,Hunt for adversary abuse of Living Off the Land Binaries (LOLBins) by analyzing endpoint process creation logs for suspicious execution patterns of legitimate Windows system binaries used for malicious purposes.,75,1
hunting-for-ntlm-relay-attacks,"Detect NTLM relay attacks by analyzing Windows Event 4624 logon type 3 with NTLMSSP authentication, identifying IP-to-hostname mismatches, Responder traffic signatures, SMB signing status, and suspicious authentication patterns across the domain.",75,1
hunting-for-persistence-mechanisms-in-windows,"Systematically hunt for adversary persistence mechanisms across Windows endpoints including registry, services, startup folders, and WMI subscriptions.",75,1
hunting-for-persistence-via-wmi-subscriptions,"Hunt for adversary persistence through Windows Management Instrumentation event subscriptions by monitoring WMI consumer, filter, and binding creation events that execute malicious code triggered by system events.",75,1
hunting-for-process-injection-techniques,"Detect process injection techniques (T1055) including CreateRemoteThread, process hollowing, and DLL injection via Sysmon Event IDs 8 and 10 and EDR process telemetry",75,1
hunting-for-registry-persistence-mechanisms,"Hunt for registry-based persistence mechanisms including Run keys, Winlogon modifications, IFEO injection, and COM hijacking in Windows environments.",75,1
hunting-for-registry-run-key-persistence,Detect MITRE ATT&CK T1547.001 registry Run key persistence by analyzing Sysmon Event ID 13 logs and registry queries to identify malicious auto-start entries.,75,1
hunting-for-scheduled-task-persistence,"Hunt for adversary persistence via Windows Scheduled Tasks by analyzing task creation events, suspicious task actions, and unusual scheduling patterns.",75,1
hunting-for-shadow-copy-deletion,"Hunt for Volume Shadow Copy deletion activity that indicates ransomware preparation or anti-forensics by monitoring vssadmin, wmic, and PowerShell shadow copy commands.",75,1
hunting-for-spearphishing-indicators,"Hunt for spearphishing campaign indicators across email logs, endpoint telemetry, and network data to detect targeted email attacks.",75,1
hunting-for-startup-folder-persistence,"Detect T1547.001 startup folder persistence by monitoring Windows startup directories for suspicious file creation, analyzing autoruns entries, and using Python watchdog for real-time filesystem monitoring.",75,1
hunting-for-supply-chain-compromise,"Hunt for supply chain compromise indicators including trojanized software updates, compromised dependencies, unauthorized code modifications, and tampered build artifacts.",75,1
hunting-for-suspicious-scheduled-tasks,"Hunt for adversary persistence and execution via Windows scheduled tasks by analyzing task creation events, suspicious task properties, and unusual execution patterns that indicate T1053.005 abuse.",75,1
hunting-for-unusual-network-connections,"Hunt for unusual network connections by analyzing outbound traffic patterns, rare destinations, non-standard ports, and anomalous connection frequencies from endpoints.",75,1
hunting-for-unusual-service-installations,"Detect suspicious Windows service installations (MITRE ATT&CK T1543.003) by parsing System event logs for Event ID 7045, analyzing service binary paths, and identifying indicators of persistence mechanisms.",75,1
hunting-for-webshell-activity,"Hunt for web shell deployments on internet-facing servers by analyzing file creation in web directories, suspicious process spawning from web servers, and anomalous HTTP patterns.",75,1
hybrid-cloud-architect,Expert hybrid cloud architect specializing in complex multi-cloud solutions across AWS/Azure/GCP and private clouds (OpenStack/VMware).,75,1
hybrid-cloud-networking,"Configure secure, high-performance connectivity between on-premises and cloud environments using VPN, Direct Connect, and ExpressRoute.",75,1
hybrid-search-implementation,"Combine vector and keyword search for improved retrieval. Use when implementing RAG systems, building search engines, or when neither approach alone provides sufficient recall.",75,1
hypothesis-generation,"Structured hypothesis formulation from observations. Use when you have experimental observations or data and need to formulate testable hypotheses with predictions, propose mechanisms, and design experiments to test them. Follows scientific method framework. For open-ended ideation use scientific-brainstorming; for automated LLM-driven hypothesis testing on datasets use hypogenic.",75,1
i18n-localization,"Internationalization and localization patterns. Detecting hardcoded strings, managing translations, locale files, RTL support.",75,1
iconsax-library,Extensive icon library and AI-driven icon generation skill for premium UI/UX design.,75,1
ideal-customer-profile,"Identify the Ideal Customer Profile (ICP) from research data with demographics, behaviors, JTBD, and needs. Use when defining your ICP, analyzing PMF survey data, or understanding who your best customers are.",75,1
identify-assumptions-existing,"Identify risky assumptions for a feature idea in an existing product across Value, Usability, Viability, and Feasibility. Uses multi-perspective devil's advocate thinking. Use when stress-testing a feature idea, doing risk assessment, or preparing for assumption mapping.",75,1
identify-assumptions-new,"Identify risky assumptions for a new product idea across 8 risk categories including Go-to-Market, Strategy, and Team. Use when evaluating startup risks, assessing a new product concept, or mapping assumptions for a new venture.",75,1
idor-testing,Provide systematic methodologies for identifying and exploiting Insecure Direct Object Reference (IDOR) vulnerabilities in web applications.,75,1
image-ocr-processing,image ocr processing,75,1
image-preprocessing-pipeline,image preprocessing pipeline,75,1
imagen,"Generate images using Google Gemini's image generation capabilities. Use this skill when the user needs to create, generate, or produce images for any purpose including UI mockups, icons, illustrations, diagrams, concept art, placeholder images, or visual representations.",75,1
imaging-data-commons,"Query and download public cancer imaging data from NCI Imaging Data Commons using idc-index. Use for accessing large-scale radiology (CT, MR, PET) and pathology datasets for AI training or research. No authentication required. Query by metadata, visualize in browser, check licenses.",75,1
implementing-aes-encryption-for-data-at-rest,AES (Advanced Encryption Standard) is a symmetric block cipher standardized by NIST (FIPS 197) used to protect classified and sensitive data. This skill covers implementing AES-256 encryption in GCM m,75,1
implementing-alert-fatigue-reduction,"Implements strategies to reduce SOC alert fatigue by tuning detection rules, consolidating duplicate alerts, implementing risk-based alerting, and measuring alert quality metrics to maintain analyst effectiveness and prevent critical alert dismissal. Use when SOC teams face overwhelming alert volumes, high false positive rates, or declining analyst performance.",75,1
implementing-anti-phishing-training-program,"Security awareness training is the human layer of phishing defense. An effective anti-phishing training program combines regular simulations, interactive learning modules, metric tracking, and positiv",75,1
implementing-anti-ransomware-group-policy,"Configures Windows Group Policy Objects (GPO) to prevent ransomware execution and limit its spread. Implements AppLocker rules, Software Restriction Policies, Controlled Folder Access, attack surface reduction rules, and network protection settings. Activates for requests involving Windows GPO hardening against ransomware, AppLocker configuration, Controlled Folder Access setup, or endpoint protection via Group Policy.",75,1
implementing-api-abuse-detection-with-rate-limiting,"Implement API abuse detection using token bucket, sliding window, and adaptive rate limiting algorithms to prevent DDoS, brute force, and credential stuffing attacks.",75,1
implementing-api-gateway-security-controls,"Implements security controls at the API gateway layer including authentication enforcement, rate limiting, request validation, IP allowlisting, TLS termination, and threat protection. The engineer configures API gateways (Kong, AWS API Gateway, Azure APIM, Apigee) to act as a centralized security enforcement point that validates, throttles, and monitors all API traffic before it reaches backend services. Activates for requests involving API gateway security, API management security, gateway authentication, or centralized API protection.",75,1
implementing-api-key-security-controls,"Implements secure API key generation, storage, rotation, and revocation controls to protect API authentication credentials from leakage, brute force, and abuse. The engineer designs API key formats with sufficient entropy, implements secure hashing for storage, enforces per-key scoping and rate limiting, monitors for leaked keys in public repositories, and builds key rotation workflows. Activates for requests involving API key management, API key security, key rotation policy, or API credential protection.",75,1
implementing-api-rate-limiting-and-throttling,"Implements API rate limiting and throttling controls using token bucket, sliding window, and fixed window algorithms to protect against brute force attacks, credential stuffing, resource exhaustion, and API abuse. The engineer configures per-user, per-IP, and per-endpoint rate limits using Redis-backed counters, API gateway plugins, or application middleware, and implements proper HTTP 429 responses with Retry-After headers. Activates for requests involving rate limiting implementation, API throttling setup, request quota management, or API abuse prevention.",75,1
implementing-api-schema-validation-security,"Implement API schema validation using OpenAPI specifications and JSON Schema to enforce input/output contracts and prevent injection, data exposure, and mass assignment attacks.",75,1
implementing-api-security-posture-management,"Implement API Security Posture Management to continuously discover, classify, and score APIs based on risk while enforcing security policies across the API lifecycle.",75,1
implementing-api-security-testing-with-42crunch,Implement comprehensive API security testing using the 42Crunch platform to perform static audit and dynamic conformance scanning of OpenAPI specifications.,75,1
implementing-api-threat-protection-with-apigee,"Implement API threat protection using Google Apigee policies including JSON/XML threat protection, OAuth 2.0, SpikeArrest, and Advanced API Security for OWASP Top 10 defense.",75,1
implementing-aqua-security-for-container-scanning,"Deploy Aqua Security's Trivy scanner to detect vulnerabilities, misconfigurations, secrets, and license issues in container images across CI/CD pipelines and registries.",75,1
implementing-attack-path-analysis-with-xm-cyber,"Deploy XM Cyber's continuous exposure management platform to map attack paths, identify choke points, and prioritize the 2% of exposures that threaten critical assets.",75,1
implementing-attack-surface-management,"Implements external attack surface management (EASM) using Shodan, Censys, and ProjectDiscovery tools (subfinder, httpx, nuclei) for asset discovery, subdomain enumeration, service fingerprinting, and exposure scoring. Includes a weighted risk scoring algorithm based on OWASP attack surface analysis methodology and the Relative Attack Surface Quotient (RSQ). Use when building continuous ASM programs or performing external reconnaissance for security assessments.",75,1
implementing-aws-config-rules-for-compliance,"Implementing AWS Config rules for continuous compliance monitoring of AWS resources, deploying managed and custom rules aligned to CIS and PCI DSS frameworks, configuring automatic remediation with SSM Automation, and aggregating compliance data across accounts.",75,1
implementing-aws-iam-permission-boundaries,Configure IAM permission boundaries in AWS to delegate role creation to developers while enforcing maximum privilege limits set by the security team.,75,1
implementing-aws-macie-for-data-classification,"Implement Amazon Macie to automatically discover, classify, and protect sensitive data in S3 buckets using machine learning and pattern matching for PII, financial data, and credentials detection.",75,1
implementing-aws-security-hub,"This skill covers deploying AWS Security Hub as a centralized cloud security posture management platform that aggregates findings from GuardDuty, Inspector, Macie, and third-party tools. It details enabling security standards like CIS AWS Foundations Benchmark, configuring automated remediation, and building executive dashboards for compliance tracking across multi-account AWS organizations.",75,1
implementing-aws-security-hub-compliance,"Implementing AWS Security Hub to aggregate security findings across AWS accounts, enable compliance standards like CIS AWS Foundations and PCI DSS, configure automated remediation with EventBridge and Lambda, and create custom security insights for organizational risk management.",75,1
implementing-azure-defender-for-cloud,"Implementing Microsoft Defender for Cloud to enable cloud security posture management, workload protection across VMs, containers, databases, and storage, configure security recommendations, and set up adaptive security controls with automated remediation.",75,1
implementing-bgp-security-with-rpki,"Implement BGP route origin validation using RPKI with Route Origin Authorizations, RPKI-to-Router protocol, and ROV policies on Cisco and Juniper routers to prevent route hijacking.",75,1
implementing-canary-tokens-for-network-intrusion,"Deploys DNS, HTTP, and AWS API key canary tokens across network infrastructure to detect unauthorized access and lateral movement. Integrates with webhook alerting (Slack, Teams, email, generic HTTP) for real-time intrusion notifications. Provides automated token generation, placement strategies, and monitoring for enterprise network environments. Use when building deception-based network intrusion detection with Canarytokens.org and Thinkst Canary platforms.",75,1
implementing-cloud-dlp-for-data-protection,"Implementing Cloud Data Loss Prevention (DLP) using Amazon Macie, Azure Information Protection, and Google Cloud DLP API to discover, classify, and protect sensitive data across cloud storage, databases, and data pipelines.",75,1
implementing-cloud-security-posture-management,"Implementing Cloud Security Posture Management (CSPM) to continuously monitor multi-cloud environments for misconfigurations, compliance violations, and security risks using Prowler, ScoutSuite, AWS Security Hub, Azure Defender, and GCP Security Command Center.",75,1
implementing-cloud-trail-log-analysis,"Implementing AWS CloudTrail log analysis for security monitoring, threat detection, and forensic investigation using Athena, CloudWatch Logs Insights, and SIEM integration to identify unauthorized access, privilege escalation, and suspicious API activity.",75,1
implementing-cloud-vulnerability-posture-management,"Implement Cloud Security Posture Management using AWS Security Hub, Azure Defender for Cloud, and open-source tools like Prowler and ScoutSuite for multi-cloud vulnerability detection.",75,1
implementing-cloud-waf-rules,"This skill covers deploying and tuning Web Application Firewall rules on AWS WAF, Azure WAF, and Cloudflare to protect cloud-hosted applications against OWASP Top 10 attacks. It details configuring managed rule sets, creating custom rules for business logic protection, implementing rate limiting, deploying bot management, and reducing false positives through rule tuning and logging analysis.",75,1
implementing-cloud-workload-protection,"Implements cloud workload protection using boto3 and google-cloud APIs for runtime security monitoring, process anomaly detection, and file integrity checking on EC2/GCE instances. Scans for cryptomining, reverse shells, and unauthorized binaries. Use when building runtime security controls for cloud compute workloads.",75,1
implementing-continuous-security-validation-with-bas,Deploy Breach and Attack Simulation tools to continuously validate security control effectiveness by safely emulating real-world attack techniques across the kill chain.,75,1
implementing-data-loss-prevention-with-microsoft-purview,"Implements data loss prevention policies using Microsoft Purview to protect sensitive information across Exchange Online, SharePoint, OneDrive, Teams, endpoint devices, and Power BI. The analyst configures sensitivity labels with encryption and content marking, creates DLP policies using built-in and custom sensitive information types with regex patterns, deploys endpoint DLP rules to control file operations on Windows and macOS devices, and monitors policy effectiveness through Activity Explorer and DLP alert management. Uses PowerShell cmdlets and the Microsoft Graph API for programmatic policy management. Activates for requests involving DLP policy creation, sensitivity label configuration, data classification, endpoint data protection, or Microsoft Purview compliance administration.",75,1
implementing-ddos-mitigation-with-cloudflare,"Configure Cloudflare DDoS protection with managed rulesets, rate limiting, WAF rules, Bot Management, and origin protection to mitigate volumetric, protocol, and application-layer attacks.",75,1
implementing-deception-based-detection-with-canarytoken,"Deploy and monitor Canary Tokens via the Thinkst Canary API for deception-based breach detection using web bug tokens, DNS tokens, document tokens, and AWS key tokens.",75,1
implementing-delinea-secret-server-for-pam,"Implements Delinea Secret Server for privileged access management (PAM) including secret vault configuration, role-based access policies, automated password rotation, session recording, and integration with Active Directory and cloud platforms. Activates for requests involving PAM deployment, privileged credential vaulting, secret server administration, or password rotation automation.",75,1
implementing-devsecops-security-scanning,"Integrates Static Application Security Testing (SAST), Dynamic Application Security Testing (DAST), and Software Composition Analysis (SCA) into CI/CD pipelines using open-source tools. Covers Semgrep for SAST, Trivy for SCA and container scanning, OWASP ZAP for DAST, and Gitleaks for secrets detection. Activates for requests involving DevSecOps pipeline setup, automated security scanning in CI/CD, SAST/DAST/SCA integration, or shift-left security implementation.",75,1
implementing-diamond-model-analysis,"The Diamond Model of Intrusion Analysis provides a structured framework for analyzing cyber intrusions by examining four core features - Adversary, Capability, Infrastructure, and Victim. This skill covers implementing the Diamond Model programmatically to classify and correlate intrusion events, build activity threads, and generate pivot-ready intelligence.",75,1
implementing-digital-signatures-with-ed25519,"Ed25519 is a high-performance digital signature algorithm using the Edwards curve Curve25519. It provides 128-bit security with 64-byte signatures and 32-byte keys, offering significant advantages ove",75,1
implementing-disk-encryption-with-bitlocker,"Implements full disk encryption using Microsoft BitLocker on Windows endpoints to protect data at rest from unauthorized access in case of device loss or theft. Use when deploying encryption for compliance requirements, securing mobile workstations, or implementing data protection controls across the enterprise. Activates for requests involving BitLocker encryption, disk encryption, TPM configuration, or data-at-rest protection.",75,1
implementing-dmarc-dkim-spf-email-security,"SPF, DKIM, and DMARC form the three pillars of email authentication. Together they prevent domain spoofing, validate message integrity, and define policies for handling unauthenticated mail. Proper im",75,1
implementing-dragos-platform-for-ot-monitoring,"Deploy and configure the Dragos Platform for OT network monitoring, leveraging its 600+ industrial protocol parsers, intelligence-driven threat detection analytics, and asset visibility capabilities to protect ICS environments against threat groups like VOLTZITE, GRAPHITE, and BAUXITE.",75,1
implementing-ebpf-security-monitoring,"Implements eBPF-based security monitoring using Cilium Tetragon for real-time process execution tracking, network connection observability, file access auditing, and runtime enforcement. Covers TracingPolicy CRD authoring with kprobe/tracepoint hooks, in-kernel filtering via matchArgs/matchBinaries selectors, JSON event export, and integration with SIEM pipelines. Use when building kernel-level runtime security observability for Linux hosts or Kubernetes clusters.",75,1
implementing-email-sandboxing-with-proofpoint,Email sandboxing detonates suspicious attachments and URLs in isolated environments to detect zero-day malware and evasive phishing payloads. Proofpoint Targeted Attack Protection (TAP) is an industry,75,1
implementing-end-to-end-encryption-for-messaging,"End-to-end encryption (E2EE) ensures that only the communicating parties can read messages, with no intermediary (including the server) able to decrypt them. This skill implements a simplified version",75,1
implementing-endpoint-detection-with-wazuh,"Deploy and configure Wazuh SIEM/XDR for endpoint detection including agent management, custom decoder and rule XML creation, alert querying via the Wazuh REST API, and automated response actions.",75,1
implementing-endpoint-dlp-controls,"Implements endpoint Data Loss Prevention (DLP) controls to detect and prevent sensitive data exfiltration through email, USB, cloud storage, and printing. Use when deploying DLP agents, creating content inspection policies, or preventing unauthorized data movement from endpoints. Activates for requests involving DLP, data exfiltration prevention, content inspection, or sensitive data protection on endpoints.",75,1
implementing-envelope-encryption-with-aws-kms,"Envelope encryption is a strategy where data is encrypted with a data encryption key (DEK), and the DEK itself is encrypted with a master key (KEK) managed by AWS KMS. This approach allows encrypting",75,1
implementing-epss-score-for-vulnerability-prioritization,Integrate FIRST's Exploit Prediction Scoring System (EPSS) API to prioritize vulnerability remediation based on real-world exploitation probability within 30 days.,75,1
implementing-file-integrity-monitoring-with-aide,"Configure AIDE (Advanced Intrusion Detection Environment) for file integrity monitoring including baseline creation, scheduled integrity checks, change detection, and alerting",75,1
implementing-gcp-organization-policy-constraints,"Implement GCP Organization Policy constraints to enforce security guardrails across the entire resource hierarchy, restricting risky configurations and ensuring compliance at organization, folder, and project levels.",75,1
implementing-gdpr-data-subject-access-request,"Automates GDPR Data Subject Access Request (DSAR) workflows including identity verification, PII discovery across databases and files using regex and NER, data mapping, response templating per Article 15 requirements, deadline tracking, and audit logging. Covers ICO/EDPB guidance compliance, exemption handling, and scalable batch processing. Use when building or auditing DSAR response capabilities under GDPR/UK GDPR.",75,1
implementing-github-advanced-security-for-code-scanning,Configure GitHub Advanced Security with CodeQL to perform automated static analysis and vulnerability detection across repositories at enterprise scale.,75,1
