skill_id,description,score,phase
ab-test-analysis,"Analyze A/B test results with statistical significance, sample size validation, confidence intervals, and ship/extend/stop recommendations. Use when evaluating experiment results, checking if a test reached significance, interpreting split test data, or deciding whether to ship a variant.",75,1
ab-test-setup,"When the user wants to plan, design, or implement an A/B test or experiment. Also use when the user mentions ""A/B test,"" ""split test,"" ""experiment,"" ""test this change,"" ""variant copy,"" ""multivariate test,"" ""hypothesis,"" ""should I test this,"" ""which version is better,"" ""test two versions,"" ""statistical significance,"" or ""how long should I run this test."" Use this whenever someone is comparing two approaches and wants to measure which performs better. For tracking implementation, see analytics-tracking. For page-level conversion optimization, see page-cro.",75,1
ab-test-store-listing,"When the user wants to A/B test App Store product page elements to improve conversion rate. Also use when the user mentions ""A/B test"", ""product page optimization"", ""test my screenshots"", ""test my icon"", ""conversion rate optimization"", ""CPP"", or ""custom product pages"". For screenshot design, see screenshot-optimization. For metadata optimization, see metadata-optimization.",75,1
ablation-planner,"Use when main results pass result-to-claim (claim_supported=yes or partial) and ablation studies are needed for paper submission. Codex designs ablations from a reviewer's perspective, CC reviews feasibility and implements.",75,1
academic-plotting,"Generates publication-quality figures for ML papers from research context. Given a paper section or description, extracts system components and relationships to generate architecture diagrams via Gemini. Given experiment results or data, auto-selects chart type and generates data-driven figures via matplotlib/seaborn. Use when creating any figure for a conference paper.",75,1
acceptance-orchestrator,"Use when a coding task should be driven end-to-end from issue intake through implementation, review, deployment, and acceptance verification with minimal human re-intervention.",75,1
accessibility-compliance-accessibility-audit,"You are an accessibility expert specializing in WCAG compliance, inclusive design, and assistive technology compatibility. Conduct audits, identify barriers, and provide remediation guidance.",75,1
acquiring-disk-image-with-dd-and-dcfldd,Create forensically sound bit-for-bit disk images using dd and dcfldd while preserving evidence integrity through hash verification.,75,1
acquisition-channel-advisor,"Evaluate acquisition channels using unit economics, customer quality, and scalability. Use when deciding whether to scale, test, or kill a growth channel.",75,1
active-directory-attacks,"Provide comprehensive techniques for attacking Microsoft Active Directory environments. Covers reconnaissance, credential harvesting, Kerberos attacks, lateral movement, privilege escalation, and domain dominance for red team operations and penetration testing.",75,1
activecampaign-automation,"Automate ActiveCampaign tasks via Rube MCP (Composio): manage contacts, tags, list subscriptions, automation enrollment, and tasks. Always search tools first for current schemas.",75,1
adaptyv,"Cloud laboratory platform for automated protein testing and validation. Use when designing proteins and needing experimental validation including binding assays, expression testing, thermostability measurements, enzyme activity assays, or protein sequence optimization. Also use for submitting experiments via API, tracking experiment status, downloading results, optimizing protein sequences for better expression using computational tools (NetSolP, SoluProt, SolubleMPNN, ESM), or managing protein design workflows with wet-lab validation.",75,1
add-new-opc-skill,"Checklist and automation guide for adding a new skill to the OPC Skills project. Ensures all required files, metadata, logos, and listings are created before release. Use when adding a new skill, publishing a skill, or preparing a skill for release.",75,1
address-github-comments,Use when you need to address review or issue comments on an open GitHub Pull Request using the gh CLI.,75,1
adhx,"Fetch any X/Twitter post as clean LLM-friendly JSON. Converts x.com, twitter.com, or adhx.com links into structured data with full article content, author info, and engagement metrics. No scraping or browser required.",75,1
advanced-evaluation,"This skill should be used when the user asks to ""implement LLM-as-judge"", ""compare model outputs"", ""create evaluation rubrics"", ""mitigate evaluation bias"", or mentions direct scoring, pairwise comparison, position bias, evaluation pipelines, or automated quality assessment.",75,1
advogado-criminal,"Advogado criminalista especializado em Maria da Penha, violencia domestica, feminicidio, direito penal brasileiro, medidas protetivas, inquerito policial e acao penal.",75,1
advogado-especialista,"Advogado especialista em todas as areas do Direito brasileiro: familia, criminal, trabalhista, tributario, consumidor, imobiliario, empresarial, civil e constitucional.",75,1
aegisops-ai,"Autonomous DevSecOps & FinOps Guardrails. Orchestrates Gemini 3 Flash to audit Linux Kernel patches, Terraform cost drifts, and K8s compliance.",75,1
aeo-optimization,"AI Engine Optimization - semantic triples, page templates, content clusters for AI citations",75,1
aeon,"This skill should be used for time series machine learning tasks including classification, regression, clustering, forecasting, anomaly detection, segmentation, and similarity search. Use when working with temporal data, sequential patterns, or time-indexed observations requiring specialized algorithms beyond standard ML approaches. Particularly suited for univariate and multivariate time series analysis with scikit-learn compatible APIs.",75,1
agent-framework-azure-ai-py,"Build Azure AI Foundry agents using the Microsoft Agent Framework Python SDK (agent-framework-azure-ai). Use when creating persistent agents with AzureAIAgentsProvider, using hosted tools (code interpreter, file search, web search), integrating MCP servers, managing conversation threads, or implementing streaming responses. Covers function tools, structured outputs, and multi-tool agents.",75,1
agent-manager-skill,Manage multiple local CLI agents via tmux sessions (start/stop/monitor/assign) with cron-friendly scheduling.,75,1
agent-memory-mcp,"A hybrid memory system that provides persistent, searchable knowledge management for AI agents (Architecture, Patterns, Decisions).",75,1
agent-memory-systems,You are a cognitive architect who understands that memory makes agents intelligent. You've built memory systems for agents handling millions of interactions. You know that the hard part isn't storing - it's retrieving the right memory at the right time.,75,1
agent-orchestration-improve-agent,"Systematic improvement of existing agents through performance analysis, prompt engineering, and continuous iteration.",75,1
agent-orchestration-multi-agent-optimize,"Optimize multi-agent systems with coordinated profiling, workload distribution, and cost-aware orchestration. Use when improving agent performance, throughput, or reliability.",75,1
agent-orchestrator,"Meta-skill que orquestra todos os agentes do ecossistema. Scan automatico de skills, match por capacidades, coordenacao de workflows multi-skill e registry management.",75,1
agent-teams,Claude Code Agent Teams - default team-based development with strict TDD pipeline enforcement,75,1
agentfolio,"Skill for discovering and researching autonomous AI agents, tools, and ecosystems using the AgentFolio directory.",75,1
agentic-actions-auditor,"Audits GitHub Actions workflows for security vulnerabilities in AI agent integrations including Claude Code Action, Gemini CLI, OpenAI Codex, and GitHub AI Inference. Detects attack vectors where attacker-controlled input reaches. AI agents running in CI/CD pipelines.",75,1
agentic-development,Build AI agents with Pydantic AI (Python) and Claude SDK (Node.js),75,1
agentic-engineering,"Operate as an agentic engineer using eval-first execution, decomposition, and cost-aware model routing. Use when AI agents perform most implementation work and humans enforce quality and risk controls.",75,1
agentmail,"Email infrastructure for AI agents. Create accounts, send/receive emails, manage webhooks, and check karma balance via the AgentMail API.",75,1
agents-v2-py,"Build container-based Foundry Agents using Azure AI Projects SDK with ImageBasedHostedAgentDefinition. Use when creating hosted agents that run custom code in Azure AI Foundry with your own container images. Triggers: ""ImageBasedHostedAgentDefinition"", ""hosted agent"", ""container agent"", ""Foundry Agent"", ""create_version"", ""ProtocolVersionRecord"", ""AgentProtocol.RESPONSES"", ""custom agent image"".",75,1
ai-agent-development,"AI agent development workflow for building autonomous agents, multi-agent systems, and agent orchestration with CrewAI, LangGraph, and custom agents.",75,1
ai-discoverability-audit,"Audit how a brand appears in AI-powered search (ChatGPT, Perplexity, Claude, Gemini). Use when user mentions ""AI search,"" ""how do I show up in ChatGPT,"" ""AI discoverability,"" ""AEO,"" ""LLM visibility,"" or wants to understand their brand's AI presence.",75,1
ai-engineer,"Build production-ready LLM applications, advanced RAG systems, and intelligent agents. Implements vector search, multimodal AI, agent orchestration, and enterprise AI integrations.",75,1
ai-engineering-toolkit,"6 production-ready AI engineering workflows: prompt evaluation (8-dimension scoring), context budget planning, RAG pipeline design, agent security audit (65-point checklist), eval harness building, and product sense coaching.",75,1
ai-md,"Convert human-written CLAUDE.md into AI-native structured-label format. Battle-tested across 4 models. Same rules, fewer tokens, higher compliance.",75,1
ai-ml,"AI and machine learning workflow covering LLM application development, RAG implementation, agent architecture, ML pipelines, and AI-powered features.",75,1
ai-models,"Latest AI models reference - Claude, OpenAI, Gemini, Eleven Labs, Replicate",75,1
ai-seo,"When the user wants to optimize content for AI search engines, get cited by LLMs, or appear in AI-generated answers. Also use when the user mentions 'AI SEO,' 'AEO,' 'GEO,' 'LLMO,' 'answer engine optimization,' 'generative engine optimization,' 'LLM optimization,' 'AI Overviews,' 'optimize for ChatGPT,' 'optimize for Perplexity,' 'AI citations,' 'AI visibility,' 'zero-click search,' 'how do I show up in AI answers,' 'LLM mentions,' or 'optimize for Claude/Gemini.' Use this whenever someone wants their content to be cited or surfaced by AI assistants and AI search engines. For traditional technical and on-page SEO audits, see seo-audit. For structured data implementation, see schema-markup.",75,1
ai-studio-image,Geracao de imagens humanizadas via Google AI Studio (Gemini). Fotos realistas estilo influencer ou educacional com iluminacao natural e imperfeicoes sutis.,75,1
ai-wrapper-product,"You know AI wrappers get a bad rap, but the good ones solve real problems. You build products where AI is the engine, not the gimmick. You understand prompt engineering is product development. You balance costs with user experience. You create AI products people actually pay for and use daily.",75,1
airflow-dag-patterns,"Build production Apache Airflow DAGs with best practices for operators, sensors, testing, and deployment. Use when creating data pipelines, orchestrating workflows, or scheduling batch jobs.",75,1
airtable-automation,"Automate Airtable tasks via Rube MCP (Composio): records, bases, tables, fields, views. Always search tools first for current schemas.",75,1
algolia-search,"Expert patterns for Algolia search implementation, indexing strategies, React InstantSearch, and relevance tuning Use when: adding search to, algolia, instantsearch, search api, search functionality.",75,1
alpha-vantage,"Access 20+ years of global financial data: equities, options, forex, crypto, commodities, economic indicators, and 50+ technical indicators.",75,1
altitude-horizon-framework,"Understand the PM-to-Director transition through altitude and horizon thinking. Use when diagnosing scope, time-horizon, or leadership-level gaps.",75,1
amazon-alexa,"Integracao completa com Amazon Alexa para criar skills de voz inteligentes, transformar Alexa em assistente com Claude como cerebro (projeto Auri) e integrar com AWS ecosystem (Lambda, DynamoDB, Polly, Transcribe, Lex, Smart Home).",75,1
amplitude-automation,"Automate Amplitude tasks via Rube MCP (Composio): events, user activity, cohorts, user identification. Always search tools first for current schemas.",75,1
analytics-tracking,"When the user wants to set up, improve, or audit analytics tracking and measurement. Also use when the user mentions ""set up tracking,"" ""GA4,"" ""Google Analytics,"" ""conversion tracking,"" ""event tracking,"" ""UTM parameters,"" ""tag manager,"" ""GTM,"" ""analytics implementation,"" ""tracking plan,"" ""how do I measure this,"" ""track conversions,"" ""attribution,"" ""Mixpanel,"" ""Segment,"" ""are my events firing,"" or ""analytics isn't working."" Use this whenever someone asks how to know if something is working or wants to measure marketing results. For A/B test measurement, see ab-test-setup.",75,1
analyze-feature-requests,"Analyze and prioritize a list of feature requests by theme, strategic alignment, impact, effort, and risk. Use when reviewing customer feature requests, triaging a backlog, or making prioritization decisions.",75,1
analyze-results,"Analyze ML experiment results, compute statistics, generate comparison tables and insights. Use when user says ""analyze results"", ""compare"", or needs to interpret experimental data.",75,1
analyzing-active-directory-acl-abuse,"Detect dangerous ACL misconfigurations in Active Directory using ldap3 to identify GenericAll, WriteDACL, and WriteOwner abuse paths",75,1
analyzing-android-malware-with-apktool,"Perform static analysis of Android APK malware samples using apktool for decompilation, jadx for Java source recovery, and androguard for permission analysis, manifest inspection, and suspicious API call detection.",75,1
analyzing-api-gateway-access-logs,"Parses API Gateway access logs (AWS API Gateway, Kong, Nginx) to detect BOLA/IDOR attacks, rate limit bypass, credential scanning, and injection attempts. Uses pandas for statistical analysis of request patterns and anomaly detection. Use when investigating API abuse or building API-specific threat detection rules.",75,1
analyzing-apt-group-with-mitre-navigator,Analyze advanced persistent threat (APT) group techniques using MITRE ATT&CK Navigator to create layered heatmaps of adversary TTPs for detection gap analysis and threat-informed defense.,75,1
analyzing-azure-activity-logs-for-threats,"Queries Azure Monitor activity logs and sign-in logs via azure-monitor-query to detect suspicious administrative operations, impossible travel, privilege escalation, and resource modifications. Builds KQL queries for threat hunting in Azure environments. Use when investigating suspicious Azure tenant activity or building cloud SIEM detections.",75,1
analyzing-bootkit-and-rootkit-samples,"Analyzes bootkit and advanced rootkit malware that infects the Master Boot Record (MBR), Volume Boot Record (VBR), or UEFI firmware to gain persistence below the operating system. Covers boot sector analysis, UEFI module inspection, and anti-rootkit detection techniques. Activates for requests involving bootkit analysis, MBR malware investigation, UEFI persistence analysis, or pre-OS malware detection.",75,1
analyzing-campaign-attribution-evidence,Campaign attribution analysis involves systematically evaluating evidence to determine which threat actor or group is responsible for a cyber operation. This skill covers collecting and weighting attr,75,1
analyzing-certificate-transparency-for-phishing,"Monitor Certificate Transparency logs using crt.sh and Certstream to detect phishing domains, lookalike certificates, and unauthorized certificate issuance targeting your organization.",75,1
analyzing-cloud-storage-access-patterns,"Detect abnormal access patterns in AWS S3, GCS, and Azure Blob Storage by analyzing CloudTrail Data Events, GCS audit logs, and Azure Storage Analytics. Identifies after-hours bulk downloads, access from new IP addresses, unusual API calls (GetObject spikes), and potential data exfiltration using statistical baselines and time-series anomaly detection.",75,1
analyzing-cobalt-strike-beacon-configuration,"Extract and analyze Cobalt Strike beacon configuration from PE files and memory dumps to identify C2 infrastructure, malleable profiles, and operator tradecraft.",75,1
analyzing-cobaltstrike-malleable-c2-profiles,"Parse and analyze Cobalt Strike Malleable C2 profiles using dissect.cobaltstrike and pyMalleableC2 to extract C2 indicators, detect evasion techniques, and generate network detection signatures.",75,1
analyzing-cyber-kill-chain,"Analyzes intrusion activity against the Lockheed Martin Cyber Kill Chain framework to identify which phases an adversary has completed, where defenses succeeded or failed, and what controls would have interrupted the attack at earlier phases. Use when conducting post-incident analysis, building prevention-focused security controls, or mapping detection gaps to kill chain phases. Activates for requests involving kill chain analysis, intrusion kill chain, attack phase mapping, or Lockheed Martin kill chain framework.",75,1
analyzing-disk-image-with-autopsy,"Perform comprehensive forensic analysis of disk images using Autopsy to recover files, examine artifacts, and build investigation timelines.",75,1
analyzing-dns-logs-for-exfiltration,"Analyzes DNS query logs to detect data exfiltration via DNS tunneling, DGA domain communication, and covert C2 channels using entropy analysis, query volume anomalies, and subdomain length detection in SIEM platforms. Use when SOC teams need to identify DNS-based threats that bypass traditional network security controls.",75,1
analyzing-docker-container-forensics,"Investigate compromised Docker containers by analyzing images, layers, volumes, logs, and runtime artifacts to identify malicious activity and evidence.",75,1
analyzing-email-headers-for-phishing-investigation,"Parse and analyze email headers to trace the origin of phishing emails, verify sender authenticity, and identify spoofing through SPF, DKIM, and DMARC validation.",75,1
analyzing-ethereum-smart-contract-vulnerabilities,"Perform static and symbolic analysis of Solidity smart contracts using Slither and Mythril to detect reentrancy, integer overflow, access control, and other vulnerability classes before deployment to Ethereum mainnet.",75,1
analyzing-golang-malware-with-ghidra,"Reverse engineer Go-compiled malware using Ghidra with specialized scripts for function recovery, string extraction, and type reconstruction in stripped Go binaries.",75,1
analyzing-heap-spray-exploitation,"Detect and analyze heap spray attacks in memory dumps using Volatility3 plugins to identify NOP sled patterns, shellcode landing zones, and suspicious large allocations in process virtual address space.",75,1
analyzing-ios-app-security-with-objection,"Performs runtime mobile security exploration of iOS applications using Objection, a Frida-powered toolkit that enables security testers to interact with app internals without jailbreaking. Use when assessing iOS app security posture, bypassing client-side protections, dumping keychain items, inspecting filesystem storage, and evaluating runtime behavior. Activates for requests involving iOS security testing, Objection runtime analysis, Frida-based iOS assessment, or mobile runtime exploration.",75,1
analyzing-kubernetes-audit-logs,"Parses Kubernetes API server audit logs (JSON lines) to detect exec-into-pod, secret access, RBAC modifications, privileged pod creation, and anonymous API access. Builds threat detection rules from audit event patterns. Use when investigating Kubernetes cluster compromise or building k8s-specific SIEM detection rules.",75,1
analyzing-linux-audit-logs-for-intrusion,"Uses the Linux Audit framework (auditd) with ausearch and aureport utilities to detect intrusion attempts, unauthorized access, privilege escalation, and suspicious system activity. Covers audit rule configuration, log querying, timeline reconstruction, and integration with SIEM platforms. Activates for requests involving auditd analysis, Linux audit log investigation, ausearch queries, aureport summaries, or host-based intrusion detection on Linux.",75,1
analyzing-linux-elf-malware,"Analyzes malicious Linux ELF (Executable and Linkable Format) binaries including botnets, cryptominers, ransomware, and rootkits targeting Linux servers, containers, and cloud infrastructure. Covers static analysis, dynamic tracing, and reverse engineering of x86_64 and ARM ELF samples. Activates for requests involving Linux malware analysis, ELF binary investigation, Linux server compromise assessment, or container malware analysis.",75,1
analyzing-linux-kernel-rootkits,"Detect kernel-level rootkits in Linux memory dumps using Volatility3 linux plugins (check_syscall, lsmod, hidden_modules), rkhunter system scanning, and /proc vs /sys discrepancy analysis to identify hooked syscalls, hidden kernel modules, and tampered system structures.",75,1
analyzing-lnk-file-and-jump-list-artifacts,"Analyze Windows LNK shortcut files and Jump List artifacts to establish evidence of file access, program execution, and user activity using LECmd, JLECmd, and manual binary parsing of the Shell Link Binary format.",75,1
analyzing-macro-malware-in-office-documents,"Analyzes malicious VBA macros embedded in Microsoft Office documents (Word, Excel, PowerPoint) to identify download cradles, payload execution, persistence mechanisms, and anti-analysis techniques. Uses olevba, oledump, and VBA deobfuscation to extract the attack chain. Activates for requests involving Office macro analysis, VBA malware investigation, maldoc analysis, or document-based threat examination.",75,1
analyzing-malicious-url-with-urlscan,"URLScan.io is a free service for scanning and analyzing suspicious URLs. It captures screenshots, DOM content, HTTP transactions, JavaScript behavior, and network connections of web pages in an isolat",75,1
analyzing-malware-behavior-with-cuckoo-sandbox,"Executes malware samples in Cuckoo Sandbox to observe runtime behavior including process creation, file system modifications, registry changes, network communications, and API calls. Generates comprehensive behavioral reports for malware classification and IOC extraction. Activates for requests involving dynamic malware analysis, sandbox detonation, behavioral analysis, or automated malware execution.",75,1
analyzing-malware-family-relationships-with-malpedia,"Use the Malpedia platform and API to research malware family relationships, track variant evolution, link families to threat actors, and integrate YARA rules for detection across malware lineages.",75,1
analyzing-malware-sandbox-evasion-techniques,"Detect sandbox evasion techniques in malware samples by analyzing timing checks, VM artifact queries, user interaction detection, and sleep inflation patterns from Cuckoo/AnyRun behavioral reports",75,1
analyzing-memory-dumps-with-volatility,"Analyzes RAM memory dumps from compromised systems using the Volatility framework to identify malicious processes, injected code, network connections, loaded modules, and extracted credentials. Supports Windows, Linux, and macOS memory forensics. Activates for requests involving memory forensics, RAM analysis, volatile data examination, process injection detection, or memory-resident malware investigation.",75,1
analyzing-mft-for-deleted-file-recovery,"Analyze the NTFS Master File Table ($MFT) to recover metadata and content of deleted files by examining MFT record entries, $LogFile, $UsnJrnl, and MFT slack space using MFTECmd, analyzeMFT, and X-Ways Forensics.",75,1
analyzing-network-covert-channels-in-malware,"Detect and analyze covert communication channels used by malware including DNS tunneling, ICMP exfiltration, steganographic HTTP, and protocol abuse for C2 and data exfiltration.",75,1
analyzing-network-flow-data-with-netflow,"Parse NetFlow v9 and IPFIX records to detect volumetric anomalies, port scanning, data exfiltration, and C2 beaconing patterns. Uses the Python netflow library to decode flow records, builds traffic baselines, and applies statistical analysis to identify flows with abnormal byte counts, connection durations, and periodic timing patterns.",75,1
analyzing-network-packets-with-scapy,"Craft, send, sniff, and dissect network packets using Scapy for protocol analysis, network reconnaissance, and traffic anomaly detection in authorized security testing",75,1
analyzing-network-traffic-for-incidents,"Analyzes network traffic captures and flow data to identify adversary activity during security incidents, including command-and-control communications, lateral movement, data exfiltration, and exploitation attempts. Uses Wireshark, Zeek, and NetFlow analysis techniques. Activates for requests involving network traffic analysis, packet capture investigation, PCAP analysis, network forensics, C2 traffic detection, or exfiltration detection.",75,1
