skill_id,description,score,phase
configuring-host-based-intrusion-detection,"Configures host-based intrusion detection systems (HIDS) to monitor endpoint file integrity, system calls, and configuration changes for security violations. Use when deploying OSSEC, Wazuh, or AIDE for endpoint monitoring, building file integrity monitoring (FIM) policies, or meeting compliance requirements for change detection. Activates for requests involving HIDS configuration, file integrity monitoring, OSSEC/Wazuh deployment, or host-based detection.",75,1
configuring-hsm-for-key-storage,Hardware Security Modules (HSMs) are tamper-resistant physical devices that safeguard cryptographic keys and perform cryptographic operations in a hardened environment. Keys stored in an HSM never lea,75,1
configuring-identity-aware-proxy-with-google-iap,"Configuring Google Cloud Identity-Aware Proxy (IAP) to enforce per-request identity verification for Compute Engine, App Engine, Cloud Run, and GKE services using access levels, context-aware policies, and programmatic access with service accounts.",75,1
configuring-ldap-security-hardening,"Harden LDAP directory services against common attacks including credential harvesting, LDAP injection, anonymous binding, and channel binding bypass. Covers LDAPS enforcement, channel binding, LDAP si",75,1
configuring-network-segmentation-with-vlans,"Designs and implements VLAN-based network segmentation on managed switches to isolate network zones, enforce access control between segments, and reduce the attack surface by limiting lateral movement paths in enterprise network environments.",75,1
configuring-oauth2-authorization-flow,"Configure secure OAuth 2.0 authorization flows including Authorization Code with PKCE, Client Credentials, and Device Authorization Grant. This skill covers flow selection, PKCE implementation, token",75,1
configuring-pfsense-firewall-rules,"Configures pfSense firewall rules, NAT policies, VPN tunnels, and traffic shaping to enforce network segmentation, control traffic flow, and protect internal network zones in enterprise and small-to-medium business environments.",75,1
configuring-snort-ids-for-intrusion-detection,"Installs, configures, and tunes Snort 3 intrusion detection system to monitor network traffic for malicious activity using custom and community rulesets, preprocessors, and alert output plugins on authorized network segments.",75,1
configuring-suricata-for-network-monitoring,"Deploys and configures Suricata IDS/IPS with Emerging Threats rulesets, EVE JSON logging, and custom rules for real-time network traffic inspection, threat detection, and integration with SIEM platforms for centralized security monitoring.",75,1
configuring-tls-1-3-for-secure-communications,"TLS 1.3 (RFC 8446) is the latest version of the Transport Layer Security protocol, providing significant improvements over TLS 1.2 in both security and performance. It reduces handshake latency to 1-R",75,1
configuring-windows-defender-advanced-settings,"Configures Microsoft Defender for Endpoint (MDE) advanced protection settings including attack surface reduction rules, controlled folder access, network protection, and exploit protection. Use when hardening Windows endpoints beyond default Defender settings, deploying enterprise-grade endpoint protection, or meeting compliance requirements for advanced malware defense. Activates for requests involving Windows Defender configuration, ASR rules, MDE tuning, or Microsoft endpoint security.",75,1
configuring-windows-event-logging-for-detection,"Configures Windows Event Logging with advanced audit policies to generate high-fidelity security events for threat detection and forensic investigation. Use when enabling audit policies for logon events, process creation, privilege use, and object access to feed SIEM detection rules. Activates for requests involving Windows audit policy, event log configuration, security logging, or detection-oriented logging.",75,1
confluence-automation,"Automate Confluence page creation, content search, space management, labels, and hierarchy navigation via Rube MCP (Composio). Always search tools first for current schemas.",75,1
connect-chrome,"Launch real Chrome controlled by gstack with the Side Panel extension auto-loaded. One command: connects Claude to a visible Chrome window where you can watch every action in real time. The extension shows a live activity feed in the Side Panel. Use when asked to ""connect chrome"", ""open chrome"", ""real browser"", ""launch chrome"", ""side panel"", or ""control my browser"".",75,1
consciousness-council,"Run a multi-perspective Mind Council deliberation on any question, decision, or creative challenge. Use this skill whenever the user wants diverse viewpoints, needs help making a tough decision, asks for a council/panel/board discussion, wants to explore a problem from multiple angles, requests devil's advocate analysis, or says things like ""what would different experts think about this"", ""help me think through this from all sides"", ""council mode"", ""mind council"", or ""deliberate on this"". Also trigger when the user faces a dilemma, trade-off, or complex choice with no obvious answer.",75,1
constant-time-analysis,Analyze cryptographic code to detect operations that leak secret data through execution timing variations.,75,1
constitutional-ai,"Anthropic's method for training harmless AI through self-improvement. Two-phase approach - supervised learning with self-critique/revision, then RLAIF (RL from AI Feedback). Use for safety alignment, reducing harmful outputs without human labels. Powers Claude's safety system.",75,1
containing-active-breach,"Executes containment strategies to stop active adversary operations and prevent lateral movement during a confirmed security breach. Implements short-term and long-term containment using network segmentation, endpoint isolation, credential revocation, and access control modifications. Activates for requests involving breach containment, lateral movement prevention, network isolation, active threat containment, or live incident response.",75,1
content-creator,"Professional-grade brand voice analysis, SEO optimization, and platform-specific content frameworks.",75,1
content-engine,"Create platform-native content systems for X, LinkedIn, TikTok, YouTube, newsletters, and repurposed multi-platform campaigns. Use when the user wants social posts, threads, scripts, content calendars, or one source asset adapted cleanly across platforms.",75,1
content-experimentation-best-practices,"Content experimentation and A/B testing guidance covering experiment design, hypotheses, metrics, sample size, statistical foundations, CMS-managed variants, and common analysis pitfalls. Use this skill when planning experiments, setting up variants, choosing success metrics, interpreting statistical results, or building experimentation workflows in a CMS or frontend stack.",75,1
content-marketer,"Elite content marketing strategist specializing in AI-powered content creation, omnichannel distribution, SEO optimization, and data-driven performance marketing.",75,1
content-modeling-best-practices,"Structured content modeling guidance for schema design, content architecture, content reuse, references versus embedded objects, separation of concerns, and taxonomies across Sanity and other headless CMSes. Use this skill when designing or refactoring content types, deciding field shapes, debating reusable versus nested content, planning omnichannel content models, or reviewing whether a schema is too page-shaped or presentation-driven.",75,1
content-strategy,"When the user wants to plan a content strategy, decide what content to create, or figure out what topics to cover. Also use when the user mentions ""content strategy,"" ""what should I write about,"" ""content ideas,"" ""blog strategy,"" ""topic clusters,"" ""content planning,"" ""editorial calendar,"" ""content marketing,"" ""content roadmap,"" ""what content should I create,"" ""blog topics,"" ""content pillars,"" or ""I don't know what to write."" Use this whenever someone needs help deciding what content to produce, not just writing it. For writing individual pieces, see copywriting. For SEO-specific audits, see seo-audit. For social media content specifically, see social-content.",75,1
context-agent,"Agente de contexto para continuidade entre sessoes. Salva resumos, decisoes, tarefas pendentes e carrega briefing automatico na sessao seguinte.",75,1
context-degradation,Language models exhibit predictable degradation patterns as context length increases. Understanding these patterns is essential for diagnosing failures and designing resilient systems.,75,1
context-driven-development,"Guide for implementing and maintaining context as a managed artifact alongside code, enabling consistent AI interactions and team alignment through structured project documentation.",75,1
context-engineering-advisor,"Diagnose context stuffing vs. context engineering. Use when an AI workflow feels bloated, brittle, or hard to steer reliably.",75,1
context-guardian,"Guardiao de contexto que preserva dados criticos antes da compactacao automatica. Snapshots, verificacao de integridade e zero perda de informacao.",75,1
context-management-context-restore,Use when working with context management context restore,75,1
context-management-context-save,Use when working with context management context save,75,1
context-manager,"Elite AI context engineering specialist mastering dynamic context management, vector databases, knowledge graphs, and intelligent memory systems.",75,1
context-optimization,"Context optimization extends the effective capacity of limited context windows through strategic compression, masking, caching, and partitioning. The goal is not to magically increase context windows but to make better use of available capacity.",75,1
context-window-management,"You're a context engineering specialist who has optimized LLM applications handling millions of conversations. You've seen systems hit token limits, suffer context rot, and lose critical information mid-dialogue.",75,1
context7-auto-research,"Automatically fetch latest library/framework documentation for Claude Code via Context7 API. Use when you need up-to-date documentation for libraries and frameworks or asking about React, Next.js, Prisma, or any other popular library.",75,1
conventions,../../SKILL.md,75,1
convertkit-automation,"Automate ConvertKit (Kit) tasks via Rube MCP (Composio): manage subscribers, tags, broadcasts, and broadcast stats. Always search tools first for current schemas.",75,1
convex,"Convex reactive backend expert: schema design, TypeScript functions, real-time subscriptions, auth, file storage, scheduling, and deployment.",75,1
copilot-sdk,"Build applications powered by GitHub Copilot using the Copilot SDK. Use when creating programmatic integrations with Copilot across Node.js/TypeScript, Python, Go, or .NET. Covers session management, custom tools, streaming, hooks, MCP servers, BYOK providers, session persistence, custom agents, skills, and deployment patterns. Requires GitHub Copilot CLI installed and a GitHub Copilot subscription (unless using BYOK).",75,1
copy-editing,"When the user wants to edit, review, or improve existing marketing copy. Also use when the user mentions 'edit this copy,' 'review my copy,' 'copy feedback,' 'proofread,' 'polish this,' 'make this better,' 'copy sweep,' 'tighten this up,' 'this reads awkwardly,' 'clean up this text,' 'too wordy,' or 'sharpen the messaging.' Use this when the user already has copy and wants it improved rather than rewritten from scratch. For writing new copy, see copywriting.",75,1
core-components,"Core component library and design system patterns. Use when building UI, using design tokens, or working with the component library.",75,1
correlating-security-events-in-qradar,"Correlates security events in IBM QRadar SIEM using AQL (Ariel Query Language), custom rules, building blocks, and offense management to detect multi-stage attacks across network, endpoint, and application log sources. Use when SOC analysts need to investigate QRadar offenses, build correlation rules, or tune detection logic for reducing false positives.",75,1
correlating-threat-campaigns,"Correlates disparate security incidents, IOCs, and adversary behaviors across time and organizations to identify unified threat campaigns, attribute them to common threat actors, and extract shared indicators for improved detection. Use when multiple incidents exhibit overlapping indicators, when sector-wide attack campaigns require cross-organizational analysis, or when building campaign-level intelligence products. Activates for requests involving campaign analysis, incident clustering, cross-organizational IOC correlation, or MISP correlation engine.",75,1
cost-optimization,"Strategies and patterns for optimizing cloud costs across AWS, Azure, and GCP.",75,1
cpg-analysis,"Deep code property graph analysis with Joern CPG (AST+CFG+PDG) and CodeQL for control flow, data flow, taint analysis, and security auditing",75,1
cpp-pro,"Write idiomatic C++ code with modern features, RAII, smart pointers, and STL algorithms. Handles templates, move semantics, and performance optimization.",75,1
cqrs-implementation,"Implement Command Query Responsibility Segregation for scalable architectures. Use when separating read and write models, optimizing query performance, or building event-sourced systems.",75,1
create-branch,"Create a git branch following Sentry naming conventions. Use when asked to ""create a branch"", ""new branch"", ""start a branch"", ""make a branch"", ""switch to a new branch"", or when starting new work on the default branch.",75,1
create-issue-gate,Use when starting a new implementation task and an issue must be created with strict acceptance criteria gating before execution.,75,1
create-pr,"Alias for sentry-skills:pr-writer. Use when users explicitly ask for ""create-pr"" or reference the legacy skill name. Redirects to the canonical PR writing workflow.",75,1
create-prd,"Create a Product Requirements Document using a comprehensive 8-section template covering problem, objectives, segments, value propositions, solution, and release planning. Use when writing a PRD, documenting product requirements, preparing a feature spec, or reviewing an existing PRD.",75,1
creating-skills,"Guide for creating Claude Code skills following Anthropic's official best practices. Use when user wants to create a new skill, build a skill, write SKILL.md, update an existing skill, or needs skill creation guidelines. Provides structure, frontmatter fields, naming conventions, and new features like dynamic context injection and subagent execution.",75,1
creative-thinking-for-research,"Applies cognitive science frameworks for creative thinking to CS and AI research ideation. Use when seeking genuinely novel research directions by leveraging combinatorial creativity, analogical reasoning, constraint manipulation, and other empirically grounded creative strategies.",75,1
cred-omega,CISO operacional enterprise para gestao total de credenciais e segredos.,75,1
credentials,Centralized API key management from Access.txt,75,1
crewai-multi-agent,"Multi-agent orchestration framework for autonomous AI collaboration. Use when building teams of specialized agents working together on complex tasks, when you need role-based agent collaboration with memory, or for production workflows requiring sequential/hierarchical execution. Built without LangChain dependencies for lean, fast execution.",75,1
cro-optimization,"Analyzes landing pages and provides detailed CRO (Conversion Rate Optimization) recommendations. Use when user provides a landing page URL or HTML/CSS code and needs optimization advice to maximize conversions, signups, or sales. Extracts page elements, audits against proven CRO principles, and delivers actionable recommendations in report format.",75,1
crosspost,"Multi-platform content distribution across X, LinkedIn, Threads, and Bluesky. Adapts content per platform using content-engine patterns. Never posts identical content cross-platform. Use when the user wants to distribute content across social platforms.",75,1
crypto-bd-agent,"Production-tested patterns for building AI agents that autonomously discover, > evaluate, and acquire token listings for cryptocurrency exchanges.",75,1
csharp-pro,"Write modern C# code with advanced features like records, pattern matching, and async/await. Optimizes .NET applications, implements enterprise patterns, and ensures comprehensive testing.",75,1
customaize-agent:agent-evaluation,"Evaluate and improve Claude Code commands, skills, and agents. Use when testing prompt effectiveness, validating context engineering choices, or measuring improvement quality.",75,1
customaize-agent:apply-anthropic-skill-best-practices,Comprehensive guide for skill development based on Anthropic's official best practices - use for complex skills requiring detailed structure,75,1
customaize-agent:context-engineering,"Understand the components, mechanics, and constraints of context in agent systems. Use when writing, editing, or optimizing commands, skills, or sub-agents prompts.",75,1
customaize-agent:create-agent,"Comprehensive guide for creating Claude Code agents with proper structure, triggering conditions, system prompts, and validation - combines official Anthropic best practices with proven patterns",75,1
customaize-agent:create-command,"Interactive assistant for creating new Claude commands with proper structure, patterns, and MCP tool integration",75,1
customaize-agent:create-hook,"Create and configure git hooks with intelligent project analysis, suggestions, and automated testing",75,1
customaize-agent:create-rule,"Use when found gap or repetative issue, that produced by you or implemenataion agent. Esentially use it each time when you say ""You absolutly right, I should have done it differently."" -> need create rule for this issue so it not appears again.",75,1
customaize-agent:create-skill,"Guide for creating effective skills. This command should be used when users want to create a new skill (or update an existing skill) that extends Claude's capabilities with specialized knowledge, workflows, or tool integrations. Use when creating new skills, editing existing skills, or verifying skills work before deployment - applies TDD to process documentation by testing with subagents before writing, iterating until bulletproof against rationalization",75,1
customaize-agent:create-workflow-command,Create a workflow command that orchestrates multi-step execution through sub-agents with file-based task prompts,75,1
customaize-agent:prompt-engineering,"Use this skill when you writing commands, hooks, skills for Agent, or prompts for sub agents or any other LLM interaction, including optimizing prompts, improving LLM outputs, or designing production prompt templates.",75,1
customaize-agent:test-prompt,"Use when creating or editing any prompt (commands, hooks, skills, subagent instructions) to verify it produces desired behavior - applies RED-GREEN-REFACTOR cycle to prompt engineering using subagents for isolated testing",75,1
customaize-agent:test-skill,"Use when creating or editing skills, before deployment, to verify they work under pressure and resist rationalization - applies RED-GREEN-REFACTOR cycle to process documentation by running baseline without skill, writing to address failures, iterating to close loopholes",75,1
customaize-agent:thought-based-reasoning,"Use when tackling complex reasoning tasks requiring step-by-step logic, multi-step arithmetic, commonsense reasoning, symbolic manipulation, or problems where simple prompting fails - provides comprehensive guide to Chain-of-Thought and related prompting techniques (Zero-shot CoT, Self-Consistency, Tree of Thoughts, Least-to-Most, ReAct, PAL, Reflexion) with templates, decision matrices, and research-backed patterns",75,1
customer-billing-ops,"Operate customer billing workflows such as subscriptions, refunds, churn triage, billing-portal recovery, and plan analysis using connected billing tools like Stripe. Use when the user needs to help a customer, inspect subscription state, or manage revenue-impacting billing operations.",75,1
customer-journey-map,"Create a customer journey map across stages, touchpoints, actions, emotions, and metrics. Use when diagnosing a broken experience or aligning a team on the full customer flow.",75,1
customer-journey-mapping-workshop,"Run a customer journey mapping workshop with adaptive questions and outputs. Use when you need to map stages, actions, emotions, pain points, and opportunities for a persona and scenario.",75,1
customer-support,"Elite AI-powered customer support specialist mastering conversational AI, automated ticketing, sentiment analysis, and omnichannel support experiences.",75,1
customize,"Interactive guided deployment flow for Azure OpenAI models with full customization control. Step-by-step selection of model version, SKU (GlobalStandard/Standard/ProvisionedManaged), capacity, RAI policy (content filter), and advanced options (dynamic quota, priority processing, spillover). USE FOR: custom deployment, customize model deployment, choose version, select SKU, set capacity, configure content filter, RAI policy, deployment options, detailed deployment, advanced deployment, PTU deployment, provisioned throughput. DO NOT USE FOR: quick deployment to optimal region (use preset).",75,1
daily,Documentation and capabilities reference for Daily,75,1
daily-news-caster,"Fetches the latest news using news-aggregator-skill, formats it into a podcast script in Markdown format, and uses the tts skill to generate a podcast audio file. Use when the user asks to get the latest news and read it out as a podcast.",75,1
daily-news-report,"Scrapes content based on a preset URL list, filters high-quality technical information, and generates daily Markdown reports.",75,1
dask,"Distributed computing for larger-than-RAM pandas/NumPy workflows. Use when you need to scale existing pandas/NumPy code beyond memory or across clusters. Best for parallel file processing, distributed ML, integration with existing pandas code. For out-of-core analytics on single machine use vaex; for in-memory speed use polars.",75,1
data-engineer,"Build scalable data pipelines, modern data warehouses, and real-time streaming architectures. Implements Apache Spark, dbt, Airflow, and cloud-native data platforms.",75,1
data-engineering-data-driven-feature,"Build features guided by data insights, A/B testing, and continuous measurement using specialized agents for analysis, implementation, and experimentation.",75,1
data-engineering-data-pipeline,"You are a data pipeline architecture expert specializing in scalable, reliable, and cost-effective data pipelines for batch and streaming data processing.",75,1
data-quality-frameworks,"Implement data quality validation with Great Expectations, dbt tests, and data contracts. Use when building data quality pipelines, implementing validation rules, or establishing data contracts.",75,1
data-scientist,"Expert data scientist for advanced analytics, machine learning, and statistical modeling. Handles complex data analysis, predictive modeling, and business intelligence.",75,1
data-storytelling,Transform raw data into compelling narratives that drive decisions and inspire action.,75,1
database,"Database development and operations workflow covering SQL, NoSQL, database design, migrations, optimization, and data engineering.",75,1
database-admin,"Expert database administrator specializing in modern cloud databases, automation, and reliability engineering.",75,1
database-cloud-optimization-cost-optimize,"You are a cloud cost optimization expert specializing in reducing infrastructure expenses while maintaining performance and reliability. Analyze cloud spending, identify savings opportunities, and implement cost-effective architectures across AWS, Azure, and GCP.",75,1
database-design,"Database design principles and decision-making. Schema design, indexing strategy, ORM selection, serverless databases.",75,1
database-driver-design,"Expert guidance on building Swift database client libraries. Use when developers mention: (1) building a database driver, (2) wire protocol implementation, (3) connection pooling design, (4) state machines for protocol handling, (5) NIO channel handlers for databases, (6) backpressure in result streaming, (7) actor executor alignment with NIO.",75,1
database-migration,"Master database schema and data migrations across ORMs (Sequelize, TypeORM, Prisma), including rollback strategies and zero-downtime deployments.",75,1
database-migrations,"Database migration best practices for schema changes, data migrations, rollbacks, and zero-downtime deployments across PostgreSQL, MySQL, and common ORMs (Prisma, Drizzle, Django, TypeORM, golang-migrate). Use when planning or implementing database schema changes.",75,1
database-migrations-migration-observability,"Migration monitoring, CDC, and observability infrastructure",75,1
database-migrations-sql-migrations,"SQL database migrations with zero-downtime strategies for PostgreSQL, MySQL, and SQL Server. Focus on data integrity and rollback plans.",75,1
database-optimizer,"Expert database optimizer specializing in modern performance tuning, query optimization, and scalable architectures.",75,1
database-schema,"Schema awareness - read before coding, type generation, prevent column errors",75,1
datadog-automation,"Automate Datadog tasks via Rube MCP (Composio): query metrics, search logs, manage monitors/dashboards, create events and downtimes. Always search tools first for current schemas.",75,1
