skill_id,description,score,phase
react-state-management,"Master modern React state management with Redux Toolkit, Zustand, Jotai, and React Query. Use when setting up global state, managing server state, or choosing between state management solutions.",19,1
android-jetpack-compose-expert,"Expert guidance for building modern Android UIs with Jetpack Compose, covering state management, navigation, performance, and Material Design 3.",11,1
angular-state-management,"Master modern Angular state management with Signals, NgRx, and RxJS. Use when setting up global state, managing component stores, choosing between state solutions, or migrating from legacy patterns.",11,1
cc-skill-frontend-patterns,"Frontend development patterns for React, Next.js, state management, performance optimization, and UI best practices.",11,1
context-fundamentals,"Context is the complete state available to a language model at inference time. It includes everything the model can attend to when generating responses: system instructions, tool definitions, retrieved documents, message history, and tool outputs.",11,1
deploying-osquery-for-endpoint-monitoring,"Deploys and configures osquery for real-time endpoint monitoring using SQL-based queries to inspect running processes, open ports, installed software, and system configuration. Use when building visibility into endpoint state, threat hunting across fleet, or implementing compliance monitoring. Activates for requests involving osquery deployment, endpoint visibility, fleet management, or SQL-based endpoint querying.",11,1
flutter,"Flutter development with Riverpod state management, Freezed, go_router, and mocktail testing",11,1
frontend-developer,"Build React components, implement responsive layouts, and handle client-side state management. Masters React 19, Next.js 15, and modern frontend architecture.",11,1
react-flow-architect,"Build production-ready ReactFlow applications with hierarchical navigation, performance optimization, and advanced state management.",11,1
react-native-architecture,"Production-ready patterns for React Native development with Expo, including navigation, state management, native modules, and offline-first architecture.",11,1
robius-state-management,"CRITICAL: Use for Robius state management patterns. Triggers on: AppState, persistence, theme switch, 状态管理, Scope::with_data, save state, load state, serde, 状态持久化, 主题切换",11,1
swift-patterns,"Review, refactor, or build SwiftUI features with correct state management, modern API usage, optimal view composition, navigation patterns, performance optimization, and testing best practices.",11,1
swiftui-expert-skill,"Write, review, or improve SwiftUI code following best practices for state management, view composition, performance, and iOS 26+ Liquid Glass adoption. Use when building new SwiftUI features, refactoring existing views, reviewing code quality, or adopting modern SwiftUI patterns.",11,1
tanstack-query-expert,"Expert in TanStack Query (React Query) — asynchronous state management. Covers data fetching, stale time configuration, mutations, optimistic updates, and Next.js App Router (SSR) integration.",11,1
terraform-aws-modules,"Terraform module creation for AWS — reusable modules, state management, and HCL best practices. Use when building or reviewing Terraform AWS infrastructure.",11,1
terraform-specialist,"Expert Terraform/OpenTofu specialist mastering advanced IaC automation, state management, and enterprise infrastructure patterns.",11,1
linear,"Linear CLI for issue tracking and project management. Use when developers mention: (1) Linear issues or tickets, (2) issue tracking or task management, (3) WDY team issues, (4) closing, updating, or triaging tickets, (5) linking PRs to issues, (6) issue states (triage, backlog, started, completed).",9,1
attach-db,"Attach a DuckDB database file for use with /duckdb-skills:query. Explores the schema (tables, columns, row counts) and writes a SQL state file so subsequent queries can restore this session automatically via duckdb -init.",7,1
automate-whatsapp,"Build WhatsApp automations with Kapso workflows: configure WhatsApp triggers, edit workflow graphs, manage executions, deploy functions, and use databases/integrations for state. Use when automating WhatsApp conversations and event handling.",7,1
bdi-mental-states,"This skill should be used when the user asks to ""model agent mental states"", ""implement BDI architecture"", ""create belief-desire-intention models"", ""transform RDF to beliefs"", ""build cognitive agent"", or mentions BDI ontology, mental state modeling, rational agency, or neuro-symbolic AI integration.",7,1
blip-2-vision-language,"Vision-language pre-training framework bridging frozen image encoders and LLMs. Use when you need image captioning, visual question answering, image-text retrieval, or multimodal chat with state-of-the-art zero-shot performance.",7,1
collecting-volatile-evidence-from-compromised-host,"Collect volatile forensic evidence from a compromised system following order of volatility, preserving memory, network connections, processes, and system state before they are lost.",7,1
dispatching-parallel-agents,Use when facing 2+ independent tasks that can be worked on without shared state or sequential dependencies,7,1
fpf:actualize,Reconcile the project's FPF state with recent repository changes,7,1
fpf:status,Display the current state of the FPF knowledge base,7,1
interview-coach,"Full job search coaching system — JD decoding, resume, storybank, mock interviews, transcript analysis, comp negotiation. 23 commands, persistent state.",7,1
makepad-animation,"CRITICAL: Use for Makepad animation system. Triggers on: makepad animation, makepad animator, makepad hover, makepad state, makepad transition, ""from: { all: Forward"", makepad pressed, makepad 动画, makepad 状态, makepad 过渡, makepad 悬停效果",7,1
mamba-architecture,"State-space model with O(n) complexity vs Transformers' O(n²). 5× faster inference, million-token sequences, no KV cache. Selective SSM with hardware-aware design. Mamba-1 (d_state=16) and Mamba-2 (d_state=128, multi-head). Models 130M-2.8B on HuggingFace.",7,1
next-step,"Analyzes album state and recommends the optimal next action. Use when the user asks ""what should I do next?"" or ""what's left to do?""",7,1
performing-file-carving-with-foremost,Recover files from disk images and unallocated space using Foremost's header-footer signature carving to extract evidence regardless of file system state.,7,1
post-processing,"Extract, analyze, and summarize simulation output data — pull spatial fields at specific timesteps, compute time-series trends and detect steady state, extract line profiles through the domain, generate statistical summaries and distributions, calculate derived quantities (gradients, fluxes, volume fractions, interface area), compare results against analytical solutions or experimental data, and produce automated analysis reports. Use when interpreting finished simulation results, checking mass or energy conservation, comparing two runs or meshes, extracting interface profiles from phase-field output, or preparing publication-quality analysis, even if the user only says ""what do my results look like"" or ""did my simulation reach steady state.""",7,1
sadd:subagent-driven-development,"Use when executing implementation plans with independent tasks in the current session or facing 3+ independent issues that can be investigated without shared state or dependencies - dispatches fresh subagent for each task with code review between tasks, enabling fast iteration with quality gates",7,1
scvelo,"RNA velocity analysis with scVelo. Estimate cell state transitions from unspliced/spliced mRNA dynamics, infer trajectory directions, compute latent time, and identify driver genes in single-cell RNA-seq data. Complements Scanpy/scVI-tools for trajectory inference.",7,1
sentence-transformers,"Framework for state-of-the-art sentence, text, and image embeddings. Provides 5000+ pre-trained models for semantic similarity, clustering, and retrieval. Supports multilingual, domain-specific, and multimodal models. Use for generating embeddings for RAG, semantic search, or similarity tasks. Best for production embedding generation.",7,1
session-start,"Runs the session startup procedure - verifies setup, loads config and state, checks skill models, and reports project status. Use at the beginning of a fresh session.",7,1
stable-diffusion-image-generation,"State-of-the-art text-to-image generation with Stable Diffusion models via HuggingFace Diffusers. Use when generating images from text prompts, performing image-to-image translation, inpainting, or building custom diffusion pipelines.",7,1
swiftui-ui-patterns,"Apply proven SwiftUI UI patterns for navigation, sheets, async state, and reusable screens.",7,1
team-coordination,"Multi-person projects - shared state, todo claiming, handoffs",7,1
verification-before-completion,"Claiming work is complete without verification is dishonesty, not efficiency. Use when ANY variation of success/completion claims, ANY expression of satisfaction, or ANY positive statement about work state.",7,1
context-management-context-restore,Use when working with context management context restore,5,1
context-management-context-save,Use when working with context management context save,5,1
context-manager,"Elite AI context engineering specialist mastering dynamic context management, vector databases, knowledge graphs, and intelligent memory systems.",5,1
filesystem-context,"Use for file-based context management, dynamic context discovery, and reducing context window bloat. Offload context to files for just-in-time loading.",5,1
outcome-roadmap,"Transform an output-focused roadmap into an outcome-focused one that communicates strategic intent. Rewrites initiatives as outcome statements reflecting user and business impacts. Use when shifting to outcome roadmaps, making a roadmap more strategic, or rewriting feature lists as outcomes.",5,1
positioning-statement,"Create a Geoffrey Moore-style positioning statement. Use when clarifying who you serve, what problem you solve, your category, and why you're different from alternatives.",5,1
problem-framing-canvas,Guide teams through MITRE's Problem Framing Canvas. Use when you need a clearer problem statement before jumping to solutions.,5,1
proof-writer,"Writes rigorous mathematical proofs for ML/AI theory. Use when asked to prove a theorem, lemma, proposition, or corollary, fill in missing proof steps, formalize a proof sketch, 补全证明, 写证明, 证明某个命题, or determine whether a claimed proof can actually be completed under the stated assumptions.",5,1
research-grants,"Write competitive research proposals for NSF, NIH, DOE, DARPA, and Taiwan NSTC. Agency-specific formatting, review criteria, budget preparation, broader impacts, significance statements, innovation narratives, and compliance with submission requirements.",5,1
researchers-gov,"Researches DOJ/FBI/SEC press releases, agency statements, and government sources. Use when research needs official government records or agency documentation.",5,1
session-management,"Context preservation, tiered summarization, resumability",5,1
xlsx-official,Unless otherwise stated by the user or existing template,5,1
