skill_id,description,src_path
aws-serverless,Proper Lambda function structure with error handling,lib/sickn33-antigravity-awesome-skills/plugins/antigravity-awesome-skills-claude/skills/aws-serverless/SKILL.md
azure-cloud-migrate,"Assess and migrate cross-cloud workloads to Azure with migration reports and code conversion guidance. Supports AWS, GCP, and other providers. WHEN: migrate Lambda to Azure Functions, migrate AWS to Azure, Lambda migration assessment, convert AWS serverless to Azure, migration readiness report, migrate from AWS, migrate from GCP, cross-cloud migration.",lib/microsoft-skills/.github/plugins/azure-skills/skills/azure-cloud-migrate/SKILL.md
cloudflare-d1,"Cloudflare D1 SQLite database with Workers, Drizzle ORM, migrations",lib/alinaqi-claude-bootstrap/skills/cloudflare-d1/SKILL.md
cloudflare-workers-expert,"Expert in Cloudflare Workers and the Edge Computing ecosystem. Covers Wrangler, KV, D1, Durable Objects, and R2 storage.",lib/sickn33-antigravity-awesome-skills/plugins/antigravity-awesome-skills-claude/skills/cloudflare-workers-expert/SKILL.md
hono,"Build ultra-fast web APIs and full-stack apps with Hono — runs on Cloudflare Workers, Deno, Bun, Node.js, and any WinterCG-compatible runtime.",lib/sickn33-antigravity-awesome-skills/plugins/antigravity-awesome-skills-claude/skills/hono/SKILL.md
latchbio-integration,"Latch platform for bioinformatics workflows. Build pipelines with Latch SDK, @workflow/@task decorators, deploy serverless workflows, LatchFile/LatchDir, Nextflow/Snakemake integration.",lib/k-dense-ai-claude-scientific-skills/scientific-skills/latchbio-integration/SKILL.md
