skill_id,description,score,phase
performing-web-cache-deception-attack,Execute web cache deception attacks by exploiting path normalization discrepancies between CDN caching layers and origin servers to cache and retrieve sensitive authenticated content.,11,2
prompt-caching,"You're a caching specialist who has reduced LLM costs by 90% through strategic caching. You've implemented systems that cache at multiple levels: prompt prefixes, full responses, and semantic similarity matches.",11,2
analyzing-windows-amcache-artifacts,"Parses and analyzes the Windows Amcache.hve registry hive to extract evidence of program execution, application installation, and driver loading for digital forensics investigations. Uses Eric Zimmerman's AmcacheParser and Timeline Explorer for artifact extraction, SHA-1 hash correlation with threat intel, and timeline reconstruction. Activates for requests involving Amcache forensics, program execution evidence, Windows artifact analysis, or application compatibility cache investigation.",7,2
azure-resource-manager-redis-dotnet,Azure Resource Manager SDK for Redis in .NET.,7,2
cache-integration,cache integration,7,2
debug-buttercup,"All pods run in namespace crs. Use when pods in the crs namespace are in CrashLoopBackOff, OOMKilled, or restarting, multiple services restart simultaneously (cascade failure), or redis is unresponsive or showing AOF warnings.",7,2
extracting-browser-history-artifacts,"Extract and analyze browser history, cookies, cache, downloads, and bookmarks from Chrome, Firefox, and Edge for forensic evidence of user web activity.",7,2
hugging-face-cli,"The hf CLI provides direct terminal access to the Hugging Face Hub for downloading, uploading, and managing repositories, cache, and compute resources.",7,2
netlify-caching,"Guide for controlling caching on Netlify's CDN. Use when configuring cache headers, setting up stale-while-revalidate, implementing on-demand cache purge, or understanding Netlify's CDN caching behavior. Covers Cache-Control, Netlify-CDN-Cache-Control, cache tags, durable cache, and framework-specific caching patterns.",6,2
