skill_id,description,score,phase
ckm:ui-styling,"Create beautiful, accessible user interfaces with shadcn/ui components (built on Radix UI + Tailwind), Tailwind CSS utility-first styling, and canvas-based visual designs. Use when building user interfaces, implementing design systems, creating responsive layouts, adding accessible components (dialogs, dropdowns, forms, tables), customizing themes and colors, implementing dark mode, generating visual designs and posters, or establishing consistent styling patterns across applications.",19,1
baseline-ui,"Validates animation durations, enforces typography scale, checks component accessibility, and prevents layout anti-patterns in Tailwind CSS projects. Use when building UI components, reviewing CSS utilities, styling React views, or enforcing design consistency.",15,1
expo-tailwind-setup,Set up Tailwind CSS v4 in Expo with react-native-css and NativeWind v5 for universal styling,15,1
pptx-posters,"Create research posters using HTML/CSS that can be exported to PDF or PPTX. Use this skill ONLY when the user explicitly requests PowerPoint/PPTX poster format. For standard research posters, use latex-posters instead. This skill provides modern web-based poster design with responsive layouts and easy visual integration.",15,1
tailwind-design-system,"Build production-ready design systems with Tailwind CSS, including design tokens, component variants, responsive patterns, and accessibility.",15,1
cro-optimization,"Analyzes landing pages and provides detailed CRO (Conversion Rate Optimization) recommendations. Use when user provides a landing page URL or HTML/CSS code and needs optimization advice to maximize conversions, signups, or sales. Extracts page elements, audits against proven CRO principles, and delivers actionable recommendations in report format.",11,1
tailwind-patterns,"Tailwind CSS v4 principles. CSS-first configuration, container queries, modern patterns, design token architecture.",11,1
color-expert,"Use when working with color naming, color theory, color spaces, color definitions, or any task involving color knowledge - palettes, ramps, gradients, conversions, accessibility, perceptual matching, pigment mixing, print-vs-screen color, CSS color syntax, or historical color terminology. Use this skill whenever the user is choosing, comparing, generating, naming, converting, or explaining colors, even if they do not explicitly ask for ""color theory.""",7,1
