skill_id,description,src_path
python-performance-optimization,"Profile and optimize Python code using cProfile, memory profilers, and performance best practices. Use when debugging slow Python code, optimizing bottlenecks, or improving application performance.",src/antigravity-awesome-skills/skills/python-performance-optimization/SKILL.md
python-plugin-wrapper,python plugin wrapper,src/kreuzberg-dev-kreuzberg/.ai-rulez/domains/plugin-system/skills/python-plugin-wrapper/SKILL.md
pyzotero,"Interact with Zotero reference management libraries using the pyzotero Python client. Retrieve, create, update, and delete items, collections, tags, and attachments via the Zotero Web API v3. Use this skill when working with Zotero libraries programmatically, managing bibliographic references, exporting citations, searching library contents, uploading PDF attachments, or building research automation workflows that integrate with Zotero.",src/K-Dense-AI-claude-scientific-skills/scientific-skills/pyzotero/SKILL.md
reddit-api,Reddit API with PRAW (Python) and Snoowrap (Node.js),src/alinaqi-claude-bootstrap/skills/reddit-api/SKILL.md
rowan,"Cloud-based quantum chemistry platform with Python API. Preferred for computational chemistry workflows including pKa prediction, geometry optimization, conformer searching, molecular property calculations, protein-ligand docking (AutoDock Vina), and AI protein cofolding (Chai-1, Boltz-1/2). Use when tasks involve quantum chemistry calculations, molecular property prediction, DFT or semiempirical methods, neural network potentials (AIMNet2), protein-ligand binding predictions, or automated computational chemistry pipelines. Provides cloud compute resources with no local setup required.",src/K-Dense-AI-claude-scientific-skills/scientific-skills/rowan/SKILL.md
scanpy,"Scanpy is a scalable Python toolkit for analyzing single-cell RNA-seq data, built on AnnData. Apply this skill for complete single-cell workflows including quality control, normalization, dimensionality reduction, clustering, marker gene identification, visualization, and trajectory analysis.",src/antigravity-awesome-skills/skills/scanpy/SKILL.md
scikit-learn,"Machine learning in Python with scikit-learn. Use for classification, regression, clustering, model evaluation, and ML pipelines.",src/antigravity-awesome-skills/skills/scikit-learn/SKILL.md
scikit-survival,"Comprehensive toolkit for survival analysis and time-to-event modeling in Python using scikit-survival. Use this skill when working with censored survival data, performing time-to-event analysis, fitting Cox models, Random Survival Forests, Gradient Boosting models, or Survival SVMs, evaluating survival predictions with concordance index or Brier score, handling competing risks, or implementing any survival analysis workflow with the scikit-survival library.",src/K-Dense-AI-claude-scientific-skills/scientific-skills/scikit-survival/SKILL.md
seaborn,"Seaborn is a Python visualization library for creating publication-quality statistical graphics. Use this skill for dataset-oriented plotting, multivariate analysis, automatic statistical estimation, and complex multi-panel figures with minimal code.",src/antigravity-awesome-skills/skills/seaborn/SKILL.md
setup,Detects your Python environment and guides you through installing plugin dependencies. Use on first-time setup or when MCP server fails to start.,src/bitwize-music-studio-claude-ai-music-skills/skills/setup/SKILL.md
statsmodels,"Statsmodels is Python's premier library for statistical modeling, providing tools for estimation, inference, and diagnostics across a wide range of statistical methods.",src/antigravity-awesome-skills/skills/statsmodels/SKILL.md
sympy,SymPy is a Python library for symbolic mathematics that enables exact computation using mathematical symbols rather than numerical approximations.,src/antigravity-awesome-skills/skills/sympy/SKILL.md
telegram,"Integracao completa com Telegram Bot API. Setup com BotFather, mensagens, webhooks, inline keyboards, grupos, canais. Boilerplates Node.js e Python.",src/antigravity-awesome-skills/skills/telegram/SKILL.md
temporal-python-pro,"Master Temporal workflow orchestration with Python SDK. Implements durable workflows, saga patterns, and distributed transactions. Covers async/await, testing strategies, and production deployment.",src/antigravity-awesome-skills/skills/temporal-python-pro/SKILL.md
temporal-python-testing,"Comprehensive testing approaches for Temporal workflows using pytest, progressive disclosure resources for specific testing scenarios.",src/antigravity-awesome-skills/skills/temporal-python-testing/SKILL.md
tinybird-python-sdk-guidelines,"Tinybird Python SDK for defining datasources, pipes, and queries in Python. Use when working with tinybird-sdk, Python Tinybird projects, or data ingestion and queries in Python.",src/tinybird-agent-skills/skills/tinybird-python-sdk-guidelines/SKILL.md
using-tmux-for-interactive-commands,"Use when you need to run interactive CLI tools (vim, git rebase -i, Python REPL, etc.) that require real-time input/output - provides tmux-based approach for controlling interactive sessions through detached sessions and send-keys",src/superpowers-lab/skills/using-tmux-for-interactive-commands/SKILL.md
vertex-ai-api-dev,"Guides the usage of Gemini API on Google Cloud Vertex AI with the Gen AI SDK. Use when the user asks about using Gemini in an enterprise environment or explicitly mentions Vertex AI. Covers SDK usage (Python, JS/TS, Go, Java, C#), capabilities like Live API, tools, multimedia generation, caching, and batch prediction.",src/gemini-skills/skills/vertex-ai-api-dev/SKILL.md
whatsapp-cloud-api,"Integracao com WhatsApp Business Cloud API (Meta). Mensagens, templates, webhooks HMAC-SHA256, automacao de atendimento. Boilerplates Node.js e Python.",src/antigravity-awesome-skills/skills/whatsapp-cloud-api/SKILL.md
xvary-stock-research,"Thesis-driven equity analysis from public SEC EDGAR and market data; /analyze, /score, /compare workflows with bundled Python tools (Claude Code, Cursor, Codex).",src/antigravity-awesome-skills/skills/xvary-stock-research/SKILL.md
datamol,"Pythonic wrapper around RDKit with simplified interface and sensible defaults. Preferred for standard drug discovery including SMILES parsing, standardization, descriptors, fingerprints, clustering, 3D conformers, parallel processing. Returns native rdkit.Chem.Mol objects. For advanced control or custom parameters, use rdkit directly.",src/K-Dense-AI-claude-scientific-skills/scientific-skills/datamol/SKILL.md
fastapi-templates,"Create production-ready FastAPI projects with async patterns, dependency injection, and comprehensive error handling. Use when building new FastAPI applications or setting up backend API projects.",src/antigravity-awesome-skills/plugins/antigravity-bundle-python-pro/skills/fastapi-templates/SKILL.md
junta-leiloeiros,"Coleta e consulta dados de leiloeiros oficiais de todas as 27 Juntas Comerciais do Brasil. Scraper multi-UF, banco SQLite, API FastAPI e exportacao CSV/JSON.",src/antigravity-awesome-skills/skills/junta-leiloeiros/SKILL.md
