skill_id,description,score,phase
agent-framework-azure-ai-py,Build persistent agents on Azure AI Foundry using the Microsoft Agent Framework Python SDK.,100,5
agentic-development,Build AI agents with Pydantic AI (Python) and Claude SDK (Node.js),100,5
analyzing-network-flow-data-with-netflow,"Parse NetFlow v9 and IPFIX records to detect volumetric anomalies, port scanning, data exfiltration, and C2 beaconing patterns. Uses the Python netflow library to decode flow records, builds traffic baselines, and applies statistical analysis to identify flows with abnormal byte counts, connection durations, and periodic timing patterns.",100,5
analyzing-powershell-script-block-logging,"Parse Windows PowerShell Script Block Logs (Event ID 4104) from EVTX files to detect obfuscated commands, encoded payloads, and living-off-the-land techniques. Uses python-evtx to extract and reconstruct multi-block scripts, applies entropy analysis and pattern matching for Base64-encoded commands, Invoke-Expression abuse, download cradles, and AMSI bypass attempts.",100,4
analyzing-threat-actor-ttps-with-mitre-navigator,"Map advanced persistent threat (APT) group tactics, techniques, and procedures (TTPs) to the MITRE ATT&CK framework using the ATT&CK Navigator and attackcti Python library. The analyst queries STIX/TAXII data for group-technique associations, generates Navigator layer files for visualization, and compares defensive coverage against adversary profiles. Activates for requests involving APT TTP mapping, ATT&CK Navigator layers, threat actor profiling, or MITRE technique coverage analysis.",100,4
analyzing-windows-prefetch-with-python,"Parse Windows Prefetch files using the windowsprefetch Python library to reconstruct application execution history, detect renamed or masquerading binaries, and identify suspicious program execution patterns.",100,4
astropy,"Comprehensive Python library for astronomy and astrophysics. This skill should be used when working with astronomical data including celestial coordinates, physical units, FITS files, cosmological calculations, time systems, tables, world coordinate systems (WCS), and astronomical data analysis. Use when tasks involve coordinate transformations, unit conversions, FITS file manipulation, cosmological distance calculations, time scale conversions, or astronomical data processing.",100,4
async-python-patterns,"Comprehensive guidance for implementing asynchronous Python applications using asyncio, concurrent programming patterns, and async/await for building high-performance, non-blocking systems.",100,5
automating-ioc-enrichment,"Automates the enrichment of raw indicators of compromise with multi-source threat intelligence context using SOAR platforms, Python pipelines, or TIP playbooks to reduce analyst triage time and standardize enrichment outputs. Use when building automated enrichment workflows integrated with SIEM alerts, email submission pipelines, or bulk IOC processing from threat feeds. Activates for requests involving SOAR enrichment, Cortex XSOAR, Splunk SOAR, TheHive, Python enrichment pipelines, or automated IOC processing.",100,5
azure-ai-contentsafety-py,Azure AI Content Safety SDK for Python. Use for detecting harmful content in text and images with multi-severity classification.,100,4
azure-ai-contentunderstanding-py,"Azure AI Content Understanding SDK for Python. Use for multimodal content extraction from documents, images, audio, and video.",100,4
azure-ai-language-conversations-py,"Implement Conversational Language Understanding (CLU) using the azure-ai-language-conversations Python SDK. Use when working with ConversationAnalysisClient to analyze conversation intent and entities, building NLP features, or integrating language understanding into applications.",100,5
azure-ai-ml-py,"Azure Machine Learning SDK v2 for Python. Use for ML workspaces, jobs, models, datasets, compute, and pipelines.",100,4
azure-ai-transcription-py,Azure AI Transcription SDK for Python. Use for real-time and batch speech-to-text transcription with timestamps and diarization.,100,4
azure-appconfiguration-py,"Azure App Configuration SDK for Python. Use for centralized configuration management, feature flags, and dynamic settings.",100,4
azure-containerregistry-py,"Azure Container Registry SDK for Python. Use for managing container images, artifacts, and repositories.",100,4
azure-cosmos-py,"Azure Cosmos DB SDK for Python (NoSQL API). Use for document CRUD, queries, containers, and globally distributed data.",100,4
azure-data-tables-py,"Azure Tables SDK for Python (Storage and Cosmos DB). Use for NoSQL key-value storage, entity CRUD, and batch operations.",100,4
azure-eventgrid-py,"Azure Event Grid SDK for Python. Use for publishing events, handling CloudEvents, and event-driven architectures.",100,4
azure-eventhub-py,"Azure Event Hubs SDK for Python streaming. Use for high-throughput event ingestion, producers, consumers, and checkpointing.",100,4
azure-identity-py,"Azure Identity SDK for Python authentication. Use for DefaultAzureCredential, managed identity, service principals, and token caching.",100,4
azure-keyvault-py,"Azure Key Vault SDK for Python. Use for secrets, keys, and certificates management with secure storage.",100,4
azure-messaging,"Troubleshoot and resolve issues with Azure Messaging SDKs for Event Hubs and Service Bus. Covers connection failures, authentication errors, message processing issues, and SDK configuration problems. WHEN: event hub SDK error, service bus SDK issue, messaging connection failure, AMQP error, event processor host issue, message lock lost, send timeout, receiver disconnected, SDK troubleshooting, azure messaging SDK, event hub consumer, service bus queue issue, topic subscription error, enable logging event hub, service bus logging, eventhub python, servicebus java, eventhub javascript, servicebus dotnet, event hub checkpoint, event hub not receiving messages, service bus dead letter.",100,4
azure-messaging-webpubsubservice-py,"Azure Web PubSub Service SDK for Python. Use for real-time messaging, WebSocket connections, and pub/sub patterns.",100,4
azure-mgmt-apicenter-py,"Azure API Center Management SDK for Python. Use for managing API inventory, metadata, and governance across your organization.",100,4
azure-mgmt-apimanagement-py,"Azure API Management SDK for Python. Use for managing APIM services, APIs, products, subscriptions, and policies.",100,4
azure-mgmt-botservice-py,"Azure Bot Service Management SDK for Python. Use for creating, managing, and configuring Azure Bot Service resources.",100,4
azure-mgmt-fabric-py,Azure Fabric Management SDK for Python. Use for managing Microsoft Fabric capacities and resources.,100,4
azure-monitor-ingestion-py,Azure Monitor Ingestion SDK for Python. Use for sending custom logs to Log Analytics workspace via Logs Ingestion API.,100,4
azure-monitor-opentelemetry-exporter-py,Azure Monitor OpenTelemetry Exporter for Python. Use for low-level OpenTelemetry export to Application Insights.,100,4
azure-monitor-opentelemetry-py,Azure Monitor OpenTelemetry Distro for Python. Use for one-line Application Insights setup with auto-instrumentation.,100,4
azure-search-documents-py,"Azure AI Search SDK for Python. Use for vector search, hybrid search, semantic ranking, indexing, and skillsets.",100,4
azure-servicebus-py,"Azure Service Bus SDK for Python messaging. Use for queues, topics, subscriptions, and enterprise messaging patterns.",100,4
azure-speech-to-text-rest-py,Azure Speech to Text REST API for short audio (Python). Use for simple speech recognition of audio files up to 60 seconds without the Speech SDK.,100,4
azure-storage-blob-py,"Azure Blob Storage SDK for Python. Use for uploading, downloading, listing blobs, managing containers, and blob lifecycle.",100,4
azure-storage-file-datalake-py,"Azure Data Lake Storage Gen2 SDK for Python. Use for hierarchical file systems, big data analytics, and file/directory operations.",100,4
azure-storage-file-share-py,"Azure Storage File Share SDK for Python. Use for SMB file shares, directories, and file operations in the cloud.",100,4
azure-storage-queue-py,"Azure Queue Storage SDK for Python. Use for reliable message queuing, task distribution, and asynchronous processing.",100,5
biopython,"Comprehensive molecular biology toolkit. Use for sequence manipulation, file parsing (FASTA/GenBank/PDB), phylogenetics, and programmatic NCBI/PubMed access (Bio.Entrez). Best for batch processing, custom bioinformatics pipelines, BLAST automation. For quick lookups use gget; for multi-service integration use bioservices.",100,5
bioservices,"Unified Python interface to 40+ bioinformatics services. Use when querying multiple databases (UniProt, KEGG, ChEMBL, Reactome) in a single workflow with consistent API. Best for cross-database analysis, ID mapping across services. For quick single-database lookups use gget; for sequence/file manipulation use biopython.",100,5
copilot-sdk,"Build applications that programmatically interact with GitHub Copilot. The SDK wraps the Copilot CLI via JSON-RPC, providing session management, custom tools, hooks, MCP server integration, and streaming across Node.js, Python, Go, and .NET.",100,5
datamol,"Pythonic wrapper around RDKit with simplified interface and sensible defaults. Preferred for standard drug discovery including SMILES parsing, standardization, descriptors, fingerprints, clustering, 3D conformers, parallel processing. Returns native rdkit.Chem.Mol objects. For advanced control or custom parameters, use rdkit directly.",100,4
dbos-python,"Guide for building reliable, fault-tolerant Python applications with DBOS durable workflows. Use when adding DBOS to existing Python code, creating workflows and steps, or using queues for concurrency control.",100,5
deploying-ransomware-canary-files,"Deploys and monitors ransomware canary files across critical directories using Python's watchdog library for real-time filesystem event detection. Places strategically named decoy files that mimic high-value targets (financial records, credentials, database exports) in locations ransomware typically enumerates first. Monitors for any read, modify, rename, or delete operations on canary files and triggers immediate alerts via email, Slack webhook, or syslog when interaction is detected, providing early warning before full encryption begins.",100,4
detecting-azure-storage-account-misconfigurations,"Audit Azure Blob and ADLS storage accounts for public access exposure, weak or long-lived SAS tokens, missing encryption at rest, disabled HTTPS-only traffic, and outdated TLS versions using the azure-mgmt-storage Python SDK.",100,4
detecting-modbus-protocol-anomalies,"This skill covers detecting anomalies in Modbus/TCP and Modbus RTU communications in industrial control systems. It addresses function code monitoring, register range validation, timing analysis, unauthorized client detection, and deep packet inspection for malformed Modbus frames. The skill leverages Zeek with Modbus protocol analyzers, Suricata IDS with OT rules, and custom Python-based detection using Markov chain models for normal Modbus transaction sequences.",100,4
detecting-shadow-it-cloud-usage,"Detect unauthorized SaaS and cloud service usage (shadow IT) by analyzing proxy logs, DNS query logs, and netflow data using Python pandas for traffic pattern analysis and domain classification.",100,4
discord-bot-architect,"Specialized skill for building production-ready Discord bots. Covers Discord.js (JavaScript) and Pycord (Python), gateway intents, slash commands, interactive components, rate limiting, and sharding.",100,5
dnanexus-integration,"DNAnexus cloud genomics platform. Build apps/applets, manage data (upload/download), dxpy Python SDK, run workflows, FASTQ/BAM/VCF, for genomics pipeline development and execution.",100,5
edgartools,"Python library for accessing, analyzing, and extracting data from SEC EDGAR filings. Use when working with SEC filings, financial statements (income statement, balance sheet, cash flow), XBRL financial data, insider trading (Form 4), institutional holdings (13F), company financials, annual/quarterly reports (10-K, 10-Q), proxy statements (DEF 14A), 8-K current events, company screening by ticker/CIK/industry, multi-period financial analysis, or any SEC regulatory filings.",100,4
exploiting-insecure-deserialization,"Identifying and exploiting insecure deserialization vulnerabilities in Java, PHP, Python, and .NET applications to achieve remote code execution during authorized penetration tests.",100,4
fastapi-pro,"Build high-performance async APIs with FastAPI, SQLAlchemy 2.0, and Pydantic V2. Master microservices, WebSockets, and modern Python async patterns.",100,2
fastapi-router-py,"Create FastAPI routers following established patterns with proper authentication, response models, and HTTP status codes.",100,4
fastapi-templates,"Create production-ready FastAPI projects with async patterns, dependency injection, and comprehensive error handling. Use when building new FastAPI applications or setting up backend API projects.",100,2
fluidsim,"Framework for computational fluid dynamics simulations using Python. Use when running fluid dynamics simulations including Navier-Stokes equations (2D/3D), shallow water equations, stratified flows, or when analyzing turbulence, vortex dynamics, or geophysical flows. Provides pseudospectral methods with FFT, HPC support, and comprehensive output analysis.",100,5
geopandas,"Python library for working with geospatial vector data including shapefiles, GeoJSON, and GeoPackage files. Use when working with geographic data for spatial analysis, geometric operations, coordinate transformations, spatial joins, overlay operations, choropleth mapping, or any task involving reading/writing/analyzing vector geographic data. Supports PostGIS databases, interactive maps, and integration with matplotlib/folium/cartopy. Use for tasks like buffer analysis, spatial joins between datasets, dissolving boundaries, clipping data, calculating areas/distances, reprojecting coordinate systems, creating maps, or converting between spatial file formats.",100,4
gget,"Fast CLI/Python queries to 20+ bioinformatics databases. Use for quick lookups: gene info, BLAST searches, AlphaFold structures, enrichment analysis. Best for interactive exploration, simple queries. For batch processing or advanced BLAST use biopython; for multi-database Python workflows use bioservices.",100,5
hunting-for-cobalt-strike-beacons,"Detect Cobalt Strike beacon network activity using default TLS certificate signatures (serial 8BB00EE), JA3/JA3S/JARM fingerprints, HTTP C2 profile pattern matching, beacon jitter analysis, and named pipe detection via Zeek, Suricata, and Python PCAP analysis.",100,4
hunting-for-defense-evasion-via-timestomping,Detect NTFS timestamp manipulation (MITRE T1070.006) by comparing $STANDARD_INFORMATION vs $FILE_NAME timestamps in the MFT. Uses analyzeMFT and Python to identify files with anomalous temporal patterns indicating anti-forensic timestomping activity.,100,4
hunting-for-startup-folder-persistence,"Detect T1547.001 startup folder persistence by monitoring Windows startup directories for suspicious file creation, analyzing autoruns entries, and using Python watchdog for real-time filesystem monitoring.",100,4
implementing-network-traffic-baselining,"Build network traffic baselines from NetFlow/IPFIX data using Python pandas for statistical analysis, z-score anomaly detection, and hourly/daily traffic pattern profiling",100,5
implementing-runtime-application-self-protection,"Deploy Runtime Application Self-Protection (RASP) agents to detect and block attacks from within application runtime, covering OpenRASP integration, attack pattern detection, and security policy configuration for Java and Python web applications.",100,4
implementing-security-information-sharing-with-stix2,"Create, validate, and share STIX 2.1 threat intelligence objects using the stix2 Python library. Covers indicators, malware, campaigns, relationships, bundles, and TAXII 2.1 publishing.",100,4
implementing-vulnerability-management-with-greenbone,"Deploy and operate Greenbone/OpenVAS vulnerability management using the python-gvm library to create scan targets, execute vulnerability scans, and parse scan reports via GMP protocol.",100,4
junta-leiloeiros,"Coleta e consulta dados de leiloeiros oficiais de todas as 27 Juntas Comerciais do Brasil. Scraper multi-UF, banco SQLite, API FastAPI e exportacao CSV/JSON.",100,4
m365-agents-py,"Microsoft 365 Agents SDK for Python. Build multichannel agents for Teams/M365/Copilot Studio with aiohttp hosting, AgentApplication routing, streaming responses, and MSAL-based auth.",100,5
matplotlib,"Low-level plotting library for full customization. Use when you need fine-grained control over every plot element, creating novel plot types, or integrating with specific scientific workflows. Export to PNG/PDF/SVG for publication. For quick statistical plots use seaborn; for interactive plots use plotly; for publication-ready multi-panel figures with journal styling, use scientific-visualization.",100,5
modal,"Cloud computing platform for running Python on GPUs and serverless infrastructure. Use when deploying AI/ML models, running GPU-accelerated workloads, serving web endpoints, scheduling batch jobs, or scaling Python code to the cloud. Use this skill whenever the user mentions Modal, serverless GPU compute, deploying ML models to the cloud, serving inference endpoints, running batch processing in the cloud, or needs to scale Python workloads beyond their local machine. Also use when the user wants to run code on H100s, A100s, or other cloud GPUs, or needs to create a web API for a model.",100,4
n8n-code-python,"Write Python code in n8n Code nodes. Use when writing Python in n8n, using _input/_json/_node syntax, working with standard library, or need to understand Python limitations in n8n Code nodes.",100,4
networkx,"Comprehensive toolkit for creating, analyzing, and visualizing complex networks and graphs in Python. Use when working with network/graph data structures, analyzing relationships between entities, computing graph algorithms (shortest paths, centrality, clustering), detecting communities, generating synthetic networks, or visualizing network topologies. Applicable to social networks, biological networks, transportation systems, citation networks, and any domain involving pairwise relationships.",100,4
odoo-rpc-api,"Expert on Odoo's external JSON-RPC and XML-RPC APIs. Covers authentication, model calls, record CRUD, and real-world integration examples in Python, JavaScript, and curl.",100,4
omero-integration,"Microscopy data management platform. Access images via Python, retrieve datasets, analyze pixels, manage ROIs/annotations, batch processing, for high-content screening and microscopy workflows.",100,4
performing-binary-exploitation-analysis,"Analyze binary exploitation techniques including buffer overflows and ROP chains using pwntools Python library. Covers checksec analysis, gadget discovery with ROPgadget, and exploit development for CTF and authorized security assessments.",100,4
performing-hardware-security-module-integration,"Integrate Hardware Security Modules (HSMs) using PKCS#11 interface for cryptographic key management, signing operations, and secure key storage with python-pkcs11, AWS CloudHSM, and YubiHSM2.",100,4
performing-ssl-tls-security-assessment,"Assess SSL/TLS server configurations using the sslyze Python library to evaluate cipher suites, certificate chains, protocol versions, HSTS headers, and known vulnerabilities like Heartbleed and ROBOT.",100,5
performing-threat-hunting-with-yara-rules,"Use YARA pattern-matching rules to hunt for malware, suspicious files, and indicators of compromise across filesystems and memory dumps. Covers rule authoring, yara-python scanning, and integration with threat intel feeds.",100,4
pydeseq2,"Differential gene expression analysis (Python DESeq2). Identify DE genes from bulk RNA-seq counts, Wald tests, FDR correction, volcano/MA plots, for RNA-seq analysis.",100,4
python-development-python-scaffold,"You are a Python project architecture expert specializing in scaffolding production-ready Python applications. Generate complete project structures with modern tooling (uv, FastAPI, Django), type hint",100,4
python-fastapi-development,"Python FastAPI backend development with async patterns, SQLAlchemy, Pydantic, authentication, and production API patterns.",100,4
python-ocr-backend-integration,python ocr uackend integration,100,4
python-packaging,"Comprehensive guide to creating, structuring, and distributing Python packages using modern packaging tools, pyproject.toml, and publishing to PyPI.",100,5
python-patterns,"Python development principles and decision-making. Framework selection, async patterns, type hints, project structure. Teaches thinking, not copying.",100,4
python-performance-optimization,"Profile and optimize Python code using cProfile, memory profilers, and performance best practices. Use when debugging slow Python code, optimizing bottlenecks, or improving application performance.",100,4
python-plugin-wrapper,python plugin wrapper,100,4
python-pro,"Master Python 3.12+ with modern features, async programming, performance optimization, and production-ready practices. Expert in the latest Python ecosystem including uv, ruff, pydantic, and FastAPI.",100,4
pyzotero,"Interact with Zotero reference management libraries using the pyzotero Python client. Retrieve, create, update, and delete items, collections, tags, and attachments via the Zotero Web API v3. Use this skill when working with Zotero libraries programmatically, managing bibliographic references, exporting citations, searching library contents, uploading PDF attachments, or building research automation workflows that integrate with Zotero.",100,2
reddit-api,Reddit API with PRAW (Python) and Snoowrap (Node.js),100,4
rowan,"Cloud-based quantum chemistry platform with Python API. Preferred for computational chemistry workflows including pKa prediction, geometry optimization, conformer searching, molecular property calculations, protein-ligand docking (AutoDock Vina), and AI protein cofolding (Chai-1, Boltz-1/2). Use when tasks involve quantum chemistry calculations, molecular property prediction, DFT or semiempirical methods, neural network potentials (AIMNet2), protein-ligand binding predictions, or automated computational chemistry pipelines. Provides cloud compute resources with no local setup required.",100,2
scanpy,"Standard single-cell RNA-seq analysis pipeline. Use for QC, normalization, dimensionality reduction (PCA/UMAP/t-SNE), clustering, differential expression, and visualization. Best for exploratory scRNA-seq analysis with established workflows. For deep learning models use scvi-tools; for data format questions use anndata.",100,4
scikit-learn,"Machine learning in Python with scikit-learn. Use when working with supervised learning (classification, regression), unsupervised learning (clustering, dimensionality reduction), model evaluation, hyperparameter tuning, preprocessing, or building ML pipelines. Provides comprehensive reference documentation for algorithms, preprocessing techniques, pipelines, and best practices.",100,5
scikit-survival,"Comprehensive toolkit for survival analysis and time-to-event modeling in Python using scikit-survival. Use this skill when working with censored survival data, performing time-to-event analysis, fitting Cox models, Random Survival Forests, Gradient Boosting models, or Survival SVMs, evaluating survival predictions with concordance index or Brier score, handling competing risks, or implementing any survival analysis workflow with the scikit-survival library.",100,4
seaborn,"Statistical visualization with pandas integration. Use for quick exploration of distributions, relationships, and categorical comparisons with attractive defaults. Best for box plots, violin plots, pair plots, heatmaps. Built on matplotlib. For interactive plots use plotly; for publication styling use scientific-visualization.",100,5
setup,Detects your Python environment and guides you through installing plugin dependencies. Use on first-time setup or when MCP server fails to start.,100,5
statsmodels,"Statistical models library for Python. Use when you need specific model classes (OLS, GLM, mixed models, ARIMA) with detailed diagnostics, residuals, and inference. Best for econometrics, time series, rigorous inference with coefficient tables. For guided statistical test selection with APA reporting use statistical-analysis.",100,5
supabase-python,FastAPI with Supabase and SQLAlchemy/SQLModel,100,4
sympy,"Use this skill when working with symbolic mathematics in Python. This skill should be used for symbolic computation tasks including solving equations algebraically, performing calculus operations (derivatives, integrals, limits), manipulating algebraic expressions, working with matrices symbolically, physics calculations, number theory problems, geometry computations, and generating executable code from mathematical expressions. Apply this skill when the user needs exact symbolic results rather than numerical approximations, or when working with mathematical formulas that contain variables and parameters.",100,4
telegram,"Integracao completa com Telegram Bot API. Setup com BotFather, mensagens, webhooks, inline keyboards, grupos, canais. Boilerplates Node.js e Python.",100,4
temporal-python-pro,"Master Temporal workflow orchestration with Python SDK. Implements durable workflows, saga patterns, and distributed transactions. Covers async/await, testing strategies, and production deployment.",100,4
temporal-python-testing,"Comprehensive testing approaches for Temporal workflows using pytest, progressive disclosure resources for specific testing scenarios.",100,4
