skill_id,description,score,phase
python-development-python-scaffold,"You are a Python project architecture expert specializing in scaffolding production-ready Python applications. Generate complete project structures with modern tooling (uv, FastAPI, Django), type hint",17,1
detecting-shadow-it-cloud-usage,"Detect unauthorized SaaS and cloud service usage (shadow IT) by analyzing proxy logs, DNS query logs, and netflow data using Python pandas for traffic pattern analysis and domain classification.",13,1
fastapi-pro,"Build high-performance async APIs with FastAPI, SQLAlchemy 2.0, and Pydantic V2. Master microservices, WebSockets, and modern Python async patterns.",13,1
implementing-network-traffic-baselining,"Build network traffic baselines from NetFlow/IPFIX data using Python pandas for statistical analysis, z-score anomaly detection, and hourly/daily traffic pattern profiling",13,1
python-fastapi-development,"Python FastAPI backend development with async patterns, SQLAlchemy, Pydantic, authentication, and production API patterns.",13,1
python-pro,"Master Python 3.12+ with modern features, async programming, performance optimization, and production-ready practices. Expert in the latest Python ecosystem including uv, ruff, pydantic, and FastAPI.",13,1
supabase-python,FastAPI with Supabase and SQLAlchemy/SQLModel,13,1
zarr-python,"Chunked N-D arrays for cloud storage. Compressed arrays, parallel I/O, S3/GCS integration, NumPy/Dask/Xarray compatible, for large-scale scientific computing pipelines.",13,1
agent-framework-azure-ai-py,Build persistent agents on Azure AI Foundry using the Microsoft Agent Framework Python SDK.,11,1
azure-ai-contentsafety-py,Azure AI Content Safety SDK for Python. Use for detecting harmful content in text and images with multi-severity classification.,11,1
azure-ai-contentunderstanding-py,"Azure AI Content Understanding SDK for Python. Use for multimodal content extraction from documents, images, audio, and video.",11,1
azure-ai-language-conversations-py,"Implement Conversational Language Understanding (CLU) using the azure-ai-language-conversations Python SDK. Use when working with ConversationAnalysisClient to analyze conversation intent and entities, building NLP features, or integrating language understanding into applications.",11,1
azure-ai-ml-py,"Azure Machine Learning SDK v2 for Python. Use for ML workspaces, jobs, models, datasets, compute, and pipelines.",11,1
azure-ai-transcription-py,Azure AI Transcription SDK for Python. Use for real-time and batch speech-to-text transcription with timestamps and diarization.,11,1
azure-appconfiguration-py,"Azure App Configuration SDK for Python. Use for centralized configuration management, feature flags, and dynamic settings.",11,1
azure-containerregistry-py,"Azure Container Registry SDK for Python. Use for managing container images, artifacts, and repositories.",11,1
azure-cosmos-py,"Azure Cosmos DB SDK for Python (NoSQL API). Use for document CRUD, queries, containers, and globally distributed data.",11,1
azure-data-tables-py,"Azure Tables SDK for Python (Storage and Cosmos DB). Use for NoSQL key-value storage, entity CRUD, and batch operations.",11,1
azure-eventgrid-py,"Azure Event Grid SDK for Python. Use for publishing events, handling CloudEvents, and event-driven architectures.",11,1
azure-eventhub-py,"Azure Event Hubs SDK for Python streaming. Use for high-throughput event ingestion, producers, consumers, and checkpointing.",11,1
azure-identity-py,"Azure Identity SDK for Python authentication. Use for DefaultAzureCredential, managed identity, service principals, and token caching.",11,1
azure-keyvault-py,"Azure Key Vault SDK for Python. Use for secrets, keys, and certificates management with secure storage.",11,1
azure-messaging-webpubsubservice-py,"Azure Web PubSub Service SDK for Python. Use for real-time messaging, WebSocket connections, and pub/sub patterns.",11,1
azure-mgmt-apicenter-py,"Azure API Center Management SDK for Python. Use for managing API inventory, metadata, and governance across your organization.",11,1
azure-mgmt-apimanagement-py,"Azure API Management SDK for Python. Use for managing APIM services, APIs, products, subscriptions, and policies.",11,1
azure-mgmt-botservice-py,"Azure Bot Service Management SDK for Python. Use for creating, managing, and configuring Azure Bot Service resources.",11,1
azure-mgmt-fabric-py,Azure Fabric Management SDK for Python. Use for managing Microsoft Fabric capacities and resources.,11,1
azure-monitor-ingestion-py,Azure Monitor Ingestion SDK for Python. Use for sending custom logs to Log Analytics workspace via Logs Ingestion API.,11,1
azure-monitor-opentelemetry-exporter-py,Azure Monitor OpenTelemetry Exporter for Python. Use for low-level OpenTelemetry export to Application Insights.,11,1
azure-monitor-opentelemetry-py,Azure Monitor OpenTelemetry Distro for Python. Use for one-line Application Insights setup with auto-instrumentation.,11,1
azure-search-documents-py,"Azure AI Search SDK for Python. Use for vector search, hybrid search, semantic ranking, indexing, and skillsets.",11,1
azure-servicebus-py,"Azure Service Bus SDK for Python messaging. Use for queues, topics, subscriptions, and enterprise messaging patterns.",11,1
azure-speech-to-text-rest-py,Azure Speech to Text REST API for short audio (Python). Use for simple speech recognition of audio files up to 60 seconds without the Speech SDK.,11,1
azure-storage-blob-py,"Azure Blob Storage SDK for Python. Use for uploading, downloading, listing blobs, managing containers, and blob lifecycle.",11,1
azure-storage-file-datalake-py,"Azure Data Lake Storage Gen2 SDK for Python. Use for hierarchical file systems, big data analytics, and file/directory operations.",11,1
azure-storage-file-share-py,"Azure Storage File Share SDK for Python. Use for SMB file shares, directories, and file operations in the cloud.",11,1
azure-storage-queue-py,"Azure Queue Storage SDK for Python. Use for reliable message queuing, task distribution, and asynchronous processing.",11,1
fastapi-router-py,"Create FastAPI routers following established patterns with proper authentication, response models, and HTTP status codes.",11,1
geopandas,"Python library for working with geospatial vector data including shapefiles, GeoJSON, and GeoPackage files. Use when working with geographic data for spatial analysis, geometric operations, coordinate transformations, spatial joins, overlay operations, choropleth mapping, or any task involving reading/writing/analyzing vector geographic data. Supports PostGIS databases, interactive maps, and integration with matplotlib/folium/cartopy. Use for tasks like buffer analysis, spatial joins between datasets, dissolving boundaries, clipping data, calculating areas/distances, reprojecting coordinate systems, creating maps, or converting between spatial file formats.",11,1
m365-agents-py,"Microsoft 365 Agents SDK for Python. Build multichannel agents for Teams/M365/Copilot Studio with aiohttp hosting, AgentApplication routing, streaming responses, and MSAL-based auth.",11,1
agentic-development,Build AI agents with Pydantic AI (Python) and Claude SDK (Node.js),9,1
analyzing-network-flow-data-with-netflow,"Parse NetFlow v9 and IPFIX records to detect volumetric anomalies, port scanning, data exfiltration, and C2 beaconing patterns. Uses the Python netflow library to decode flow records, builds traffic baselines, and applies statistical analysis to identify flows with abnormal byte counts, connection durations, and periodic timing patterns.",9,1
analyzing-powershell-script-block-logging,"Parse Windows PowerShell Script Block Logs (Event ID 4104) from EVTX files to detect obfuscated commands, encoded payloads, and living-off-the-land techniques. Uses python-evtx to extract and reconstruct multi-block scripts, applies entropy analysis and pattern matching for Base64-encoded commands, Invoke-Expression abuse, download cradles, and AMSI bypass attempts.",9,1
analyzing-threat-actor-ttps-with-mitre-navigator,"Map advanced persistent threat (APT) group tactics, techniques, and procedures (TTPs) to the MITRE ATT&CK framework using the ATT&CK Navigator and attackcti Python library. The analyst queries STIX/TAXII data for group-technique associations, generates Navigator layer files for visualization, and compares defensive coverage against adversary profiles. Activates for requests involving APT TTP mapping, ATT&CK Navigator layers, threat actor profiling, or MITRE technique coverage analysis.",9,1
analyzing-windows-prefetch-with-python,"Parse Windows Prefetch files using the windowsprefetch Python library to reconstruct application execution history, detect renamed or masquerading binaries, and identify suspicious program execution patterns.",9,1
astropy,"Astropy is the core Python package for astronomy, providing essential functionality for astronomical research and data analysis.",9,1
async-python-patterns,"Comprehensive guidance for implementing asynchronous Python applications using asyncio, concurrent programming patterns, and async/await for building high-performance, non-blocking systems.",9,1
automating-ioc-enrichment,"Automates the enrichment of raw indicators of compromise with multi-source threat intelligence context using SOAR platforms, Python pipelines, or TIP playbooks to reduce analyst triage time and standardize enrichment outputs. Use when building automated enrichment workflows integrated with SIEM alerts, email submission pipelines, or bulk IOC processing from threat feeds. Activates for requests involving SOAR enrichment, Cortex XSOAR, Splunk SOAR, TheHive, Python enrichment pipelines, or automated IOC processing.",9,1
azure-messaging,"Troubleshoot and resolve issues with Azure Messaging SDKs for Event Hubs and Service Bus. Covers connection failures, authentication errors, message processing issues, and SDK configuration problems. WHEN: event hub SDK error, service bus SDK issue, messaging connection failure, AMQP error, event processor host issue, message lock lost, send timeout, receiver disconnected, SDK troubleshooting, azure messaging SDK, event hub consumer, service bus queue issue, topic subscription error, enable logging event hub, service bus logging, eventhub python, servicebus java, eventhub javascript, servicebus dotnet, event hub checkpoint, event hub not receiving messages, service bus dead letter.",9,1
biopython,"Biopython is a comprehensive set of freely available Python tools for biological computation. It provides functionality for sequence manipulation, file I/O, database access, structural bioinformatics, phylogenetics, and many other bioinformatics tasks.",9,1
bioservices,"Unified Python interface to 40+ bioinformatics services. Use when querying multiple databases (UniProt, KEGG, ChEMBL, Reactome) in a single workflow with consistent API. Best for cross-database analysis, ID mapping across services. For quick single-database lookups use gget; for sequence/file manipulation use biopython.",9,1
copilot-sdk,"Build applications that programmatically interact with GitHub Copilot. The SDK wraps the Copilot CLI via JSON-RPC, providing session management, custom tools, hooks, MCP server integration, and streaming across Node.js, Python, Go, and .NET.",9,1
dbos-python,"Guide for building reliable, fault-tolerant Python applications with DBOS durable workflows. Use when adding DBOS to existing Python code, creating workflows and steps, or using queues for concurrency control.",9,1
deploying-ransomware-canary-files,"Deploys and monitors ransomware canary files across critical directories using Python's watchdog library for real-time filesystem event detection. Places strategically named decoy files that mimic high-value targets (financial records, credentials, database exports) in locations ransomware typically enumerates first. Monitors for any read, modify, rename, or delete operations on canary files and triggers immediate alerts via email, Slack webhook, or syslog when interaction is detected, providing early warning before full encryption begins.",9,1
detecting-azure-storage-account-misconfigurations,"Audit Azure Blob and ADLS storage accounts for public access exposure, weak or long-lived SAS tokens, missing encryption at rest, disabled HTTPS-only traffic, and outdated TLS versions using the azure-mgmt-storage Python SDK.",9,1
detecting-modbus-protocol-anomalies,"This skill covers detecting anomalies in Modbus/TCP and Modbus RTU communications in industrial control systems. It addresses function code monitoring, register range validation, timing analysis, unauthorized client detection, and deep packet inspection for malformed Modbus frames. The skill leverages Zeek with Modbus protocol analyzers, Suricata IDS with OT rules, and custom Python-based detection using Markov chain models for normal Modbus transaction sequences.",9,1
discord-bot-architect,"Specialized skill for building production-ready Discord bots. Covers Discord.js (JavaScript) and Pycord (Python), gateway intents, slash commands, interactive components, rate limiting, and sharding.",9,1
dnanexus-integration,"DNAnexus cloud genomics platform. Build apps/applets, manage data (upload/download), dxpy Python SDK, run workflows, FASTQ/BAM/VCF, for genomics pipeline development and execution.",9,1
edgartools,"Python library for accessing, analyzing, and extracting data from SEC EDGAR filings. Use when working with SEC filings, financial statements (income statement, balance sheet, cash flow), XBRL financial data, insider trading (Form 4), institutional holdings (13F), company financials, annual/quarterly reports (10-K, 10-Q), proxy statements (DEF 14A), 8-K current events, company screening by ticker/CIK/industry, multi-period financial analysis, or any SEC regulatory filings.",9,1
exploiting-insecure-deserialization,"Identifying and exploiting insecure deserialization vulnerabilities in Java, PHP, Python, and .NET applications to achieve remote code execution during authorized penetration tests.",9,1
fluidsim,"Framework for computational fluid dynamics simulations using Python. Use when running fluid dynamics simulations including Navier-Stokes equations (2D/3D), shallow water equations, stratified flows, or when analyzing turbulence, vortex dynamics, or geophysical flows. Provides pseudospectral methods with FFT, HPC support, and comprehensive output analysis.",9,1
gget,"Fast CLI/Python queries to 20+ bioinformatics databases. Use for quick lookups: gene info, BLAST searches, AlphaFold structures, enrichment analysis. Best for interactive exploration, simple queries. For batch processing or advanced BLAST use biopython; for multi-database Python workflows use bioservices.",9,1
hunting-for-cobalt-strike-beacons,"Detect Cobalt Strike beacon network activity using default TLS certificate signatures (serial 8BB00EE), JA3/JA3S/JARM fingerprints, HTTP C2 profile pattern matching, beacon jitter analysis, and named pipe detection via Zeek, Suricata, and Python PCAP analysis.",9,1
hunting-for-defense-evasion-via-timestomping,Detect NTFS timestamp manipulation (MITRE T1070.006) by comparing $STANDARD_INFORMATION vs $FILE_NAME timestamps in the MFT. Uses analyzeMFT and Python to identify files with anomalous temporal patterns indicating anti-forensic timestomping activity.,9,1
hunting-for-startup-folder-persistence,"Detect T1547.001 startup folder persistence by monitoring Windows startup directories for suspicious file creation, analyzing autoruns entries, and using Python watchdog for real-time filesystem monitoring.",9,1
implementing-runtime-application-self-protection,"Deploy Runtime Application Self-Protection (RASP) agents to detect and block attacks from within application runtime, covering OpenRASP integration, attack pattern detection, and security policy configuration for Java and Python web applications.",9,1
implementing-security-information-sharing-with-stix2,"Create, validate, and share STIX 2.1 threat intelligence objects using the stix2 Python library. Covers indicators, malware, campaigns, relationships, bundles, and TAXII 2.1 publishing.",9,1
implementing-vulnerability-management-with-greenbone,"Deploy and operate Greenbone/OpenVAS vulnerability management using the python-gvm library to create scan targets, execute vulnerability scans, and parse scan reports via GMP protocol.",9,1
matplotlib,"Matplotlib is Python's foundational visualization library for creating static, animated, and interactive plots.",9,1
modal,"Cloud computing platform for running Python on GPUs and serverless infrastructure. Use when deploying AI/ML models, running GPU-accelerated workloads, serving web endpoints, scheduling batch jobs, or scaling Python code to the cloud. Use this skill whenever the user mentions Modal, serverless GPU compute, deploying ML models to the cloud, serving inference endpoints, running batch processing in the cloud, or needs to scale Python workloads beyond their local machine. Also use when the user wants to run code on H100s, A100s, or other cloud GPUs, or needs to create a web API for a model.",9,1
n8n-code-python,"Write Python code in n8n Code nodes. Use when writing Python in n8n, using _input/_json/_node syntax, working with standard library, or need to understand Python limitations in n8n Code nodes.",9,1
networkx,"NetworkX is a Python package for creating, manipulating, and analyzing complex networks and graphs.",9,1
odoo-rpc-api,"Expert on Odoo's external JSON-RPC and XML-RPC APIs. Covers authentication, model calls, record CRUD, and real-world integration examples in Python, JavaScript, and curl.",9,1
omero-integration,"Microscopy data management platform. Access images via Python, retrieve datasets, analyze pixels, manage ROIs/annotations, batch processing, for high-content screening and microscopy workflows.",9,1
performing-binary-exploitation-analysis,"Analyze binary exploitation techniques including buffer overflows and ROP chains using pwntools Python library. Covers checksec analysis, gadget discovery with ROPgadget, and exploit development for CTF and authorized security assessments.",9,1
performing-hardware-security-module-integration,"Integrate Hardware Security Modules (HSMs) using PKCS#11 interface for cryptographic key management, signing operations, and secure key storage with python-pkcs11, AWS CloudHSM, and YubiHSM2.",9,1
performing-ssl-tls-security-assessment,"Assess SSL/TLS server configurations using the sslyze Python library to evaluate cipher suites, certificate chains, protocol versions, HSTS headers, and known vulnerabilities like Heartbleed and ROBOT.",9,1
performing-threat-hunting-with-yara-rules,"Use YARA pattern-matching rules to hunt for malware, suspicious files, and indicators of compromise across filesystems and memory dumps. Covers rule authoring, yara-python scanning, and integration with threat intel feeds.",9,1
pydeseq2,"Differential gene expression analysis (Python DESeq2). Identify DE genes from bulk RNA-seq counts, Wald tests, FDR correction, volcano/MA plots, for RNA-seq analysis.",9,1
python,"Python development with ruff, mypy, pytest - TDD and type safety",9,1
python-ocr-backend-integration,python ocr uackend integration,9,1
python-packaging,"Comprehensive guide to creating, structuring, and distributing Python packages using modern packaging tools, pyproject.toml, and publishing to PyPI.",9,1
python-patterns,"Python development principles and decision-making. Framework selection, async patterns, type hints, project structure. Teaches thinking, not copying.",9,1
python-performance-optimization,"Profile and optimize Python code using cProfile, memory profilers, and performance best practices. Use when debugging slow Python code, optimizing bottlenecks, or improving application performance.",9,1
python-plugin-wrapper,python plugin wrapper,9,1
pyzotero,"Interact with Zotero reference management libraries using the pyzotero Python client. Retrieve, create, update, and delete items, collections, tags, and attachments via the Zotero Web API v3. Use this skill when working with Zotero libraries programmatically, managing bibliographic references, exporting citations, searching library contents, uploading PDF attachments, or building research automation workflows that integrate with Zotero.",9,1
reddit-api,Reddit API with PRAW (Python) and Snoowrap (Node.js),9,1
rowan,"Cloud-based quantum chemistry platform with Python API. Preferred for computational chemistry workflows including pKa prediction, geometry optimization, conformer searching, molecular property calculations, protein-ligand docking (AutoDock Vina), and AI protein cofolding (Chai-1, Boltz-1/2). Use when tasks involve quantum chemistry calculations, molecular property prediction, DFT or semiempirical methods, neural network potentials (AIMNet2), protein-ligand binding predictions, or automated computational chemistry pipelines. Provides cloud compute resources with no local setup required.",9,1
scanpy,"Scanpy is a scalable Python toolkit for analyzing single-cell RNA-seq data, built on AnnData. Apply this skill for complete single-cell workflows including quality control, normalization, dimensionality reduction, clustering, marker gene identification, visualization, and trajectory analysis.",9,1
scikit-learn,"Machine learning in Python with scikit-learn. Use for classification, regression, clustering, model evaluation, and ML pipelines.",9,1
scikit-survival,"Comprehensive toolkit for survival analysis and time-to-event modeling in Python using scikit-survival. Use this skill when working with censored survival data, performing time-to-event analysis, fitting Cox models, Random Survival Forests, Gradient Boosting models, or Survival SVMs, evaluating survival predictions with concordance index or Brier score, handling competing risks, or implementing any survival analysis workflow with the scikit-survival library.",9,1
seaborn,"Seaborn is a Python visualization library for creating publication-quality statistical graphics. Use this skill for dataset-oriented plotting, multivariate analysis, automatic statistical estimation, and complex multi-panel figures with minimal code.",9,1
setup,Detects your Python environment and guides you through installing plugin dependencies. Use on first-time setup or when MCP server fails to start.,9,1
statsmodels,"Statsmodels is Python's premier library for statistical modeling, providing tools for estimation, inference, and diagnostics across a wide range of statistical methods.",9,1
sympy,SymPy is a Python library for symbolic mathematics that enables exact computation using mathematical symbols rather than numerical approximations.,9,1
telegram,"Integracao completa com Telegram Bot API. Setup com BotFather, mensagens, webhooks, inline keyboards, grupos, canais. Boilerplates Node.js e Python.",9,1
temporal-python-pro,"Master Temporal workflow orchestration with Python SDK. Implements durable workflows, saga patterns, and distributed transactions. Covers async/await, testing strategies, and production deployment.",9,1
temporal-python-testing,"Comprehensive testing approaches for Temporal workflows using pytest, progressive disclosure resources for specific testing scenarios.",9,1
tinybird-python-sdk-guidelines,"Tinybird Python SDK for defining datasources, pipes, and queries in Python. Use when working with tinybird-sdk, Python Tinybird projects, or data ingestion and queries in Python.",9,1
using-tmux-for-interactive-commands,"Use when you need to run interactive CLI tools (vim, git rebase -i, Python REPL, etc.) that require real-time input/output - provides tmux-based approach for controlling interactive sessions through detached sessions and send-keys",9,1
vertex-ai-api-dev,"Guides the usage of Gemini API on Google Cloud Vertex AI with the Gen AI SDK. Use when the user asks about using Gemini in an enterprise environment or explicitly mentions Vertex AI. Covers SDK usage (Python, JS/TS, Go, Java, C#), capabilities like Live API, tools, multimedia generation, caching, and batch prediction.",9,1
whatsapp-cloud-api,"Integracao com WhatsApp Business Cloud API (Meta). Mensagens, templates, webhooks HMAC-SHA256, automacao de atendimento. Boilerplates Node.js e Python.",9,1
xvary-stock-research,"Thesis-driven equity analysis from public SEC EDGAR and market data; /analyze, /score, /compare workflows with bundled Python tools (Claude Code, Cursor, Codex).",9,1
datamol,"Pythonic wrapper around RDKit with simplified interface and sensible defaults. Preferred for standard drug discovery including SMILES parsing, standardization, descriptors, fingerprints, clustering, 3D conformers, parallel processing. Returns native rdkit.Chem.Mol objects. For advanced control or custom parameters, use rdkit directly.",7,1
fastapi-templates,"Create production-ready FastAPI projects with async patterns, dependency injection, and comprehensive error handling. Use when building new FastAPI applications or setting up backend API projects.",7,1
junta-leiloeiros,"Coleta e consulta dados de leiloeiros oficiais de todas as 27 Juntas Comerciais do Brasil. Scraper multi-UF, banco SQLite, API FastAPI e exportacao CSV/JSON.",7,1
