skill_id,description,score,phase
tinybird-python-sdk-guidelines,"Tinybird Python SDK for defining datasources, pipes, and queries in Python. Use when working with tinybird-sdk, Python Tinybird projects, or data ingestion and queries in Python.",100,5
using-tmux-for-interactive-commands,"Use when you need to run interactive CLI tools (vim, git rebase -i, Python REPL, etc.) that require real-time input/output - provides tmux-based approach for controlling interactive sessions through detached sessions and send-keys",100,5
vertex-ai-api-dev,"Guides the usage of Gemini API on Google Cloud Vertex AI with the Gen AI SDK. Use when the user asks about using Gemini in an enterprise environment or explicitly mentions Vertex AI. Covers SDK usage (Python, JS/TS, Go, Java, C#), capabilities like Live API, tools, multimedia generation, caching, and batch prediction.",100,2
whatsapp-cloud-api,"Integracao com WhatsApp Business Cloud API (Meta). Mensagens, templates, webhooks HMAC-SHA256, automacao de atendimento. Boilerplates Node.js e Python.",100,4
xvary-stock-research,"Thesis-driven equity analysis from public SEC EDGAR and market data; /analyze, /score, /compare workflows with bundled Python tools (Claude Code, Cursor, Codex).",100,5
zarr-python,"Chunked N-D arrays for cloud storage. Compressed arrays, parallel I/O, S3/GCS integration, NumPy/Dask/Xarray compatible, for large-scale scientific computing pipelines.",100,4
python,"Python development with ruff, mypy, pytest - TDD and type safety",95,1
