skill_id,description,score,phase
building-identity-governance-lifecycle-process,"Builds comprehensive identity governance and lifecycle management processes including joiner-mover-leaver automation, role mining, access request workflows, periodic recertification, and orphaned account remediation using IGA platforms. Activates for requests involving identity lifecycle management, JML processes, role-based access provisioning, or identity governance program design.",100,1
building-incident-response-playbook,"Designs and documents structured incident response playbooks that define step-by-step procedures for specific incident types aligned with NIST SP 800-61r3 and SANS PICERL frameworks. Covers playbook structure, decision trees, escalation criteria, RACI matrices, and integration with SOAR platforms. Activates for requests involving IR playbook creation, incident response procedure documentation, response runbook development, or SOAR playbook design.",100,1
implementing-just-in-time-access-provisioning,"Implement Just-In-Time (JIT) access provisioning to eliminate standing privileges by granting temporary, time-bound access only when needed. This skill covers JIT architecture design, approval workflo",100,1
implementing-privileged-access-workstation,"Design and implement Privileged Access Workstations (PAWs) with device hardening, just-in-time access, and integration with CyberArk or BeyondTrust for secure administrative operations.",100,1
performing-access-review-and-certification,"Conduct systematic access reviews and certifications to ensure users have appropriate access rights aligned with their roles. This skill covers review campaign design, reviewer selection, risk-based p",100,1
