skill_id,description,score,phase
academic-plotting,"Generates publication-quality figures for ML papers from research context. Given a paper section or description, extracts system components and relationships to generate architecture diagrams via Gemini. Given experiment results or data, auto-selects chart type and generates data-driven figures via matplotlib/seaborn. Use when creating any figure for a conference paper.",100,2
agent-memory-mcp,"A hybrid memory system that provides persistent, searchable knowledge management for AI agents (Architecture, Patterns, Decisions).",100,2
ai-agents-architect,"I build AI systems that can act autonomously while remaining controllable. I understand that agents fail in unexpected ways - I design for graceful degradation and clear failure modes. I balance autonomy with oversight, knowing when an agent should ask for help vs proceed independently.",100,6
ai-ml,"AI and machine learning workflow covering LLM application development, RAG implementation, agent architecture, ML pipelines, and AI-powered features.",100,2
api-design,"REST API design patterns including resource naming, status codes, pagination, filtering, error responses, versioning, and rate limiting for production APIs.",100,2
api-design-principles,"Master REST and GraphQL API design principles to build intuitive, scalable, and maintainable APIs that delight developers and stand the test of time.",100,2
api-documentation,"API documentation workflow for generating OpenAPI specs, creating developer guides, and maintaining comprehensive API documentation.",100,2
api-documenter,"Master API documentation with OpenAPI 3.1, AI-powered tools, and modern developer experience practices. Create interactive docs, generate SDKs, and build comprehensive developer portals.",100,2
api-patterns,"API design principles and decision-making. REST vs GraphQL vs tRPC selection, response formats, versioning, pagination.",100,2
api-security-testing,"API security testing workflow for REST and GraphQL APIs covering authentication, authorization, rate limiting, input validation, and security best practices.",100,2
architect-review,Master software architect specializing in modern architecture,100,2
architecture,"Architectural decision-making framework. Requirements analysis, trade-off evaluation, ADR documentation. Use when making architecture decisions or analyzing system design.",100,6
architecture-patterns,"Master proven backend architecture patterns including Clean Architecture, Hexagonal Architecture, and Domain-Driven Design to build maintainable, testable, and scalable systems.",100,2
autoresearch,"Orchestrates end-to-end autonomous AI research projects using a two-loop architecture. The inner loop runs rapid experiment iterations with clear optimization targets. The outer loop synthesizes results, identifies patterns, and steers research direction. Routes to domain-specific skills for execution, supports continuous agent operation via Claude Code /loop and OpenClaw heartbeat, and produces research presentations and papers. Use when starting a research project, running autonomous experiments, or managing a multi-hypothesis research effort.",100,2
aws-serverless-eda,"AWS serverless and event-driven architecture expert based on Well-Architected Framework. Use when building serverless APIs, Lambda functions, REST APIs, microservices, or async workflows. Covers Lambda with TypeScript/Python, API Gateway (REST/HTTP), DynamoDB, Step Functions, EventBridge, SQS, SNS, and serverless patterns. Essential when user mentions serverless, Lambda, API Gateway, event-driven, async processing, queues, pub/sub, or wants to build scalable serverless applications with AWS best practices.",100,2
backend-architect,"Expert backend architect specializing in scalable API design, microservices architecture, and distributed systems.",100,2
backend-patterns,"Backend architecture patterns, API design, database optimization, and server-side best practices for Node.js, Express, and Next.js API routes.",100,2
bdi-mental-states,"This skill should be used when the user asks to ""model agent mental states"", ""implement BDI architecture"", ""create belief-desire-intention models"", ""transform RDF to beliefs"", ""build cognitive agent"", or mentions BDI ontology, mental state modeling, rational agency, or neuro-symbolic AI integration.",100,2
c4-architecture-c4-architecture,Generate comprehensive C4 architecture documentation for an existing repository/codebase using a bottom-up analysis approach.,100,2
c4-component,"Expert C4 Component-level documentation specialist. Synthesizes C4 Code-level documentation into Component-level architecture, defining component boundaries, interfaces, and relationships.",100,2
code-documentation-doc-generate,"You are a documentation expert specializing in creating comprehensive, maintainable documentation from code. Generate API docs, architecture diagrams, user guides, and technical references using AI-powered analysis and industry best practices.",100,2
comfyui-gateway,"REST API gateway for ComfyUI servers. Workflow management, job queuing, webhooks, caching, auth, rate limiting, and image delivery (URL + base64).",100,2
computer-use-agents,"The fundamental architecture of computer use agents: observe screen, reason about next action, execute action, repeat. This loop integrates vision models with action execution through an iterative pipeline.",100,2
data-engineering-data-pipeline,"You are a data pipeline architecture expert specializing in scalable, reliable, and cost-effective data pipelines for batch and streaming data processing.",100,2
ddd-context-mapping,Map relationships between bounded contexts and define integration contracts using DDD context mapping patterns.,100,2
ddd-strategic-design,"Design DDD strategic artifacts including subdomains, bounded contexts, and ubiquitous language for complex business domains.",100,6
ddd-tactical-patterns,"Apply DDD tactical patterns in code using entities, value objects, aggregates, repositories, and domain events with explicit invariants.",100,2
ddd:setup-code-formating,Sets up code formatting rules and style guidelines in CLAUDE.md,100,2
deployment-pipeline-design,Architecture patterns for multi-stage CI/CD pipelines with approval gates and deployment strategies.,100,2
design-an-interface,"Generate multiple radically different interface designs for a module using parallel sub-agents. Use when user wants to design an API, explore interface options, compare module shapes, or mentions ""design it twice"".",100,6
distributed-llm-pretraining-torchtitan,"Provides PyTorch-native distributed LLM pretraining using torchtitan with 4D parallelism (FSDP2, TP, PP, CP). Use when pretraining Llama 3.1, DeepSeek V3, or custom models at scale from 8 to 512+ GPUs with Float8, torch.compile, and distributed checkpointing.",100,2
django-patterns,"Django architecture patterns, REST API design with DRF, ORM best practices, caching, signals, middleware, and production-grade Django apps.",100,2
docs-architect,"Creates comprehensive technical documentation from existing codebases. Analyzes architecture, design patterns, and implementation details to produce long-form technical manuals and ebooks.",100,2
document-release,"Post-ship documentation update. Reads all project docs, cross-references the diff, updates README/ARCHITECTURE/CONTRIBUTING/CLAUDE.md to match what shipped, polishes CHANGELOG voice, cleans up TODOS, and optionally bumps VERSION. Use when asked to ""update the docs"", ""sync documentation"", or ""post-ship docs"". Proactively suggest after a PR is merged or code is shipped. (gstack)",100,2
domain-driven-design,Plan and route Domain-Driven Design work from strategic modeling to tactical implementation and evented architecture patterns.,100,2
dse-loop,"Autonomous design space exploration loop for computer architecture and EDA. Runs a program, analyzes results, tunes parameters, and iterates until objective is met or timeout. Use when user says ""DSE"", ""design space exploration"", ""sweep parameters"", ""optimize"", ""find best config"", or wants iterative parameter tuning.",100,6
electron-development,"Master Electron desktop app development with secure IPC, contextIsolation, preload scripts, multi-process architecture, electron-builder packaging, code signing, and auto-update.",100,2
graphql,You're a developer who has built GraphQL APIs at scale. You've seen the N+1 query problem bring down production servers. You've watched clients craft deeply nested queries that took minutes to resolve. You know that GraphQL's power is also its danger.,100,2
hummingbird,"Expert guidance on Hummingbird 2 web framework. Use when developers mention: (1) Hummingbird, HB, or Hummingbird 2, (2) Swift web server or HTTP server, (3) server-side Swift routing or middleware, (4) building REST APIs in Swift, (5) RequestContext or ChildRequestContext, (6) HummingbirdAuth or authentication middleware, (7) HummingbirdWebSocket, (8) HummingbirdFluent or database integration, (9) ResponseGenerator or EditedResponse.",100,2
implementing-llms-litgpt,"Implements and trains LLMs using Lightning AI's LitGPT with 20+ pretrained architectures (Llama, Gemma, Phi, Qwen, Mistral). Use when need clean model implementations, educational understanding of architectures, or production fine-tuning with LoRA/QLoRA. Single-file implementations, no abstraction layers.",100,2
langchain-architecture,"Master the LangChain framework for building sophisticated LLM applications with agents, chains, memory, and tool integration.",100,2
laravel-expert,"Senior Laravel Engineer role for production-grade, maintainable, and idiomatic Laravel solutions. Focuses on clean architecture, security, performance, and modern standards (Laravel 10/11+).",100,2
laravel-patterns,"Laravel architecture patterns, routing/controllers, Eloquent ORM, service layers, queues, events, caching, and API resources for production apps.",100,2
lightning-architecture-review,"Review Bitcoin Lightning Network protocol designs, compare channel factory approaches, and analyze Layer 2 scaling tradeoffs. Covers trust models, on-chain footprint, consensus requirements, HTLC/PTLC compatibility, liveness, and watchtower support.",100,2
microservices-patterns,"Master microservices architecture patterns including service boundaries, inter-service communication, data management, and resilience patterns for building distributed systems.",100,2
monorepo-architect,"Expert in monorepo architecture, build systems, and dependency management at scale. Masters Nx, Turborepo, Bazel, and Lerna for efficient multi-project development. Use PROACTIVELY for monorepo setup,",100,2
multi-cloud-architecture,"Decision framework and patterns for architecting applications across AWS, Azure, and GCP.",100,2
multi-platform-apps-multi-platform,"Build and deploy the same feature consistently across web, mobile, and desktop platforms using API-first architecture and parallel implementation strategies.",100,2
n8n-expression-syntax,"Validate n8n expression syntax and fix common errors. Use when writing n8n expressions, using {{}} syntax, accessing $json/$node variables, troubleshooting expression errors, or working with webhook data in workflows.",100,2
nanogpt,"Educational GPT implementation in ~300 lines. Reproduces GPT-2 (124M) on OpenWebText. Clean, hackable code for learning transformers. By Andrej Karpathy. Perfect for understanding GPT architecture from scratch. Train on Shakespeare (CPU) or OpenWebText (multi-GPU).",100,2
nerdzao-elite,"Senior Elite Software Engineer (15+) and Senior Product Designer. Full workflow with planning, architecture, TDD, clean code, and pixel-perfect UX validation.",100,2
nestjs-expert,"You are an expert in Nest.js with deep knowledge of enterprise-grade Node.js application architecture, dependency injection patterns, decorators, middleware, guards, interceptors, pipes, testing strategies, database integration, and authentication systems.",100,2
nnsight-remote-interpretability,"Provides guidance for interpreting and manipulating neural network internals using nnsight with optional NDIF remote execution. Use when needing to run interpretability experiments on massive models (70B+) without local GPU resources, or when working with any PyTorch architecture.",100,2
odoo-woocommerce-bridge,"Sync Odoo with WooCommerce: products, inventory, orders, and customers via WooCommerce REST API and Odoo external API.",100,2
openapi-spec-generation,"Generate and maintain OpenAPI 3.1 specifications from code, design-first specs, and validation patterns. Use when creating API documentation, generating SDKs, or ensuring API contract compliance.",100,2
pakistan-payments-stack,"Design and implement production-grade Pakistani payment integrations (JazzCash, Easypaisa, bank/PSP rails, optional Raast) for SaaS with PKR billing, webhook reliability, and reconciliation.",100,2
plugin-architecture-patterns,plugin architecture patterns,100,2
producthunt,"Search and retrieve content from Product Hunt. Get posts, topics, users, and collections via the GraphQL API. Use when user mentions Product Hunt, PH, or product launches.",100,2
production-code-audit,"Autonomously deep-scan entire codebase line-by-line, understand architecture and patterns, then systematically transform it to production-grade, corporate-level professional quality with optimizations",100,2
rails-conventions,"Rails 8.x application architecture, implementation, and review guidance for production codebases. Use when building or reviewing Ruby on Rails 8 features across models, controllers, routes, Hotwire, jobs, APIs, performance, security, and testing. Trigger for requests mentioning Rails 8, Active Record, Active Job, GoodJob, Solid Queue, Turbo/Stimulus, REST resources, migrations, code quality, naming, and production readiness.",100,2
readme,"When the user wants to create or update a README.md file for a project. Also use when the user says ""write readme,"" ""create readme,"" ""document this project,"" ""project documentation,"" or asks for help with README.md. This skill creates absurdly thorough documentation covering local setup, architecture, and deployment.",100,2
rwkv-architecture,"RNN+Transformer hybrid with O(n) inference. Linear time, infinite context, no KV cache. Train like GPT (parallel), infer like RNN (sequential). Linux Foundation AI project. Production at Windows, Office, NeMo. RWKV-7 (March 2025). Models up to 14B parameters.",100,2
salesforce-development,Use @wire decorator for reactive data binding with Lightning Data Service or Apex methods. @wire fits LWC's reactive architecture and enables Salesforce performance optimizations.,100,2
shopify-development,"Build Shopify apps, extensions, themes using GraphQL Admin API, Shopify CLI, Polaris UI, and Liquid.",100,2
site-architecture,"Technical SEO - robots.txt, sitemap, meta tags, Core Web Vitals",100,2
software-architecture,"Guide for quality focused software architecture. This skill should be used when users want to write code, design architecture, analyze code, in any case that relates to software development.",100,6
springboot-patterns,"Spring Boot architecture patterns, REST API design, layered services, data access, caching, async processing, and logging. Use for Java Spring Boot backend work.",100,2
swift-library-design,"Expert guidance on Swift library and framework design. Use when developers mention: (1) designing a Swift library or framework, (2) public API design patterns, (3) protocol-oriented architecture or associated types, (4) result builders or DSL design, (5) performance optimization for libraries, (6) @inlinable or @usableFromInline, (7) noncopyable types for APIs, (8) progressive disclosure in API design, (9) ResponseGenerator or builder patterns.",100,2
ubiquitous-language,"Extract a DDD-style ubiquitous language glossary from the current conversation, flagging ambiguities and proposing canonical terms. Saves to UBIQUITOUS_LANGUAGE.md. Use when user wants to define domain terms, build a glossary, harden terminology, create a ubiquitous language, or mentions ""domain model"" or ""DDD"".",100,2
woocommerce,"WooCommerce REST API - products, orders, customers, webhooks",100,2
wordpress-theme-development,"WordPress theme development workflow covering theme architecture, template hierarchy, custom post types, block editor support, responsive design, and WordPress 7.0 features: DataViews, Pattern Editing, Navigation Overlays, and admin refresh.",100,2
